commit	tokens_per_sec	mfu_percent	peak_memory_gb	status	description	command
f083910a	12216	0.00	163.95	discard	TORCH_NCCL_AVOID_RECORD_STREAMS=0 does not compose with event-cache disable on the compiled-QKV recipe	TORCH_NCCL_AVOID_RECORD_STREAMS=0 TORCH_NCCL_CUDA_EVENT_CACHE=0 NCCL_NVLS_ENABLE=1 NCCL_CTA_POLICY=2 NGPU=8 LOG_RANK=0 MODULE=qwen3 CONFIG=qwen3_14b ./run_train.sh --training.steps=10 --compile.enable --compile.components=loss,feed_forward,qkv_linear --training.dtype=bfloat16 --training.seq_len=128 --training.local_batch_size=168 --loss.num_chunks=4 --optimizer.weight_decay=0.0 --dataloader.num_workers=2 --dataloader.persistent_workers --dataloader.prefetch_factor=2 --metrics.log_freq=1 --comm.trace_buf_size=0 --dump_folder=outputs/autoresearch/may19-qwen3-14b/run482-event-cache0-avoid-record-streams0 > outputs/autoresearch/may19-qwen3-14b/run482-event-cache0-avoid-record-streams0.run.log 2>&1
6f3abedb	12258	0.00	163.95	discard	NCCL_PROGRESS_APPENDOP_FREQ=16 does not compose with event-cache disable on the compiled-QKV recipe	NCCL_PROGRESS_APPENDOP_FREQ=16 TORCH_NCCL_CUDA_EVENT_CACHE=0 NCCL_NVLS_ENABLE=1 NCCL_CTA_POLICY=2 NGPU=8 LOG_RANK=0 MODULE=qwen3 CONFIG=qwen3_14b ./run_train.sh --training.steps=10 --compile.enable --compile.components=loss,feed_forward,qkv_linear --training.dtype=bfloat16 --training.seq_len=128 --training.local_batch_size=168 --loss.num_chunks=4 --optimizer.weight_decay=0.0 --dataloader.num_workers=2 --dataloader.persistent_workers --dataloader.prefetch_factor=2 --metrics.log_freq=1 --comm.trace_buf_size=0 --dump_folder=outputs/autoresearch/may19-qwen3-14b/run483-event-cache0-nccl-progress-appendop-freq16 > outputs/autoresearch/may19-qwen3-14b/run483-event-cache0-nccl-progress-appendop-freq16.run.log 2>&1
e53d7608	12000	0.00	163.95	discard	forward-only FSDP prefetch is slower and has weaker loss behavior on the event-cache-disabled compiled-QKV recipe	TORCH_NCCL_CUDA_EVENT_CACHE=0 NCCL_NVLS_ENABLE=1 NCCL_CTA_POLICY=2 NGPU=8 LOG_RANK=0 MODULE=qwen3 CONFIG=qwen3_14b ./run_train.sh --training.steps=10 --compile.enable --compile.components=loss,feed_forward,qkv_linear --training.dtype=bfloat16 --training.seq_len=128 --training.local_batch_size=168 --loss.num_chunks=4 --optimizer.weight_decay=0.0 --dataloader.num_workers=2 --dataloader.persistent_workers --dataloader.prefetch_factor=2 --metrics.log_freq=1 --comm.trace_buf_size=0 --dump_folder=outputs/autoresearch/may19-qwen3-14b/run484-forward-only-prefetch-event-cache0 > outputs/autoresearch/may19-qwen3-14b/run484-forward-only-prefetch-event-cache0.run.log 2>&1
7b4bd985	12311	0.00	163.95	discard	TORCH_NCCL_HIGH_PRIORITY=1 is valid but below the event-cache-disabled compiled-QKV peak	TORCH_NCCL_HIGH_PRIORITY=1 TORCH_NCCL_CUDA_EVENT_CACHE=0 NCCL_NVLS_ENABLE=1 NCCL_CTA_POLICY=2 NGPU=8 LOG_RANK=0 MODULE=qwen3 CONFIG=qwen3_14b ./run_train.sh --training.steps=10 --compile.enable --compile.components=loss,feed_forward,qkv_linear --training.dtype=bfloat16 --training.seq_len=128 --training.local_batch_size=168 --loss.num_chunks=4 --optimizer.weight_decay=0.0 --dataloader.num_workers=2 --dataloader.persistent_workers --dataloader.prefetch_factor=2 --metrics.log_freq=1 --comm.trace_buf_size=0 --dump_folder=outputs/autoresearch/may19-qwen3-14b/run485-event-cache0-torch-nccl-high-priority > outputs/autoresearch/may19-qwen3-14b/run485-event-cache0-torch-nccl-high-priority.run.log 2>&1
0248af0e	11976	0.00	171.82	discard	removing loss compile is slower and memory-risky on the event-cache-disabled compiled-QKV recipe	TORCH_NCCL_CUDA_EVENT_CACHE=0 NCCL_NVLS_ENABLE=1 NCCL_CTA_POLICY=2 NGPU=8 LOG_RANK=0 MODULE=qwen3 CONFIG=qwen3_14b ./run_train.sh --training.steps=10 --compile.enable --compile.components=feed_forward,qkv_linear --training.dtype=bfloat16 --training.seq_len=128 --training.local_batch_size=168 --loss.num_chunks=4 --optimizer.weight_decay=0.0 --dataloader.num_workers=2 --dataloader.persistent_workers --dataloader.prefetch_factor=2 --metrics.log_freq=1 --comm.trace_buf_size=0 --dump_folder=outputs/autoresearch/may19-qwen3-14b/run486-event-cache0-no-loss-compile > outputs/autoresearch/may19-qwen3-14b/run486-event-cache0-no-loss-compile.run.log 2>&1
c28e46ba	0	0.00	0.0	crash	vendored flash-attention resolves missing CUTE APIs but Flex FLASH crashes in SM100 block-sparse correction path	PYTHONPATH=/home/avenkataraman/github/pytorch/third_party/flash-attention:$PYTHONPATH TORCH_NCCL_CUDA_EVENT_CACHE=0 NCCL_NVLS_ENABLE=1 NCCL_CTA_POLICY=2 NGPU=8 LOG_RANK=0 MODULE=qwen3 CONFIG=qwen3_14b ./run_train.sh --training.steps=10 --compile.enable --compile.components=loss,feed_forward,qkv_linear --training.dtype=bfloat16 --training.seq_len=128 --training.local_batch_size=168 --loss.num_chunks=4 --optimizer.weight_decay=0.0 --dataloader.num_workers=2 --dataloader.persistent_workers --dataloader.prefetch_factor=2 --metrics.log_freq=1 --comm.trace_buf_size=0 --dump_folder=outputs/autoresearch/may19-qwen3-14b/run487-flex-flash-vendored-fa-event-cache0 > outputs/autoresearch/may19-qwen3-14b/run487-flex-flash-vendored-fa-event-cache0.run.log 2>&1
41883410	0	0.00	0.0	crash	varlen attention remains blocked by missing flash_attn_interface/flash_attn_3 compiled extension	TORCH_NCCL_CUDA_EVENT_CACHE=0 NCCL_NVLS_ENABLE=1 NCCL_CTA_POLICY=2 NGPU=8 LOG_RANK=0 MODULE=qwen3 CONFIG=qwen3_14b ./run_train.sh --training.steps=10 --compile.enable --compile.components=loss,feed_forward,qkv_linear --training.dtype=bfloat16 --training.seq_len=128 --training.local_batch_size=168 --loss.num_chunks=4 --optimizer.weight_decay=0.0 --dataloader.num_workers=2 --dataloader.persistent_workers --dataloader.prefetch_factor=2 --metrics.log_freq=1 --comm.trace_buf_size=0 --dump_folder=outputs/autoresearch/may19-qwen3-14b/run488-varlen-attention-event-cache0 > outputs/autoresearch/may19-qwen3-14b/run488-varlen-attention-event-cache0.run.log 2>&1
6ab75081	0	0.00	0.0	crash	vendored flash_attn_3 installs and imports, but PyTorch FA3 varlen rejects this SM100/B200 host because it requires compute capability 9.0	PYTHONPATH=/home/avenkataraman/github/pytorch/third_party/flash-attention/hopper:/home/avenkataraman/github/pytorch/third_party/flash-attention:$PYTHONPATH TORCH_NCCL_CUDA_EVENT_CACHE=0 NCCL_NVLS_ENABLE=1 NCCL_CTA_POLICY=2 NGPU=8 LOG_RANK=0 MODULE=qwen3 CONFIG=qwen3_14b ./run_train.sh --training.steps=10 --compile.enable --compile.components=loss,feed_forward,qkv_linear --training.dtype=bfloat16 --training.seq_len=128 --training.local_batch_size=168 --loss.num_chunks=4 --optimizer.weight_decay=0.0 --dataloader.num_workers=2 --dataloader.persistent_workers --dataloader.prefetch_factor=2 --metrics.log_freq=1 --comm.trace_buf_size=0 --dump_folder=outputs/autoresearch/may19-qwen3-14b/run489-varlen-vendored-fa3-event-cache0 > outputs/autoresearch/may19-qwen3-14b/run489-varlen-vendored-fa3-event-cache0.run.log 2>&1
4816c3fd	12442	0.00	163.95	discard	fused_opt_states_bf16 is a near miss but does not beat the event-cache-disabled peak or lower peak memory	TORCH_NCCL_CUDA_EVENT_CACHE=0 NCCL_NVLS_ENABLE=1 NCCL_CTA_POLICY=2 NGPU=8 LOG_RANK=0 MODULE=qwen3 CONFIG=qwen3_14b ./run_train.sh --training.steps=10 --compile.enable --compile.components=loss,feed_forward,qkv_linear --training.dtype=bfloat16 --training.seq_len=128 --training.local_batch_size=168 --loss.num_chunks=4 --optimizer.weight_decay=0.0 --optimizer.implementation=fused_opt_states_bf16 --dataloader.num_workers=2 --dataloader.persistent_workers --dataloader.prefetch_factor=2 --metrics.log_freq=1 --comm.trace_buf_size=0 --dump_folder=outputs/autoresearch/may19-qwen3-14b/run490-event-cache0-fused-opt-states-bf16 > outputs/autoresearch/may19-qwen3-14b/run490-event-cache0-fused-opt-states-bf16.run.log 2>&1
a099091d	0	0.00	0.0	crash	fullgraph decoder-layer compile crashes before step 1 with Inductor fake-tensor metadata recursion on the MXFP8/FSDP view path	TORCH_NCCL_CUDA_EVENT_CACHE=0 NCCL_NVLS_ENABLE=1 NCCL_CTA_POLICY=2 NGPU=8 LOG_RANK=0 MODULE=qwen3 CONFIG=qwen3_14b ./run_train.sh --training.steps=10 --compile.enable --compile.components=loss,layer --training.dtype=bfloat16 --training.seq_len=128 --training.local_batch_size=168 --loss.num_chunks=4 --optimizer.weight_decay=0.0 --dataloader.num_workers=2 --dataloader.persistent_workers --dataloader.prefetch_factor=2 --metrics.log_freq=1 --comm.trace_buf_size=0 --dump_folder=outputs/autoresearch/may19-qwen3-14b/run491-event-cache0-compile-layer > outputs/autoresearch/may19-qwen3-14b/run491-event-cache0-compile-layer.run.log 2>&1
ffd4bed6	0	0.00	0.0	crash	non-fullgraph decoder-layer compile hits the same Inductor fake-tensor metadata recursion, so layer compile is blocked independent of fullgraph mode	TORCH_NCCL_CUDA_EVENT_CACHE=0 NCCL_NVLS_ENABLE=1 NCCL_CTA_POLICY=2 NGPU=8 LOG_RANK=0 MODULE=qwen3 CONFIG=qwen3_14b ./run_train.sh --training.steps=10 --compile.enable --compile.components=loss,layer --training.dtype=bfloat16 --training.seq_len=128 --training.local_batch_size=168 --loss.num_chunks=4 --optimizer.weight_decay=0.0 --dataloader.num_workers=2 --dataloader.persistent_workers --dataloader.prefetch_factor=2 --metrics.log_freq=1 --comm.trace_buf_size=0 --dump_folder=outputs/autoresearch/may19-qwen3-14b/run492-event-cache0-compile-layer-nonfullgraph > outputs/autoresearch/may19-qwen3-14b/run492-event-cache0-compile-layer-nonfullgraph.run.log 2>&1
2934b677	12152	0.00	163.95	discard	TORCH_NCCL_USE_TENSOR_REGISTER_ALLOCATOR_HOOK=1 does not compose with event-cache disable on the compiled-Q/K/V recipe	TORCH_NCCL_USE_TENSOR_REGISTER_ALLOCATOR_HOOK=1 TORCH_NCCL_CUDA_EVENT_CACHE=0 NCCL_NVLS_ENABLE=1 NCCL_CTA_POLICY=2 NGPU=8 LOG_RANK=0 MODULE=qwen3 CONFIG=qwen3_14b ./run_train.sh --training.steps=10 --compile.enable --compile.components=loss,feed_forward,qkv_linear --training.dtype=bfloat16 --training.seq_len=128 --training.local_batch_size=168 --loss.num_chunks=4 --optimizer.weight_decay=0.0 --dataloader.num_workers=2 --dataloader.persistent_workers --dataloader.prefetch_factor=2 --metrics.log_freq=1 --comm.trace_buf_size=0 --dump_folder=outputs/autoresearch/may19-qwen3-14b/run493-event-cache0-tensor-register-allocator-hook > outputs/autoresearch/may19-qwen3-14b/run493-event-cache0-tensor-register-allocator-hook.run.log 2>&1
9bf1d113	12217	0.00	163.95	discard	disabling NVLS is slower on the event-cache-disabled compiled-Q/K/V recipe, so explicit NVLS remains active	TORCH_NCCL_CUDA_EVENT_CACHE=0 NCCL_NVLS_ENABLE=0 NCCL_CTA_POLICY=2 NGPU=8 LOG_RANK=0 MODULE=qwen3 CONFIG=qwen3_14b ./run_train.sh --training.steps=10 --compile.enable --compile.components=loss,feed_forward,qkv_linear --training.dtype=bfloat16 --training.seq_len=128 --training.local_batch_size=168 --loss.num_chunks=4 --optimizer.weight_decay=0.0 --dataloader.num_workers=2 --dataloader.persistent_workers --dataloader.prefetch_factor=2 --metrics.log_freq=1 --comm.trace_buf_size=0 --dump_folder=outputs/autoresearch/may19-qwen3-14b/run494-event-cache0-nvls-disable > outputs/autoresearch/may19-qwen3-14b/run494-event-cache0-nvls-disable.run.log 2>&1
7c9127fc	12202	0.00	163.95	discard	foreach optimizer implementation is slower than the default fused optimizer on the event-cache-disabled compiled-Q/K/V recipe	TORCH_NCCL_CUDA_EVENT_CACHE=0 NCCL_NVLS_ENABLE=1 NCCL_CTA_POLICY=2 NGPU=8 LOG_RANK=0 MODULE=qwen3 CONFIG=qwen3_14b ./run_train.sh --training.steps=10 --compile.enable --compile.components=loss,feed_forward,qkv_linear --training.dtype=bfloat16 --training.seq_len=128 --training.local_batch_size=168 --loss.num_chunks=4 --optimizer.weight_decay=0.0 --optimizer.implementation=foreach --dataloader.num_workers=2 --dataloader.persistent_workers --dataloader.prefetch_factor=2 --metrics.log_freq=1 --comm.trace_buf_size=0 --dump_folder=outputs/autoresearch/may19-qwen3-14b/run495-event-cache0-optimizer-foreach > outputs/autoresearch/may19-qwen3-14b/run495-event-cache0-optimizer-foreach.run.log 2>&1
6205c762	12273	0.00	163.95	discard	NCCL_CGA_CLUSTER_SIZE=2 does not beat the event-cache-disabled compiled-Q/K/V recipe	TORCH_NCCL_CUDA_EVENT_CACHE=0 NCCL_CGA_CLUSTER_SIZE=2 NCCL_NVLS_ENABLE=1 NCCL_CTA_POLICY=2 NGPU=8 LOG_RANK=0 MODULE=qwen3 CONFIG=qwen3_14b ./run_train.sh --training.steps=10 --compile.enable --compile.components=loss,feed_forward,qkv_linear --training.dtype=bfloat16 --training.seq_len=128 --training.local_batch_size=168 --loss.num_chunks=4 --optimizer.weight_decay=0.0 --dataloader.num_workers=2 --dataloader.persistent_workers --dataloader.prefetch_factor=2 --metrics.log_freq=1 --comm.trace_buf_size=0 --dump_folder=outputs/autoresearch/may19-qwen3-14b/run496-event-cache0-nccl-cga2 > outputs/autoresearch/may19-qwen3-14b/run496-event-cache0-nccl-cga2.run.log 2>&1
c49a164d	12006	0.00	163.95	discard	patched vendored Flex FLASH completes but is slower than SDPA on the event-cache-disabled compiled-Q/K/V recipe	PYTHONPATH=/home/avenkataraman/github/pytorch/third_party/flash-attention:$PYTHONPATH TORCH_NCCL_CUDA_EVENT_CACHE=0 NCCL_NVLS_ENABLE=1 NCCL_CTA_POLICY=2 NGPU=8 LOG_RANK=0 MODULE=qwen3 CONFIG=qwen3_14b ./run_train.sh --training.steps=10 --compile.enable --compile.components=loss,feed_forward,qkv_linear --training.dtype=bfloat16 --training.seq_len=128 --training.local_batch_size=168 --loss.num_chunks=4 --optimizer.weight_decay=0.0 --dataloader.num_workers=2 --dataloader.persistent_workers --dataloader.prefetch_factor=2 --metrics.log_freq=1 --comm.trace_buf_size=0 --dump_folder=outputs/autoresearch/may19-qwen3-14b/run497-flex-flash-vendored-gO-guard-event-cache0 > outputs/autoresearch/may19-qwen3-14b/run497-flex-flash-vendored-gO-guard-event-cache0.run.log 2>&1
977e095e	12409	0.00	163.95	discard	plain FlexAttention is a near miss but remains below the SDPA event-cache-disabled peak	TORCH_NCCL_CUDA_EVENT_CACHE=0 NCCL_NVLS_ENABLE=1 NCCL_CTA_POLICY=2 NGPU=8 LOG_RANK=0 MODULE=qwen3 CONFIG=qwen3_14b ./run_train.sh --training.steps=10 --compile.enable --compile.components=loss,feed_forward,qkv_linear --training.dtype=bfloat16 --training.seq_len=128 --training.local_batch_size=168 --loss.num_chunks=4 --optimizer.weight_decay=0.0 --dataloader.num_workers=2 --dataloader.persistent_workers --dataloader.prefetch_factor=2 --metrics.log_freq=1 --comm.trace_buf_size=0 --dump_folder=outputs/autoresearch/may19-qwen3-14b/run498-flex-event-cache0-compiled-qkv > outputs/autoresearch/may19-qwen3-14b/run498-flex-event-cache0-compiled-qkv.run.log 2>&1
1e7be560	12202	0.00	163.95	keep	profiled plain FlexAttention near-miss; profiled tps is diagnostic, trace shows attention lower but MXFP8/GEMM/all-gather higher versus SDPA	TORCH_NCCL_CUDA_EVENT_CACHE=0 NCCL_NVLS_ENABLE=1 NCCL_CTA_POLICY=2 NGPU=8 LOG_RANK=0 MODULE=qwen3 CONFIG=qwen3_14b ./run_train.sh --training.steps=10 --compile.enable --compile.components=loss,feed_forward,qkv_linear --training.dtype=bfloat16 --training.seq_len=128 --training.local_batch_size=168 --loss.num_chunks=4 --optimizer.weight_decay=0.0 --dataloader.num_workers=2 --dataloader.persistent_workers --dataloader.prefetch_factor=2 --metrics.log_freq=1 --comm.trace_buf_size=0 --profiler.enable_profiling --profiler.profile_freq=10 --profiler.profiler_warmup=2 --profiler.profiler_active=1 --dump_folder=outputs/autoresearch/may19-qwen3-14b/run499-profile-flex-event-cache0-compiled-qkv > outputs/autoresearch/may19-qwen3-14b/run499-profile-flex-event-cache0-compiled-qkv.run.log 2>&1
16f4dddf+dirty	12379	0.00	163.98	discard	concatenating Q/K/V backward grad-input into one MXFP8 matmul is valid but slower than three separate projection backward GEMMs	TORCH_NCCL_CUDA_EVENT_CACHE=0 NCCL_NVLS_ENABLE=1 NCCL_CTA_POLICY=2 NGPU=8 LOG_RANK=0 MODULE=qwen3 CONFIG=qwen3_14b ./run_train.sh --training.steps=10 --compile.enable --compile.components=loss,feed_forward,qkv_linear --training.dtype=bfloat16 --training.seq_len=128 --training.local_batch_size=168 --loss.num_chunks=4 --optimizer.weight_decay=0.0 --dataloader.num_workers=2 --dataloader.persistent_workers --dataloader.prefetch_factor=2 --metrics.log_freq=1 --comm.trace_buf_size=0 --dump_folder=outputs/autoresearch/may19-qwen3-14b/run500-qkv-backward-concat-grad-input-event-cache0 > outputs/autoresearch/may19-qwen3-14b/run500-qkv-backward-concat-grad-input-event-cache0.run.log 2>&1
4784cdb3	12222	0.00	163.95	discard	seq96 local batch224 keeps active tokens and MXFP8 loss tiling but is slower than seq128 local batch168	TORCH_NCCL_CUDA_EVENT_CACHE=0 NCCL_NVLS_ENABLE=1 NCCL_CTA_POLICY=2 NGPU=8 LOG_RANK=0 MODULE=qwen3 CONFIG=qwen3_14b ./run_train.sh --training.steps=10 --compile.enable --compile.components=loss,feed_forward,qkv_linear --training.dtype=bfloat16 --training.seq_len=96 --training.local_batch_size=224 --loss.num_chunks=4 --optimizer.weight_decay=0.0 --dataloader.num_workers=2 --dataloader.persistent_workers --dataloader.prefetch_factor=2 --metrics.log_freq=1 --comm.trace_buf_size=0 --dump_folder=outputs/autoresearch/may19-qwen3-14b/run501-event-cache0-seq96-lbs224-same-tokens > outputs/autoresearch/may19-qwen3-14b/run501-event-cache0-seq96-lbs224-same-tokens.run.log 2>&1
84f86ec8	12313	0.00	163.95	discard	seq112 local batch192 keeps active tokens and MXFP8 loss tiling but is still slower than seq128 local batch168	TORCH_NCCL_CUDA_EVENT_CACHE=0 NCCL_NVLS_ENABLE=1 NCCL_CTA_POLICY=2 NGPU=8 LOG_RANK=0 MODULE=qwen3 CONFIG=qwen3_14b ./run_train.sh --training.steps=10 --compile.enable --compile.components=loss,feed_forward,qkv_linear --training.dtype=bfloat16 --training.seq_len=112 --training.local_batch_size=192 --loss.num_chunks=4 --optimizer.weight_decay=0.0 --dataloader.num_workers=2 --dataloader.persistent_workers --dataloader.prefetch_factor=2 --metrics.log_freq=1 --comm.trace_buf_size=0 --dump_folder=outputs/autoresearch/may19-qwen3-14b/run502-event-cache0-seq112-lbs192-same-tokens > outputs/autoresearch/may19-qwen3-14b/run502-event-cache0-seq112-lbs192-same-tokens.run.log 2>&1
8afc3687+dirty	0	0.00	0.0	crash	cloning layer residual outputs does not unblock decoder-layer compile; Inductor still hits fake-tensor metadata recursion on the MXFP8/FSDP view path	TORCH_NCCL_CUDA_EVENT_CACHE=0 NCCL_NVLS_ENABLE=1 NCCL_CTA_POLICY=2 NGPU=8 LOG_RANK=0 MODULE=qwen3 CONFIG=qwen3_14b ./run_train.sh --training.steps=10 --compile.enable --compile.components=loss,layer_clones --training.dtype=bfloat16 --training.seq_len=128 --training.local_batch_size=168 --loss.num_chunks=4 --optimizer.weight_decay=0.0 --dataloader.num_workers=2 --dataloader.persistent_workers --dataloader.prefetch_factor=2 --metrics.log_freq=1 --comm.trace_buf_size=0 --dump_folder=outputs/autoresearch/may19-qwen3-14b/run503-layer-compile-cloned-residual-outputs > outputs/autoresearch/may19-qwen3-14b/run503-layer-compile-cloned-residual-outputs.run.log 2>&1
125d00d5	12018	0.00	163.95	discard	metrics.log_freq=10 avoids per-step scalar metric syncs but lowers the reported step-10 average throughput	TORCH_NCCL_CUDA_EVENT_CACHE=0 NCCL_NVLS_ENABLE=1 NCCL_CTA_POLICY=2 NGPU=8 LOG_RANK=0 MODULE=qwen3 CONFIG=qwen3_14b ./run_train.sh --training.steps=10 --compile.enable --compile.components=loss,feed_forward,qkv_linear --training.dtype=bfloat16 --training.seq_len=128 --training.local_batch_size=168 --loss.num_chunks=4 --optimizer.weight_decay=0.0 --dataloader.num_workers=2 --dataloader.persistent_workers --dataloader.prefetch_factor=2 --metrics.log_freq=10 --comm.trace_buf_size=0 --dump_folder=outputs/autoresearch/may19-qwen3-14b/run504-event-cache0-metrics-logfreq10 > outputs/autoresearch/may19-qwen3-14b/run504-event-cache0-metrics-logfreq10.run.log 2>&1
f574f23b+dirty	12280	0.00	163.15	discard	sequential RoPE fast path lowers memory but slows the event-cache-disabled compiled-Q/K/V recipe	TORCH_NCCL_CUDA_EVENT_CACHE=0 NCCL_NVLS_ENABLE=1 NCCL_CTA_POLICY=2 NGPU=8 LOG_RANK=0 MODULE=qwen3 CONFIG=qwen3_14b ./run_train.sh --training.steps=10 --compile.enable --compile.components=loss,feed_forward,qkv_linear --training.dtype=bfloat16 --training.seq_len=128 --training.local_batch_size=168 --loss.num_chunks=4 --optimizer.weight_decay=0.0 --dataloader.num_workers=2 --dataloader.persistent_workers --dataloader.prefetch_factor=2 --metrics.log_freq=1 --comm.trace_buf_size=0 --dump_folder=outputs/autoresearch/may19-qwen3-14b/run505-sequential-rope-fast-path-event-cache0 > outputs/autoresearch/may19-qwen3-14b/run505-sequential-rope-fast-path-event-cache0.run.log 2>&1
dab36ae7+dirty	13622	0.00	162.66	keep	custom Triton sequential RoPE autograd kernel is a new measured peak on the event-cache-disabled compiled-Q/K/V recipe	TORCH_NCCL_CUDA_EVENT_CACHE=0 NCCL_NVLS_ENABLE=1 NCCL_CTA_POLICY=2 NGPU=8 LOG_RANK=0 MODULE=qwen3 CONFIG=qwen3_14b ./run_train.sh --training.steps=10 --compile.enable --compile.components=loss,feed_forward,qkv_linear --training.dtype=bfloat16 --training.seq_len=128 --training.local_batch_size=168 --loss.num_chunks=4 --optimizer.weight_decay=0.0 --dataloader.num_workers=2 --dataloader.persistent_workers --dataloader.prefetch_factor=2 --metrics.log_freq=1 --comm.trace_buf_size=0 --dump_folder=outputs/autoresearch/may19-qwen3-14b/run506-triton-sequential-rope-event-cache0 > outputs/autoresearch/may19-qwen3-14b/run506-triton-sequential-rope-event-cache0.run.log 2>&1
