commit	tokens_per_sec	mfu_percent	peak_memory_gb	status	description	command
00fb0456	0	0.00	0.0	crash	MXFP8Linear Triton dim1 with loss chunk8 clears row tiling but Inductor backward post-grad reinplace hits fake-tensor RecursionError	NCCL_CTA_POLICY=2 NGPU=8 LOG_RANK=0 MODULE=qwen3 CONFIG=qwen3_14b ./run_train.sh --training.steps=10 --compile.enable --training.dtype=bfloat16 --training.seq_len=128 --training.local_batch_size=160 --loss.num_chunks=8 --dataloader.num_workers=2 --dataloader.persistent_workers --dataloader.prefetch_factor=2 --metrics.log_freq=1 --comm.trace_buf_size=0 --dump_folder=outputs/autoresearch/may19-qwen3-14b/run342-mxfp8-linear-triton-dim1-loss-chunks8-sdpa-prefetch-seq128-lbs160-compile-bf16-nccl-zero-cta-dataloader-worker2-prefetch2-metrics-logfreq1-no-flight-recorder > run.log 2>&1
131374fa	0	0.00	0.0	oom	MXFP8Linear Triton dim1 with loss-only compile avoids Inductor model-backward recursion but OOMs at batch160	NCCL_CTA_POLICY=2 NGPU=8 LOG_RANK=0 MODULE=qwen3 CONFIG=qwen3_14b ./run_train.sh --training.steps=10 --compile.enable --compile.components='["loss"]' --training.dtype=bfloat16 --training.seq_len=128 --training.local_batch_size=160 --loss.num_chunks=8 --dataloader.num_workers=2 --dataloader.persistent_workers --dataloader.prefetch_factor=2 --metrics.log_freq=1 --comm.trace_buf_size=0 --dump_folder=outputs/autoresearch/may19-qwen3-14b/run343-mxfp8-linear-triton-dim1-loss-only-compile-loss-chunks8-sdpa-prefetch-seq128-lbs160-bf16-nccl-zero-cta-dataloader-worker2-prefetch2-metrics-logfreq1-no-flight-recorder > run.log 2>&1
4ef7d090	10960	0.00	161.90	keep	MXFP8Linear Triton dim1 works with loss-only compile, loss chunks8, and local batch128; first complete MXFP8 Qwen run	NCCL_CTA_POLICY=2 NGPU=8 LOG_RANK=0 MODULE=qwen3 CONFIG=qwen3_14b ./run_train.sh --training.steps=10 --compile.enable --compile.components='["loss"]' --training.dtype=bfloat16 --training.seq_len=128 --training.local_batch_size=128 --loss.num_chunks=8 --dataloader.num_workers=2 --dataloader.persistent_workers --dataloader.prefetch_factor=2 --metrics.log_freq=1 --comm.trace_buf_size=0 --dump_folder=outputs/autoresearch/may19-qwen3-14b/run344-mxfp8-linear-triton-dim1-loss-only-compile-loss-chunks8-sdpa-prefetch-seq128-lbs128-bf16-nccl-zero-cta-dataloader-worker2-prefetch2-metrics-logfreq1-no-flight-recorder > run.log 2>&1
ada8aff1	0	0.00	177.53	oom	MXFP8Linear loss-only compile local batch152 completes step1 but OOMs during subsequent loss/lm_head work	NCCL_CTA_POLICY=2 NGPU=8 LOG_RANK=0 MODULE=qwen3 CONFIG=qwen3_14b ./run_train.sh --training.steps=10 --compile.enable --compile.components='["loss"]' --training.dtype=bfloat16 --training.seq_len=128 --training.local_batch_size=152 --loss.num_chunks=8 --dataloader.num_workers=2 --dataloader.persistent_workers --dataloader.prefetch_factor=2 --metrics.log_freq=1 --comm.trace_buf_size=0 --dump_folder=outputs/autoresearch/may19-qwen3-14b/run345-mxfp8-linear-triton-dim1-loss-only-compile-loss-chunks8-sdpa-prefetch-seq128-lbs152-bf16-nccl-zero-cta-dataloader-worker2-prefetch2-metrics-logfreq1-no-flight-recorder > run.log 2>&1
c31ca0d1	6483	0.00	173.96	discard	MXFP8Linear loss-only compile local batch144 completes but memory is risky with allocator retries, throughput is low, and loss increases overall	NCCL_CTA_POLICY=2 NGPU=8 LOG_RANK=0 MODULE=qwen3 CONFIG=qwen3_14b ./run_train.sh --training.steps=10 --compile.enable --compile.components='["loss"]' --training.dtype=bfloat16 --training.seq_len=128 --training.local_batch_size=144 --loss.num_chunks=8 --dataloader.num_workers=2 --dataloader.persistent_workers --dataloader.prefetch_factor=2 --metrics.log_freq=1 --comm.trace_buf_size=0 --dump_folder=outputs/autoresearch/may19-qwen3-14b/run346-mxfp8-linear-triton-dim1-loss-only-compile-loss-chunks8-sdpa-prefetch-seq128-lbs144-bf16-nccl-zero-cta-dataloader-worker2-prefetch2-metrics-logfreq1-no-flight-recorder > run.log 2>&1
0002b8cb	11202	0.00	168.94	keep	MXFP8Linear loss-only compile local batch136 completes cleanly and improves tps over batch128	NCCL_CTA_POLICY=2 NGPU=8 LOG_RANK=0 MODULE=qwen3 CONFIG=qwen3_14b ./run_train.sh --training.steps=10 --compile.enable --compile.components='["loss"]' --training.dtype=bfloat16 --training.seq_len=128 --training.local_batch_size=136 --loss.num_chunks=8 --dataloader.num_workers=2 --dataloader.persistent_workers --dataloader.prefetch_factor=2 --metrics.log_freq=1 --comm.trace_buf_size=0 --dump_folder=outputs/autoresearch/may19-qwen3-14b/run347-mxfp8-linear-triton-dim1-loss-only-compile-loss-chunks8-sdpa-prefetch-seq128-lbs136-bf16-nccl-zero-cta-dataloader-worker2-prefetch2-metrics-logfreq1-no-flight-recorder > run.log 2>&1
0a1de54b	560	0.00	173.92	discard	MXFP8Linear batch136 loss chunks4 completes but hits allocator retries, risky memory, bad tps, and non-decreasing loss	NCCL_CTA_POLICY=2 NGPU=8 LOG_RANK=0 MODULE=qwen3 CONFIG=qwen3_14b ./run_train.sh --training.steps=10 --compile.enable --compile.components='["loss"]' --training.dtype=bfloat16 --training.seq_len=128 --training.local_batch_size=136 --loss.num_chunks=4 --dataloader.num_workers=2 --dataloader.persistent_workers --dataloader.prefetch_factor=2 --metrics.log_freq=1 --comm.trace_buf_size=0 --dump_folder=outputs/autoresearch/may19-qwen3-14b/run348-mxfp8-linear-triton-dim1-loss-only-compile-loss-chunks4-sdpa-prefetch-seq128-lbs136-bf16-nccl-zero-cta-dataloader-worker2-prefetch2-metrics-logfreq1-no-flight-recorder > run.log 2>&1
b0ad0320	11065	0.00	168.94	keep	exact MXFP8 batch136 chunks8 rerun validates cleanly but samples below the 11202 tps measured peak	NCCL_CTA_POLICY=2 NGPU=8 LOG_RANK=0 MODULE=qwen3 CONFIG=qwen3_14b ./run_train.sh --training.steps=10 --compile.enable --compile.components='["loss"]' --training.dtype=bfloat16 --training.seq_len=128 --training.local_batch_size=136 --loss.num_chunks=8 --dataloader.num_workers=2 --dataloader.persistent_workers --dataloader.prefetch_factor=2 --metrics.log_freq=1 --comm.trace_buf_size=0 --dump_folder=outputs/autoresearch/may19-qwen3-14b/run349-mxfp8-linear-triton-dim1-loss-only-compile-loss-chunks8-rerun-sdpa-prefetch-seq128-lbs136-bf16-nccl-zero-cta-dataloader-worker2-prefetch2-metrics-logfreq1-no-flight-recorder > run.log 2>&1
84eacc9d	11171	0.00	166.01	keep	MXFP8Linear batch128 loss chunks4 is clean and near peak with lower memory but does not beat batch136 chunks8	NCCL_CTA_POLICY=2 NGPU=8 LOG_RANK=0 MODULE=qwen3 CONFIG=qwen3_14b ./run_train.sh --training.steps=10 --compile.enable --compile.components='["loss"]' --training.dtype=bfloat16 --training.seq_len=128 --training.local_batch_size=128 --loss.num_chunks=4 --dataloader.num_workers=2 --dataloader.persistent_workers --dataloader.prefetch_factor=2 --metrics.log_freq=1 --comm.trace_buf_size=0 --dump_folder=outputs/autoresearch/may19-qwen3-14b/run350-mxfp8-linear-triton-dim1-loss-only-compile-loss-chunks4-sdpa-prefetch-seq128-lbs128-bf16-nccl-zero-cta-dataloader-worker2-prefetch2-metrics-logfreq1-no-flight-recorder > run.log 2>&1
8f50844a	11199	0.00	170.60	discard	MXFP8Linear batch132 loss chunks4 nearly ties peak but uses memory above the preferred risk line	NCCL_CTA_POLICY=2 NGPU=8 LOG_RANK=0 MODULE=qwen3 CONFIG=qwen3_14b ./run_train.sh --training.steps=10 --compile.enable --compile.components='["loss"]' --training.dtype=bfloat16 --training.seq_len=128 --training.local_batch_size=132 --loss.num_chunks=4 --dataloader.num_workers=2 --dataloader.persistent_workers --dataloader.prefetch_factor=2 --metrics.log_freq=1 --comm.trace_buf_size=0 --dump_folder=outputs/autoresearch/may19-qwen3-14b/run351-mxfp8-linear-triton-dim1-loss-only-compile-loss-chunks4-sdpa-prefetch-seq128-lbs132-bf16-nccl-zero-cta-dataloader-worker2-prefetch2-metrics-logfreq1-no-flight-recorder > run.log 2>&1
43367b5c	7823	0.00	171.26	discard	MXFP8Linear batch128 loss chunks2 crosses into allocator retries and is much slower	NCCL_CTA_POLICY=2 NGPU=8 LOG_RANK=0 MODULE=qwen3 CONFIG=qwen3_14b ./run_train.sh --training.steps=10 --compile.enable --compile.components='["loss"]' --training.dtype=bfloat16 --training.seq_len=128 --training.local_batch_size=128 --loss.num_chunks=2 --dataloader.num_workers=2 --dataloader.persistent_workers --dataloader.prefetch_factor=2 --metrics.log_freq=1 --comm.trace_buf_size=0 --dump_folder=outputs/autoresearch/may19-qwen3-14b/run352-mxfp8-linear-triton-dim1-loss-only-compile-loss-chunks2-sdpa-prefetch-seq128-lbs128-bf16-nccl-zero-cta-dataloader-worker2-prefetch2-metrics-logfreq1-no-flight-recorder > run.log 2>&1
a86eeab1	11028	0.00	168.94	keep	profiled MXFP8 current best for bottleneck analysis; profiled tps is not used for ranking	NCCL_CTA_POLICY=2 NGPU=8 LOG_RANK=0 MODULE=qwen3 CONFIG=qwen3_14b ./run_train.sh --training.steps=10 --compile.enable --compile.components='["loss"]' --training.dtype=bfloat16 --training.seq_len=128 --training.local_batch_size=136 --loss.num_chunks=8 --dataloader.num_workers=2 --dataloader.persistent_workers --dataloader.prefetch_factor=2 --metrics.log_freq=1 --comm.trace_buf_size=0 --profiler.enable_profiling --profiler.profile_freq=10 --profiler.profiler_warmup=2 --profiler.profiler_active=1 --dump_folder=outputs/autoresearch/may19-qwen3-14b/run353-profile-mxfp8-linear-triton-dim1-loss-only-compile-loss-chunks8-sdpa-prefetch-seq128-lbs136-bf16-nccl-zero-cta-dataloader-worker2-prefetch2-metrics-logfreq1-no-flight-recorder > run.log 2>&1
4572676c	11164	0.00	168.92	discard	excluding small WKV projections from MXFP8 is valid but slower than full MXFP8 coverage	NCCL_CTA_POLICY=2 NGPU=8 LOG_RANK=0 MODULE=qwen3 CONFIG=qwen3_14b ./run_train.sh --training.steps=10 --compile.enable --compile.components='["loss"]' --training.dtype=bfloat16 --training.seq_len=128 --training.local_batch_size=136 --loss.num_chunks=8 --dataloader.num_workers=2 --dataloader.persistent_workers --dataloader.prefetch_factor=2 --metrics.log_freq=1 --comm.trace_buf_size=0 --dump_folder=outputs/autoresearch/may19-qwen3-14b/run354-mxfp8-exclude-wkv-loss-only-compile-loss-chunks8-sdpa-prefetch-seq128-lbs136-bf16-nccl-zero-cta-dataloader-worker2-prefetch2-metrics-logfreq1-no-flight-recorder > run.log 2>&1
d52e1242	0	0.00	173.96	oom	MXFP8 optimizer-in-backward batch144 still hits allocator retries and rank 6 SIGABRTs after step4	NCCL_CTA_POLICY=2 NGPU=8 LOG_RANK=0 MODULE=qwen3 CONFIG=qwen3_14b ./run_train.sh --training.steps=10 --compile.enable --compile.components='["loss"]' --training.dtype=bfloat16 --training.seq_len=128 --training.local_batch_size=144 --loss.num_chunks=8 --dataloader.num_workers=2 --dataloader.persistent_workers --dataloader.prefetch_factor=2 --metrics.log_freq=1 --comm.trace_buf_size=0 --dump_folder=outputs/autoresearch/may19-qwen3-14b/run355-mxfp8-optimizer-in-backward-loss-only-compile-loss-chunks8-sdpa-prefetch-seq128-lbs144-bf16-nccl-zero-cta-dataloader-worker2-prefetch2-metrics-logfreq1-no-flight-recorder > run.log 2>&1
8d6d195e	11078	0.00	168.94	discard	fused BF16 optimizer states are valid but slower and do not reduce MXFP8 peak memory	NCCL_CTA_POLICY=2 NGPU=8 LOG_RANK=0 MODULE=qwen3 CONFIG=qwen3_14b ./run_train.sh --training.steps=10 --compile.enable --compile.components='["loss"]' --training.dtype=bfloat16 --training.seq_len=128 --training.local_batch_size=136 --loss.num_chunks=8 --optimizer.implementation=fused_opt_states_bf16 --dataloader.num_workers=2 --dataloader.persistent_workers --dataloader.prefetch_factor=2 --metrics.log_freq=1 --comm.trace_buf_size=0 --dump_folder=outputs/autoresearch/may19-qwen3-14b/run356-mxfp8-fused-opt-states-bf16-loss-only-compile-loss-chunks8-sdpa-prefetch-seq128-lbs136-bf16-nccl-zero-cta-dataloader-worker2-prefetch2-metrics-logfreq1-no-flight-recorder > run.log 2>&1
fbc1965c	11095	0.00	168.94	discard	default NCCL CTA policy is valid but slower than NCCL_CTA_POLICY=2 for MXFP8	NCCL_CTA_POLICY omitted; NGPU=8 LOG_RANK=0 MODULE=qwen3 CONFIG=qwen3_14b ./run_train.sh --training.steps=10 --compile.enable --compile.components='["loss"]' --training.dtype=bfloat16 --training.seq_len=128 --training.local_batch_size=136 --loss.num_chunks=8 --dataloader.num_workers=2 --dataloader.persistent_workers --dataloader.prefetch_factor=2 --metrics.log_freq=1 --comm.trace_buf_size=0 --dump_folder=outputs/autoresearch/may19-qwen3-14b/run357-mxfp8-default-nccl-cta-policy-loss-only-compile-loss-chunks8-sdpa-prefetch-seq128-lbs136-bf16-dataloader-worker2-prefetch2-metrics-logfreq1-no-flight-recorder > run.log 2>&1
1fff37df	11020	0.00	168.94	discard	NCCL_CTA_POLICY=1 is valid but slower than policy2 for MXFP8	NCCL_CTA_POLICY=1 NGPU=8 LOG_RANK=0 MODULE=qwen3 CONFIG=qwen3_14b ./run_train.sh --training.steps=10 --compile.enable --compile.components='["loss"]' --training.dtype=bfloat16 --training.seq_len=128 --training.local_batch_size=136 --loss.num_chunks=8 --dataloader.num_workers=2 --dataloader.persistent_workers --dataloader.prefetch_factor=2 --metrics.log_freq=1 --comm.trace_buf_size=0 --dump_folder=outputs/autoresearch/may19-qwen3-14b/run358-mxfp8-nccl-cta-policy1-loss-only-compile-loss-chunks8-sdpa-prefetch-seq128-lbs136-bf16-dataloader-worker2-prefetch2-metrics-logfreq1-no-flight-recorder > run.log 2>&1
9200ffb3	8305	0.00	173.16	discard	excluding lm_head from MXFP8 does not rescue batch136 chunks4; allocator retries and risky memory remain	NCCL_CTA_POLICY=2 NGPU=8 LOG_RANK=0 MODULE=qwen3 CONFIG=qwen3_14b ./run_train.sh --training.steps=10 --compile.enable --compile.components='["loss"]' --training.dtype=bfloat16 --training.seq_len=128 --training.local_batch_size=136 --loss.num_chunks=4 --dataloader.num_workers=2 --dataloader.persistent_workers --dataloader.prefetch_factor=2 --metrics.log_freq=1 --comm.trace_buf_size=0 --dump_folder=outputs/autoresearch/may19-qwen3-14b/run359-mxfp8-exclude-lm-head-loss-only-compile-loss-chunks4-sdpa-prefetch-seq128-lbs136-bf16-nccl-zero-cta-dataloader-worker2-prefetch2-metrics-logfreq1-no-flight-recorder > run.log 2>&1
acd7635d	11206	0.00	169.29	keep	disabling FSDP forward input casts under MXFP8 is a tiny new measured peak but emits an FSDP MXFP8 view-output warning	NCCL_CTA_POLICY=2 NGPU=8 LOG_RANK=0 MODULE=qwen3 CONFIG=qwen3_14b ./run_train.sh --training.steps=10 --compile.enable --compile.components='["loss"]' --training.dtype=bfloat16 --training.seq_len=128 --training.local_batch_size=136 --loss.num_chunks=8 --dataloader.num_workers=2 --dataloader.persistent_workers --dataloader.prefetch_factor=2 --metrics.log_freq=1 --comm.trace_buf_size=0 --dump_folder=outputs/autoresearch/may19-qwen3-14b/run360-mxfp8-no-fsdp-forward-input-casts-loss-only-compile-loss-chunks8-sdpa-prefetch-seq128-lbs136-bf16-nccl-zero-cta-dataloader-worker2-prefetch2-metrics-logfreq1-no-flight-recorder > run.log 2>&1
0b0076b8	11381	0.00	170.30	keep	no-cast batch132 chunks4 is the highest tps so far but remains memory-risky above 95% and emits the MXFP8 FSDP view warning	NCCL_CTA_POLICY=2 NGPU=8 LOG_RANK=0 MODULE=qwen3 CONFIG=qwen3_14b ./run_train.sh --training.steps=10 --compile.enable --compile.components='["loss"]' --training.dtype=bfloat16 --training.seq_len=128 --training.local_batch_size=132 --loss.num_chunks=4 --dataloader.num_workers=2 --dataloader.persistent_workers --dataloader.prefetch_factor=2 --metrics.log_freq=1 --comm.trace_buf_size=0 --dump_folder=outputs/autoresearch/may19-qwen3-14b/run361-mxfp8-no-fsdp-forward-input-casts-loss-only-compile-loss-chunks4-sdpa-prefetch-seq128-lbs132-bf16-nccl-zero-cta-dataloader-worker2-prefetch2-metrics-logfreq1-no-flight-recorder > run.log 2>&1
8328dba6	11235	0.00	170.30	discard	compiling only Qwen3 RMSNorm modules is valid but slower than the no-cast chunks4 peak	NCCL_CTA_POLICY=2 NGPU=8 LOG_RANK=0 MODULE=qwen3 CONFIG=qwen3_14b ./run_train.sh --training.steps=10 --compile.enable --compile.components='["loss","norms"]' --training.dtype=bfloat16 --training.seq_len=128 --training.local_batch_size=132 --loss.num_chunks=4 --dataloader.num_workers=2 --dataloader.persistent_workers --dataloader.prefetch_factor=2 --metrics.log_freq=1 --comm.trace_buf_size=0 --dump_folder=outputs/autoresearch/may19-qwen3-14b/run362-mxfp8-compile-norms-no-fsdp-forward-input-casts-loss-chunks4-sdpa-prefetch-seq128-lbs132-bf16-nccl-zero-cta-dataloader-worker2-prefetch2-metrics-logfreq1-no-flight-recorder > run.log 2>&1
283701c5	11165	0.00	170.30	keep	profiled no-cast batch132 chunks4 current best for bottleneck analysis; profiled tps is not used for ranking	NCCL_CTA_POLICY=2 NGPU=8 LOG_RANK=0 MODULE=qwen3 CONFIG=qwen3_14b ./run_train.sh --training.steps=10 --compile.enable --compile.components='["loss"]' --training.dtype=bfloat16 --training.seq_len=128 --training.local_batch_size=132 --loss.num_chunks=4 --dataloader.num_workers=2 --dataloader.persistent_workers --dataloader.prefetch_factor=2 --metrics.log_freq=1 --comm.trace_buf_size=0 --profiler.enable_profiling --profiler.profile_freq=10 --profiler.profiler_warmup=2 --profiler.profiler_active=1 --dump_folder=outputs/autoresearch/may19-qwen3-14b/run363-profile-mxfp8-no-fsdp-forward-input-casts-loss-only-compile-loss-chunks4-sdpa-prefetch-seq128-lbs132-bf16-nccl-zero-cta-dataloader-worker2-prefetch2-metrics-logfreq1-no-flight-recorder > run.log 2>&1
f23af524	11277	0.00	171.61	discard	pairwise FSDP grouping under MXFP8 no-cast is slower and increases memory risk	NCCL_CTA_POLICY=2 NGPU=8 LOG_RANK=0 MODULE=qwen3 CONFIG=qwen3_14b ./run_train.sh --training.steps=10 --compile.enable --compile.components='["loss"]' --training.dtype=bfloat16 --training.seq_len=128 --training.local_batch_size=132 --loss.num_chunks=4 --dataloader.num_workers=2 --dataloader.persistent_workers --dataloader.prefetch_factor=2 --metrics.log_freq=1 --comm.trace_buf_size=0 --dump_folder=outputs/autoresearch/may19-qwen3-14b/run364-mxfp8-pairwise-fsdp-no-fsdp-forward-input-casts-loss-only-compile-loss-chunks4-sdpa-prefetch-seq128-lbs132-bf16-nccl-zero-cta-dataloader-worker2-prefetch2-metrics-logfreq1-no-flight-recorder > run.log 2>&1
a49a6292	11386	0.00	166.26	keep	no-cast batch128 chunks4 slightly beats the batch132 peak while staying below the memory-risk line	NCCL_CTA_POLICY=2 NGPU=8 LOG_RANK=0 MODULE=qwen3 CONFIG=qwen3_14b ./run_train.sh --training.steps=10 --compile.enable --compile.components='["loss"]' --training.dtype=bfloat16 --training.seq_len=128 --training.local_batch_size=128 --loss.num_chunks=4 --dataloader.num_workers=2 --dataloader.persistent_workers --dataloader.prefetch_factor=2 --metrics.log_freq=1 --comm.trace_buf_size=0 --dump_folder=outputs/autoresearch/may19-qwen3-14b/run365-mxfp8-no-fsdp-forward-input-casts-loss-only-compile-loss-chunks4-sdpa-prefetch-seq128-lbs128-bf16-nccl-zero-cta-dataloader-worker2-prefetch2-metrics-logfreq1-no-flight-recorder > run.log 2>&1
d05e782e	11134	0.00	161.67	discard	no-cast batch124 chunks4 is clean and lower-memory but slower than batch128 chunks4	NCCL_CTA_POLICY=2 NGPU=8 LOG_RANK=0 MODULE=qwen3 CONFIG=qwen3_14b ./run_train.sh --training.steps=10 --compile.enable --compile.components='["loss"]' --training.dtype=bfloat16 --training.seq_len=128 --training.local_batch_size=124 --loss.num_chunks=4 --dataloader.num_workers=2 --dataloader.persistent_workers --dataloader.prefetch_factor=2 --metrics.log_freq=1 --comm.trace_buf_size=0 --dump_folder=outputs/autoresearch/may19-qwen3-14b/run366-mxfp8-no-fsdp-forward-input-casts-loss-only-compile-loss-chunks4-sdpa-prefetch-seq128-lbs124-bf16-nccl-zero-cta-dataloader-worker2-prefetch2-metrics-logfreq1-no-flight-recorder > run.log 2>&1
6074a430	11179	0.00	166.26	keep	profiled no-cast batch128 chunks4 current best; profiled tps is not used for ranking	NCCL_CTA_POLICY=2 NGPU=8 LOG_RANK=0 MODULE=qwen3 CONFIG=qwen3_14b ./run_train.sh --training.steps=10 --compile.enable --compile.components='["loss"]' --training.dtype=bfloat16 --training.seq_len=128 --training.local_batch_size=128 --loss.num_chunks=4 --dataloader.num_workers=2 --dataloader.persistent_workers --dataloader.prefetch_factor=2 --metrics.log_freq=1 --comm.trace_buf_size=0 --profiler.enable_profiling --profiler.profile_freq=10 --profiler.profiler_warmup=2 --profiler.profiler_active=1 --dump_folder=outputs/autoresearch/may19-qwen3-14b/run367-profile-mxfp8-no-fsdp-forward-input-casts-loss-only-compile-loss-chunks4-sdpa-prefetch-seq128-lbs128-bf16-nccl-zero-cta-dataloader-worker2-prefetch2-metrics-logfreq1-no-flight-recorder > run.log 2>&1
80ce2fe5	11294	0.00	166.26	discard	default NCCL CTA policy is valid but slower than policy2 on the no-cast batch128 chunks4 best	NCCL_CTA_POLICY omitted; NGPU=8 LOG_RANK=0 MODULE=qwen3 CONFIG=qwen3_14b ./run_train.sh --training.steps=10 --compile.enable --compile.components='["loss"]' --training.dtype=bfloat16 --training.seq_len=128 --training.local_batch_size=128 --loss.num_chunks=4 --dataloader.num_workers=2 --dataloader.persistent_workers --dataloader.prefetch_factor=2 --metrics.log_freq=1 --comm.trace_buf_size=0 --dump_folder=outputs/autoresearch/may19-qwen3-14b/run368-mxfp8-default-nccl-cta-no-fsdp-forward-input-casts-loss-only-compile-loss-chunks4-sdpa-prefetch-seq128-lbs128-bf16-dataloader-worker2-prefetch2-metrics-logfreq1-no-flight-recorder > run.log 2>&1
bec0696b	11318	0.00	166.26	keep	exact no-cast batch128 chunks4 rerun is clean and validates the current best shape but lands below the measured peak	NCCL_CTA_POLICY=2 NGPU=8 LOG_RANK=0 MODULE=qwen3 CONFIG=qwen3_14b ./run_train.sh --training.steps=10 --compile.enable --compile.components='["loss"]' --training.dtype=bfloat16 --training.seq_len=128 --training.local_batch_size=128 --loss.num_chunks=4 --dataloader.num_workers=2 --dataloader.persistent_workers --dataloader.prefetch_factor=2 --metrics.log_freq=1 --comm.trace_buf_size=0 --dump_folder=outputs/autoresearch/may19-qwen3-14b/run369-rerun-mxfp8-no-fsdp-forward-input-casts-loss-only-compile-loss-chunks4-sdpa-prefetch-seq128-lbs128-bf16-nccl-zero-cta-dataloader-worker2-prefetch2-metrics-logfreq1-no-flight-recorder > run.log 2>&1
