commit	tokens_per_sec	mfu_percent	peak_memory_gb	status	description	command
bfc8d098+dirty	14019	0.00	169.24	discard	concatenating QKV MXFP8 weight/grad-output paths is valid but slower and higher-memory than the kept norm_modules branch	TORCH_NCCL_CUDA_EVENT_CACHE=0 NCCL_NVLS_ENABLE=1 NCCL_CTA_POLICY=2 NGPU=8 LOG_RANK=0 MODULE=qwen3 CONFIG=qwen3_14b ./run_train.sh --training.steps=10 --compile.enable --compile.components=loss,feed_forward,qkv_linear,qk_norm_rope,norm_modules,qkv_concat --training.dtype=bfloat16 --training.seq_len=128 --training.local_batch_size=176 --loss.num_chunks=4 --optimizer.weight_decay=0.0 --dataloader.num_workers=2 --dataloader.persistent_workers --dataloader.prefetch_factor=2 --metrics.log_freq=1 --comm.trace_buf_size=0 --dump_folder=outputs/autoresearch/may19-qwen3-14b/run556-qkv-concat-norm-modules-batch176-event-cache0 > outputs/autoresearch/may19-qwen3-14b/run556-qkv-concat-norm-modules-batch176-event-cache0.run.log 2>&1
bfc8d098+dirty	13850	0.00	169.77	discard	concatenating FFN gate/up MXFP8 weight/grad-output paths is valid but slower and higher-memory than the kept norm_modules branch	TORCH_NCCL_CUDA_EVENT_CACHE=0 NCCL_NVLS_ENABLE=1 NCCL_CTA_POLICY=2 NGPU=8 LOG_RANK=0 MODULE=qwen3 CONFIG=qwen3_14b ./run_train.sh --training.steps=10 --compile.enable --compile.components=loss,feed_forward,qkv_linear,qk_norm_rope,norm_modules,gate_up_concat --training.dtype=bfloat16 --training.seq_len=128 --training.local_batch_size=176 --loss.num_chunks=4 --optimizer.weight_decay=0.0 --dataloader.num_workers=2 --dataloader.persistent_workers --dataloader.prefetch_factor=2 --metrics.log_freq=1 --comm.trace_buf_size=0 --dump_folder=outputs/autoresearch/may19-qwen3-14b/run557-gate-up-concat-norm-modules-batch176-event-cache0 > outputs/autoresearch/may19-qwen3-14b/run557-gate-up-concat-norm-modules-batch176-event-cache0.run.log 2>&1
bfc8d098	14161	0.00	168.91	discard	NCCL_MIN_NCHANNELS=8 is valid on the norm_modules stack but below the kept norm_modules short sample	NCCL_MIN_NCHANNELS=8 TORCH_NCCL_CUDA_EVENT_CACHE=0 NCCL_NVLS_ENABLE=1 NCCL_CTA_POLICY=2 NGPU=8 LOG_RANK=0 MODULE=qwen3 CONFIG=qwen3_14b ./run_train.sh --training.steps=10 --compile.enable --compile.components=loss,feed_forward,qkv_linear,qk_norm_rope,norm_modules --training.dtype=bfloat16 --training.seq_len=128 --training.local_batch_size=176 --loss.num_chunks=4 --optimizer.weight_decay=0.0 --dataloader.num_workers=2 --dataloader.persistent_workers --dataloader.prefetch_factor=2 --metrics.log_freq=1 --comm.trace_buf_size=0 --dump_folder=outputs/autoresearch/may19-qwen3-14b/run558-nccl-min-nchannels8-norm-modules-batch176-event-cache0 > outputs/autoresearch/may19-qwen3-14b/run558-nccl-min-nchannels8-norm-modules-batch176-event-cache0.run.log 2>&1
bfc8d098	13948	0.00	169.68	discard	loss chunks8 on the norm_modules stack is slower and higher-memory than the kept chunks4 setting	TORCH_NCCL_CUDA_EVENT_CACHE=0 NCCL_NVLS_ENABLE=1 NCCL_CTA_POLICY=2 NGPU=8 LOG_RANK=0 MODULE=qwen3 CONFIG=qwen3_14b ./run_train.sh --training.steps=10 --compile.enable --compile.components=loss,feed_forward,qkv_linear,qk_norm_rope,norm_modules --training.dtype=bfloat16 --training.seq_len=128 --training.local_batch_size=176 --loss.num_chunks=8 --optimizer.weight_decay=0.0 --dataloader.num_workers=2 --dataloader.persistent_workers --dataloader.prefetch_factor=2 --metrics.log_freq=1 --comm.trace_buf_size=0 --dump_folder=outputs/autoresearch/may19-qwen3-14b/run559-loss-chunks8-norm-modules-batch176-event-cache0 > outputs/autoresearch/may19-qwen3-14b/run559-loss-chunks8-norm-modules-batch176-event-cache0.run.log 2>&1
bfc8d098+dirty	14252	0.00	169.39	keep	QKV backward-only concat gives a new batch176 short sample and stays just under 95 percent HBM; needs sustained validation	TORCH_NCCL_CUDA_EVENT_CACHE=0 NCCL_NVLS_ENABLE=1 NCCL_CTA_POLICY=2 NGPU=8 LOG_RANK=0 MODULE=qwen3 CONFIG=qwen3_14b ./run_train.sh --training.steps=10 --compile.enable --compile.components=loss,feed_forward,qkv_linear,qk_norm_rope,norm_modules,qkv_backward_concat --training.dtype=bfloat16 --training.seq_len=128 --training.local_batch_size=176 --loss.num_chunks=4 --optimizer.weight_decay=0.0 --dataloader.num_workers=2 --dataloader.persistent_workers --dataloader.prefetch_factor=2 --metrics.log_freq=1 --comm.trace_buf_size=0 --dump_folder=outputs/autoresearch/may19-qwen3-14b/run560-qkv-backward-concat-norm-modules-batch176-event-cache0 > outputs/autoresearch/may19-qwen3-14b/run560-qkv-backward-concat-norm-modules-batch176-event-cache0.run.log 2>&1
bfc8d098+dirty	14094	0.00	169.39	keep	QKV backward-only concat sustains a new overall throughput peak over steps 11-20 while staying just under 95 percent HBM	TORCH_NCCL_CUDA_EVENT_CACHE=0 NCCL_NVLS_ENABLE=1 NCCL_CTA_POLICY=2 NGPU=8 LOG_RANK=0 MODULE=qwen3 CONFIG=qwen3_14b ./run_train.sh --training.steps=20 --compile.enable --compile.components=loss,feed_forward,qkv_linear,qk_norm_rope,norm_modules,qkv_backward_concat --training.dtype=bfloat16 --training.seq_len=128 --training.local_batch_size=176 --loss.num_chunks=4 --optimizer.weight_decay=0.0 --dataloader.num_workers=2 --dataloader.persistent_workers --dataloader.prefetch_factor=2 --metrics.log_freq=1 --comm.trace_buf_size=0 --dump_folder=outputs/autoresearch/may19-qwen3-14b/run561-qkv-backward-concat-norm-modules-20step-batch176-event-cache0 > outputs/autoresearch/may19-qwen3-14b/run561-qkv-backward-concat-norm-modules-20step-batch176-event-cache0.run.log 2>&1
bfc8d098+dirty	14267	0.00	169.39	keep	profiled the QKV backward-only concat branch; profiled tps is diagnostic and trace shows fewer MXFP8 dim1 casts despite added cat work	TORCH_NCCL_CUDA_EVENT_CACHE=0 NCCL_NVLS_ENABLE=1 NCCL_CTA_POLICY=2 NGPU=8 LOG_RANK=0 MODULE=qwen3 CONFIG=qwen3_14b ./run_train.sh --training.steps=10 --compile.enable --compile.components=loss,feed_forward,qkv_linear,qk_norm_rope,norm_modules,qkv_backward_concat --training.dtype=bfloat16 --training.seq_len=128 --training.local_batch_size=176 --loss.num_chunks=4 --optimizer.weight_decay=0.0 --dataloader.num_workers=2 --dataloader.persistent_workers --dataloader.prefetch_factor=2 --metrics.log_freq=1 --comm.trace_buf_size=0 --profiler.enable_profiling --profiler.profile_freq=10 --profiler.profiler_warmup=2 --profiler.profiler_active=1 --dump_folder=outputs/autoresearch/may19-qwen3-14b/run562-profile-qkv-backward-concat-norm-modules-batch176-event-cache0 > outputs/autoresearch/may19-qwen3-14b/run562-profile-qkv-backward-concat-norm-modules-batch176-event-cache0.run.log 2>&1
bfc8d098+dirty	13913	0.00	169.47	discard	adding FFN gate/up backward concat on top of QKV backward concat is valid but slower and crosses the 95 percent memory line	TORCH_NCCL_CUDA_EVENT_CACHE=0 NCCL_NVLS_ENABLE=1 NCCL_CTA_POLICY=2 NGPU=8 LOG_RANK=0 MODULE=qwen3 CONFIG=qwen3_14b ./run_train.sh --training.steps=10 --compile.enable --compile.components=loss,feed_forward,qkv_linear,qk_norm_rope,norm_modules,qkv_backward_concat,gate_up_backward_concat --training.dtype=bfloat16 --training.seq_len=128 --training.local_batch_size=176 --loss.num_chunks=4 --optimizer.weight_decay=0.0 --dataloader.num_workers=2 --dataloader.persistent_workers --dataloader.prefetch_factor=2 --metrics.log_freq=1 --comm.trace_buf_size=0 --dump_folder=outputs/autoresearch/may19-qwen3-14b/run563-qkv-and-gate-up-backward-concat-norm-modules-batch176-event-cache0 > outputs/autoresearch/may19-qwen3-14b/run563-qkv-and-gate-up-backward-concat-norm-modules-batch176-event-cache0.run.log 2>&1
bfc8d098+dirty	14476	0.00	172.60	discard	batch180 with QKV backward concat gives a high short sample but crosses the memory envelope at 96.77 percent HBM	TORCH_NCCL_CUDA_EVENT_CACHE=0 NCCL_NVLS_ENABLE=1 NCCL_CTA_POLICY=2 NGPU=8 LOG_RANK=0 MODULE=qwen3 CONFIG=qwen3_14b ./run_train.sh --training.steps=10 --compile.enable --compile.components=loss,feed_forward,qkv_linear,qk_norm_rope,norm_modules,qkv_backward_concat --training.dtype=bfloat16 --training.seq_len=128 --training.local_batch_size=180 --loss.num_chunks=4 --optimizer.weight_decay=0.0 --dataloader.num_workers=2 --dataloader.persistent_workers --dataloader.prefetch_factor=2 --metrics.log_freq=1 --comm.trace_buf_size=0 --dump_folder=outputs/autoresearch/may19-qwen3-14b/run564-qkv-backward-concat-norm-modules-batch180-event-cache0 > outputs/autoresearch/may19-qwen3-14b/run564-qkv-backward-concat-norm-modules-batch180-event-cache0.run.log 2>&1
bfc8d098+dirty	14303	0.00	169.39	keep	QKV grad-input-only backward concat is valid and beats the full backward-concat short sample at the same memory peak	TORCH_NCCL_CUDA_EVENT_CACHE=0 NCCL_NVLS_ENABLE=1 NCCL_CTA_POLICY=2 NGPU=8 LOG_RANK=0 MODULE=qwen3 CONFIG=qwen3_14b ./run_train.sh --training.steps=10 --compile.enable --compile.components=loss,feed_forward,qkv_linear,qk_norm_rope,norm_modules,qkv_grad_input_concat --training.dtype=bfloat16 --training.seq_len=128 --training.local_batch_size=176 --loss.num_chunks=4 --optimizer.weight_decay=0.0 --dataloader.num_workers=2 --dataloader.persistent_workers --dataloader.prefetch_factor=2 --metrics.log_freq=1 --comm.trace_buf_size=0 --dump_folder=outputs/autoresearch/may19-qwen3-14b/run565-qkv-grad-input-concat-norm-modules-batch176-event-cache0 > outputs/autoresearch/may19-qwen3-14b/run565-qkv-grad-input-concat-norm-modules-batch176-event-cache0.run.log 2>&1
bfc8d098+dirty	14242	0.00	168.91	discard	QKV grad-weight-only backward concat is valid but slower than the grad-input-only candidate and the full backward-concat short sample	TORCH_NCCL_CUDA_EVENT_CACHE=0 NCCL_NVLS_ENABLE=1 NCCL_CTA_POLICY=2 NGPU=8 LOG_RANK=0 MODULE=qwen3 CONFIG=qwen3_14b ./run_train.sh --training.steps=10 --compile.enable --compile.components=loss,feed_forward,qkv_linear,qk_norm_rope,norm_modules,qkv_grad_weight_concat --training.dtype=bfloat16 --training.seq_len=128 --training.local_batch_size=176 --loss.num_chunks=4 --optimizer.weight_decay=0.0 --dataloader.num_workers=2 --dataloader.persistent_workers --dataloader.prefetch_factor=2 --metrics.log_freq=1 --comm.trace_buf_size=0 --dump_folder=outputs/autoresearch/may19-qwen3-14b/run566-qkv-grad-weight-concat-norm-modules-batch176-event-cache0 > outputs/autoresearch/may19-qwen3-14b/run566-qkv-grad-weight-concat-norm-modules-batch176-event-cache0.run.log 2>&1
bfc8d098+dirty	14137	0.00	169.39	keep	QKV grad-input-only backward concat sustains a new peak over steps 11-20 while staying just under 95 percent HBM	TORCH_NCCL_CUDA_EVENT_CACHE=0 NCCL_NVLS_ENABLE=1 NCCL_CTA_POLICY=2 NGPU=8 LOG_RANK=0 MODULE=qwen3 CONFIG=qwen3_14b ./run_train.sh --training.steps=20 --compile.enable --compile.components=loss,feed_forward,qkv_linear,qk_norm_rope,norm_modules,qkv_grad_input_concat --training.dtype=bfloat16 --training.seq_len=128 --training.local_batch_size=176 --loss.num_chunks=4 --optimizer.weight_decay=0.0 --dataloader.num_workers=2 --dataloader.persistent_workers --dataloader.prefetch_factor=2 --metrics.log_freq=1 --comm.trace_buf_size=0 --dump_folder=outputs/autoresearch/may19-qwen3-14b/run567-qkv-grad-input-concat-norm-modules-20step-batch176-event-cache0 > outputs/autoresearch/may19-qwen3-14b/run567-qkv-grad-input-concat-norm-modules-20step-batch176-event-cache0.run.log 2>&1
bfc8d098+dirty	14251	0.00	169.39	keep	profiled the QKV grad-input-only backward concat branch; profiled tps is diagnostic and trace will drive the next source change	TORCH_NCCL_CUDA_EVENT_CACHE=0 NCCL_NVLS_ENABLE=1 NCCL_CTA_POLICY=2 NGPU=8 LOG_RANK=0 MODULE=qwen3 CONFIG=qwen3_14b ./run_train.sh --training.steps=10 --compile.enable --compile.components=loss,feed_forward,qkv_linear,qk_norm_rope,norm_modules,qkv_grad_input_concat --training.dtype=bfloat16 --training.seq_len=128 --training.local_batch_size=176 --loss.num_chunks=4 --optimizer.weight_decay=0.0 --dataloader.num_workers=2 --dataloader.persistent_workers --dataloader.prefetch_factor=2 --metrics.log_freq=1 --comm.trace_buf_size=0 --profiler.enable_profiling --profiler.profile_freq=10 --profiler.profiler_warmup=2 --profiler.profiler_active=1 --dump_folder=outputs/autoresearch/may19-qwen3-14b/run568-profile-qkv-grad-input-concat-norm-modules-batch176-event-cache0 > outputs/autoresearch/may19-qwen3-14b/run568-profile-qkv-grad-input-concat-norm-modules-batch176-event-cache0.run.log 2>&1
bfc8d098+dirty	14365	0.00	169.39	keep	pairwise RoPE kernel on top of QKV grad-input concat is valid and improves the short sample at the same memory peak	TORCH_NCCL_CUDA_EVENT_CACHE=0 NCCL_NVLS_ENABLE=1 NCCL_CTA_POLICY=2 NGPU=8 LOG_RANK=0 MODULE=qwen3 CONFIG=qwen3_14b ./run_train.sh --training.steps=10 --compile.enable --compile.components=loss,feed_forward,qkv_linear,qk_norm_rope,norm_modules,qkv_grad_input_concat,pairwise_rope --training.dtype=bfloat16 --training.seq_len=128 --training.local_batch_size=176 --loss.num_chunks=4 --optimizer.weight_decay=0.0 --dataloader.num_workers=2 --dataloader.persistent_workers --dataloader.prefetch_factor=2 --metrics.log_freq=1 --comm.trace_buf_size=0 --dump_folder=outputs/autoresearch/may19-qwen3-14b/run569-pairwise-rope-qkv-grad-input-concat-norm-modules-batch176-event-cache0 > outputs/autoresearch/may19-qwen3-14b/run569-pairwise-rope-qkv-grad-input-concat-norm-modules-batch176-event-cache0.run.log 2>&1
bfc8d098+dirty	14169	0.00	169.39	keep	pairwise RoPE plus QKV grad-input concat sustains a new peak over steps 11-20 at the same memory peak	TORCH_NCCL_CUDA_EVENT_CACHE=0 NCCL_NVLS_ENABLE=1 NCCL_CTA_POLICY=2 NGPU=8 LOG_RANK=0 MODULE=qwen3 CONFIG=qwen3_14b ./run_train.sh --training.steps=20 --compile.enable --compile.components=loss,feed_forward,qkv_linear,qk_norm_rope,norm_modules,qkv_grad_input_concat,pairwise_rope --training.dtype=bfloat16 --training.seq_len=128 --training.local_batch_size=176 --loss.num_chunks=4 --optimizer.weight_decay=0.0 --dataloader.num_workers=2 --dataloader.persistent_workers --dataloader.prefetch_factor=2 --metrics.log_freq=1 --comm.trace_buf_size=0 --dump_folder=outputs/autoresearch/may19-qwen3-14b/run570-pairwise-rope-qkv-grad-input-concat-norm-modules-20step-batch176-event-cache0 > outputs/autoresearch/may19-qwen3-14b/run570-pairwise-rope-qkv-grad-input-concat-norm-modules-20step-batch176-event-cache0.run.log 2>&1
bfc8d098+dirty	14265	0.00	169.39	keep	profiled the pairwise RoPE plus QKV grad-input concat branch; profiled tps is diagnostic	TORCH_NCCL_CUDA_EVENT_CACHE=0 NCCL_NVLS_ENABLE=1 NCCL_CTA_POLICY=2 NGPU=8 LOG_RANK=0 MODULE=qwen3 CONFIG=qwen3_14b ./run_train.sh --training.steps=10 --compile.enable --compile.components=loss,feed_forward,qkv_linear,qk_norm_rope,norm_modules,qkv_grad_input_concat,pairwise_rope --training.dtype=bfloat16 --training.seq_len=128 --training.local_batch_size=176 --loss.num_chunks=4 --optimizer.weight_decay=0.0 --dataloader.num_workers=2 --dataloader.persistent_workers --dataloader.prefetch_factor=2 --metrics.log_freq=1 --comm.trace_buf_size=0 --profiler.enable_profiling --profiler.profile_freq=10 --profiler.profiler_warmup=2 --profiler.profiler_active=1 --dump_folder=outputs/autoresearch/may19-qwen3-14b/run571-profile-pairwise-rope-qkv-grad-input-concat-norm-modules-batch176-event-cache0 > outputs/autoresearch/may19-qwen3-14b/run571-profile-pairwise-rope-qkv-grad-input-concat-norm-modules-batch176-event-cache0.run.log 2>&1
bfc8d098+dirty	14422	0.00	169.39	keep	pairwise RoPE block512 improves the short sample on top of QKV grad-input concat at the same memory peak	TORCH_NCCL_CUDA_EVENT_CACHE=0 NCCL_NVLS_ENABLE=1 NCCL_CTA_POLICY=2 NGPU=8 LOG_RANK=0 MODULE=qwen3 CONFIG=qwen3_14b ./run_train.sh --training.steps=10 --compile.enable --compile.components=loss,feed_forward,qkv_linear,qk_norm_rope,norm_modules,qkv_grad_input_concat,pairwise_rope --training.dtype=bfloat16 --training.seq_len=128 --training.local_batch_size=176 --loss.num_chunks=4 --optimizer.weight_decay=0.0 --dataloader.num_workers=2 --dataloader.persistent_workers --dataloader.prefetch_factor=2 --metrics.log_freq=1 --comm.trace_buf_size=0 --dump_folder=outputs/autoresearch/may19-qwen3-14b/run572-pairwise-rope-block512-qkv-grad-input-concat-norm-modules-batch176-event-cache0 > outputs/autoresearch/may19-qwen3-14b/run572-pairwise-rope-block512-qkv-grad-input-concat-norm-modules-batch176-event-cache0.run.log 2>&1
bfc8d098+dirty	14218	0.00	169.39	keep	pairwise RoPE block512 plus QKV grad-input concat sustains a new peak over steps 11-20 at the same memory peak	TORCH_NCCL_CUDA_EVENT_CACHE=0 NCCL_NVLS_ENABLE=1 NCCL_CTA_POLICY=2 NGPU=8 LOG_RANK=0 MODULE=qwen3 CONFIG=qwen3_14b ./run_train.sh --training.steps=20 --compile.enable --compile.components=loss,feed_forward,qkv_linear,qk_norm_rope,norm_modules,qkv_grad_input_concat,pairwise_rope --training.dtype=bfloat16 --training.seq_len=128 --training.local_batch_size=176 --loss.num_chunks=4 --optimizer.weight_decay=0.0 --dataloader.num_workers=2 --dataloader.persistent_workers --dataloader.prefetch_factor=2 --metrics.log_freq=1 --comm.trace_buf_size=0 --dump_folder=outputs/autoresearch/may19-qwen3-14b/run573-pairwise-rope-block512-qkv-grad-input-concat-norm-modules-20step-batch176-event-cache0 > outputs/autoresearch/may19-qwen3-14b/run573-pairwise-rope-block512-qkv-grad-input-concat-norm-modules-20step-batch176-event-cache0.run.log 2>&1
bfc8d098+dirty	14215	0.00	169.39	discard	pairwise RoPE block1024 is valid but slower than block512 at the same memory peak	TORCH_NCCL_CUDA_EVENT_CACHE=0 NCCL_NVLS_ENABLE=1 NCCL_CTA_POLICY=2 NGPU=8 LOG_RANK=0 MODULE=qwen3 CONFIG=qwen3_14b ./run_train.sh --training.steps=10 --compile.enable --compile.components=loss,feed_forward,qkv_linear,qk_norm_rope,norm_modules,qkv_grad_input_concat,pairwise_rope --training.dtype=bfloat16 --training.seq_len=128 --training.local_batch_size=176 --loss.num_chunks=4 --optimizer.weight_decay=0.0 --dataloader.num_workers=2 --dataloader.persistent_workers --dataloader.prefetch_factor=2 --metrics.log_freq=1 --comm.trace_buf_size=0 --dump_folder=outputs/autoresearch/may19-qwen3-14b/run574-pairwise-rope-block1024-qkv-grad-input-concat-norm-modules-batch176-event-cache0 > outputs/autoresearch/may19-qwen3-14b/run574-pairwise-rope-block1024-qkv-grad-input-concat-norm-modules-batch176-event-cache0.run.log 2>&1
bfc8d098+dirty	14258	0.00	169.39	keep	profiled pairwise RoPE block512 plus QKV grad-input concat; profiled tps is diagnostic	TORCH_NCCL_CUDA_EVENT_CACHE=0 NCCL_NVLS_ENABLE=1 NCCL_CTA_POLICY=2 NGPU=8 LOG_RANK=0 MODULE=qwen3 CONFIG=qwen3_14b ./run_train.sh --training.steps=10 --compile.enable --compile.components=loss,feed_forward,qkv_linear,qk_norm_rope,norm_modules,qkv_grad_input_concat,pairwise_rope --training.dtype=bfloat16 --training.seq_len=128 --training.local_batch_size=176 --loss.num_chunks=4 --optimizer.weight_decay=0.0 --dataloader.num_workers=2 --dataloader.persistent_workers --dataloader.prefetch_factor=2 --metrics.log_freq=1 --comm.trace_buf_size=0 --profiler.enable_profiling --profiler.profile_freq=10 --profiler.profiler_warmup=2 --profiler.profiler_active=1 --dump_folder=outputs/autoresearch/may19-qwen3-14b/run575-profile-pairwise-rope-block512-qkv-grad-input-concat-norm-modules-batch176-event-cache0 > outputs/autoresearch/may19-qwen3-14b/run575-profile-pairwise-rope-block512-qkv-grad-input-concat-norm-modules-batch176-event-cache0.run.log 2>&1
bfc8d098+dirty	13949	0.00	169.47	discard	FFN gate/up grad-input-only backward concat is valid but slower and crosses the 95 percent memory line	TORCH_NCCL_CUDA_EVENT_CACHE=0 NCCL_NVLS_ENABLE=1 NCCL_CTA_POLICY=2 NGPU=8 LOG_RANK=0 MODULE=qwen3 CONFIG=qwen3_14b ./run_train.sh --training.steps=10 --compile.enable --compile.components=loss,feed_forward,qkv_linear,qk_norm_rope,norm_modules,qkv_grad_input_concat,pairwise_rope,gate_up_grad_input_concat --training.dtype=bfloat16 --training.seq_len=128 --training.local_batch_size=176 --loss.num_chunks=4 --optimizer.weight_decay=0.0 --dataloader.num_workers=2 --dataloader.persistent_workers --dataloader.prefetch_factor=2 --metrics.log_freq=1 --comm.trace_buf_size=0 --dump_folder=outputs/autoresearch/may19-qwen3-14b/run576-gate-up-grad-input-concat-pairwise-rope-qkv-grad-input-concat-norm-modules-batch176-event-cache0 > outputs/autoresearch/may19-qwen3-14b/run576-gate-up-grad-input-concat-pairwise-rope-qkv-grad-input-concat-norm-modules-batch176-event-cache0.run.log 2>&1
bfc8d098+dirty	14229	0.00	169.39	discard	NCCL_MIN_NCHANNELS=8 remains slower than the block512 best on the updated QKV and RoPE stack	NCCL_MIN_NCHANNELS=8 TORCH_NCCL_CUDA_EVENT_CACHE=0 NCCL_NVLS_ENABLE=1 NCCL_CTA_POLICY=2 NGPU=8 LOG_RANK=0 MODULE=qwen3 CONFIG=qwen3_14b ./run_train.sh --training.steps=10 --compile.enable --compile.components=loss,feed_forward,qkv_linear,qk_norm_rope,norm_modules,qkv_grad_input_concat,pairwise_rope --training.dtype=bfloat16 --training.seq_len=128 --training.local_batch_size=176 --loss.num_chunks=4 --optimizer.weight_decay=0.0 --dataloader.num_workers=2 --dataloader.persistent_workers --dataloader.prefetch_factor=2 --metrics.log_freq=1 --comm.trace_buf_size=0 --dump_folder=outputs/autoresearch/may19-qwen3-14b/run577-nccl-min-nchannels8-pairwise-rope-block512-qkv-grad-input-concat-norm-modules-batch176-event-cache0 > outputs/autoresearch/may19-qwen3-14b/run577-nccl-min-nchannels8-pairwise-rope-block512-qkv-grad-input-concat-norm-modules-batch176-event-cache0.run.log 2>&1
