commit	tokens_per_sec	mfu_percent	peak_memory_gb	status	description	command
bfc8d098+dirty	14309	0.00	168.91	discard	NCCL_MAX_CTAS=64 on the lean model-compile stack is valid but slower than the current recipe at the same memory peak	TORCH_NCCL_CUDA_EVENT_CACHE=0 NCCL_MAX_CTAS=64 NCCL_NVLS_ENABLE=1 NCCL_CTA_POLICY=2 NGPU=8 LOG_RANK=0 MODULE=qwen3 CONFIG=qwen3_14b ./run_train.sh --training.steps=10 --compile.enable --compile.components=model,loss,qk_norm_rope,qkv_grad_input_concat,pairwise_rope --training.dtype=bfloat16 --training.seq_len=128 --training.local_batch_size=176 --loss.num_chunks=4 --optimizer.weight_decay=0.0 --dataloader.num_workers=2 --dataloader.persistent_workers --dataloader.prefetch_factor=2 --metrics.log_freq=1 --comm.trace_buf_size=0 --dump_folder=outputs/autoresearch/may19-qwen3-14b/run621-nccl-max-ctas64-model-compile-pairwise-rope-qkv-grad-input-concat-batch176-event-cache0 > outputs/autoresearch/may19-qwen3-14b/run621-nccl-max-ctas64-model-compile-pairwise-rope-qkv-grad-input-concat-batch176-event-cache0.run.log 2>&1
bfc8d098+dirty	14320	0.00	168.91	discard	pairwise RoPE block128 is valid but slower than the block256 durable setting at the same memory peak	TORCH_NCCL_CUDA_EVENT_CACHE=0 NCCL_NVLS_ENABLE=1 NCCL_CTA_POLICY=2 NGPU=8 LOG_RANK=0 MODULE=qwen3 CONFIG=qwen3_14b ./run_train.sh --training.steps=10 --compile.enable --compile.components=model,loss,qk_norm_rope,qkv_grad_input_concat,pairwise_rope --training.dtype=bfloat16 --training.seq_len=128 --training.local_batch_size=176 --loss.num_chunks=4 --optimizer.weight_decay=0.0 --dataloader.num_workers=2 --dataloader.persistent_workers --dataloader.prefetch_factor=2 --metrics.log_freq=1 --comm.trace_buf_size=0 --dump_folder=outputs/autoresearch/may19-qwen3-14b/run622-pairwise-rope-block128-model-compile-qkv-grad-input-concat-batch176-event-cache0 > outputs/autoresearch/may19-qwen3-14b/run622-pairwise-rope-block128-model-compile-qkv-grad-input-concat-batch176-event-cache0.run.log 2>&1
bfc8d098+dirty	14250	0.00	168.91	discard	fused_opt_states_bf16 on the current lean model-compile stack is valid but does not reduce peak memory and is slower than the active optimizer path	TORCH_NCCL_CUDA_EVENT_CACHE=0 NCCL_NVLS_ENABLE=1 NCCL_CTA_POLICY=2 NGPU=8 LOG_RANK=0 MODULE=qwen3 CONFIG=qwen3_14b ./run_train.sh --training.steps=10 --compile.enable --compile.components=model,loss,qk_norm_rope,qkv_grad_input_concat,pairwise_rope --training.dtype=bfloat16 --training.seq_len=128 --training.local_batch_size=176 --loss.num_chunks=4 --optimizer.weight_decay=0.0 --optimizer.implementation=fused_opt_states_bf16 --dataloader.num_workers=2 --dataloader.persistent_workers --dataloader.prefetch_factor=2 --metrics.log_freq=1 --comm.trace_buf_size=0 --dump_folder=outputs/autoresearch/may19-qwen3-14b/run623-bf16-opt-states-model-compile-pairwise-rope-qkv-grad-input-concat-batch176-event-cache0 > outputs/autoresearch/may19-qwen3-14b/run623-bf16-opt-states-model-compile-pairwise-rope-qkv-grad-input-concat-batch176-event-cache0.run.log 2>&1
bfc8d098+dirty	14369	0.00	168.91	discard	NCCL_CGA_CLUSTER_SIZE=2 on the lean model-compile stack is valid but slower than the current recipe at the same memory peak	TORCH_NCCL_CUDA_EVENT_CACHE=0 NCCL_CGA_CLUSTER_SIZE=2 NCCL_NVLS_ENABLE=1 NCCL_CTA_POLICY=2 NGPU=8 LOG_RANK=0 MODULE=qwen3 CONFIG=qwen3_14b ./run_train.sh --training.steps=10 --compile.enable --compile.components=model,loss,qk_norm_rope,qkv_grad_input_concat,pairwise_rope --training.dtype=bfloat16 --training.seq_len=128 --training.local_batch_size=176 --loss.num_chunks=4 --optimizer.weight_decay=0.0 --dataloader.num_workers=2 --dataloader.persistent_workers --dataloader.prefetch_factor=2 --metrics.log_freq=1 --comm.trace_buf_size=0 --dump_folder=outputs/autoresearch/may19-qwen3-14b/run624-nccl-cga2-model-compile-pairwise-rope-qkv-grad-input-concat-batch176-event-cache0 > outputs/autoresearch/may19-qwen3-14b/run624-nccl-cga2-model-compile-pairwise-rope-qkv-grad-input-concat-batch176-event-cache0.run.log 2>&1
bfc8d098+dirty	14252	0.00	168.91	discard	disabling FSDP forward prefetch under lean model compile does not reduce peak memory and slows throughput, so it does not unlock larger batch experiments	TORCH_NCCL_CUDA_EVENT_CACHE=0 NCCL_NVLS_ENABLE=1 NCCL_CTA_POLICY=2 NGPU=8 LOG_RANK=0 MODULE=qwen3 CONFIG=qwen3_14b ./run_train.sh --training.steps=10 --compile.enable --compile.components=model,loss,qk_norm_rope,qkv_grad_input_concat,pairwise_rope,fsdp_no_forward_prefetch --training.dtype=bfloat16 --training.seq_len=128 --training.local_batch_size=176 --loss.num_chunks=4 --optimizer.weight_decay=0.0 --dataloader.num_workers=2 --dataloader.persistent_workers --dataloader.prefetch_factor=2 --metrics.log_freq=1 --comm.trace_buf_size=0 --dump_folder=outputs/autoresearch/may19-qwen3-14b/run625-fsdp-no-forward-prefetch-model-compile-pairwise-rope-qkv-grad-input-concat-batch176-event-cache0 > outputs/autoresearch/may19-qwen3-14b/run625-fsdp-no-forward-prefetch-model-compile-pairwise-rope-qkv-grad-input-concat-batch176-event-cache0.run.log 2>&1
bfc8d098+dirty	14411	0.00	168.91	keep	torch.compile(dynamic=False) for each TransformerBlock gives a modest short improvement at the same memory peak; needs sustained validation	TORCH_NCCL_CUDA_EVENT_CACHE=0 NCCL_NVLS_ENABLE=1 NCCL_CTA_POLICY=2 NGPU=8 LOG_RANK=0 MODULE=qwen3 CONFIG=qwen3_14b ./run_train.sh --training.steps=10 --compile.enable --compile.components=model,model_dynamic_false,loss,qk_norm_rope,qkv_grad_input_concat,pairwise_rope --training.dtype=bfloat16 --training.seq_len=128 --training.local_batch_size=176 --loss.num_chunks=4 --optimizer.weight_decay=0.0 --dataloader.num_workers=2 --dataloader.persistent_workers --dataloader.prefetch_factor=2 --metrics.log_freq=1 --comm.trace_buf_size=0 --dump_folder=outputs/autoresearch/may19-qwen3-14b/run626-model-dynamic-false-pairwise-rope-qkv-grad-input-concat-batch176-event-cache0 > outputs/autoresearch/may19-qwen3-14b/run626-model-dynamic-false-pairwise-rope-qkv-grad-input-concat-batch176-event-cache0.run.log 2>&1
bfc8d098+dirty	14252	0.00	168.91	discard	torch.compile(dynamic=False) for each TransformerBlock gives a modest short signal but sustained steps 11-20 regress below the default dynamic compile winner	TORCH_NCCL_CUDA_EVENT_CACHE=0 NCCL_NVLS_ENABLE=1 NCCL_CTA_POLICY=2 NGPU=8 LOG_RANK=0 MODULE=qwen3 CONFIG=qwen3_14b ./run_train.sh --training.steps=20 --compile.enable --compile.components=model,model_dynamic_false,loss,qk_norm_rope,qkv_grad_input_concat,pairwise_rope --training.dtype=bfloat16 --training.seq_len=128 --training.local_batch_size=176 --loss.num_chunks=4 --optimizer.weight_decay=0.0 --dataloader.num_workers=2 --dataloader.persistent_workers --dataloader.prefetch_factor=2 --metrics.log_freq=1 --comm.trace_buf_size=0 --dump_folder=outputs/autoresearch/may19-qwen3-14b/run627-model-dynamic-false-pairwise-rope-qkv-grad-input-concat-20step-batch176-event-cache0 > outputs/autoresearch/may19-qwen3-14b/run627-model-dynamic-false-pairwise-rope-qkv-grad-input-concat-20step-batch176-event-cache0.run.log 2>&1
bfc8d098+dirty	14563	0.00	168.91	keep	torch.compile(dynamic=False) for only the Q/K RMSNorm plus RoPE helper gives a strong short sample at unchanged memory; needs sustained validation	TORCH_NCCL_CUDA_EVENT_CACHE=0 NCCL_NVLS_ENABLE=1 NCCL_CTA_POLICY=2 NGPU=8 LOG_RANK=0 MODULE=qwen3 CONFIG=qwen3_14b ./run_train.sh --training.steps=10 --compile.enable --compile.components=model,loss,qk_norm_rope,qk_norm_rope_dynamic_false,qkv_grad_input_concat,pairwise_rope --training.dtype=bfloat16 --training.seq_len=128 --training.local_batch_size=176 --loss.num_chunks=4 --optimizer.weight_decay=0.0 --dataloader.num_workers=2 --dataloader.persistent_workers --dataloader.prefetch_factor=2 --metrics.log_freq=1 --comm.trace_buf_size=0 --dump_folder=outputs/autoresearch/may19-qwen3-14b/run628-qk-norm-rope-dynamic-false-model-compile-pairwise-rope-qkv-grad-input-concat-batch176-event-cache0 > outputs/autoresearch/may19-qwen3-14b/run628-qk-norm-rope-dynamic-false-model-compile-pairwise-rope-qkv-grad-input-concat-batch176-event-cache0.run.log 2>&1
bfc8d098+dirty	14217	0.00	168.91	discard	torch.compile(dynamic=False) for only the Q/K RMSNorm plus RoPE helper gives a strong short spike but sustained steps 11-20 regress below the default helper compile winner	TORCH_NCCL_CUDA_EVENT_CACHE=0 NCCL_NVLS_ENABLE=1 NCCL_CTA_POLICY=2 NGPU=8 LOG_RANK=0 MODULE=qwen3 CONFIG=qwen3_14b ./run_train.sh --training.steps=20 --compile.enable --compile.components=model,loss,qk_norm_rope,qk_norm_rope_dynamic_false,qkv_grad_input_concat,pairwise_rope --training.dtype=bfloat16 --training.seq_len=128 --training.local_batch_size=176 --loss.num_chunks=4 --optimizer.weight_decay=0.0 --dataloader.num_workers=2 --dataloader.persistent_workers --dataloader.prefetch_factor=2 --metrics.log_freq=1 --comm.trace_buf_size=0 --dump_folder=outputs/autoresearch/may19-qwen3-14b/run629-qk-norm-rope-dynamic-false-model-compile-pairwise-rope-qkv-grad-input-concat-20step-batch176-event-cache0 > outputs/autoresearch/may19-qwen3-14b/run629-qk-norm-rope-dynamic-false-model-compile-pairwise-rope-qkv-grad-input-concat-20step-batch176-event-cache0.run.log 2>&1
bfc8d098+dirty	0	0.00	0.00	discard	batch175 fails in torchao MXFP8 dim1 conversion because the chunked gradient row count violates the max_row_tile_size divisibility assertion; viable local batch sizes with chunks4 are constrained to multiples of 4 here	TORCH_NCCL_CUDA_EVENT_CACHE=0 NCCL_NVLS_ENABLE=1 NCCL_CTA_POLICY=2 NGPU=8 LOG_RANK=0 MODULE=qwen3 CONFIG=qwen3_14b ./run_train.sh --training.steps=10 --compile.enable --compile.components=model,loss,qk_norm_rope,qkv_grad_input_concat,pairwise_rope --training.dtype=bfloat16 --training.seq_len=128 --training.local_batch_size=175 --loss.num_chunks=4 --optimizer.weight_decay=0.0 --dataloader.num_workers=2 --dataloader.persistent_workers --dataloader.prefetch_factor=2 --metrics.log_freq=1 --comm.trace_buf_size=0 --dump_folder=outputs/autoresearch/may19-qwen3-14b/run630-batch175-model-compile-pairwise-rope-qkv-grad-input-concat-event-cache0 > outputs/autoresearch/may19-qwen3-14b/run630-batch175-model-compile-pairwise-rope-qkv-grad-input-concat-event-cache0.run.log 2>&1
bfc8d098+dirty	14317	0.00	166.25	discard	batch172 is valid and lowers peak memory, but tokens/sec is below the batch176 lean model-compile winner	TORCH_NCCL_CUDA_EVENT_CACHE=0 NCCL_NVLS_ENABLE=1 NCCL_CTA_POLICY=2 NGPU=8 LOG_RANK=0 MODULE=qwen3 CONFIG=qwen3_14b ./run_train.sh --training.steps=10 --compile.enable --compile.components=model,loss,qk_norm_rope,qkv_grad_input_concat,pairwise_rope --training.dtype=bfloat16 --training.seq_len=128 --training.local_batch_size=172 --loss.num_chunks=4 --optimizer.weight_decay=0.0 --dataloader.num_workers=2 --dataloader.persistent_workers --dataloader.prefetch_factor=2 --metrics.log_freq=1 --comm.trace_buf_size=0 --dump_folder=outputs/autoresearch/may19-qwen3-14b/run631-batch172-model-compile-pairwise-rope-qkv-grad-input-concat-event-cache0 > outputs/autoresearch/may19-qwen3-14b/run631-batch172-model-compile-pairwise-rope-qkv-grad-input-concat-event-cache0.run.log 2>&1
bfc8d098+dirty	14080	0.00	167.48	discard	batch172 with FSDP forward prefetch distance 2 stays under the memory envelope but loses too much tokens/sec versus batch176	TORCH_NCCL_CUDA_EVENT_CACHE=0 NCCL_NVLS_ENABLE=1 NCCL_CTA_POLICY=2 NGPU=8 LOG_RANK=0 MODULE=qwen3 CONFIG=qwen3_14b ./run_train.sh --training.steps=10 --compile.enable --compile.components=model,loss,qk_norm_rope,qkv_grad_input_concat,pairwise_rope,fsdp_forward_prefetch2 --training.dtype=bfloat16 --training.seq_len=128 --training.local_batch_size=172 --loss.num_chunks=4 --optimizer.weight_decay=0.0 --dataloader.num_workers=2 --dataloader.persistent_workers --dataloader.prefetch_factor=2 --metrics.log_freq=1 --comm.trace_buf_size=0 --dump_folder=outputs/autoresearch/may19-qwen3-14b/run632-batch172-fsdp-forward-prefetch2-model-compile-pairwise-rope-qkv-grad-input-concat-event-cache0 > outputs/autoresearch/may19-qwen3-14b/run632-batch172-fsdp-forward-prefetch2-model-compile-pairwise-rope-qkv-grad-input-concat-event-cache0.run.log 2>&1
bfc8d098+dirty	14268	0.00	170.14	discard	FSDP forward prefetch distance 2 at batch176 raises memory and sustained steps 11-20 regress below the lean model-compile winner despite a prior short spike	TORCH_NCCL_CUDA_EVENT_CACHE=0 NCCL_NVLS_ENABLE=1 NCCL_CTA_POLICY=2 NGPU=8 LOG_RANK=0 MODULE=qwen3 CONFIG=qwen3_14b ./run_train.sh --training.steps=20 --compile.enable --compile.components=model,loss,qk_norm_rope,qkv_grad_input_concat,pairwise_rope,fsdp_forward_prefetch2 --training.dtype=bfloat16 --training.seq_len=128 --training.local_batch_size=176 --loss.num_chunks=4 --optimizer.weight_decay=0.0 --dataloader.num_workers=2 --dataloader.persistent_workers --dataloader.prefetch_factor=2 --metrics.log_freq=1 --comm.trace_buf_size=0 --dump_folder=outputs/autoresearch/may19-qwen3-14b/run633-fsdp-forward-prefetch2-model-compile-pairwise-rope-qkv-grad-input-concat-20step-batch176-event-cache0 > outputs/autoresearch/may19-qwen3-14b/run633-fsdp-forward-prefetch2-model-compile-pairwise-rope-qkv-grad-input-concat-20step-batch176-event-cache0.run.log 2>&1
bfc8d098+dirty	14507	0.00	168.81	keep	resharding the last layer at batch176 improves the short sample while slightly lowering peak memory; needs sustained validation	TORCH_NCCL_CUDA_EVENT_CACHE=0 NCCL_NVLS_ENABLE=1 NCCL_CTA_POLICY=2 NGPU=8 LOG_RANK=0 MODULE=qwen3 CONFIG=qwen3_14b ./run_train.sh --training.steps=10 --compile.enable --compile.components=model,loss,qk_norm_rope,qkv_grad_input_concat,pairwise_rope,reshard_last_layer --training.dtype=bfloat16 --training.seq_len=128 --training.local_batch_size=176 --loss.num_chunks=4 --optimizer.weight_decay=0.0 --dataloader.num_workers=2 --dataloader.persistent_workers --dataloader.prefetch_factor=2 --metrics.log_freq=1 --comm.trace_buf_size=0 --dump_folder=outputs/autoresearch/may19-qwen3-14b/run634-reshard-last-layer-model-compile-pairwise-rope-qkv-grad-input-concat-batch176-event-cache0 > outputs/autoresearch/may19-qwen3-14b/run634-reshard-last-layer-model-compile-pairwise-rope-qkv-grad-input-concat-batch176-event-cache0.run.log 2>&1
bfc8d098+dirty	14257	0.00	168.81	discard	resharding the last layer at batch176 lowers memory slightly and gives a strong short spike, but sustained steps 11-20 regress below the lean model-compile winner	TORCH_NCCL_CUDA_EVENT_CACHE=0 NCCL_NVLS_ENABLE=1 NCCL_CTA_POLICY=2 NGPU=8 LOG_RANK=0 MODULE=qwen3 CONFIG=qwen3_14b ./run_train.sh --training.steps=20 --compile.enable --compile.components=model,loss,qk_norm_rope,qkv_grad_input_concat,pairwise_rope,reshard_last_layer --training.dtype=bfloat16 --training.seq_len=128 --training.local_batch_size=176 --loss.num_chunks=4 --optimizer.weight_decay=0.0 --dataloader.num_workers=2 --dataloader.persistent_workers --dataloader.prefetch_factor=2 --metrics.log_freq=1 --comm.trace_buf_size=0 --dump_folder=outputs/autoresearch/may19-qwen3-14b/run635-reshard-last-layer-model-compile-pairwise-rope-qkv-grad-input-concat-20step-batch176-event-cache0 > outputs/autoresearch/may19-qwen3-14b/run635-reshard-last-layer-model-compile-pairwise-rope-qkv-grad-input-concat-20step-batch176-event-cache0.run.log 2>&1
bfc8d098+dirty	13935	0.00	169.34	discard	loss chunks8 is valid on the current lean model-compile stack but slower and higher-memory than loss chunks4	TORCH_NCCL_CUDA_EVENT_CACHE=0 NCCL_NVLS_ENABLE=1 NCCL_CTA_POLICY=2 NGPU=8 LOG_RANK=0 MODULE=qwen3 CONFIG=qwen3_14b ./run_train.sh --training.steps=10 --compile.enable --compile.components=model,loss,qk_norm_rope,qkv_grad_input_concat,pairwise_rope --training.dtype=bfloat16 --training.seq_len=128 --training.local_batch_size=176 --loss.num_chunks=8 --optimizer.weight_decay=0.0 --dataloader.num_workers=2 --dataloader.persistent_workers --dataloader.prefetch_factor=2 --metrics.log_freq=1 --comm.trace_buf_size=0 --dump_folder=outputs/autoresearch/may19-qwen3-14b/run636-loss-chunks8-model-compile-pairwise-rope-qkv-grad-input-concat-batch176-event-cache0 > outputs/autoresearch/may19-qwen3-14b/run636-loss-chunks8-model-compile-pairwise-rope-qkv-grad-input-concat-batch176-event-cache0.run.log 2>&1
bfc8d098+dirty	14533	0.00	168.91	keep	pairwise RoPE block256 with explicit num_warps=8 improves the short sample at unchanged memory; needs sustained validation	TORCH_NCCL_CUDA_EVENT_CACHE=0 NCCL_NVLS_ENABLE=1 NCCL_CTA_POLICY=2 NGPU=8 LOG_RANK=0 MODULE=qwen3 CONFIG=qwen3_14b ./run_train.sh --training.steps=10 --compile.enable --compile.components=model,loss,qk_norm_rope,qkv_grad_input_concat,pairwise_rope --training.dtype=bfloat16 --training.seq_len=128 --training.local_batch_size=176 --loss.num_chunks=4 --optimizer.weight_decay=0.0 --dataloader.num_workers=2 --dataloader.persistent_workers --dataloader.prefetch_factor=2 --metrics.log_freq=1 --comm.trace_buf_size=0 --dump_folder=outputs/autoresearch/may19-qwen3-14b/run637-pairwise-rope-warps8-model-compile-qkv-grad-input-concat-batch176-event-cache0 > outputs/autoresearch/may19-qwen3-14b/run637-pairwise-rope-warps8-model-compile-qkv-grad-input-concat-batch176-event-cache0.run.log 2>&1
bfc8d098+dirty	14293	0.00	168.91	discard	the num_warps=8 source override was on the sequential RoPE fallback rather than the active pairwise RoPE path, and the sustained 20-step validation did not beat the lean model-compile winner	TORCH_NCCL_CUDA_EVENT_CACHE=0 NCCL_NVLS_ENABLE=1 NCCL_CTA_POLICY=2 NGPU=8 LOG_RANK=0 MODULE=qwen3 CONFIG=qwen3_14b ./run_train.sh --training.steps=20 --compile.enable --compile.components=model,loss,qk_norm_rope,qkv_grad_input_concat,pairwise_rope --training.dtype=bfloat16 --training.seq_len=128 --training.local_batch_size=176 --loss.num_chunks=4 --optimizer.weight_decay=0.0 --dataloader.num_workers=2 --dataloader.persistent_workers --dataloader.prefetch_factor=2 --metrics.log_freq=1 --comm.trace_buf_size=0 --dump_folder=outputs/autoresearch/may19-qwen3-14b/run638-pairwise-rope-warps8-model-compile-qkv-grad-input-concat-20step-batch176-event-cache0 > outputs/autoresearch/may19-qwen3-14b/run638-pairwise-rope-warps8-model-compile-qkv-grad-input-concat-20step-batch176-event-cache0.run.log 2>&1
bfc8d098+dirty	14492	0.00	168.91	discard	QKV forward+grad-input concat is valid but the short screen does not beat the existing lean model-compile short or sustained winners	TORCH_NCCL_CUDA_EVENT_CACHE=0 NCCL_NVLS_ENABLE=1 NCCL_CTA_POLICY=2 NGPU=8 LOG_RANK=0 MODULE=qwen3 CONFIG=qwen3_14b ./run_train.sh --training.steps=10 --compile.enable --compile.components=model,loss,qk_norm_rope,qkv_forward_grad_input_concat,pairwise_rope --training.dtype=bfloat16 --training.seq_len=128 --training.local_batch_size=176 --loss.num_chunks=4 --optimizer.weight_decay=0.0 --dataloader.num_workers=2 --dataloader.persistent_workers --dataloader.prefetch_factor=2 --metrics.log_freq=1 --comm.trace_buf_size=0 --dump_folder=outputs/autoresearch/may19-qwen3-14b/run639-qkv-forward-grad-input-concat-model-compile-pairwise-rope-batch176-event-cache0 > outputs/autoresearch/may19-qwen3-14b/run639-qkv-forward-grad-input-concat-model-compile-pairwise-rope-batch176-event-cache0.run.log 2>&1
bfc8d098+dirty	14315	0.00	168.91	discard	gate/up forward concat is valid but slower than the lean model-compile recipe, so the extra weight concat and larger fused forward matmul do not pay back	TORCH_NCCL_CUDA_EVENT_CACHE=0 NCCL_NVLS_ENABLE=1 NCCL_CTA_POLICY=2 NGPU=8 LOG_RANK=0 MODULE=qwen3 CONFIG=qwen3_14b ./run_train.sh --training.steps=10 --compile.enable --compile.components=model,loss,qk_norm_rope,qkv_grad_input_concat,pairwise_rope,gate_up_forward_concat --training.dtype=bfloat16 --training.seq_len=128 --training.local_batch_size=176 --loss.num_chunks=4 --optimizer.weight_decay=0.0 --dataloader.num_workers=2 --dataloader.persistent_workers --dataloader.prefetch_factor=2 --metrics.log_freq=1 --comm.trace_buf_size=0 --dump_folder=outputs/autoresearch/may19-qwen3-14b/run640-gate-up-forward-concat-model-compile-pairwise-rope-qkv-grad-input-concat-batch176-event-cache0 > outputs/autoresearch/may19-qwen3-14b/run640-gate-up-forward-concat-model-compile-pairwise-rope-qkv-grad-input-concat-batch176-event-cache0.run.log 2>&1
bfc8d098+dirty	14438	0.00	168.91	discard	SDPA Flash-only backend selection is valid but does not improve over the default backend priority path, which was already selecting Flash kernels	TORCH_NCCL_CUDA_EVENT_CACHE=0 NCCL_NVLS_ENABLE=1 NCCL_CTA_POLICY=2 NGPU=8 LOG_RANK=0 MODULE=qwen3 CONFIG=qwen3_14b ./run_train.sh --training.steps=10 --compile.enable --compile.components=model,loss,qk_norm_rope,qkv_grad_input_concat,pairwise_rope,sdpa_flash_only --training.dtype=bfloat16 --training.seq_len=128 --training.local_batch_size=176 --loss.num_chunks=4 --optimizer.weight_decay=0.0 --dataloader.num_workers=2 --dataloader.persistent_workers --dataloader.prefetch_factor=2 --metrics.log_freq=1 --comm.trace_buf_size=0 --dump_folder=outputs/autoresearch/may19-qwen3-14b/run641-sdpa-flash-only-model-compile-pairwise-rope-qkv-grad-input-concat-batch176-event-cache0 > outputs/autoresearch/may19-qwen3-14b/run641-sdpa-flash-only-model-compile-pairwise-rope-qkv-grad-input-concat-batch176-event-cache0.run.log 2>&1
