commit	tokens_per_sec	mfu_percent	peak_memory_gb	status	description	command
c789129	10456	39.15	169.1	keep	post-restore exact current-best rerun is clean but lower variance sample	NCCL_CTA_POLICY=2 NGPU=8 LOG_RANK=0 MODULE=qwen3 CONFIG=qwen3_14b ./run_train.sh --training.steps=10 --compile.enable --training.dtype=bfloat16 --training.seq_len=128 --training.local_batch_size=160 --loss.num_chunks=6 --dataloader.num_workers=2 --dataloader.persistent_workers --dataloader.prefetch_factor=2 --metrics.log_freq=1 --comm.trace_buf_size=0 --dump_folder=outputs/autoresearch/may19-qwen3-14b/run223-rerun-post-restore-sdpa-prefetch-seq128-lbs160-compile-bf16-nccl-zero-cta-loss-chunks6-dataloader-worker2-prefetch2-metrics-logfreq1-no-flight-recorder > run.log 2>&1
efc19b4	10313	38.62	169.1	discard	NCCL_MAX_NCHANNELS=8 is slower than default channels	NCCL_MAX_NCHANNELS=8 NCCL_CTA_POLICY=2 NGPU=8 LOG_RANK=0 MODULE=qwen3 CONFIG=qwen3_14b ./run_train.sh --training.steps=10 --compile.enable --training.dtype=bfloat16 --training.seq_len=128 --training.local_batch_size=160 --loss.num_chunks=6 --dataloader.num_workers=2 --dataloader.persistent_workers --dataloader.prefetch_factor=2 --metrics.log_freq=1 --comm.trace_buf_size=0 --dump_folder=outputs/autoresearch/may19-qwen3-14b/run224-sdpa-prefetch-seq128-lbs160-compile-bf16-nccl-zero-cta-max-nchannels8-loss-chunks6-dataloader-worker2-prefetch2-metrics-logfreq1-no-flight-recorder > run.log 2>&1
5459123	10559	39.54	169.1	discard	removing NCCL_CTA_POLICY=2 is below validated best	NGPU=8 LOG_RANK=0 MODULE=qwen3 CONFIG=qwen3_14b ./run_train.sh --training.steps=10 --compile.enable --training.dtype=bfloat16 --training.seq_len=128 --training.local_batch_size=160 --loss.num_chunks=6 --dataloader.num_workers=2 --dataloader.persistent_workers --dataloader.prefetch_factor=2 --metrics.log_freq=1 --comm.trace_buf_size=0 --dump_folder=outputs/autoresearch/may19-qwen3-14b/run225-sdpa-prefetch-seq128-lbs160-compile-bf16-no-nccl-cta-policy-loss-chunks6-dataloader-worker2-prefetch2-metrics-logfreq1-no-flight-recorder > run.log 2>&1
f0e7f2d	10471	39.21	169.1	discard	NCCL_CTA_POLICY=1 is slower than policy 2	NCCL_CTA_POLICY=1 NGPU=8 LOG_RANK=0 MODULE=qwen3 CONFIG=qwen3_14b ./run_train.sh --training.steps=10 --compile.enable --training.dtype=bfloat16 --training.seq_len=128 --training.local_batch_size=160 --loss.num_chunks=6 --dataloader.num_workers=2 --dataloader.persistent_workers --dataloader.prefetch_factor=2 --metrics.log_freq=1 --comm.trace_buf_size=0 --dump_folder=outputs/autoresearch/may19-qwen3-14b/run226-sdpa-prefetch-seq128-lbs160-compile-bf16-nccl-cta-policy1-loss-chunks6-dataloader-worker2-prefetch2-metrics-logfreq1-no-flight-recorder > run.log 2>&1
7f6c7aa	10378	38.86	169.1	discard	DataLoader prefetch_factor=3 is slower than factor 2	NCCL_CTA_POLICY=2 NGPU=8 LOG_RANK=0 MODULE=qwen3 CONFIG=qwen3_14b ./run_train.sh --training.steps=10 --compile.enable --training.dtype=bfloat16 --training.seq_len=128 --training.local_batch_size=160 --loss.num_chunks=6 --dataloader.num_workers=2 --dataloader.persistent_workers --dataloader.prefetch_factor=3 --metrics.log_freq=1 --comm.trace_buf_size=0 --dump_folder=outputs/autoresearch/may19-qwen3-14b/run227-sdpa-prefetch-seq128-lbs160-compile-bf16-nccl-zero-cta-loss-chunks6-dataloader-worker2-prefetch3-metrics-logfreq1-no-flight-recorder > run.log 2>&1
2c400d5	10408	38.97	169.1	discard	NCCL_MAX_CTAS=32 is slower than uncapped default	NCCL_MAX_CTAS=32 NCCL_CTA_POLICY=2 NGPU=8 LOG_RANK=0 MODULE=qwen3 CONFIG=qwen3_14b ./run_train.sh --training.steps=10 --compile.enable --training.dtype=bfloat16 --training.seq_len=128 --training.local_batch_size=160 --loss.num_chunks=6 --dataloader.num_workers=2 --dataloader.persistent_workers --dataloader.prefetch_factor=2 --metrics.log_freq=1 --comm.trace_buf_size=0 --dump_folder=outputs/autoresearch/may19-qwen3-14b/run228-sdpa-prefetch-seq128-lbs160-compile-bf16-nccl-zero-cta-max-ctas32-loss-chunks6-dataloader-worker2-prefetch2-metrics-logfreq1-no-flight-recorder > run.log 2>&1
baf62dd	10460	39.17	169.1	keep	exact current-best rerun after brackets is lower clean sample	NCCL_CTA_POLICY=2 NGPU=8 LOG_RANK=0 MODULE=qwen3 CONFIG=qwen3_14b ./run_train.sh --training.steps=10 --compile.enable --training.dtype=bfloat16 --training.seq_len=128 --training.local_batch_size=160 --loss.num_chunks=6 --dataloader.num_workers=2 --dataloader.persistent_workers --dataloader.prefetch_factor=2 --metrics.log_freq=1 --comm.trace_buf_size=0 --dump_folder=outputs/autoresearch/may19-qwen3-14b/run229-rerun-sdpa-prefetch-seq128-lbs160-compile-bf16-nccl-zero-cta-loss-chunks6-dataloader-worker2-prefetch2-metrics-logfreq1-no-flight-recorder > run.log 2>&1
cb876244	9323	34.91	100.4	discard	TP2 FSDP4 saves memory but is much slower than DP-only best	NCCL_CTA_POLICY=2 NGPU=8 LOG_RANK=0 MODULE=qwen3 CONFIG=qwen3_14b ./run_train.sh --training.steps=10 --compile.enable --training.dtype=bfloat16 --training.seq_len=128 --training.local_batch_size=160 --loss.num_chunks=6 --dataloader.num_workers=2 --dataloader.persistent_workers --dataloader.prefetch_factor=2 --metrics.log_freq=1 --parallelism.tensor_parallel_degree=2 --comm.trace_buf_size=0 --dump_folder=outputs/autoresearch/may19-qwen3-14b/run230-tp2-fsdp4-sdpa-prefetch-seq128-lbs160-compile-bf16-nccl-zero-cta-loss-chunks6-dataloader-worker2-prefetch2-metrics-logfreq1-no-flight-recorder > run.log 2>&1
e12ce86	10446	39.12	169.1	keep	post-TP2 restore exact current-best rerun is clean but lower sample	NCCL_CTA_POLICY=2 NGPU=8 LOG_RANK=0 MODULE=qwen3 CONFIG=qwen3_14b ./run_train.sh --training.steps=10 --compile.enable --training.dtype=bfloat16 --training.seq_len=128 --training.local_batch_size=160 --loss.num_chunks=6 --dataloader.num_workers=2 --dataloader.persistent_workers --dataloader.prefetch_factor=2 --metrics.log_freq=1 --comm.trace_buf_size=0 --dump_folder=outputs/autoresearch/may19-qwen3-14b/run231-rerun-post-tp2-restore-sdpa-prefetch-seq128-lbs160-compile-bf16-nccl-zero-cta-loss-chunks6-dataloader-worker2-prefetch2-metrics-logfreq1-no-flight-recorder > run.log 2>&1
c974d65	10581	39.62	169.1	discard	NCCL_CUMEM_ENABLE=0 is clean but below validated peak	NCCL_CUMEM_ENABLE=0 NCCL_CTA_POLICY=2 NGPU=8 LOG_RANK=0 MODULE=qwen3 CONFIG=qwen3_14b ./run_train.sh --training.steps=10 --compile.enable --training.dtype=bfloat16 --training.seq_len=128 --training.local_batch_size=160 --loss.num_chunks=6 --dataloader.num_workers=2 --dataloader.persistent_workers --dataloader.prefetch_factor=2 --metrics.log_freq=1 --comm.trace_buf_size=0 --dump_folder=outputs/autoresearch/may19-qwen3-14b/run232-nccl-cumem-disable-sdpa-prefetch-seq128-lbs160-compile-bf16-nccl-zero-cta-loss-chunks6-dataloader-worker2-prefetch2-metrics-logfreq1-no-flight-recorder > run.log 2>&1
ad7fe20	10580	39.62	169.1	discard	NCCL_ALGO=Ring is below peak and showed transient stalls	NCCL_ALGO=Ring NCCL_CTA_POLICY=2 NGPU=8 LOG_RANK=0 MODULE=qwen3 CONFIG=qwen3_14b ./run_train.sh --training.steps=10 --compile.enable --training.dtype=bfloat16 --training.seq_len=128 --training.local_batch_size=160 --loss.num_chunks=6 --dataloader.num_workers=2 --dataloader.persistent_workers --dataloader.prefetch_factor=2 --metrics.log_freq=1 --comm.trace_buf_size=0 --dump_folder=outputs/autoresearch/may19-qwen3-14b/run233-nccl-algo-ring-sdpa-prefetch-seq128-lbs160-compile-bf16-nccl-zero-cta-loss-chunks6-dataloader-worker2-prefetch2-metrics-logfreq1-no-flight-recorder > run.log 2>&1
b54675e	10528	39.43	169.1	keep	exact current-best rerun after NCCL probes is clean but lower sample	NCCL_CTA_POLICY=2 NGPU=8 LOG_RANK=0 MODULE=qwen3 CONFIG=qwen3_14b ./run_train.sh --training.steps=10 --compile.enable --training.dtype=bfloat16 --training.seq_len=128 --training.local_batch_size=160 --loss.num_chunks=6 --dataloader.num_workers=2 --dataloader.persistent_workers --dataloader.prefetch_factor=2 --metrics.log_freq=1 --comm.trace_buf_size=0 --dump_folder=outputs/autoresearch/may19-qwen3-14b/run234-rerun-after-nccl-probes-sdpa-prefetch-seq128-lbs160-compile-bf16-nccl-zero-cta-loss-chunks6-dataloader-worker2-prefetch2-metrics-logfreq1-no-flight-recorder > run.log 2>&1
0a1bb59	10574	39.60	169.1	discard	NCCL_MIN_CTAS=32 is clean but below validated peak	NCCL_MIN_CTAS=32 NCCL_CTA_POLICY=2 NGPU=8 LOG_RANK=0 MODULE=qwen3 CONFIG=qwen3_14b ./run_train.sh --training.steps=10 --compile.enable --training.dtype=bfloat16 --training.seq_len=128 --training.local_batch_size=160 --loss.num_chunks=6 --dataloader.num_workers=2 --dataloader.persistent_workers --dataloader.prefetch_factor=2 --metrics.log_freq=1 --comm.trace_buf_size=0 --dump_folder=outputs/autoresearch/may19-qwen3-14b/run235-nccl-min-ctas32-sdpa-prefetch-seq128-lbs160-compile-bf16-nccl-zero-cta-loss-chunks6-dataloader-worker2-prefetch2-metrics-logfreq1-no-flight-recorder > run.log 2>&1
56341e6	10510	39.36	169.1	discard	NCCL_LAUNCH_MODE=GROUP is slower than default launch mode	NCCL_LAUNCH_MODE=GROUP NCCL_CTA_POLICY=2 NGPU=8 LOG_RANK=0 MODULE=qwen3 CONFIG=qwen3_14b ./run_train.sh --training.steps=10 --compile.enable --training.dtype=bfloat16 --training.seq_len=128 --training.local_batch_size=160 --loss.num_chunks=6 --dataloader.num_workers=2 --dataloader.persistent_workers --dataloader.prefetch_factor=2 --metrics.log_freq=1 --comm.trace_buf_size=0 --dump_folder=outputs/autoresearch/may19-qwen3-14b/run236-nccl-launch-mode-group-sdpa-prefetch-seq128-lbs160-compile-bf16-nccl-zero-cta-loss-chunks6-dataloader-worker2-prefetch2-metrics-logfreq1-no-flight-recorder > run.log 2>&1
394bb02	10482	39.25	169.1	discard	TORCH_NCCL_HIGH_PRIORITY=1 is slower than default stream priority	TORCH_NCCL_HIGH_PRIORITY=1 NCCL_CTA_POLICY=2 NGPU=8 LOG_RANK=0 MODULE=qwen3 CONFIG=qwen3_14b ./run_train.sh --training.steps=10 --compile.enable --training.dtype=bfloat16 --training.seq_len=128 --training.local_batch_size=160 --loss.num_chunks=6 --dataloader.num_workers=2 --dataloader.persistent_workers --dataloader.prefetch_factor=2 --metrics.log_freq=1 --comm.trace_buf_size=0 --dump_folder=outputs/autoresearch/may19-qwen3-14b/run237-torch-nccl-high-priority-sdpa-prefetch-seq128-lbs160-compile-bf16-nccl-zero-cta-loss-chunks6-dataloader-worker2-prefetch2-metrics-logfreq1-no-flight-recorder > run.log 2>&1
d7564fc	10428	39.05	169.1	discard	NCCL_CGA_CLUSTER_SIZE=4 is slower than default clustering	NCCL_CGA_CLUSTER_SIZE=4 NCCL_CTA_POLICY=2 NGPU=8 LOG_RANK=0 MODULE=qwen3 CONFIG=qwen3_14b ./run_train.sh --training.steps=10 --compile.enable --training.dtype=bfloat16 --training.seq_len=128 --training.local_batch_size=160 --loss.num_chunks=6 --dataloader.num_workers=2 --dataloader.persistent_workers --dataloader.prefetch_factor=2 --metrics.log_freq=1 --comm.trace_buf_size=0 --dump_folder=outputs/autoresearch/may19-qwen3-14b/run238-nccl-cga-cluster-size4-sdpa-prefetch-seq128-lbs160-compile-bf16-nccl-zero-cta-loss-chunks6-dataloader-worker2-prefetch2-metrics-logfreq1-no-flight-recorder > run.log 2>&1
e8d2173	10497	39.31	169.1	discard	NCCL_MIN_NCHANNELS=32 is slower than default channel selection	NCCL_MIN_NCHANNELS=32 NCCL_CTA_POLICY=2 NGPU=8 LOG_RANK=0 MODULE=qwen3 CONFIG=qwen3_14b ./run_train.sh --training.steps=10 --compile.enable --training.dtype=bfloat16 --training.seq_len=128 --training.local_batch_size=160 --loss.num_chunks=6 --dataloader.num_workers=2 --dataloader.persistent_workers --dataloader.prefetch_factor=2 --metrics.log_freq=1 --comm.trace_buf_size=0 --dump_folder=outputs/autoresearch/may19-qwen3-14b/run239-nccl-min-nchannels32-sdpa-prefetch-seq128-lbs160-compile-bf16-nccl-zero-cta-loss-chunks6-dataloader-worker2-prefetch2-metrics-logfreq1-no-flight-recorder > run.log 2>&1
a6b8b7b	10328	38.67	169.1	discard	CUDA_DEVICE_MAX_CONNECTIONS=2 reduces overlap and is slower	CUDA_DEVICE_MAX_CONNECTIONS=2 NCCL_CTA_POLICY=2 NGPU=8 LOG_RANK=0 MODULE=qwen3 CONFIG=qwen3_14b ./run_train.sh --training.steps=10 --compile.enable --training.dtype=bfloat16 --training.seq_len=128 --training.local_batch_size=160 --loss.num_chunks=6 --dataloader.num_workers=2 --dataloader.persistent_workers --dataloader.prefetch_factor=2 --metrics.log_freq=1 --comm.trace_buf_size=0 --dump_folder=outputs/autoresearch/may19-qwen3-14b/run240-cuda-device-max-connections2-sdpa-prefetch-seq128-lbs160-compile-bf16-nccl-zero-cta-loss-chunks6-dataloader-worker2-prefetch2-metrics-logfreq1-no-flight-recorder > run.log 2>&1
1437003	10377	38.86	169.1	discard	CUDA_DEVICE_MAX_CONNECTIONS=4 is slower than default queue count	CUDA_DEVICE_MAX_CONNECTIONS=4 NCCL_CTA_POLICY=2 NGPU=8 LOG_RANK=0 MODULE=qwen3 CONFIG=qwen3_14b ./run_train.sh --training.steps=10 --compile.enable --training.dtype=bfloat16 --training.seq_len=128 --training.local_batch_size=160 --loss.num_chunks=6 --dataloader.num_workers=2 --dataloader.persistent_workers --dataloader.prefetch_factor=2 --metrics.log_freq=1 --comm.trace_buf_size=0 --dump_folder=outputs/autoresearch/may19-qwen3-14b/run241-cuda-device-max-connections4-sdpa-prefetch-seq128-lbs160-compile-bf16-nccl-zero-cta-loss-chunks6-dataloader-worker2-prefetch2-metrics-logfreq1-no-flight-recorder > run.log 2>&1
8f190d7	10650	39.88	169.1	keep	exact current-best rerun samples a new reported-tps peak despite transient stalls	NCCL_CTA_POLICY=2 NGPU=8 LOG_RANK=0 MODULE=qwen3 CONFIG=qwen3_14b ./run_train.sh --training.steps=10 --compile.enable --training.dtype=bfloat16 --training.seq_len=128 --training.local_batch_size=160 --loss.num_chunks=6 --dataloader.num_workers=2 --dataloader.persistent_workers --dataloader.prefetch_factor=2 --metrics.log_freq=1 --comm.trace_buf_size=0 --dump_folder=outputs/autoresearch/may19-qwen3-14b/run242-rerun-after-scheduling-probes-sdpa-prefetch-seq128-lbs160-compile-bf16-nccl-zero-cta-loss-chunks6-dataloader-worker2-prefetch2-metrics-logfreq1-no-flight-recorder > run.log 2>&1
524037f	10439	39.09	169.1	keep	exact rerun of 10650 sample falls back to normal variance band	NCCL_CTA_POLICY=2 NGPU=8 LOG_RANK=0 MODULE=qwen3 CONFIG=qwen3_14b ./run_train.sh --training.steps=10 --compile.enable --training.dtype=bfloat16 --training.seq_len=128 --training.local_batch_size=160 --loss.num_chunks=6 --dataloader.num_workers=2 --dataloader.persistent_workers --dataloader.prefetch_factor=2 --metrics.log_freq=1 --comm.trace_buf_size=0 --dump_folder=outputs/autoresearch/may19-qwen3-14b/run243-rerun-current-best-peak-sdpa-prefetch-seq128-lbs160-compile-bf16-nccl-zero-cta-loss-chunks6-dataloader-worker2-prefetch2-metrics-logfreq1-no-flight-recorder > run.log 2>&1
b97a281	10457	39.16	169.1	discard	separate tok_embeddings FSDP prefetch saves tiny memory but is slower	NCCL_CTA_POLICY=2 NGPU=8 LOG_RANK=0 MODULE=qwen3 CONFIG=qwen3_14b ./run_train.sh --training.steps=10 --compile.enable --training.dtype=bfloat16 --training.seq_len=128 --training.local_batch_size=160 --loss.num_chunks=6 --dataloader.num_workers=2 --dataloader.persistent_workers --dataloader.prefetch_factor=2 --metrics.log_freq=1 --comm.trace_buf_size=0 --dump_folder=outputs/autoresearch/may19-qwen3-14b/run244-embedding-fsdp-prefetch-sdpa-prefetch-seq128-lbs160-compile-bf16-nccl-zero-cta-loss-chunks6-dataloader-worker2-prefetch2-metrics-logfreq1-no-flight-recorder > run.log 2>&1
2b92e37	10560	39.54	169.1	keep	post-embedding-restore exact current-best rerun is healthy	NCCL_CTA_POLICY=2 NGPU=8 LOG_RANK=0 MODULE=qwen3 CONFIG=qwen3_14b ./run_train.sh --training.steps=10 --compile.enable --training.dtype=bfloat16 --training.seq_len=128 --training.local_batch_size=160 --loss.num_chunks=6 --dataloader.num_workers=2 --dataloader.persistent_workers --dataloader.prefetch_factor=2 --metrics.log_freq=1 --comm.trace_buf_size=0 --dump_folder=outputs/autoresearch/may19-qwen3-14b/run245-rerun-post-embedding-restore-sdpa-prefetch-seq128-lbs160-compile-bf16-nccl-zero-cta-loss-chunks6-dataloader-worker2-prefetch2-metrics-logfreq1-no-flight-recorder > run.log 2>&1
0c3762a	10530	39.43	169.1	discard	TORCH_NCCL_ENABLE_MONITORING=0 is below current-best calibration band	TORCH_NCCL_ENABLE_MONITORING=0 NCCL_CTA_POLICY=2 NGPU=8 LOG_RANK=0 MODULE=qwen3 CONFIG=qwen3_14b ./run_train.sh --training.steps=10 --compile.enable --training.dtype=bfloat16 --training.seq_len=128 --training.local_batch_size=160 --loss.num_chunks=6 --dataloader.num_workers=2 --dataloader.persistent_workers --dataloader.prefetch_factor=2 --metrics.log_freq=1 --comm.trace_buf_size=0 --dump_folder=outputs/autoresearch/may19-qwen3-14b/run246-torch-nccl-monitoring-disable-sdpa-prefetch-seq128-lbs160-compile-bf16-nccl-zero-cta-loss-chunks6-dataloader-worker2-prefetch2-metrics-logfreq1-no-flight-recorder > run.log 2>&1
cfbca39	10505	39.34	169.1	discard	NCCL_P2P_LEVEL=NVL is slower than auto transport selection	NCCL_P2P_LEVEL=NVL NCCL_CTA_POLICY=2 NGPU=8 LOG_RANK=0 MODULE=qwen3 CONFIG=qwen3_14b ./run_train.sh --training.steps=10 --compile.enable --training.dtype=bfloat16 --training.seq_len=128 --training.local_batch_size=160 --loss.num_chunks=6 --dataloader.num_workers=2 --dataloader.persistent_workers --dataloader.prefetch_factor=2 --metrics.log_freq=1 --comm.trace_buf_size=0 --dump_folder=outputs/autoresearch/may19-qwen3-14b/run247-nccl-p2p-level-nvl-sdpa-prefetch-seq128-lbs160-compile-bf16-nccl-zero-cta-loss-chunks6-dataloader-worker2-prefetch2-metrics-logfreq1-no-flight-recorder > run.log 2>&1
2b6d84f	10489	39.28	169.1	discard	NCCL_PXN_DISABLE=1 is slower than default PXN behavior	NCCL_PXN_DISABLE=1 NCCL_CTA_POLICY=2 NGPU=8 LOG_RANK=0 MODULE=qwen3 CONFIG=qwen3_14b ./run_train.sh --training.steps=10 --compile.enable --training.dtype=bfloat16 --training.seq_len=128 --training.local_batch_size=160 --loss.num_chunks=6 --dataloader.num_workers=2 --dataloader.persistent_workers --dataloader.prefetch_factor=2 --metrics.log_freq=1 --comm.trace_buf_size=0 --dump_folder=outputs/autoresearch/may19-qwen3-14b/run248-nccl-pxn-disable-sdpa-prefetch-seq128-lbs160-compile-bf16-nccl-zero-cta-loss-chunks6-dataloader-worker2-prefetch2-metrics-logfreq1-no-flight-recorder > run.log 2>&1
92120cd	10453	39.15	169.1	discard	NCCL_NTHREADS=512 is slower than default NCCL thread-block size	NCCL_NTHREADS=512 NCCL_CTA_POLICY=2 NGPU=8 LOG_RANK=0 MODULE=qwen3 CONFIG=qwen3_14b ./run_train.sh --training.steps=10 --compile.enable --training.dtype=bfloat16 --training.seq_len=128 --training.local_batch_size=160 --loss.num_chunks=6 --dataloader.num_workers=2 --dataloader.persistent_workers --dataloader.prefetch_factor=2 --metrics.log_freq=1 --comm.trace_buf_size=0 --dump_folder=outputs/autoresearch/may19-qwen3-14b/run249-nccl-nthreads512-sdpa-prefetch-seq128-lbs160-compile-bf16-nccl-zero-cta-loss-chunks6-dataloader-worker2-prefetch2-metrics-logfreq1-no-flight-recorder > run.log 2>&1
7b0ccbf	10195	38.18	168.6	discard	loss.num_chunks=8 saves little memory but adds too much loss-path overhead	NCCL_CTA_POLICY=2 NGPU=8 LOG_RANK=0 MODULE=qwen3 CONFIG=qwen3_14b ./run_train.sh --training.steps=10 --compile.enable --training.dtype=bfloat16 --training.seq_len=128 --training.local_batch_size=160 --loss.num_chunks=8 --dataloader.num_workers=2 --dataloader.persistent_workers --dataloader.prefetch_factor=2 --metrics.log_freq=1 --comm.trace_buf_size=0 --dump_folder=outputs/autoresearch/may19-qwen3-14b/run250-loss-chunks8-sdpa-prefetch-seq128-lbs160-compile-bf16-nccl-zero-cta-dataloader-worker2-prefetch2-metrics-logfreq1-no-flight-recorder > run.log 2>&1
994c44b	10382	38.88	169.1	keep	exact current-best rerun after loss and NCCL probes is clean but lower sample	NCCL_CTA_POLICY=2 NGPU=8 LOG_RANK=0 MODULE=qwen3 CONFIG=qwen3_14b ./run_train.sh --training.steps=10 --compile.enable --training.dtype=bfloat16 --training.seq_len=128 --training.local_batch_size=160 --loss.num_chunks=6 --dataloader.num_workers=2 --dataloader.persistent_workers --dataloader.prefetch_factor=2 --metrics.log_freq=1 --comm.trace_buf_size=0 --dump_folder=outputs/autoresearch/may19-qwen3-14b/run251-rerun-after-loss-nccl-probes-sdpa-prefetch-seq128-lbs160-compile-bf16-nccl-zero-cta-loss-chunks6-dataloader-worker2-prefetch2-metrics-logfreq1-no-flight-recorder > run.log 2>&1
c671468	10452	39.14	169.1	discard	NCCL_DMABUF_ENABLE=0 is slower than default DMA-BUF behavior	NCCL_DMABUF_ENABLE=0 NCCL_CTA_POLICY=2 NGPU=8 LOG_RANK=0 MODULE=qwen3 CONFIG=qwen3_14b ./run_train.sh --training.steps=10 --compile.enable --training.dtype=bfloat16 --training.seq_len=128 --training.local_batch_size=160 --loss.num_chunks=6 --dataloader.num_workers=2 --dataloader.persistent_workers --dataloader.prefetch_factor=2 --metrics.log_freq=1 --comm.trace_buf_size=0 --dump_folder=outputs/autoresearch/may19-qwen3-14b/run252-nccl-dmabuf-disable-sdpa-prefetch-seq128-lbs160-compile-bf16-nccl-zero-cta-loss-chunks6-dataloader-worker2-prefetch2-metrics-logfreq1-no-flight-recorder > run.log 2>&1
60155ea	10505	39.34	169.1	discard	OMP_NUM_THREADS=2 under log_freq=1 is below measured peak	OMP_NUM_THREADS=2 NCCL_CTA_POLICY=2 NGPU=8 LOG_RANK=0 MODULE=qwen3 CONFIG=qwen3_14b ./run_train.sh --training.steps=10 --compile.enable --training.dtype=bfloat16 --training.seq_len=128 --training.local_batch_size=160 --loss.num_chunks=6 --dataloader.num_workers=2 --dataloader.persistent_workers --dataloader.prefetch_factor=2 --metrics.log_freq=1 --comm.trace_buf_size=0 --dump_folder=outputs/autoresearch/may19-qwen3-14b/run253-omp2-sdpa-prefetch-seq128-lbs160-compile-bf16-nccl-zero-cta-loss-chunks6-dataloader-worker2-prefetch2-metrics-logfreq1-no-flight-recorder > run.log 2>&1
