commit	tokens_per_sec	mfu_percent	peak_memory_gb	status	description	command
b29e75a	7455	31.15	168.1	discard	flex best with structured logging disabled fails loss sanity	NGPU=8 LOG_RANK=0 MODULE=qwen3 CONFIG=qwen3_14b ./run_train.sh --training.steps=10 --compile.enable --training.dtype=bfloat16 --training.local_batch_size=5 --comm.trace_buf_size=0 --debug.no-enable-structured-logging --dump_folder=outputs/autoresearch/may19-qwen3-14b/run56-flex-no-structured-logging-compile-bf16-lbs5-no-flight-recorder > run.log 2>&1
ba3af10	5899	24.65	168.1	discard	flex best with fixed debug seed fails loss sanity	NGPU=8 LOG_RANK=0 MODULE=qwen3 CONFIG=qwen3_14b ./run_train.sh --training.steps=10 --compile.enable --training.dtype=bfloat16 --training.local_batch_size=5 --comm.trace_buf_size=0 --debug.seed=42 --dump_folder=outputs/autoresearch/may19-qwen3-14b/run57-flex-seed42-compile-bf16-lbs5-no-flight-recorder > run.log 2>&1
75e484f	6922	28.92	168.1	discard	flex lm_head-only no-reshard slows loss path	NGPU=8 LOG_RANK=0 MODULE=qwen3 CONFIG=qwen3_14b ./run_train.sh --training.steps=10 --compile.enable --training.dtype=bfloat16 --training.local_batch_size=5 --comm.trace_buf_size=0 --dump_folder=outputs/autoresearch/may19-qwen3-14b/run58-flex-lm-head-no-reshard-compile-bf16-lbs5-no-flight-recorder > run.log 2>&1
7c1c351	8835	36.91	168.1	keep	flex attention with explicit FSDP prefetch schedule	NGPU=8 LOG_RANK=0 MODULE=qwen3 CONFIG=qwen3_14b ./run_train.sh --training.steps=10 --compile.enable --training.dtype=bfloat16 --training.local_batch_size=5 --comm.trace_buf_size=0 --dump_folder=outputs/autoresearch/may19-qwen3-14b/run59-flex-fsdp-prefetch-compile-bf16-lbs5-no-flight-recorder > run.log 2>&1
e213be2	0	0.00	0.0	invalid	prefetch flex selective fp8 contaminated by external vllm workers	NGPU=8 LOG_RANK=0 MODULE=qwen3 CONFIG=qwen3_14b ./run_train.sh --training.steps=10 --compile.enable --training.dtype=bfloat16 --training.local_batch_size=5 --comm.trace_buf_size=0 --dump_folder=outputs/autoresearch/may19-qwen3-14b/run60-prefetch-flex-fp8-bf16-lm-head-compile-bf16-lbs5-no-flight-recorder > run.log 2>&1
e213be2	8762	36.61	168.1	discard	prefetch flex selective fp8 with bf16 lm_head retry	NGPU=8 LOG_RANK=0 MODULE=qwen3 CONFIG=qwen3_14b ./run_train.sh --training.steps=10 --compile.enable --training.dtype=bfloat16 --training.local_batch_size=5 --comm.trace_buf_size=0 --dump_folder=outputs/autoresearch/may19-qwen3-14b/run61-prefetch-flex-fp8-bf16-lm-head-compile-bf16-lbs5-no-flight-recorder-retry > run.log 2>&1
025f0c3	8829	36.89	168.1	discard	exact rerun of prefetch flex best	NGPU=8 LOG_RANK=0 MODULE=qwen3 CONFIG=qwen3_14b ./run_train.sh --training.steps=10 --compile.enable --training.dtype=bfloat16 --training.local_batch_size=5 --comm.trace_buf_size=0 --dump_folder=outputs/autoresearch/may19-qwen3-14b/run62-rerun-prefetch-flex-compile-bf16-lbs5-no-flight-recorder > run.log 2>&1
1e8f047	8484	35.45	168.1	discard	profile prefetch flex best	NGPU=8 LOG_RANK=0 MODULE=qwen3 CONFIG=qwen3_14b ./run_train.sh --training.steps=10 --compile.enable --training.dtype=bfloat16 --training.local_batch_size=5 --comm.trace_buf_size=0 --dump_folder=outputs/autoresearch/may19-qwen3-14b/run63-profile-prefetch-flex-best --profiler.enable_profiling --profiler.profile_freq=10 --profiler.profiler_warmup=2 --profiler.profiler_active=1 > run.log 2>&1
388fdfd	8627	36.04	169.3	discard	two-module FSDP prefetch window	NGPU=8 LOG_RANK=0 MODULE=qwen3 CONFIG=qwen3_14b ./run_train.sh --training.steps=10 --compile.enable --training.dtype=bfloat16 --training.local_batch_size=5 --comm.trace_buf_size=0 --dump_folder=outputs/autoresearch/may19-qwen3-14b/run64-flex-two-module-prefetch-compile-bf16-lbs5-no-flight-recorder > run.log 2>&1
1996329	8596	35.92	168.1	discard	forward-only FSDP prefetch	NGPU=8 LOG_RANK=0 MODULE=qwen3 CONFIG=qwen3_14b ./run_train.sh --training.steps=10 --compile.enable --training.dtype=bfloat16 --training.local_batch_size=5 --comm.trace_buf_size=0 --dump_folder=outputs/autoresearch/may19-qwen3-14b/run65-flex-forward-only-prefetch-compile-bf16-lbs5-no-flight-recorder > run.log 2>&1
579e621	0	0.00	0.0	invalid	backward-only FSDP prefetch contaminated by external vllm workers	NGPU=8 LOG_RANK=0 MODULE=qwen3 CONFIG=qwen3_14b ./run_train.sh --training.steps=10 --compile.enable --training.dtype=bfloat16 --training.local_batch_size=5 --comm.trace_buf_size=0 --dump_folder=outputs/autoresearch/may19-qwen3-14b/run66-flex-backward-only-prefetch-compile-bf16-lbs5-no-flight-recorder > run.log 2>&1
579e621	8387	35.04	168.1	discard	backward-only FSDP prefetch retry	NGPU=8 LOG_RANK=0 MODULE=qwen3 CONFIG=qwen3_14b ./run_train.sh --training.steps=10 --compile.enable --training.dtype=bfloat16 --training.local_batch_size=5 --comm.trace_buf_size=0 --dump_folder=outputs/autoresearch/may19-qwen3-14b/run67-flex-backward-only-prefetch-compile-bf16-lbs5-no-flight-recorder-retry > run.log 2>&1
f67bbcb	8612	35.98	163.2	discard	BF16 FSDP reduce dtype fails loss and grad_norm sanity	NGPU=8 LOG_RANK=0 MODULE=qwen3 CONFIG=qwen3_14b ./run_train.sh --training.steps=10 --compile.enable --training.dtype=bfloat16 --training.local_batch_size=5 --comm.trace_buf_size=0 --dump_folder=outputs/autoresearch/may19-qwen3-14b/run68-flex-prefetch-bf16-reduce-compile-bf16-lbs5-no-flight-recorder > run.log 2>&1
316182a	1984	8.29	172.1	discard	HSDP 2x4 prefetch source with allocator retries	NGPU=8 LOG_RANK=0 MODULE=qwen3 CONFIG=qwen3_14b ./run_train.sh --training.steps=10 --compile.enable --training.dtype=bfloat16 --training.local_batch_size=5 --comm.trace_buf_size=0 --parallelism.data_parallel_replicate_degree=2 --parallelism.data_parallel_shard_degree=4 --dump_folder=outputs/autoresearch/may19-qwen3-14b/run69-flex-prefetch-hsdp2x4-compile-bf16-lbs5-no-flight-recorder > run.log 2>&1
b6ccf9c	8847	36.96	167.8	keep	separate tok_embeddings FSDP wrap with terminal prefetch	NGPU=8 LOG_RANK=0 MODULE=qwen3 CONFIG=qwen3_14b ./run_train.sh --training.steps=10 --compile.enable --training.dtype=bfloat16 --training.local_batch_size=5 --comm.trace_buf_size=0 --dump_folder=outputs/autoresearch/may19-qwen3-14b/run70-flex-prefetch-separate-tok-embeddings-compile-bf16-lbs5-no-flight-recorder > run.log 2>&1
d876c83	4790	20.01	167.8	discard	exact rerun of embedding-prefetch best fails loss sanity	NGPU=8 LOG_RANK=0 MODULE=qwen3 CONFIG=qwen3_14b ./run_train.sh --training.steps=10 --compile.enable --training.dtype=bfloat16 --training.local_batch_size=5 --comm.trace_buf_size=0 --dump_folder=outputs/autoresearch/may19-qwen3-14b/run71-rerun-flex-prefetch-separate-tok-embeddings-compile-bf16-lbs5-no-flight-recorder > run.log 2>&1
d876c83	8524	35.62	167.8	discard	second exact rerun of embedding-prefetch best below prior best	NGPU=8 LOG_RANK=0 MODULE=qwen3 CONFIG=qwen3_14b ./run_train.sh --training.steps=10 --compile.enable --training.dtype=bfloat16 --training.local_batch_size=5 --comm.trace_buf_size=0 --dump_folder=outputs/autoresearch/may19-qwen3-14b/run72-rerun2-flex-prefetch-separate-tok-embeddings-compile-bf16-lbs5-no-flight-recorder > run.log 2>&1
549bd46	8836	36.92	167.8	discard	separate tok_embeddings wrap without endpoint prefetch below measured best	NGPU=8 LOG_RANK=0 MODULE=qwen3 CONFIG=qwen3_14b ./run_train.sh --training.steps=10 --compile.enable --training.dtype=bfloat16 --training.local_batch_size=5 --comm.trace_buf_size=0 --dump_folder=outputs/autoresearch/may19-qwen3-14b/run73-flex-separate-tok-embeddings-no-endpoint-prefetch-compile-bf16-lbs5-no-flight-recorder > run.log 2>&1
7374453	8670	36.23	167.8	discard	exact rerun of no-endpoint embedding wrap fails loss sanity	NGPU=8 LOG_RANK=0 MODULE=qwen3 CONFIG=qwen3_14b ./run_train.sh --training.steps=10 --compile.enable --training.dtype=bfloat16 --training.local_batch_size=5 --comm.trace_buf_size=0 --dump_folder=outputs/autoresearch/may19-qwen3-14b/run74-rerun-flex-separate-tok-embeddings-no-endpoint-prefetch-compile-bf16-lbs5-no-flight-recorder > run.log 2>&1
e84866a	0	0.00	0.0	crash	MXFP8 cublas recipe unsupported by installed torchao	NGPU=8 LOG_RANK=0 MODULE=qwen3 CONFIG=qwen3_14b ./run_train.sh --training.steps=10 --compile.enable --training.dtype=bfloat16 --training.local_batch_size=5 --comm.trace_buf_size=0 --dump_folder=outputs/autoresearch/may19-qwen3-14b/run75-flex-prefetch-mxfp8-cublas-compile-bf16-lbs5-no-flight-recorder > run.log 2>&1
a0de7be	0	0.00	0.0	crash	MXFP8 rceil converter hits Inductor recursion error	NGPU=8 LOG_RANK=0 MODULE=qwen3 CONFIG=qwen3_14b ./run_train.sh --training.steps=10 --compile.enable --training.dtype=bfloat16 --training.local_batch_size=5 --comm.trace_buf_size=0 --dump_folder=outputs/autoresearch/may19-qwen3-14b/run76-flex-prefetch-mxfp8-rceil-compile-bf16-lbs5-no-flight-recorder > run.log 2>&1
8e03eab	8322	34.77	168.1	discard	OMP_NUM_THREADS=2 on robust prefetch baseline	OMP_NUM_THREADS=2 NGPU=8 LOG_RANK=0 MODULE=qwen3 CONFIG=qwen3_14b ./run_train.sh --training.steps=10 --compile.enable --training.dtype=bfloat16 --training.local_batch_size=5 --comm.trace_buf_size=0 --dump_folder=outputs/autoresearch/may19-qwen3-14b/run77-flex-prefetch-omp2-compile-bf16-lbs5-no-flight-recorder > run.log 2>&1
4d6dfd5	0	0.00	0.0	invalid	seq2048 local batch 10 OOM contaminated by external GPU allocations	NGPU=8 LOG_RANK=0 MODULE=qwen3 CONFIG=qwen3_14b ./run_train.sh --training.steps=10 --compile.enable --training.dtype=bfloat16 --training.seq_len=2048 --training.local_batch_size=10 --comm.trace_buf_size=0 --dump_folder=outputs/autoresearch/may19-qwen3-14b/run78-flex-prefetch-seq2048-lbs10-compile-bf16-no-flight-recorder > run.log 2>&1
8191d88	0	0.00	0.0	invalid	seq2048 local batch 10 retry OOM contaminated by external GPU allocations	NGPU=8 LOG_RANK=0 MODULE=qwen3 CONFIG=qwen3_14b ./run_train.sh --training.steps=10 --compile.enable --training.dtype=bfloat16 --training.seq_len=2048 --training.local_batch_size=10 --comm.trace_buf_size=0 --dump_folder=outputs/autoresearch/may19-qwen3-14b/run79-retry-flex-prefetch-seq2048-lbs10-compile-bf16-no-flight-recorder > run.log 2>&1
e102690	9198	36.37	169.0	keep	seq2048 local batch 10 constant-token shape after stable clear	NGPU=8 LOG_RANK=0 MODULE=qwen3 CONFIG=qwen3_14b ./run_train.sh --training.steps=10 --compile.enable --training.dtype=bfloat16 --training.seq_len=2048 --training.local_batch_size=10 --comm.trace_buf_size=0 --dump_folder=outputs/autoresearch/may19-qwen3-14b/run80-retry2-flex-prefetch-seq2048-lbs10-compile-bf16-no-flight-recorder > run.log 2>&1
218caa7	9394	36.10	169.0	keep	seq1024 local batch 20 constant-token shape	NGPU=8 LOG_RANK=0 MODULE=qwen3 CONFIG=qwen3_14b ./run_train.sh --training.steps=10 --compile.enable --training.dtype=bfloat16 --training.seq_len=1024 --training.local_batch_size=20 --comm.trace_buf_size=0 --dump_folder=outputs/autoresearch/may19-qwen3-14b/run81-flex-prefetch-seq1024-lbs20-compile-bf16-no-flight-recorder > run.log 2>&1
584fd1c	9579	36.27	169.0	keep	seq512 local batch 40 constant-token shape	NGPU=8 LOG_RANK=0 MODULE=qwen3 CONFIG=qwen3_14b ./run_train.sh --training.steps=10 --compile.enable --training.dtype=bfloat16 --training.seq_len=512 --training.local_batch_size=40 --comm.trace_buf_size=0 --dump_folder=outputs/autoresearch/may19-qwen3-14b/run82-flex-prefetch-seq512-lbs40-compile-bf16-no-flight-recorder > run.log 2>&1
b980f65	9599	36.08	169.0	keep	seq256 local batch 80 constant-token shape	NGPU=8 LOG_RANK=0 MODULE=qwen3 CONFIG=qwen3_14b ./run_train.sh --training.steps=10 --compile.enable --training.dtype=bfloat16 --training.seq_len=256 --training.local_batch_size=80 --comm.trace_buf_size=0 --dump_folder=outputs/autoresearch/may19-qwen3-14b/run83-flex-prefetch-seq256-lbs80-compile-bf16-no-flight-recorder > run.log 2>&1
03d00df	9709	36.36	169.0	keep	seq128 local batch 160 constant-token shape	NGPU=8 LOG_RANK=0 MODULE=qwen3 CONFIG=qwen3_14b ./run_train.sh --training.steps=10 --compile.enable --training.dtype=bfloat16 --training.seq_len=128 --training.local_batch_size=160 --comm.trace_buf_size=0 --dump_folder=outputs/autoresearch/may19-qwen3-14b/run84-flex-prefetch-seq128-lbs160-compile-bf16-no-flight-recorder > run.log 2>&1
4a37041	0	0.00	0.0	invalid	seq64 local batch 320 contaminated by external VLLM workers	NGPU=8 LOG_RANK=0 MODULE=qwen3 CONFIG=qwen3_14b ./run_train.sh --training.steps=10 --compile.enable --training.dtype=bfloat16 --training.seq_len=64 --training.local_batch_size=320 --comm.trace_buf_size=0 --dump_folder=outputs/autoresearch/may19-qwen3-14b/run85-flex-prefetch-seq64-lbs320-compile-bf16-no-flight-recorder > run.log 2>&1
0970dd8	9265	34.63	169.0	discard	seq64 local batch 320 below seq128 best	NGPU=8 LOG_RANK=0 MODULE=qwen3 CONFIG=qwen3_14b ./run_train.sh --training.steps=10 --compile.enable --training.dtype=bfloat16 --training.seq_len=64 --training.local_batch_size=320 --comm.trace_buf_size=0 --dump_folder=outputs/autoresearch/may19-qwen3-14b/run86-retry-flex-prefetch-seq64-lbs320-compile-bf16-no-flight-recorder > run.log 2>&1
f49a323	3741	14.01	173.3	discard	seq128 local batch 168 allocator pressure	NGPU=8 LOG_RANK=0 MODULE=qwen3 CONFIG=qwen3_14b ./run_train.sh --training.steps=10 --compile.enable --training.dtype=bfloat16 --training.seq_len=128 --training.local_batch_size=168 --comm.trace_buf_size=0 --dump_folder=outputs/autoresearch/may19-qwen3-14b/run87-flex-prefetch-seq128-lbs168-compile-bf16-no-flight-recorder > run.log 2>&1
b80d8fb	9588	35.91	172.5	discard	seq128 local batch 164 above memory-risk line and below batch160 best	NGPU=8 LOG_RANK=0 MODULE=qwen3 CONFIG=qwen3_14b ./run_train.sh --training.steps=10 --compile.enable --training.dtype=bfloat16 --training.seq_len=128 --training.local_batch_size=164 --comm.trace_buf_size=0 --dump_folder=outputs/autoresearch/may19-qwen3-14b/run88-flex-prefetch-seq128-lbs164-compile-bf16-no-flight-recorder > run.log 2>&1
f0822c10	9676	36.23	168.1	keep	seq128 local batch 160 exact rerun validates best shape	NGPU=8 LOG_RANK=0 MODULE=qwen3 CONFIG=qwen3_14b ./run_train.sh --training.steps=10 --compile.enable --training.dtype=bfloat16 --training.seq_len=128 --training.local_batch_size=160 --comm.trace_buf_size=0 --dump_folder=outputs/autoresearch/may19-qwen3-14b/run89-rerun-flex-prefetch-seq128-lbs160-compile-bf16-no-flight-recorder > run.log 2>&1
3986055	9527	35.64	168.7	discard	seq96 local batch 213 below seq128 best	NGPU=8 LOG_RANK=0 MODULE=qwen3 CONFIG=qwen3_14b ./run_train.sh --training.steps=10 --compile.enable --training.dtype=bfloat16 --training.seq_len=96 --training.local_batch_size=213 --comm.trace_buf_size=0 --dump_folder=outputs/autoresearch/may19-qwen3-14b/run90-flex-prefetch-seq96-lbs213-compile-bf16-no-flight-recorder > run.log 2>&1
6805e3c	9383	35.17	169.0	discard	seq160 local batch 128 below seq128 best	NGPU=8 LOG_RANK=0 MODULE=qwen3 CONFIG=qwen3_14b ./run_train.sh --training.steps=10 --compile.enable --training.dtype=bfloat16 --training.seq_len=160 --training.local_batch_size=128 --comm.trace_buf_size=0 --dump_folder=outputs/autoresearch/may19-qwen3-14b/run91-flex-prefetch-seq160-lbs128-compile-bf16-no-flight-recorder > run.log 2>&1
c232773	9707	36.35	170.7	discard	seq128 local batch 162 just below best and above memory-risk line	NGPU=8 LOG_RANK=0 MODULE=qwen3 CONFIG=qwen3_14b ./run_train.sh --training.steps=10 --compile.enable --training.dtype=bfloat16 --training.seq_len=128 --training.local_batch_size=162 --comm.trace_buf_size=0 --dump_folder=outputs/autoresearch/may19-qwen3-14b/run92-flex-prefetch-seq128-lbs162-compile-bf16-no-flight-recorder > run.log 2>&1
63b76a9	9685	36.27	169.9	discard	seq128 local batch 161 above memory-risk line and below batch160 best	NGPU=8 LOG_RANK=0 MODULE=qwen3 CONFIG=qwen3_14b ./run_train.sh --training.steps=10 --compile.enable --training.dtype=bfloat16 --training.seq_len=128 --training.local_batch_size=161 --comm.trace_buf_size=0 --dump_folder=outputs/autoresearch/may19-qwen3-14b/run93-flex-prefetch-seq128-lbs161-compile-bf16-no-flight-recorder > run.log 2>&1
d9c1bc6	9285	34.77	167.8	discard	separate tok_embeddings FSDP wrap reduces memory but slows seq128 batch160	NGPU=8 LOG_RANK=0 MODULE=qwen3 CONFIG=qwen3_14b ./run_train.sh --training.steps=10 --compile.enable --training.dtype=bfloat16 --training.seq_len=128 --training.local_batch_size=160 --comm.trace_buf_size=0 --dump_folder=outputs/autoresearch/may19-qwen3-14b/run94-flex-prefetch-separate-tok-embeddings-seq128-lbs160-compile-bf16-no-flight-recorder > run.log 2>&1
81c7ebc	9625	36.04	167.8	discard	separate tok_embeddings endpoint prefetch fails loss sanity	NGPU=8 LOG_RANK=0 MODULE=qwen3 CONFIG=qwen3_14b ./run_train.sh --training.steps=10 --compile.enable --training.dtype=bfloat16 --training.seq_len=128 --training.local_batch_size=160 --comm.trace_buf_size=0 --dump_folder=outputs/autoresearch/may19-qwen3-14b/run95-flex-prefetch-separate-tok-embeddings-endpoint-seq128-lbs160-compile-bf16-no-flight-recorder > run.log 2>&1
af857e4	8533	31.96	168.1	discard	profile seq128 local batch 160 best diagnostic	NGPU=8 LOG_RANK=0 MODULE=qwen3 CONFIG=qwen3_14b ./run_train.sh --training.steps=10 --compile.enable --training.dtype=bfloat16 --training.seq_len=128 --training.local_batch_size=160 --comm.trace_buf_size=0 --dump_folder=outputs/autoresearch/may19-qwen3-14b/run96-profile-flex-prefetch-seq128-lbs160-compile-bf16-no-flight-recorder --profiler.enable_profiling --profiler.profile_freq=10 --profiler.profiler_warmup=2 --profiler.profiler_active=1 > run.log 2>&1
a364689	9164	34.32	168.1	discard	forward-only FSDP prefetch at seq128 regresses	NGPU=8 LOG_RANK=0 MODULE=qwen3 CONFIG=qwen3_14b ./run_train.sh --training.steps=10 --compile.enable --training.dtype=bfloat16 --training.seq_len=128 --training.local_batch_size=160 --comm.trace_buf_size=0 --dump_folder=outputs/autoresearch/may19-qwen3-14b/run97-flex-forward-only-prefetch-seq128-lbs160-compile-bf16-no-flight-recorder > run.log 2>&1
b7f0143	3629	13.59	173.2	discard	seq128 local batch 144 no-reshard allocator pressure	NGPU=8 LOG_RANK=0 MODULE=qwen3 CONFIG=qwen3_14b ./run_train.sh --training.steps=10 --compile.enable --training.dtype=bfloat16 --training.seq_len=128 --training.local_batch_size=144 --comm.trace_buf_size=0 --parallelism.fsdp_reshard_after_forward=never --dump_folder=outputs/autoresearch/may19-qwen3-14b/run98-flex-prefetch-seq128-lbs144-no-reshard-compile-bf16-no-flight-recorder > run.log 2>&1
846907b	10005	37.47	168.6	keep	SDPA attention seq128 local batch 160 new best	NGPU=8 LOG_RANK=0 MODULE=qwen3 CONFIG=qwen3_14b ./run_train.sh --training.steps=10 --compile.enable --training.dtype=bfloat16 --training.seq_len=128 --training.local_batch_size=160 --comm.trace_buf_size=0 --dump_folder=outputs/autoresearch/may19-qwen3-14b/run99-sdpa-prefetch-seq128-lbs160-compile-bf16-no-flight-recorder > run.log 2>&1
9c7e6fc	9982	37.38	168.6	keep	exact SDPA seq128 local batch 160 rerun validates best	NGPU=8 LOG_RANK=0 MODULE=qwen3 CONFIG=qwen3_14b ./run_train.sh --training.steps=10 --compile.enable --training.dtype=bfloat16 --training.seq_len=128 --training.local_batch_size=160 --comm.trace_buf_size=0 --dump_folder=outputs/autoresearch/may19-qwen3-14b/run100-rerun-sdpa-prefetch-seq128-lbs160-compile-bf16-no-flight-recorder > run.log 2>&1
3337de3	9646	36.12	169.2	discard	SDPA seq128 local batch 161 below batch160 best	NGPU=8 LOG_RANK=0 MODULE=qwen3 CONFIG=qwen3_14b ./run_train.sh --training.steps=10 --compile.enable --training.dtype=bfloat16 --training.seq_len=128 --training.local_batch_size=161 --comm.trace_buf_size=0 --dump_folder=outputs/autoresearch/may19-qwen3-14b/run101-sdpa-prefetch-seq128-lbs161-compile-bf16-no-flight-recorder > run.log 2>&1
aed3b50	9236	34.58	168.6	discard	profile SDPA seq128 local batch 160 best diagnostic	NGPU=8 LOG_RANK=0 MODULE=qwen3 CONFIG=qwen3_14b ./run_train.sh --training.steps=10 --compile.enable --training.dtype=bfloat16 --training.seq_len=128 --training.local_batch_size=160 --comm.trace_buf_size=0 --dump_folder=outputs/autoresearch/may19-qwen3-14b/run102-profile-sdpa-prefetch-seq128-lbs160-compile-bf16-no-flight-recorder --profiler.enable_profiling --profiler.profile_freq=10 --profiler.profiler_warmup=2 --profiler.profiler_active=1 > run.log 2>&1
04c966d	9995	37.43	168.6	discard	SDPA FP8 rowwise auto-filter just below plain SDPA best	NGPU=8 LOG_RANK=0 MODULE=qwen3 CONFIG=qwen3_14b ./run_train.sh --training.steps=10 --compile.enable --training.dtype=bfloat16 --training.seq_len=128 --training.local_batch_size=160 --comm.trace_buf_size=0 --dump_folder=outputs/autoresearch/may19-qwen3-14b/run103-sdpa-fp8-rowwise-prefetch-seq128-lbs160-compile-bf16-no-flight-recorder > run.log 2>&1
61c48ce	9547	0.00	129.0	discard	SDPA FP8 rowwise broad coverage slower at batch160 but large memory headroom	NGPU=8 LOG_RANK=0 MODULE=qwen3 CONFIG=qwen3_14b ./run_train.sh --training.steps=10 --compile.enable --training.dtype=bfloat16 --training.seq_len=128 --training.local_batch_size=160 --comm.trace_buf_size=0 --dump_folder=outputs/autoresearch/may19-qwen3-14b/run104-sdpa-fp8-rowwise-no-filter-prefetch-seq128-lbs160-compile-bf16-no-flight-recorder > run.log 2>&1
88ac4aa	0	0.00	172.6	crash	broad FP8 SDPA seq128 local batch 240 memory-pressure crash	NGPU=8 LOG_RANK=0 MODULE=qwen3 CONFIG=qwen3_14b ./run_train.sh --training.steps=10 --compile.enable --training.dtype=bfloat16 --training.seq_len=128 --training.local_batch_size=240 --comm.trace_buf_size=0 --dump_folder=outputs/autoresearch/may19-qwen3-14b/run105-sdpa-fp8-rowwise-no-filter-prefetch-seq128-lbs240-compile-bf16-no-flight-recorder > run.log 2>&1
ed3051d	9888	0.00	154.9	discard	broad FP8 SDPA seq128 local batch 200 below plain SDPA best	NGPU=8 LOG_RANK=0 MODULE=qwen3 CONFIG=qwen3_14b ./run_train.sh --training.steps=10 --compile.enable --training.dtype=bfloat16 --training.seq_len=128 --training.local_batch_size=200 --comm.trace_buf_size=0 --dump_folder=outputs/autoresearch/may19-qwen3-14b/run106-sdpa-fp8-rowwise-no-filter-prefetch-seq128-lbs200-compile-bf16-no-flight-recorder > run.log 2>&1
