commit	tokens_per_sec	mfu_percent	peak_memory_gb	status	description	command
839898f	10571	39.59	169.1	keep	exact current-best rerun after NCCL registration probes is strong but below peak	NCCL_CTA_POLICY=2 NGPU=8 LOG_RANK=0 MODULE=qwen3 CONFIG=qwen3_14b ./run_train.sh --training.steps=10 --compile.enable --training.dtype=bfloat16 --training.seq_len=128 --training.local_batch_size=160 --loss.num_chunks=6 --dataloader.num_workers=2 --dataloader.persistent_workers --dataloader.prefetch_factor=2 --metrics.log_freq=1 --comm.trace_buf_size=0 --dump_folder=outputs/autoresearch/may19-qwen3-14b/run284-rerun-after-nccl-registration-probes-sdpa-prefetch-seq128-lbs160-compile-bf16-nccl-zero-cta-loss-chunks6-dataloader-worker2-prefetch2-metrics-logfreq1-no-flight-recorder > run.log 2>&1
10a3561	0	0.00	8.2	crash	NCCL_P2P_USE_CUDA_MEMCPY=1 times out in first FSDP all-gather before step 1	NCCL_P2P_USE_CUDA_MEMCPY=1 NCCL_CTA_POLICY=2 NGPU=8 LOG_RANK=0 MODULE=qwen3 CONFIG=qwen3_14b ./run_train.sh --training.steps=10 --compile.enable --training.dtype=bfloat16 --training.seq_len=128 --training.local_batch_size=160 --loss.num_chunks=6 --dataloader.num_workers=2 --dataloader.persistent_workers --dataloader.prefetch_factor=2 --metrics.log_freq=1 --comm.trace_buf_size=0 --dump_folder=outputs/autoresearch/may19-qwen3-14b/run285-nccl-p2p-cuda-memcpy-sdpa-prefetch-seq128-lbs160-compile-bf16-nccl-zero-cta-loss-chunks6-dataloader-worker2-prefetch2-metrics-logfreq1-no-flight-recorder > run.log 2>&1
c0080c4	10586	39.64	169.1	keep	exact current-best rerun after invalid P2P memcpy recovers cleanly but remains below peak	NCCL_CTA_POLICY=2 NGPU=8 LOG_RANK=0 MODULE=qwen3 CONFIG=qwen3_14b ./run_train.sh --training.steps=10 --compile.enable --training.dtype=bfloat16 --training.seq_len=128 --training.local_batch_size=160 --loss.num_chunks=6 --dataloader.num_workers=2 --dataloader.persistent_workers --dataloader.prefetch_factor=2 --metrics.log_freq=1 --comm.trace_buf_size=0 --dump_folder=outputs/autoresearch/may19-qwen3-14b/run286-rerun-after-invalid-p2p-memcpy-sdpa-prefetch-seq128-lbs160-compile-bf16-nccl-zero-cta-loss-chunks6-dataloader-worker2-prefetch2-metrics-logfreq1-no-flight-recorder > run.log 2>&1
458dcc6	10493	39.29	169.1	discard	NCCL_LEGACY_CUDA_REGISTER=1 is below measured peak; default registration path remains best	NCCL_LEGACY_CUDA_REGISTER=1 NCCL_CTA_POLICY=2 NGPU=8 LOG_RANK=0 MODULE=qwen3 CONFIG=qwen3_14b ./run_train.sh --training.steps=10 --compile.enable --training.dtype=bfloat16 --training.seq_len=128 --training.local_batch_size=160 --loss.num_chunks=6 --dataloader.num_workers=2 --dataloader.persistent_workers --dataloader.prefetch_factor=2 --metrics.log_freq=1 --comm.trace_buf_size=0 --dump_folder=outputs/autoresearch/may19-qwen3-14b/run287-nccl-legacy-cuda-register-sdpa-prefetch-seq128-lbs160-compile-bf16-nccl-zero-cta-loss-chunks6-dataloader-worker2-prefetch2-metrics-logfreq1-no-flight-recorder > run.log 2>&1
270d4a8	10508	39.35	169.1	discard	NCCL_SINGLE_PROC_MEM_REG_ENABLE=1 is below measured peak; default registration behavior remains best	NCCL_SINGLE_PROC_MEM_REG_ENABLE=1 NCCL_CTA_POLICY=2 NGPU=8 LOG_RANK=0 MODULE=qwen3 CONFIG=qwen3_14b ./run_train.sh --training.steps=10 --compile.enable --training.dtype=bfloat16 --training.seq_len=128 --training.local_batch_size=160 --loss.num_chunks=6 --dataloader.num_workers=2 --dataloader.persistent_workers --dataloader.prefetch_factor=2 --metrics.log_freq=1 --comm.trace_buf_size=0 --dump_folder=outputs/autoresearch/may19-qwen3-14b/run288-nccl-single-proc-mem-reg-enable-sdpa-prefetch-seq128-lbs160-compile-bf16-nccl-zero-cta-loss-chunks6-dataloader-worker2-prefetch2-metrics-logfreq1-no-flight-recorder > run.log 2>&1
15db2e9	10394	38.92	169.1	profile	profiled exact current best shows busy GPUs with substantial NCCL RING_LL reduce-scatter and all-gather time	NCCL_CTA_POLICY=2 NGPU=8 LOG_RANK=0 MODULE=qwen3 CONFIG=qwen3_14b ./run_train.sh --training.steps=10 --compile.enable --training.dtype=bfloat16 --training.seq_len=128 --training.local_batch_size=160 --loss.num_chunks=6 --dataloader.num_workers=2 --dataloader.persistent_workers --dataloader.prefetch_factor=2 --metrics.log_freq=1 --comm.trace_buf_size=0 --profiler.enable_profiling --profiler.profile_freq=10 --profiler.profiler_warmup=2 --profiler.profiler_active=1 --dump_folder=outputs/autoresearch/may19-qwen3-14b/run289-profile-current-best-sdpa-prefetch-seq128-lbs160-compile-bf16-nccl-zero-cta-loss-chunks6-dataloader-worker2-prefetch2-metrics-logfreq1-no-flight-recorder > run.log 2>&1
b420f98	10446	39.12	169.1	discard	NCCL_LL_BUFFSIZE=1048576 is below measured peak; default LL buffer size remains best	NCCL_LL_BUFFSIZE=1048576 NCCL_CTA_POLICY=2 NGPU=8 LOG_RANK=0 MODULE=qwen3 CONFIG=qwen3_14b ./run_train.sh --training.steps=10 --compile.enable --training.dtype=bfloat16 --training.seq_len=128 --training.local_batch_size=160 --loss.num_chunks=6 --dataloader.num_workers=2 --dataloader.persistent_workers --dataloader.prefetch_factor=2 --metrics.log_freq=1 --comm.trace_buf_size=0 --dump_folder=outputs/autoresearch/may19-qwen3-14b/run290-nccl-ll-buffsize1m-sdpa-prefetch-seq128-lbs160-compile-bf16-nccl-zero-cta-loss-chunks6-dataloader-worker2-prefetch2-metrics-logfreq1-no-flight-recorder > run.log 2>&1
bf9809b	10583	39.63	169.1	discard	NCCL_LL_BUFFSIZE=4194304 samples high but remains below measured peak; default LL buffer size remains best	NCCL_LL_BUFFSIZE=4194304 NCCL_CTA_POLICY=2 NGPU=8 LOG_RANK=0 MODULE=qwen3 CONFIG=qwen3_14b ./run_train.sh --training.steps=10 --compile.enable --training.dtype=bfloat16 --training.seq_len=128 --training.local_batch_size=160 --loss.num_chunks=6 --dataloader.num_workers=2 --dataloader.persistent_workers --dataloader.prefetch_factor=2 --metrics.log_freq=1 --comm.trace_buf_size=0 --dump_folder=outputs/autoresearch/may19-qwen3-14b/run291-nccl-ll-buffsize4m-sdpa-prefetch-seq128-lbs160-compile-bf16-nccl-zero-cta-loss-chunks6-dataloader-worker2-prefetch2-metrics-logfreq1-no-flight-recorder > run.log 2>&1
d03ed97	10492	39.29	167.57	discard	last two transformer layers with reshard_after_forward disabled reduce memory but remain below measured peak	NCCL_CTA_POLICY=2 NGPU=8 LOG_RANK=0 MODULE=qwen3 CONFIG=qwen3_14b ./run_train.sh --training.steps=10 --compile.enable --training.dtype=bfloat16 --training.seq_len=128 --training.local_batch_size=160 --loss.num_chunks=6 --dataloader.num_workers=2 --dataloader.persistent_workers --dataloader.prefetch_factor=2 --metrics.log_freq=1 --comm.trace_buf_size=0 --dump_folder=outputs/autoresearch/may19-qwen3-14b/run292-last-two-layers-no-reshard-sdpa-prefetch-seq128-lbs160-compile-bf16-nccl-zero-cta-loss-chunks6-dataloader-worker2-prefetch2-metrics-logfreq1-no-flight-recorder > run.log 2>&1
896b3ef	10557	39.53	172.71	discard	last two no-reshard layers with local_batch_size=162 are below peak and above preferred memory envelope	NCCL_CTA_POLICY=2 NGPU=8 LOG_RANK=0 MODULE=qwen3 CONFIG=qwen3_14b ./run_train.sh --training.steps=10 --compile.enable --training.dtype=bfloat16 --training.seq_len=128 --training.local_batch_size=162 --loss.num_chunks=6 --dataloader.num_workers=2 --dataloader.persistent_workers --dataloader.prefetch_factor=2 --metrics.log_freq=1 --comm.trace_buf_size=0 --dump_folder=outputs/autoresearch/may19-qwen3-14b/run293-last-two-layers-no-reshard-lbs162-sdpa-prefetch-seq128-compile-bf16-nccl-zero-cta-loss-chunks6-dataloader-worker2-prefetch2-metrics-logfreq1-no-flight-recorder > run.log 2>&1
cf4644a	10568	39.58	169.1	keep	exact current-best rerun after suffix no-reshard probes is healthy but below peak	NCCL_CTA_POLICY=2 NGPU=8 LOG_RANK=0 MODULE=qwen3 CONFIG=qwen3_14b ./run_train.sh --training.steps=10 --compile.enable --training.dtype=bfloat16 --training.seq_len=128 --training.local_batch_size=160 --loss.num_chunks=6 --dataloader.num_workers=2 --dataloader.persistent_workers --dataloader.prefetch_factor=2 --metrics.log_freq=1 --comm.trace_buf_size=0 --dump_folder=outputs/autoresearch/may19-qwen3-14b/run294-rerun-after-suffix-no-reshard-probes-sdpa-prefetch-seq128-lbs160-compile-bf16-nccl-zero-cta-loss-chunks6-dataloader-worker2-prefetch2-metrics-logfreq1-no-flight-recorder > run.log 2>&1
4403dd9	10476	39.23	169.1	discard	NCCL_MEM_SYNC_DOMAIN=0 is below measured peak; default NCCL memory sync domain remains best	NCCL_MEM_SYNC_DOMAIN=0 NCCL_CTA_POLICY=2 NGPU=8 LOG_RANK=0 MODULE=qwen3 CONFIG=qwen3_14b ./run_train.sh --training.steps=10 --compile.enable --training.dtype=bfloat16 --training.seq_len=128 --training.local_batch_size=160 --loss.num_chunks=6 --dataloader.num_workers=2 --dataloader.persistent_workers --dataloader.prefetch_factor=2 --metrics.log_freq=1 --comm.trace_buf_size=0 --dump_folder=outputs/autoresearch/may19-qwen3-14b/run295-nccl-mem-sync-domain0-sdpa-prefetch-seq128-lbs160-compile-bf16-nccl-zero-cta-loss-chunks6-dataloader-worker2-prefetch2-metrics-logfreq1-no-flight-recorder > run.log 2>&1
f2e49dd	10454	39.15	169.1	discard	TORCH_NCCL_CUDA_EVENT_CACHE=0 plus NCCL_LL_BUFFSIZE=4194304 is below measured peak and has no useful synergy	TORCH_NCCL_CUDA_EVENT_CACHE=0 NCCL_LL_BUFFSIZE=4194304 NCCL_CTA_POLICY=2 NGPU=8 LOG_RANK=0 MODULE=qwen3 CONFIG=qwen3_14b ./run_train.sh --training.steps=10 --compile.enable --training.dtype=bfloat16 --training.seq_len=128 --training.local_batch_size=160 --loss.num_chunks=6 --dataloader.num_workers=2 --dataloader.persistent_workers --dataloader.prefetch_factor=2 --metrics.log_freq=1 --comm.trace_buf_size=0 --dump_folder=outputs/autoresearch/may19-qwen3-14b/run296-torch-nccl-event-cache0-nccl-ll-buffsize4m-sdpa-prefetch-seq128-lbs160-compile-bf16-nccl-zero-cta-loss-chunks6-dataloader-worker2-prefetch2-metrics-logfreq1-no-flight-recorder > run.log 2>&1
41bbc80	10493	39.29	169.1	discard	NCCL_P2P_SCHEDULE_GROUP_SIZE=1 is below measured peak; default P2P scheduling remains best	NCCL_P2P_SCHEDULE_GROUP_SIZE=1 NCCL_CTA_POLICY=2 NGPU=8 LOG_RANK=0 MODULE=qwen3 CONFIG=qwen3_14b ./run_train.sh --training.steps=10 --compile.enable --training.dtype=bfloat16 --training.seq_len=128 --training.local_batch_size=160 --loss.num_chunks=6 --dataloader.num_workers=2 --dataloader.persistent_workers --dataloader.prefetch_factor=2 --metrics.log_freq=1 --comm.trace_buf_size=0 --dump_folder=outputs/autoresearch/may19-qwen3-14b/run297-nccl-p2p-schedule-group-size1-sdpa-prefetch-seq128-lbs160-compile-bf16-nccl-zero-cta-loss-chunks6-dataloader-worker2-prefetch2-metrics-logfreq1-no-flight-recorder > run.log 2>&1
710556f	10450	39.13	169.1	discard	NCCL_P2P_SCHEDULE_GROUP_SIZE=8 is below measured peak; default P2P scheduling remains best	NCCL_P2P_SCHEDULE_GROUP_SIZE=8 NCCL_CTA_POLICY=2 NGPU=8 LOG_RANK=0 MODULE=qwen3 CONFIG=qwen3_14b ./run_train.sh --training.steps=10 --compile.enable --training.dtype=bfloat16 --training.seq_len=128 --training.local_batch_size=160 --loss.num_chunks=6 --dataloader.num_workers=2 --dataloader.persistent_workers --dataloader.prefetch_factor=2 --metrics.log_freq=1 --comm.trace_buf_size=0 --dump_folder=outputs/autoresearch/may19-qwen3-14b/run298-nccl-p2p-schedule-group-size8-sdpa-prefetch-seq128-lbs160-compile-bf16-nccl-zero-cta-loss-chunks6-dataloader-worker2-prefetch2-metrics-logfreq1-no-flight-recorder > run.log 2>&1
7e219ab	10424	39.03	169.1	discard	NCCL_L1_SHARED_MEMORY_CARVEOUT=100 is below measured peak; default NCCL kernel resource preference remains best	NCCL_L1_SHARED_MEMORY_CARVEOUT=100 NCCL_CTA_POLICY=2 NGPU=8 LOG_RANK=0 MODULE=qwen3 CONFIG=qwen3_14b ./run_train.sh --training.steps=10 --compile.enable --training.dtype=bfloat16 --training.seq_len=128 --training.local_batch_size=160 --loss.num_chunks=6 --dataloader.num_workers=2 --dataloader.persistent_workers --dataloader.prefetch_factor=2 --metrics.log_freq=1 --comm.trace_buf_size=0 --dump_folder=outputs/autoresearch/may19-qwen3-14b/run299-nccl-l1-shared-memory-carveout100-sdpa-prefetch-seq128-lbs160-compile-bf16-nccl-zero-cta-loss-chunks6-dataloader-worker2-prefetch2-metrics-logfreq1-no-flight-recorder > run.log 2>&1
a785be7	10576	39.60	169.1	discard	NCCL_PROGRESS_APPENDOP_FREQ=16 is below measured peak; default proxy append-op polling remains best	NCCL_PROGRESS_APPENDOP_FREQ=16 NCCL_CTA_POLICY=2 NGPU=8 LOG_RANK=0 MODULE=qwen3 CONFIG=qwen3_14b ./run_train.sh --training.steps=10 --compile.enable --training.dtype=bfloat16 --training.seq_len=128 --training.local_batch_size=160 --loss.num_chunks=6 --dataloader.num_workers=2 --dataloader.persistent_workers --dataloader.prefetch_factor=2 --metrics.log_freq=1 --comm.trace_buf_size=0 --dump_folder=outputs/autoresearch/may19-qwen3-14b/run300-nccl-progress-appendop-freq16-sdpa-prefetch-seq128-lbs160-compile-bf16-nccl-zero-cta-loss-chunks6-dataloader-worker2-prefetch2-metrics-logfreq1-no-flight-recorder > run.log 2>&1
fc4db2a	10524	39.41	169.1	discard	NCCL_PROGRESS_APPENDOP_FREQ=4 is below measured peak; default proxy append-op polling remains best	NCCL_PROGRESS_APPENDOP_FREQ=4 NCCL_CTA_POLICY=2 NGPU=8 LOG_RANK=0 MODULE=qwen3 CONFIG=qwen3_14b ./run_train.sh --training.steps=10 --compile.enable --training.dtype=bfloat16 --training.seq_len=128 --training.local_batch_size=160 --loss.num_chunks=6 --dataloader.num_workers=2 --dataloader.persistent_workers --dataloader.prefetch_factor=2 --metrics.log_freq=1 --comm.trace_buf_size=0 --dump_folder=outputs/autoresearch/may19-qwen3-14b/run301-nccl-progress-appendop-freq4-sdpa-prefetch-seq128-lbs160-compile-bf16-nccl-zero-cta-loss-chunks6-dataloader-worker2-prefetch2-metrics-logfreq1-no-flight-recorder > run.log 2>&1
5cd4fa2	10600	39.70	169.1	keep	exact current-best rerun after NCCL scheduler/resource probes is strong but below run242 peak	NCCL_CTA_POLICY=2 NGPU=8 LOG_RANK=0 MODULE=qwen3 CONFIG=qwen3_14b ./run_train.sh --training.steps=10 --compile.enable --training.dtype=bfloat16 --training.seq_len=128 --training.local_batch_size=160 --loss.num_chunks=6 --dataloader.num_workers=2 --dataloader.persistent_workers --dataloader.prefetch_factor=2 --metrics.log_freq=1 --comm.trace_buf_size=0 --dump_folder=outputs/autoresearch/may19-qwen3-14b/run302-rerun-after-nccl-scheduler-probes-sdpa-prefetch-seq128-lbs160-compile-bf16-nccl-zero-cta-loss-chunks6-dataloader-worker2-prefetch2-metrics-logfreq1-no-flight-recorder > run.log 2>&1
f7bc808	10460	39.17	169.1	discard	NCCL_P2P_LL_THRESHOLD=0 is below measured peak; default P2P LL threshold remains best	NCCL_P2P_LL_THRESHOLD=0 NCCL_CTA_POLICY=2 NGPU=8 LOG_RANK=0 MODULE=qwen3 CONFIG=qwen3_14b ./run_train.sh --training.steps=10 --compile.enable --training.dtype=bfloat16 --training.seq_len=128 --training.local_batch_size=160 --loss.num_chunks=6 --dataloader.num_workers=2 --dataloader.persistent_workers --dataloader.prefetch_factor=2 --metrics.log_freq=1 --comm.trace_buf_size=0 --dump_folder=outputs/autoresearch/may19-qwen3-14b/run303-nccl-p2p-ll-threshold0-sdpa-prefetch-seq128-lbs160-compile-bf16-nccl-zero-cta-loss-chunks6-dataloader-worker2-prefetch2-metrics-logfreq1-no-flight-recorder > run.log 2>&1
c36aa62	10458	39.16	169.1	discard	NCCL_P2P_LL_THRESHOLD=65536 is below measured peak; default P2P LL threshold remains best	NCCL_P2P_LL_THRESHOLD=65536 NCCL_CTA_POLICY=2 NGPU=8 LOG_RANK=0 MODULE=qwen3 CONFIG=qwen3_14b ./run_train.sh --training.steps=10 --compile.enable --training.dtype=bfloat16 --training.seq_len=128 --training.local_batch_size=160 --loss.num_chunks=6 --dataloader.num_workers=2 --dataloader.persistent_workers --dataloader.prefetch_factor=2 --metrics.log_freq=1 --comm.trace_buf_size=0 --dump_folder=outputs/autoresearch/may19-qwen3-14b/run304-nccl-p2p-ll-threshold65536-sdpa-prefetch-seq128-lbs160-compile-bf16-nccl-zero-cta-loss-chunks6-dataloader-worker2-prefetch2-metrics-logfreq1-no-flight-recorder > run.log 2>&1
806ca70	10500	39.32	169.06	discard	separate root endpoint FSDP wraps reduce memory slightly but remain below measured peak	NCCL_CTA_POLICY=2 NGPU=8 LOG_RANK=0 MODULE=qwen3 CONFIG=qwen3_14b ./run_train.sh --training.steps=10 --compile.enable --training.dtype=bfloat16 --training.seq_len=128 --training.local_batch_size=160 --loss.num_chunks=6 --dataloader.num_workers=2 --dataloader.persistent_workers --dataloader.prefetch_factor=2 --metrics.log_freq=1 --comm.trace_buf_size=0 --dump_folder=outputs/autoresearch/may19-qwen3-14b/run305-root-endpoint-fsdp-prefetch-sdpa-prefetch-seq128-lbs160-compile-bf16-nccl-zero-cta-loss-chunks6-dataloader-worker2-prefetch2-metrics-logfreq1-no-flight-recorder > run.log 2>&1
318b921	10487	39.27	169.1	keep	exact current-best rerun after root endpoint source restore is healthy but below peak	NCCL_CTA_POLICY=2 NGPU=8 LOG_RANK=0 MODULE=qwen3 CONFIG=qwen3_14b ./run_train.sh --training.steps=10 --compile.enable --training.dtype=bfloat16 --training.seq_len=128 --training.local_batch_size=160 --loss.num_chunks=6 --dataloader.num_workers=2 --dataloader.persistent_workers --dataloader.prefetch_factor=2 --metrics.log_freq=1 --comm.trace_buf_size=0 --dump_folder=outputs/autoresearch/may19-qwen3-14b/run306-rerun-after-root-endpoint-restore-sdpa-prefetch-seq128-lbs160-compile-bf16-nccl-zero-cta-loss-chunks6-dataloader-worker2-prefetch2-metrics-logfreq1-no-flight-recorder > run.log 2>&1
85a2d4e	10512	39.36	169.1	discard	NCCL_NVLS_CHUNKSIZE=262144 is below measured peak; default NVLS chunk size remains best	NCCL_NVLS_CHUNKSIZE=262144 NCCL_CTA_POLICY=2 NGPU=8 LOG_RANK=0 MODULE=qwen3 CONFIG=qwen3_14b ./run_train.sh --training.steps=10 --compile.enable --training.dtype=bfloat16 --training.seq_len=128 --training.local_batch_size=160 --loss.num_chunks=6 --dataloader.num_workers=2 --dataloader.persistent_workers --dataloader.prefetch_factor=2 --metrics.log_freq=1 --comm.trace_buf_size=0 --dump_folder=outputs/autoresearch/may19-qwen3-14b/run307-nccl-nvls-chunksize256k-sdpa-prefetch-seq128-lbs160-compile-bf16-nccl-zero-cta-loss-chunks6-dataloader-worker2-prefetch2-metrics-logfreq1-no-flight-recorder > run.log 2>&1
30be510	10509	39.35	169.1	discard	NCCL_NVLS_CHUNKSIZE=65536 is below measured peak; default NVLS chunk size remains best	NCCL_NVLS_CHUNKSIZE=65536 NCCL_CTA_POLICY=2 NGPU=8 LOG_RANK=0 MODULE=qwen3 CONFIG=qwen3_14b ./run_train.sh --training.steps=10 --compile.enable --training.dtype=bfloat16 --training.seq_len=128 --training.local_batch_size=160 --loss.num_chunks=6 --dataloader.num_workers=2 --dataloader.persistent_workers --dataloader.prefetch_factor=2 --metrics.log_freq=1 --comm.trace_buf_size=0 --dump_folder=outputs/autoresearch/may19-qwen3-14b/run308-nccl-nvls-chunksize64k-sdpa-prefetch-seq128-lbs160-compile-bf16-nccl-zero-cta-loss-chunks6-dataloader-worker2-prefetch2-metrics-logfreq1-no-flight-recorder > run.log 2>&1
95b3f29	10546	39.49	169.1	discard	NCCL_NVLS_NCHANNELS=16 is below measured peak; default NVLS channel count remains best	NCCL_NVLS_NCHANNELS=16 NCCL_CTA_POLICY=2 NGPU=8 LOG_RANK=0 MODULE=qwen3 CONFIG=qwen3_14b ./run_train.sh --training.steps=10 --compile.enable --training.dtype=bfloat16 --training.seq_len=128 --training.local_batch_size=160 --loss.num_chunks=6 --dataloader.num_workers=2 --dataloader.persistent_workers --dataloader.prefetch_factor=2 --metrics.log_freq=1 --comm.trace_buf_size=0 --dump_folder=outputs/autoresearch/may19-qwen3-14b/run309-nccl-nvls-nchannels16-sdpa-prefetch-seq128-lbs160-compile-bf16-nccl-zero-cta-loss-chunks6-dataloader-worker2-prefetch2-metrics-logfreq1-no-flight-recorder > run.log 2>&1
19f9650	10449	39.13	169.1	discard	NCCL_NVLS_NCHANNELS=32 is below measured peak; default NVLS channel count remains best	NCCL_NVLS_NCHANNELS=32 NCCL_CTA_POLICY=2 NGPU=8 LOG_RANK=0 MODULE=qwen3 CONFIG=qwen3_14b ./run_train.sh --training.steps=10 --compile.enable --training.dtype=bfloat16 --training.seq_len=128 --training.local_batch_size=160 --loss.num_chunks=6 --dataloader.num_workers=2 --dataloader.persistent_workers --dataloader.prefetch_factor=2 --metrics.log_freq=1 --comm.trace_buf_size=0 --dump_folder=outputs/autoresearch/may19-qwen3-14b/run310-nccl-nvls-nchannels32-sdpa-prefetch-seq128-lbs160-compile-bf16-nccl-zero-cta-loss-chunks6-dataloader-worker2-prefetch2-metrics-logfreq1-no-flight-recorder > run.log 2>&1
5ebe5ba	10416	39.01	169.1	keep	exact current-best rerun after NVLS tuning closure samples low but remains healthy	NCCL_CTA_POLICY=2 NGPU=8 LOG_RANK=0 MODULE=qwen3 CONFIG=qwen3_14b ./run_train.sh --training.steps=10 --compile.enable --training.dtype=bfloat16 --training.seq_len=128 --training.local_batch_size=160 --loss.num_chunks=6 --dataloader.num_workers=2 --dataloader.persistent_workers --dataloader.prefetch_factor=2 --metrics.log_freq=1 --comm.trace_buf_size=0 --dump_folder=outputs/autoresearch/may19-qwen3-14b/run311-rerun-after-nvls-tuning-closure-sdpa-prefetch-seq128-lbs160-compile-bf16-nccl-zero-cta-loss-chunks6-dataloader-worker2-prefetch2-metrics-logfreq1-no-flight-recorder > run.log 2>&1
6c44a2e	10519	39.39	169.1	discard	NCCL_ALGO=NVLS,Ring is below measured peak; automatic NCCL algorithm selection remains best	NCCL_ALGO=NVLS,Ring NCCL_CTA_POLICY=2 NGPU=8 LOG_RANK=0 MODULE=qwen3 CONFIG=qwen3_14b ./run_train.sh --training.steps=10 --compile.enable --training.dtype=bfloat16 --training.seq_len=128 --training.local_batch_size=160 --loss.num_chunks=6 --dataloader.num_workers=2 --dataloader.persistent_workers --dataloader.prefetch_factor=2 --metrics.log_freq=1 --comm.trace_buf_size=0 --dump_folder=outputs/autoresearch/may19-qwen3-14b/run312-nccl-algo-nvls-ring-sdpa-prefetch-seq128-lbs160-compile-bf16-nccl-zero-cta-loss-chunks6-dataloader-worker2-prefetch2-metrics-logfreq1-no-flight-recorder > run.log 2>&1
