commit	tokens_per_sec	mfu_percent	peak_memory_gb	status	description	command
822b65f1+dirty	3132	0.00	173.88	discard	fused QKV without qkv_linear compile was stopped early after allocator retries and throughput collapse	NCCL_NVLS_ENABLE=1 NCCL_CTA_POLICY=2 NGPU=8 LOG_RANK=0 MODULE=qwen3 CONFIG=qwen3_14b ./run_train.sh --training.steps=10 --compile.enable --compile.components=loss,feed_forward --training.dtype=bfloat16 --training.seq_len=128 --training.local_batch_size=168 --loss.num_chunks=4 --optimizer.weight_decay=0.0 --dataloader.num_workers=2 --dataloader.persistent_workers --dataloader.prefetch_factor=2 --metrics.log_freq=1 --comm.trace_buf_size=0 --dump_folder=outputs/autoresearch/may19-qwen3-14b/run454-fused-qkv-no-qkv-compile > outputs/autoresearch/may19-qwen3-14b/run454-fused-qkv-no-qkv-compile.run.log 2>&1
2195625b+dirty	12110	0.00	163.87	discard	nested FSDP on feed-forward modules is valid but slower and worsens the short loss trajectory	NCCL_NVLS_ENABLE=1 NCCL_CTA_POLICY=2 NGPU=8 LOG_RANK=0 MODULE=qwen3 CONFIG=qwen3_14b ./run_train.sh --training.steps=10 --compile.enable --compile.components=loss,feed_forward,qkv_linear --training.dtype=bfloat16 --training.seq_len=128 --training.local_batch_size=168 --loss.num_chunks=4 --optimizer.weight_decay=0.0 --dataloader.num_workers=2 --dataloader.persistent_workers --dataloader.prefetch_factor=2 --metrics.log_freq=1 --comm.trace_buf_size=0 --dump_folder=outputs/autoresearch/may19-qwen3-14b/run455-nested-fsdp-feed-forward > outputs/autoresearch/may19-qwen3-14b/run455-nested-fsdp-feed-forward.run.log 2>&1
efab4475+dirty	12290	0.00	169.22	discard	compiling attention output projections is valid but slower and much higher-memory	NCCL_NVLS_ENABLE=1 NCCL_CTA_POLICY=2 NGPU=8 LOG_RANK=0 MODULE=qwen3 CONFIG=qwen3_14b ./run_train.sh --training.steps=10 --compile.enable --compile.components=loss,feed_forward,qkv_linear,attention_wo --training.dtype=bfloat16 --training.seq_len=128 --training.local_batch_size=168 --loss.num_chunks=4 --optimizer.weight_decay=0.0 --dataloader.num_workers=2 --dataloader.persistent_workers --dataloader.prefetch_factor=2 --metrics.log_freq=1 --comm.trace_buf_size=0 --dump_folder=outputs/autoresearch/may19-qwen3-14b/run456-compile-attention-wo > outputs/autoresearch/may19-qwen3-14b/run456-compile-attention-wo.run.log 2>&1
ab4a53c3	10956	0.00	163.95	discard	metrics.log_freq=10 reduces console frequency but reported tps is lower and not a useful objective win	NCCL_NVLS_ENABLE=1 NCCL_CTA_POLICY=2 NGPU=8 LOG_RANK=0 MODULE=qwen3 CONFIG=qwen3_14b ./run_train.sh --training.steps=10 --compile.enable --compile.components=loss,feed_forward,qkv_linear --training.dtype=bfloat16 --training.seq_len=128 --training.local_batch_size=168 --loss.num_chunks=4 --optimizer.weight_decay=0.0 --dataloader.num_workers=2 --dataloader.persistent_workers --dataloader.prefetch_factor=2 --metrics.log_freq=10 --comm.trace_buf_size=0 --dump_folder=outputs/autoresearch/may19-qwen3-14b/run457-metrics-log-freq-10 > outputs/autoresearch/may19-qwen3-14b/run457-metrics-log-freq-10.run.log 2>&1
deaf2282	12257	0.00	163.95	discard	metrics.log_freq=2 is valid but below the active log_freq=1 peak	NCCL_NVLS_ENABLE=1 NCCL_CTA_POLICY=2 NGPU=8 LOG_RANK=0 MODULE=qwen3 CONFIG=qwen3_14b ./run_train.sh --training.steps=10 --compile.enable --compile.components=loss,feed_forward,qkv_linear --training.dtype=bfloat16 --training.seq_len=128 --training.local_batch_size=168 --loss.num_chunks=4 --optimizer.weight_decay=0.0 --dataloader.num_workers=2 --dataloader.persistent_workers --dataloader.prefetch_factor=2 --metrics.log_freq=2 --comm.trace_buf_size=0 --dump_folder=outputs/autoresearch/may19-qwen3-14b/run458-metrics-log-freq-2 > outputs/autoresearch/may19-qwen3-14b/run458-metrics-log-freq-2.run.log 2>&1
7af0858b	12336	0.00	163.95	discard	TORCH_NCCL_AVOID_RECORD_STREAMS=0 is valid but below the active NCCL stream behavior	NCCL_NVLS_ENABLE=1 NCCL_CTA_POLICY=2 TORCH_NCCL_AVOID_RECORD_STREAMS=0 NGPU=8 LOG_RANK=0 MODULE=qwen3 CONFIG=qwen3_14b ./run_train.sh --training.steps=10 --compile.enable --compile.components=loss,feed_forward,qkv_linear --training.dtype=bfloat16 --training.seq_len=128 --training.local_batch_size=168 --loss.num_chunks=4 --optimizer.weight_decay=0.0 --dataloader.num_workers=2 --dataloader.persistent_workers --dataloader.prefetch_factor=2 --metrics.log_freq=1 --comm.trace_buf_size=0 --dump_folder=outputs/autoresearch/may19-qwen3-14b/run459-torch-nccl-record-streams > outputs/autoresearch/may19-qwen3-14b/run459-torch-nccl-record-streams.run.log 2>&1
873bc788	12216	0.00	163.95	discard	NCCL_MAX_CTAS=16 is valid but below the active NCCL CTA behavior	NCCL_MAX_CTAS=16 NCCL_NVLS_ENABLE=1 NCCL_CTA_POLICY=2 NGPU=8 LOG_RANK=0 MODULE=qwen3 CONFIG=qwen3_14b ./run_train.sh --training.steps=10 --compile.enable --compile.components=loss,feed_forward,qkv_linear --training.dtype=bfloat16 --training.seq_len=128 --training.local_batch_size=168 --loss.num_chunks=4 --optimizer.weight_decay=0.0 --dataloader.num_workers=2 --dataloader.persistent_workers --dataloader.prefetch_factor=2 --metrics.log_freq=1 --comm.trace_buf_size=0 --dump_folder=outputs/autoresearch/may19-qwen3-14b/run460-nccl-max-ctas-16 > outputs/autoresearch/may19-qwen3-14b/run460-nccl-max-ctas-16.run.log 2>&1
448b5b45+dirty	11922	0.00	163.95	discard	excluding attention output projection from MXFP8 is valid but much slower	NCCL_NVLS_ENABLE=1 NCCL_CTA_POLICY=2 NGPU=8 LOG_RANK=0 MODULE=qwen3 CONFIG=qwen3_14b ./run_train.sh --training.steps=10 --compile.enable --compile.components=loss,feed_forward,qkv_linear --training.dtype=bfloat16 --training.seq_len=128 --training.local_batch_size=168 --loss.num_chunks=4 --optimizer.weight_decay=0.0 --dataloader.num_workers=2 --dataloader.persistent_workers --dataloader.prefetch_factor=2 --metrics.log_freq=1 --comm.trace_buf_size=0 --dump_folder=outputs/autoresearch/may19-qwen3-14b/run461-mxfp8-exclude-attention-wo > outputs/autoresearch/may19-qwen3-14b/run461-mxfp8-exclude-attention-wo.run.log 2>&1
06ae67e4	12368	0.00	163.95	discard	NCCL_MAX_CTAS=64 is valid and close but still below the active peak	NCCL_MAX_CTAS=64 NCCL_NVLS_ENABLE=1 NCCL_CTA_POLICY=2 NGPU=8 LOG_RANK=0 MODULE=qwen3 CONFIG=qwen3_14b ./run_train.sh --training.steps=10 --compile.enable --compile.components=loss,feed_forward,qkv_linear --training.dtype=bfloat16 --training.seq_len=128 --training.local_batch_size=168 --loss.num_chunks=4 --optimizer.weight_decay=0.0 --dataloader.num_workers=2 --dataloader.persistent_workers --dataloader.prefetch_factor=2 --metrics.log_freq=1 --comm.trace_buf_size=0 --dump_folder=outputs/autoresearch/may19-qwen3-14b/run462-nccl-max-ctas-64 > outputs/autoresearch/may19-qwen3-14b/run462-nccl-max-ctas-64.run.log 2>&1
8b89fa76	12319	0.00	163.95	discard	NCCL_MAX_CTAS=128 is valid but below the active peak	NCCL_MAX_CTAS=128 NCCL_NVLS_ENABLE=1 NCCL_CTA_POLICY=2 NGPU=8 LOG_RANK=0 MODULE=qwen3 CONFIG=qwen3_14b ./run_train.sh --training.steps=10 --compile.enable --compile.components=loss,feed_forward,qkv_linear --training.dtype=bfloat16 --training.seq_len=128 --training.local_batch_size=168 --loss.num_chunks=4 --optimizer.weight_decay=0.0 --dataloader.num_workers=2 --dataloader.persistent_workers --dataloader.prefetch_factor=2 --metrics.log_freq=1 --comm.trace_buf_size=0 --dump_folder=outputs/autoresearch/may19-qwen3-14b/run463-nccl-max-ctas-128 > outputs/autoresearch/may19-qwen3-14b/run463-nccl-max-ctas-128.run.log 2>&1
6ba86487	12252	0.00	163.95	discard	Inductor max autotune on the compiled-QKV graph is valid but below the active default Inductor settings	TORCHINDUCTOR_MAX_AUTOTUNE=1 TORCHINDUCTOR_MAX_AUTOTUNE_GEMM=1 NCCL_NVLS_ENABLE=1 NCCL_CTA_POLICY=2 NGPU=8 LOG_RANK=0 MODULE=qwen3 CONFIG=qwen3_14b ./run_train.sh --training.steps=10 --compile.enable --compile.components=loss,feed_forward,qkv_linear --training.dtype=bfloat16 --training.seq_len=128 --training.local_batch_size=168 --loss.num_chunks=4 --optimizer.weight_decay=0.0 --dataloader.num_workers=2 --dataloader.persistent_workers --dataloader.prefetch_factor=2 --metrics.log_freq=1 --comm.trace_buf_size=0 --dump_folder=outputs/autoresearch/may19-qwen3-14b/run464-inductor-max-autotune-compiled-qkv > outputs/autoresearch/may19-qwen3-14b/run464-inductor-max-autotune-compiled-qkv.run.log 2>&1
c8a5d735+dirty	12160	0.00	167.25	discard	qkv_linear compile mode=reduce-overhead is valid but slower and higher-memory	NCCL_NVLS_ENABLE=1 NCCL_CTA_POLICY=2 NGPU=8 LOG_RANK=0 MODULE=qwen3 CONFIG=qwen3_14b ./run_train.sh --training.steps=10 --compile.enable --compile.components=loss,feed_forward,qkv_linear --training.dtype=bfloat16 --training.seq_len=128 --training.local_batch_size=168 --loss.num_chunks=4 --optimizer.weight_decay=0.0 --dataloader.num_workers=2 --dataloader.persistent_workers --dataloader.prefetch_factor=2 --metrics.log_freq=1 --comm.trace_buf_size=0 --dump_folder=outputs/autoresearch/may19-qwen3-14b/run465-qkv-compile-reduce-overhead > outputs/autoresearch/may19-qwen3-14b/run465-qkv-compile-reduce-overhead.run.log 2>&1
df6e0f92	12111	0.00	164.36	discard	loss chunks8 on the compiled-QKV recipe is valid but slower and slightly higher-memory than chunks4	NCCL_NVLS_ENABLE=1 NCCL_CTA_POLICY=2 NGPU=8 LOG_RANK=0 MODULE=qwen3 CONFIG=qwen3_14b ./run_train.sh --training.steps=10 --compile.enable --compile.components=loss,feed_forward,qkv_linear --training.dtype=bfloat16 --training.seq_len=128 --training.local_batch_size=168 --loss.num_chunks=8 --optimizer.weight_decay=0.0 --dataloader.num_workers=2 --dataloader.persistent_workers --dataloader.prefetch_factor=2 --metrics.log_freq=1 --comm.trace_buf_size=0 --dump_folder=outputs/autoresearch/may19-qwen3-14b/run466-loss-chunks8-compiled-qkv > outputs/autoresearch/may19-qwen3-14b/run466-loss-chunks8-compiled-qkv.run.log 2>&1
a6022b03	12274	0.00	163.95	discard	Inductor coordinate descent tuning on the compiled-QKV graph is valid but below the active default Inductor settings	TORCHINDUCTOR_COORDINATE_DESCENT_TUNING=1 NCCL_NVLS_ENABLE=1 NCCL_CTA_POLICY=2 NGPU=8 LOG_RANK=0 MODULE=qwen3 CONFIG=qwen3_14b ./run_train.sh --training.steps=10 --compile.enable --compile.components=loss,feed_forward,qkv_linear --training.dtype=bfloat16 --training.seq_len=128 --training.local_batch_size=168 --loss.num_chunks=4 --optimizer.weight_decay=0.0 --dataloader.num_workers=2 --dataloader.persistent_workers --dataloader.prefetch_factor=2 --metrics.log_freq=1 --comm.trace_buf_size=0 --dump_folder=outputs/autoresearch/may19-qwen3-14b/run467-coordinate-descent-compiled-qkv > outputs/autoresearch/may19-qwen3-14b/run467-coordinate-descent-compiled-qkv.run.log 2>&1
74dff22a	12309	0.00	163.95	discard	NCCL_MIN_CTAS=32 is valid but below the active NCCL CTA behavior	NCCL_MIN_CTAS=32 NCCL_NVLS_ENABLE=1 NCCL_CTA_POLICY=2 NGPU=8 LOG_RANK=0 MODULE=qwen3 CONFIG=qwen3_14b ./run_train.sh --training.steps=10 --compile.enable --compile.components=loss,feed_forward,qkv_linear --training.dtype=bfloat16 --training.seq_len=128 --training.local_batch_size=168 --loss.num_chunks=4 --optimizer.weight_decay=0.0 --dataloader.num_workers=2 --dataloader.persistent_workers --dataloader.prefetch_factor=2 --metrics.log_freq=1 --comm.trace_buf_size=0 --dump_folder=outputs/autoresearch/may19-qwen3-14b/run468-nccl-min-ctas-32 > outputs/autoresearch/may19-qwen3-14b/run468-nccl-min-ctas-32.run.log 2>&1
5a423a5a+dirty	12321	0.00	163.95	discard	custom SwiGLU autograd in the compiled FFN path is valid but slower than Inductor's existing fusion	NCCL_NVLS_ENABLE=1 NCCL_CTA_POLICY=2 NGPU=8 LOG_RANK=0 MODULE=qwen3 CONFIG=qwen3_14b ./run_train.sh --training.steps=10 --compile.enable --compile.components=loss,feed_forward,qkv_linear --training.dtype=bfloat16 --training.seq_len=128 --training.local_batch_size=168 --loss.num_chunks=4 --optimizer.weight_decay=0.0 --dataloader.num_workers=2 --dataloader.persistent_workers --dataloader.prefetch_factor=2 --metrics.log_freq=1 --comm.trace_buf_size=0 --dump_folder=outputs/autoresearch/may19-qwen3-14b/run469-custom-swiglu-autograd > outputs/autoresearch/may19-qwen3-14b/run469-custom-swiglu-autograd.run.log 2>&1
ba6cfd3c	12328	0.00	163.95	discard	NCCL_MIN_CTAS=16 is valid but below the active NCCL CTA behavior	NCCL_MIN_CTAS=16 NCCL_NVLS_ENABLE=1 NCCL_CTA_POLICY=2 NGPU=8 LOG_RANK=0 MODULE=qwen3 CONFIG=qwen3_14b ./run_train.sh --training.steps=10 --compile.enable --compile.components=loss,feed_forward,qkv_linear --training.dtype=bfloat16 --training.seq_len=128 --training.local_batch_size=168 --loss.num_chunks=4 --optimizer.weight_decay=0.0 --dataloader.num_workers=2 --dataloader.persistent_workers --dataloader.prefetch_factor=2 --metrics.log_freq=1 --comm.trace_buf_size=0 --dump_folder=outputs/autoresearch/may19-qwen3-14b/run470-nccl-min-ctas-16 > outputs/autoresearch/may19-qwen3-14b/run470-nccl-min-ctas-16.run.log 2>&1
1d6827a0+dirty	0	0.00	0.0	crash	MXFP8 addmm accumulation cannot use a full-matrix grad_input bias; TorchAO lowers it to _scaled_mm vector-bias semantics	NCCL_NVLS_ENABLE=1 NCCL_CTA_POLICY=2 NGPU=8 LOG_RANK=0 MODULE=qwen3 CONFIG=qwen3_14b ./run_train.sh --training.steps=10 --compile.enable --compile.components=loss,feed_forward,qkv_linear --training.dtype=bfloat16 --training.seq_len=128 --training.local_batch_size=168 --loss.num_chunks=4 --optimizer.weight_decay=0.0 --dataloader.num_workers=2 --dataloader.persistent_workers --dataloader.prefetch_factor=2 --metrics.log_freq=1 --comm.trace_buf_size=0 --dump_folder=outputs/autoresearch/may19-qwen3-14b/run471-mxfp8-backward-addmm-accum > outputs/autoresearch/may19-qwen3-14b/run471-mxfp8-backward-addmm-accum.run.log 2>&1
575b5cc9+dirty	1263	0.00	165.05	discard	feed_forward compile mode=reduce-overhead was stopped early because CUDA graph/capture overhead made steps 1-4 dramatically slower	NCCL_NVLS_ENABLE=1 NCCL_CTA_POLICY=2 NGPU=8 LOG_RANK=0 MODULE=qwen3 CONFIG=qwen3_14b ./run_train.sh --training.steps=10 --compile.enable --compile.components=loss,feed_forward,qkv_linear --training.dtype=bfloat16 --training.seq_len=128 --training.local_batch_size=168 --loss.num_chunks=4 --optimizer.weight_decay=0.0 --dataloader.num_workers=2 --dataloader.persistent_workers --dataloader.prefetch_factor=2 --metrics.log_freq=1 --comm.trace_buf_size=0 --dump_folder=outputs/autoresearch/may19-qwen3-14b/run472-feed-forward-compile-reduce-overhead > outputs/autoresearch/may19-qwen3-14b/run472-feed-forward-compile-reduce-overhead.run.log 2>&1
4a61fefd+dirty	12160	0.00	167.60	discard	root FSDP reshard_after_forward=false is valid but slower and higher-memory on the compiled-QKV active recipe	NCCL_NVLS_ENABLE=1 NCCL_CTA_POLICY=2 NGPU=8 LOG_RANK=0 MODULE=qwen3 CONFIG=qwen3_14b ./run_train.sh --training.steps=10 --compile.enable --compile.components=loss,feed_forward,qkv_linear --training.dtype=bfloat16 --training.seq_len=128 --training.local_batch_size=168 --loss.num_chunks=4 --optimizer.weight_decay=0.0 --dataloader.num_workers=2 --dataloader.persistent_workers --dataloader.prefetch_factor=2 --metrics.log_freq=1 --comm.trace_buf_size=0 --dump_folder=outputs/autoresearch/may19-qwen3-14b/run473-root-no-reshard-compiled-qkv > outputs/autoresearch/may19-qwen3-14b/run473-root-no-reshard-compiled-qkv.run.log 2>&1
24487c30	0	0.00	0.0	crash	batch170 is not compatible with the Triton MXFP8 dim1 512-row tile at seq_len128	NCCL_NVLS_ENABLE=1 NCCL_CTA_POLICY=2 NGPU=8 LOG_RANK=0 MODULE=qwen3 CONFIG=qwen3_14b ./run_train.sh --training.steps=10 --compile.enable --compile.components=loss,feed_forward,qkv_linear --training.dtype=bfloat16 --training.seq_len=128 --training.local_batch_size=170 --loss.num_chunks=4 --optimizer.weight_decay=0.0 --dataloader.num_workers=2 --dataloader.persistent_workers --dataloader.prefetch_factor=2 --metrics.log_freq=1 --comm.trace_buf_size=0 --dump_folder=outputs/autoresearch/may19-qwen3-14b/run474-batch170-compiled-qkv > outputs/autoresearch/may19-qwen3-14b/run474-batch170-compiled-qkv.run.log 2>&1
d959c7b9	12339	0.00	160.77	discard	batch164 is valid and lower-memory but below the batch168 compiled-QKV peak	NCCL_NVLS_ENABLE=1 NCCL_CTA_POLICY=2 NGPU=8 LOG_RANK=0 MODULE=qwen3 CONFIG=qwen3_14b ./run_train.sh --training.steps=10 --compile.enable --compile.components=loss,feed_forward,qkv_linear --training.dtype=bfloat16 --training.seq_len=128 --training.local_batch_size=164 --loss.num_chunks=4 --optimizer.weight_decay=0.0 --dataloader.num_workers=2 --dataloader.persistent_workers --dataloader.prefetch_factor=2 --metrics.log_freq=1 --comm.trace_buf_size=0 --dump_folder=outputs/autoresearch/may19-qwen3-14b/run475-batch164-compiled-qkv > outputs/autoresearch/may19-qwen3-14b/run475-batch164-compiled-qkv.run.log 2>&1
36a44c0f	12248	0.00	170.24	discard	batch176 is valid but slower and memory-riskier than batch168 on the compiled-QKV recipe	NCCL_NVLS_ENABLE=1 NCCL_CTA_POLICY=2 NGPU=8 LOG_RANK=0 MODULE=qwen3 CONFIG=qwen3_14b ./run_train.sh --training.steps=10 --compile.enable --compile.components=loss,feed_forward,qkv_linear --training.dtype=bfloat16 --training.seq_len=128 --training.local_batch_size=176 --loss.num_chunks=4 --optimizer.weight_decay=0.0 --dataloader.num_workers=2 --dataloader.persistent_workers --dataloader.prefetch_factor=2 --metrics.log_freq=1 --comm.trace_buf_size=0 --dump_folder=outputs/autoresearch/may19-qwen3-14b/run476-batch176-compiled-qkv > outputs/autoresearch/may19-qwen3-14b/run476-batch176-compiled-qkv.run.log 2>&1
431aa5d7+dirty	0	0.00	0.0	crash	Flex FLASH/CUTE reaches generated CUTE kernel but installed flash-attn lacks flash_attn.cute.block_sparsity	NCCL_NVLS_ENABLE=1 NCCL_CTA_POLICY=2 NGPU=8 LOG_RANK=0 MODULE=qwen3 CONFIG=qwen3_14b ./run_train.sh --training.steps=10 --compile.enable --compile.components=loss,feed_forward,qkv_linear --training.dtype=bfloat16 --training.seq_len=128 --training.local_batch_size=168 --loss.num_chunks=4 --optimizer.weight_decay=0.0 --dataloader.num_workers=2 --dataloader.persistent_workers --dataloader.prefetch_factor=2 --metrics.log_freq=1 --comm.trace_buf_size=0 --dump_folder=outputs/autoresearch/may19-qwen3-14b/run477-flex-flash-shim-compiled-qkv > outputs/autoresearch/may19-qwen3-14b/run477-flex-flash-shim-compiled-qkv.run.log 2>&1
0d8845f5	12246	0.00	163.95	discard	NCCL_PROGRESS_APPENDOP_FREQ=16 is valid but slower than default on the compiled-QKV recipe	NCCL_PROGRESS_APPENDOP_FREQ=16 NCCL_NVLS_ENABLE=1 NCCL_CTA_POLICY=2 NGPU=8 LOG_RANK=0 MODULE=qwen3 CONFIG=qwen3_14b ./run_train.sh --training.steps=10 --compile.enable --compile.components=loss,feed_forward,qkv_linear --training.dtype=bfloat16 --training.seq_len=128 --training.local_batch_size=168 --loss.num_chunks=4 --optimizer.weight_decay=0.0 --dataloader.num_workers=2 --dataloader.persistent_workers --dataloader.prefetch_factor=2 --metrics.log_freq=1 --comm.trace_buf_size=0 --dump_folder=outputs/autoresearch/may19-qwen3-14b/run478-nccl-progress-appendop-freq16-compiled-qkv > outputs/autoresearch/may19-qwen3-14b/run478-nccl-progress-appendop-freq16-compiled-qkv.run.log 2>&1
d689d576	12454	0.00	163.95	keep	TORCH_NCCL_CUDA_EVENT_CACHE=0 is a new measured peak on the compiled-QKV recipe	TORCH_NCCL_CUDA_EVENT_CACHE=0 NCCL_NVLS_ENABLE=1 NCCL_CTA_POLICY=2 NGPU=8 LOG_RANK=0 MODULE=qwen3 CONFIG=qwen3_14b ./run_train.sh --training.steps=10 --compile.enable --compile.components=loss,feed_forward,qkv_linear --training.dtype=bfloat16 --training.seq_len=128 --training.local_batch_size=168 --loss.num_chunks=4 --optimizer.weight_decay=0.0 --dataloader.num_workers=2 --dataloader.persistent_workers --dataloader.prefetch_factor=2 --metrics.log_freq=1 --comm.trace_buf_size=0 --dump_folder=outputs/autoresearch/may19-qwen3-14b/run479-torch-nccl-cuda-event-cache0-compiled-qkv > outputs/autoresearch/may19-qwen3-14b/run479-torch-nccl-cuda-event-cache0-compiled-qkv.run.log 2>&1
a71c658c	12270	0.00	163.95	discard	TORCH_NCCL_CUDA_EVENT_CACHE=0 plus NCCL_MAX_CTAS=64 is slower than event-cache disable alone	TORCH_NCCL_CUDA_EVENT_CACHE=0 NCCL_MAX_CTAS=64 NCCL_NVLS_ENABLE=1 NCCL_CTA_POLICY=2 NGPU=8 LOG_RANK=0 MODULE=qwen3 CONFIG=qwen3_14b ./run_train.sh --training.steps=10 --compile.enable --compile.components=loss,feed_forward,qkv_linear --training.dtype=bfloat16 --training.seq_len=128 --training.local_batch_size=168 --loss.num_chunks=4 --optimizer.weight_decay=0.0 --dataloader.num_workers=2 --dataloader.persistent_workers --dataloader.prefetch_factor=2 --metrics.log_freq=1 --comm.trace_buf_size=0 --dump_folder=outputs/autoresearch/may19-qwen3-14b/run480-event-cache0-nccl-max-ctas64 > outputs/autoresearch/may19-qwen3-14b/run480-event-cache0-nccl-max-ctas64.run.log 2>&1
4f1714c0	12132	0.00	163.95	keep	profiled the event-cache-disabled active recipe; profiled TPS is diagnostic, trace shows GEMM/MXFP8 cast work is flat vs run450 while communication scheduling shifts	TORCH_NCCL_CUDA_EVENT_CACHE=0 NCCL_NVLS_ENABLE=1 NCCL_CTA_POLICY=2 NGPU=8 LOG_RANK=0 MODULE=qwen3 CONFIG=qwen3_14b ./run_train.sh --training.steps=10 --compile.enable --compile.components=loss,feed_forward,qkv_linear --training.dtype=bfloat16 --training.seq_len=128 --training.local_batch_size=168 --loss.num_chunks=4 --optimizer.weight_decay=0.0 --dataloader.num_workers=2 --dataloader.persistent_workers --dataloader.prefetch_factor=2 --metrics.log_freq=1 --comm.trace_buf_size=0 --profiler.enable_profiling --profiler.profile_freq=10 --profiler.profiler_warmup=2 --profiler.profiler_active=1 --dump_folder=outputs/autoresearch/may19-qwen3-14b/run481-profile-event-cache0-active > outputs/autoresearch/may19-qwen3-14b/run481-profile-event-cache0-active.run.log 2>&1
