commit	tokens_per_sec	mfu_percent	peak_memory_gb	status	description	command
bfc8d098+dirty	14261	0.00	168.89	discard	adding block-level model compile on top of nested qkv/feed/norm compiles is valid and lowers memory slightly but loses throughput	TORCH_NCCL_CUDA_EVENT_CACHE=0 NCCL_NVLS_ENABLE=1 NCCL_CTA_POLICY=2 NGPU=8 LOG_RANK=0 MODULE=qwen3 CONFIG=qwen3_14b ./run_train.sh --training.steps=10 --compile.enable --compile.components=model,loss,feed_forward,qkv_linear,qk_norm_rope,norm_modules,qkv_grad_input_concat,pairwise_rope --training.dtype=bfloat16 --training.seq_len=128 --training.local_batch_size=176 --loss.num_chunks=4 --optimizer.weight_decay=0.0 --dataloader.num_workers=2 --dataloader.persistent_workers --dataloader.prefetch_factor=2 --metrics.log_freq=1 --comm.trace_buf_size=0 --dump_folder=outputs/autoresearch/may19-qwen3-14b/run578-model-compile-pairwise-rope-block512-qkv-grad-input-concat-norm-modules-batch176-event-cache0 > outputs/autoresearch/may19-qwen3-14b/run578-model-compile-pairwise-rope-block512-qkv-grad-input-concat-norm-modules-batch176-event-cache0.run.log 2>&1
bfc8d098+dirty	14399	0.00	168.89	keep	block-level model compile without nested qkv/feed/norm compiles is near the short peak while lowering memory; needs sustained validation	TORCH_NCCL_CUDA_EVENT_CACHE=0 NCCL_NVLS_ENABLE=1 NCCL_CTA_POLICY=2 NGPU=8 LOG_RANK=0 MODULE=qwen3 CONFIG=qwen3_14b ./run_train.sh --training.steps=10 --compile.enable --compile.components=model,loss,qk_norm_rope,qkv_grad_input_concat,pairwise_rope --training.dtype=bfloat16 --training.seq_len=128 --training.local_batch_size=176 --loss.num_chunks=4 --optimizer.weight_decay=0.0 --dataloader.num_workers=2 --dataloader.persistent_workers --dataloader.prefetch_factor=2 --metrics.log_freq=1 --comm.trace_buf_size=0 --dump_folder=outputs/autoresearch/may19-qwen3-14b/run579-model-compile-no-nested-qkv-ffn-norm-pairwise-rope-qkv-grad-input-concat-batch176-event-cache0 > outputs/autoresearch/may19-qwen3-14b/run579-model-compile-no-nested-qkv-ffn-norm-pairwise-rope-qkv-grad-input-concat-batch176-event-cache0.run.log 2>&1
bfc8d098+dirty	14340	0.00	168.89	keep	block-level model compile without nested qkv/feed/norm compiles sustains a new peak over steps 11-20 while lowering memory	TORCH_NCCL_CUDA_EVENT_CACHE=0 NCCL_NVLS_ENABLE=1 NCCL_CTA_POLICY=2 NGPU=8 LOG_RANK=0 MODULE=qwen3 CONFIG=qwen3_14b ./run_train.sh --training.steps=20 --compile.enable --compile.components=model,loss,qk_norm_rope,qkv_grad_input_concat,pairwise_rope --training.dtype=bfloat16 --training.seq_len=128 --training.local_batch_size=176 --loss.num_chunks=4 --optimizer.weight_decay=0.0 --dataloader.num_workers=2 --dataloader.persistent_workers --dataloader.prefetch_factor=2 --metrics.log_freq=1 --comm.trace_buf_size=0 --dump_folder=outputs/autoresearch/may19-qwen3-14b/run580-model-compile-no-nested-qkv-ffn-norm-pairwise-rope-qkv-grad-input-concat-20step-batch176-event-cache0 > outputs/autoresearch/may19-qwen3-14b/run580-model-compile-no-nested-qkv-ffn-norm-pairwise-rope-qkv-grad-input-concat-20step-batch176-event-cache0.run.log 2>&1
bfc8d098+dirty	14456	0.00	168.89	keep	profiled the lean block-level model compile recipe; profiled tps is diagnostic	TORCH_NCCL_CUDA_EVENT_CACHE=0 NCCL_NVLS_ENABLE=1 NCCL_CTA_POLICY=2 NGPU=8 LOG_RANK=0 MODULE=qwen3 CONFIG=qwen3_14b ./run_train.sh --training.steps=10 --compile.enable --compile.components=model,loss,qk_norm_rope,qkv_grad_input_concat,pairwise_rope --training.dtype=bfloat16 --training.seq_len=128 --training.local_batch_size=176 --loss.num_chunks=4 --optimizer.weight_decay=0.0 --dataloader.num_workers=2 --dataloader.persistent_workers --dataloader.prefetch_factor=2 --metrics.log_freq=1 --comm.trace_buf_size=0 --profiler.enable_profiling --profiler.profile_freq=10 --profiler.profiler_warmup=2 --profiler.profiler_active=1 --dump_folder=outputs/autoresearch/may19-qwen3-14b/run581-profile-model-compile-no-nested-qkv-ffn-norm-pairwise-rope-qkv-grad-input-concat-batch176-event-cache0 > outputs/autoresearch/may19-qwen3-14b/run581-profile-model-compile-no-nested-qkv-ffn-norm-pairwise-rope-qkv-grad-input-concat-batch176-event-cache0.run.log 2>&1
bfc8d098+dirty	14448	0.00	168.89	keep	model compile plus nested norm_modules is valid and improves the short sample while keeping the lower memory peak	TORCH_NCCL_CUDA_EVENT_CACHE=0 NCCL_NVLS_ENABLE=1 NCCL_CTA_POLICY=2 NGPU=8 LOG_RANK=0 MODULE=qwen3 CONFIG=qwen3_14b ./run_train.sh --training.steps=10 --compile.enable --compile.components=model,loss,qk_norm_rope,norm_modules,qkv_grad_input_concat,pairwise_rope --training.dtype=bfloat16 --training.seq_len=128 --training.local_batch_size=176 --loss.num_chunks=4 --optimizer.weight_decay=0.0 --dataloader.num_workers=2 --dataloader.persistent_workers --dataloader.prefetch_factor=2 --metrics.log_freq=1 --comm.trace_buf_size=0 --dump_folder=outputs/autoresearch/may19-qwen3-14b/run582-model-compile-norm-modules-pairwise-rope-qkv-grad-input-concat-batch176-event-cache0 > outputs/autoresearch/may19-qwen3-14b/run582-model-compile-norm-modules-pairwise-rope-qkv-grad-input-concat-batch176-event-cache0.run.log 2>&1
bfc8d098+dirty	14212	0.00	168.89	discard	model compile plus nested norm_modules is valid but sustained steps 11-20 regress below the lean model-compile recipe	TORCH_NCCL_CUDA_EVENT_CACHE=0 NCCL_NVLS_ENABLE=1 NCCL_CTA_POLICY=2 NGPU=8 LOG_RANK=0 MODULE=qwen3 CONFIG=qwen3_14b ./run_train.sh --training.steps=20 --compile.enable --compile.components=model,loss,qk_norm_rope,norm_modules,qkv_grad_input_concat,pairwise_rope --training.dtype=bfloat16 --training.seq_len=128 --training.local_batch_size=176 --loss.num_chunks=4 --optimizer.weight_decay=0.0 --dataloader.num_workers=2 --dataloader.persistent_workers --dataloader.prefetch_factor=2 --metrics.log_freq=1 --comm.trace_buf_size=0 --dump_folder=outputs/autoresearch/may19-qwen3-14b/run583-model-compile-norm-modules-pairwise-rope-qkv-grad-input-concat-20step-batch176-event-cache0 > outputs/autoresearch/may19-qwen3-14b/run583-model-compile-norm-modules-pairwise-rope-qkv-grad-input-concat-20step-batch176-event-cache0.run.log 2>&1
bfc8d098+dirty	14375	0.00	168.89	discard	model compile plus nested qkv_linear is valid but slower than the lean model-compile recipe	TORCH_NCCL_CUDA_EVENT_CACHE=0 NCCL_NVLS_ENABLE=1 NCCL_CTA_POLICY=2 NGPU=8 LOG_RANK=0 MODULE=qwen3 CONFIG=qwen3_14b ./run_train.sh --training.steps=10 --compile.enable --compile.components=model,loss,qk_norm_rope,qkv_linear,qkv_grad_input_concat,pairwise_rope --training.dtype=bfloat16 --training.seq_len=128 --training.local_batch_size=176 --loss.num_chunks=4 --optimizer.weight_decay=0.0 --dataloader.num_workers=2 --dataloader.persistent_workers --dataloader.prefetch_factor=2 --metrics.log_freq=1 --comm.trace_buf_size=0 --dump_folder=outputs/autoresearch/may19-qwen3-14b/run584-model-compile-qkv-linear-pairwise-rope-qkv-grad-input-concat-batch176-event-cache0 > outputs/autoresearch/may19-qwen3-14b/run584-model-compile-qkv-linear-pairwise-rope-qkv-grad-input-concat-batch176-event-cache0.run.log 2>&1
bfc8d098+dirty	14375	0.00	168.89	discard	model compile plus nested feed_forward is valid but slower than the lean model-compile recipe	TORCH_NCCL_CUDA_EVENT_CACHE=0 NCCL_NVLS_ENABLE=1 NCCL_CTA_POLICY=2 NGPU=8 LOG_RANK=0 MODULE=qwen3 CONFIG=qwen3_14b ./run_train.sh --training.steps=10 --compile.enable --compile.components=model,loss,qk_norm_rope,feed_forward,qkv_grad_input_concat,pairwise_rope --training.dtype=bfloat16 --training.seq_len=128 --training.local_batch_size=176 --loss.num_chunks=4 --optimizer.weight_decay=0.0 --dataloader.num_workers=2 --dataloader.persistent_workers --dataloader.prefetch_factor=2 --metrics.log_freq=1 --comm.trace_buf_size=0 --dump_folder=outputs/autoresearch/may19-qwen3-14b/run585-model-compile-feed-forward-pairwise-rope-qkv-grad-input-concat-batch176-event-cache0 > outputs/autoresearch/may19-qwen3-14b/run585-model-compile-feed-forward-pairwise-rope-qkv-grad-input-concat-batch176-event-cache0.run.log 2>&1
bfc8d098+dirty	14430	0.00	168.89	keep	model compile without the separate qk_norm_rope helper is valid and improves the short sample versus the lean model-compile recipe	TORCH_NCCL_CUDA_EVENT_CACHE=0 NCCL_NVLS_ENABLE=1 NCCL_CTA_POLICY=2 NGPU=8 LOG_RANK=0 MODULE=qwen3 CONFIG=qwen3_14b ./run_train.sh --training.steps=10 --compile.enable --compile.components=model,loss,qkv_grad_input_concat,pairwise_rope --training.dtype=bfloat16 --training.seq_len=128 --training.local_batch_size=176 --loss.num_chunks=4 --optimizer.weight_decay=0.0 --dataloader.num_workers=2 --dataloader.persistent_workers --dataloader.prefetch_factor=2 --metrics.log_freq=1 --comm.trace_buf_size=0 --dump_folder=outputs/autoresearch/may19-qwen3-14b/run586-model-compile-no-qk-norm-rope-helper-pairwise-rope-qkv-grad-input-concat-batch176-event-cache0 > outputs/autoresearch/may19-qwen3-14b/run586-model-compile-no-qk-norm-rope-helper-pairwise-rope-qkv-grad-input-concat-batch176-event-cache0.run.log 2>&1
bfc8d098+dirty	14282	0.00	168.89	discard	model compile without the separate qk_norm_rope helper is valid but sustained steps 11-20 regress below the lean model-compile recipe	TORCH_NCCL_CUDA_EVENT_CACHE=0 NCCL_NVLS_ENABLE=1 NCCL_CTA_POLICY=2 NGPU=8 LOG_RANK=0 MODULE=qwen3 CONFIG=qwen3_14b ./run_train.sh --training.steps=20 --compile.enable --compile.components=model,loss,qkv_grad_input_concat,pairwise_rope --training.dtype=bfloat16 --training.seq_len=128 --training.local_batch_size=176 --loss.num_chunks=4 --optimizer.weight_decay=0.0 --dataloader.num_workers=2 --dataloader.persistent_workers --dataloader.prefetch_factor=2 --metrics.log_freq=1 --comm.trace_buf_size=0 --dump_folder=outputs/autoresearch/may19-qwen3-14b/run587-model-compile-no-qk-norm-rope-helper-pairwise-rope-qkv-grad-input-concat-20step-batch176-event-cache0 > outputs/autoresearch/may19-qwen3-14b/run587-model-compile-no-qk-norm-rope-helper-pairwise-rope-qkv-grad-input-concat-20step-batch176-event-cache0.run.log 2>&1
bfc8d098+dirty	14333	0.00	168.89	discard	fused Q/K pairwise RoPE custom kernel is valid but slower than the lean model-compile pairwise RoPE recipe in the short sample	TORCH_NCCL_CUDA_EVENT_CACHE=0 NCCL_NVLS_ENABLE=1 NCCL_CTA_POLICY=2 NGPU=8 LOG_RANK=0 MODULE=qwen3 CONFIG=qwen3_14b ./run_train.sh --training.steps=10 --compile.enable --compile.components=model,loss,qk_norm_rope,qkv_grad_input_concat,pairwise_rope,fused_qk_rope --training.dtype=bfloat16 --training.seq_len=128 --training.local_batch_size=176 --loss.num_chunks=4 --optimizer.weight_decay=0.0 --dataloader.num_workers=2 --dataloader.persistent_workers --dataloader.prefetch_factor=2 --metrics.log_freq=1 --comm.trace_buf_size=0 --dump_folder=outputs/autoresearch/may19-qwen3-14b/run588-fused-qk-pairwise-rope-model-compile-qkv-grad-input-concat-batch176-event-cache0 > outputs/autoresearch/may19-qwen3-14b/run588-fused-qk-pairwise-rope-model-compile-qkv-grad-input-concat-batch176-event-cache0.run.log 2>&1
bfc8d098+dirty	14313	0.00	168.89	discard	fused Q/K pairwise RoPE without the separate qk_norm_rope helper is valid but slower than the non-fused no-helper model-compile variant	TORCH_NCCL_CUDA_EVENT_CACHE=0 NCCL_NVLS_ENABLE=1 NCCL_CTA_POLICY=2 NGPU=8 LOG_RANK=0 MODULE=qwen3 CONFIG=qwen3_14b ./run_train.sh --training.steps=10 --compile.enable --compile.components=model,loss,qkv_grad_input_concat,pairwise_rope,fused_qk_rope --training.dtype=bfloat16 --training.seq_len=128 --training.local_batch_size=176 --loss.num_chunks=4 --optimizer.weight_decay=0.0 --dataloader.num_workers=2 --dataloader.persistent_workers --dataloader.prefetch_factor=2 --metrics.log_freq=1 --comm.trace_buf_size=0 --dump_folder=outputs/autoresearch/may19-qwen3-14b/run589-fused-qk-pairwise-rope-no-qk-helper-model-compile-qkv-grad-input-concat-batch176-event-cache0 > outputs/autoresearch/may19-qwen3-14b/run589-fused-qk-pairwise-rope-no-qk-helper-model-compile-qkv-grad-input-concat-batch176-event-cache0.run.log 2>&1
bfc8d098+dirty	14437	0.00	168.89	keep	model compile plus block_norms is valid and improves the short sample versus the lean model-compile recipe; needs sustained validation	TORCH_NCCL_CUDA_EVENT_CACHE=0 NCCL_NVLS_ENABLE=1 NCCL_CTA_POLICY=2 NGPU=8 LOG_RANK=0 MODULE=qwen3 CONFIG=qwen3_14b ./run_train.sh --training.steps=10 --compile.enable --compile.components=model,loss,qk_norm_rope,block_norms,qkv_grad_input_concat,pairwise_rope --training.dtype=bfloat16 --training.seq_len=128 --training.local_batch_size=176 --loss.num_chunks=4 --optimizer.weight_decay=0.0 --dataloader.num_workers=2 --dataloader.persistent_workers --dataloader.prefetch_factor=2 --metrics.log_freq=1 --comm.trace_buf_size=0 --dump_folder=outputs/autoresearch/may19-qwen3-14b/run590-model-compile-block-norms-pairwise-rope-qkv-grad-input-concat-batch176-event-cache0 > outputs/autoresearch/may19-qwen3-14b/run590-model-compile-block-norms-pairwise-rope-qkv-grad-input-concat-batch176-event-cache0.run.log 2>&1
bfc8d098+dirty	14264	0.00	168.89	discard	model compile plus block_norms is valid but sustained steps 11-20 regress below the lean model-compile recipe	TORCH_NCCL_CUDA_EVENT_CACHE=0 NCCL_NVLS_ENABLE=1 NCCL_CTA_POLICY=2 NGPU=8 LOG_RANK=0 MODULE=qwen3 CONFIG=qwen3_14b ./run_train.sh --training.steps=20 --compile.enable --compile.components=model,loss,qk_norm_rope,block_norms,qkv_grad_input_concat,pairwise_rope --training.dtype=bfloat16 --training.seq_len=128 --training.local_batch_size=176 --loss.num_chunks=4 --optimizer.weight_decay=0.0 --dataloader.num_workers=2 --dataloader.persistent_workers --dataloader.prefetch_factor=2 --metrics.log_freq=1 --comm.trace_buf_size=0 --dump_folder=outputs/autoresearch/may19-qwen3-14b/run591-model-compile-block-norms-pairwise-rope-qkv-grad-input-concat-20step-batch176-event-cache0 > outputs/autoresearch/may19-qwen3-14b/run591-model-compile-block-norms-pairwise-rope-qkv-grad-input-concat-20step-batch176-event-cache0.run.log 2>&1
bfc8d098+dirty	0	0.00	0.00	discard	FlexAttention FLASH config reaches Inductor but fails during compilation with fake-tensor RecursionError under the full lean model-compile stack	TORCH_NCCL_CUDA_EVENT_CACHE=0 NCCL_NVLS_ENABLE=1 NCCL_CTA_POLICY=2 NGPU=8 LOG_RANK=0 MODULE=qwen3 CONFIG=qwen3_14b_flex_flash ./run_train.sh --training.steps=10 --compile.enable --compile.components=model,loss,qk_norm_rope,qkv_grad_input_concat,pairwise_rope --training.dtype=bfloat16 --training.seq_len=128 --training.local_batch_size=176 --loss.num_chunks=4 --optimizer.weight_decay=0.0 --dataloader.num_workers=2 --dataloader.persistent_workers --dataloader.prefetch_factor=2 --metrics.log_freq=1 --comm.trace_buf_size=0 --dump_folder=outputs/autoresearch/may19-qwen3-14b/run592-flex-flash-model-compile-pairwise-rope-qkv-grad-input-concat-batch176-event-cache0 > outputs/autoresearch/may19-qwen3-14b/run592-flex-flash-model-compile-pairwise-rope-qkv-grad-input-concat-batch176-event-cache0.run.log 2>&1
bfc8d098+dirty	0	0.00	0.00	discard	FlexAttention FLASH without block model compile still fails because flash-attn CUTE imports missing cutlass.utils.ampere_helpers	TORCH_NCCL_CUDA_EVENT_CACHE=0 NCCL_NVLS_ENABLE=1 NCCL_CTA_POLICY=2 NGPU=8 LOG_RANK=0 MODULE=qwen3 CONFIG=qwen3_14b_flex_flash ./run_train.sh --training.steps=10 --compile.enable --compile.components=loss,qk_norm_rope,qkv_grad_input_concat,pairwise_rope --training.dtype=bfloat16 --training.seq_len=128 --training.local_batch_size=176 --loss.num_chunks=4 --optimizer.weight_decay=0.0 --dataloader.num_workers=2 --dataloader.persistent_workers --dataloader.prefetch_factor=2 --metrics.log_freq=1 --comm.trace_buf_size=0 --dump_folder=outputs/autoresearch/may19-qwen3-14b/run593-flex-flash-no-model-compile-pairwise-rope-qkv-grad-input-concat-batch176-event-cache0 > outputs/autoresearch/may19-qwen3-14b/run593-flex-flash-no-model-compile-pairwise-rope-qkv-grad-input-concat-batch176-event-cache0.run.log 2>&1
bfc8d098+dirty	0	0.00	0.00	discard	FlexAttention FLASH compat alias resolves cutlass.utils.ampere_helpers but then fails because flash-attn 2.8.3 lacks flash_attn.cute.block_sparsity expected by Inductor CUTE codegen	TORCH_NCCL_CUDA_EVENT_CACHE=0 NCCL_NVLS_ENABLE=1 NCCL_CTA_POLICY=2 NGPU=8 LOG_RANK=0 MODULE=qwen3 CONFIG=qwen3_14b_flex_flash ./run_train.sh --training.steps=10 --compile.enable --compile.components=loss,qk_norm_rope,qkv_grad_input_concat,pairwise_rope --training.dtype=bfloat16 --training.seq_len=128 --training.local_batch_size=176 --loss.num_chunks=4 --optimizer.weight_decay=0.0 --dataloader.num_workers=2 --dataloader.persistent_workers --dataloader.prefetch_factor=2 --metrics.log_freq=1 --comm.trace_buf_size=0 --dump_folder=outputs/autoresearch/may19-qwen3-14b/run594-flex-flash-compat-no-model-compile-pairwise-rope-qkv-grad-input-concat-batch176-event-cache0 > outputs/autoresearch/may19-qwen3-14b/run594-flex-flash-compat-no-model-compile-pairwise-rope-qkv-grad-input-concat-batch176-event-cache0.run.log 2>&1
bfc8d098+dirty	0	0.00	0.00	discard	FlexAttention FLASH causal still fails before the shim because Inductor CUTE codegen imports flash_attn.cute.block_sparsity missing from flash-attn 2.8.3	TORCH_NCCL_CUDA_EVENT_CACHE=0 NCCL_NVLS_ENABLE=1 NCCL_CTA_POLICY=2 NGPU=8 LOG_RANK=0 MODULE=qwen3 CONFIG=qwen3_14b_flex_flash_causal ./run_train.sh --training.steps=10 --compile.enable --compile.components=loss,qk_norm_rope,qkv_grad_input_concat,pairwise_rope --training.dtype=bfloat16 --training.seq_len=128 --training.local_batch_size=176 --loss.num_chunks=4 --optimizer.weight_decay=0.0 --dataloader.num_workers=2 --dataloader.persistent_workers --dataloader.prefetch_factor=2 --metrics.log_freq=1 --comm.trace_buf_size=0 --dump_folder=outputs/autoresearch/may19-qwen3-14b/run595-flex-flash-causal-no-model-compile-pairwise-rope-qkv-grad-input-concat-batch176-event-cache0 > outputs/autoresearch/may19-qwen3-14b/run595-flex-flash-causal-no-model-compile-pairwise-rope-qkv-grad-input-concat-batch176-event-cache0.run.log 2>&1
bfc8d098+dirty	0	0.00	0.00	discard	FlexAttention FLASH causal compatibility wrapper reaches flash-attn CUTE but fails because replacing _flash_attn_fwd dropped the compile_cache attribute used internally	TORCH_NCCL_CUDA_EVENT_CACHE=0 NCCL_NVLS_ENABLE=1 NCCL_CTA_POLICY=2 NGPU=8 LOG_RANK=0 MODULE=qwen3 CONFIG=qwen3_14b_flex_flash_causal ./run_train.sh --training.steps=10 --compile.enable --compile.components=loss,qk_norm_rope,qkv_grad_input_concat,pairwise_rope --training.dtype=bfloat16 --training.seq_len=128 --training.local_batch_size=176 --loss.num_chunks=4 --optimizer.weight_decay=0.0 --dataloader.num_workers=2 --dataloader.persistent_workers --dataloader.prefetch_factor=2 --metrics.log_freq=1 --comm.trace_buf_size=0 --dump_folder=outputs/autoresearch/may19-qwen3-14b/run596-flex-flash-causal-compat-no-model-compile-pairwise-rope-qkv-grad-input-concat-batch176-event-cache0 > outputs/autoresearch/may19-qwen3-14b/run596-flex-flash-causal-compat-no-model-compile-pairwise-rope-qkv-grad-input-concat-batch176-event-cache0.run.log 2>&1
bfc8d098+dirty	0	0.00	177.53	discard	FlexAttention FLASH causal compatibility path reaches execution but OOMs at batch176, using far more memory than the SDPA winner	TORCH_NCCL_CUDA_EVENT_CACHE=0 NCCL_NVLS_ENABLE=1 NCCL_CTA_POLICY=2 NGPU=8 LOG_RANK=0 MODULE=qwen3 CONFIG=qwen3_14b_flex_flash_causal ./run_train.sh --training.steps=10 --compile.enable --compile.components=loss,qk_norm_rope,qkv_grad_input_concat,pairwise_rope --training.dtype=bfloat16 --training.seq_len=128 --training.local_batch_size=176 --loss.num_chunks=4 --optimizer.weight_decay=0.0 --dataloader.num_workers=2 --dataloader.persistent_workers --dataloader.prefetch_factor=2 --metrics.log_freq=1 --comm.trace_buf_size=0 --dump_folder=outputs/autoresearch/may19-qwen3-14b/run597-flex-flash-causal-compat-cache-no-model-compile-pairwise-rope-qkv-grad-input-concat-batch176-event-cache0 > outputs/autoresearch/may19-qwen3-14b/run597-flex-flash-causal-compat-cache-no-model-compile-pairwise-rope-qkv-grad-input-concat-batch176-event-cache0.run.log 2>&1
bfc8d098+dirty	0	0.00	178.23	discard	FlexAttention FLASH causal compatibility path still OOMs at batch164, so its memory cost is too high for the current target envelope	TORCH_NCCL_CUDA_EVENT_CACHE=0 NCCL_NVLS_ENABLE=1 NCCL_CTA_POLICY=2 NGPU=8 LOG_RANK=0 MODULE=qwen3 CONFIG=qwen3_14b_flex_flash_causal ./run_train.sh --training.steps=10 --compile.enable --compile.components=loss,qk_norm_rope,qkv_grad_input_concat,pairwise_rope --training.dtype=bfloat16 --training.seq_len=128 --training.local_batch_size=164 --loss.num_chunks=4 --optimizer.weight_decay=0.0 --dataloader.num_workers=2 --dataloader.persistent_workers --dataloader.prefetch_factor=2 --metrics.log_freq=1 --comm.trace_buf_size=0 --dump_folder=outputs/autoresearch/may19-qwen3-14b/run598-flex-flash-causal-compat-batch164-no-model-compile-pairwise-rope-qkv-grad-input-concat-event-cache0 > outputs/autoresearch/may19-qwen3-14b/run598-flex-flash-causal-compat-batch164-no-model-compile-pairwise-rope-qkv-grad-input-concat-event-cache0.run.log 2>&1
