commit	tokens_per_sec	mfu_percent	peak_memory_gb	status	description	command
8e2327aa	11943	0.00	163.69	discard	TORCHINDUCTOR_MAX_AUTOTUNE=1 does not improve the FFN-compile batch168 setup	TORCHINDUCTOR_MAX_AUTOTUNE=1 NCCL_CTA_POLICY=2 NGPU=8 LOG_RANK=0 MODULE=qwen3 CONFIG=qwen3_14b ./run_train.sh --training.steps=10 --compile.enable --compile.components=loss,feed_forward --training.dtype=bfloat16 --training.seq_len=128 --training.local_batch_size=168 --loss.num_chunks=4 --dataloader.num_workers=2 --dataloader.persistent_workers --dataloader.prefetch_factor=2 --metrics.log_freq=1 --comm.trace_buf_size=0 --dump_folder=outputs/autoresearch/may19-qwen3-14b/run398-mxfp8-correct-loss-plus-feed-forward-compile-lbs168-torchinductor-max-autotune-last-layer-no-reshard-loss-chunks4-seq128-bf16-nccl-zero-cta-dataloader-worker2-prefetch2-metrics-logfreq1-no-flight-recorder > run.log 2>&1
5e056bb8	11845	0.00	163.69	keep	active FFN-compile batch168 exact rerun is valid but below the measured peak, confirming variance sensitivity	NCCL_CTA_POLICY=2 NGPU=8 LOG_RANK=0 MODULE=qwen3 CONFIG=qwen3_14b ./run_train.sh --training.steps=10 --compile.enable --compile.components=loss,feed_forward --training.dtype=bfloat16 --training.seq_len=128 --training.local_batch_size=168 --loss.num_chunks=4 --dataloader.num_workers=2 --dataloader.persistent_workers --dataloader.prefetch_factor=2 --metrics.log_freq=1 --comm.trace_buf_size=0 --dump_folder=outputs/autoresearch/may19-qwen3-14b/run399-rerun-mxfp8-correct-loss-plus-feed-forward-compile-lbs168-last-layer-no-reshard-loss-chunks4-seq128-bf16-nccl-zero-cta-dataloader-worker2-prefetch2-metrics-logfreq1-no-flight-recorder > run.log 2>&1
9d30d50e+dirty	2480	0.00	173.90	discard	MXFP8 wgrad_with_hp removes wgrad MXFP8 casts but explodes memory pressure and throughput collapses under allocator retries	NCCL_CTA_POLICY=2 NGPU=8 LOG_RANK=0 MODULE=qwen3 CONFIG=qwen3_14b ./run_train.sh --training.steps=10 --compile.enable --compile.components=loss,feed_forward --training.dtype=bfloat16 --training.seq_len=128 --training.local_batch_size=168 --loss.num_chunks=4 --dataloader.num_workers=2 --dataloader.persistent_workers --dataloader.prefetch_factor=2 --metrics.log_freq=1 --comm.trace_buf_size=0 --dump_folder=outputs/autoresearch/may19-qwen3-14b/run400-mxfp8-wgrad-with-hp-feed-forward-compile-lbs168-last-layer-no-reshard-loss-chunks4-seq128-bf16-nccl-zero-cta-dataloader-worker2-prefetch2-metrics-logfreq1-no-flight-recorder > run.log 2>&1
9d30d50e	1782	0.00	173.89	discard	batch184 loss chunks8 hit allocator retries by step2 and was manually stopped after step5	NCCL_CTA_POLICY=2 NGPU=8 LOG_RANK=0 MODULE=qwen3 CONFIG=qwen3_14b ./run_train.sh --training.steps=10 --compile.enable --compile.components=loss,feed_forward --training.dtype=bfloat16 --training.seq_len=128 --training.local_batch_size=184 --loss.num_chunks=8 --dataloader.num_workers=2 --dataloader.persistent_workers --dataloader.prefetch_factor=2 --metrics.log_freq=1 --comm.trace_buf_size=0 --dump_folder=outputs/autoresearch/may19-qwen3-14b/run401-mxfp8-feed-forward-compile-lbs184-loss-chunks8-last-layer-no-reshard-seq128-bf16-nccl-zero-cta-dataloader-worker2-prefetch2-metrics-logfreq1-no-flight-recorder > run.log 2>&1
9d30d50e	11931	0.00	163.69	discard	TORCH_NCCL_HIGH_PRIORITY=1 is valid on the MXFP8 FFN-compile batch168 setup but below the measured peak	TORCH_NCCL_HIGH_PRIORITY=1 NCCL_CTA_POLICY=2 NGPU=8 LOG_RANK=0 MODULE=qwen3 CONFIG=qwen3_14b ./run_train.sh --training.steps=10 --compile.enable --compile.components=loss,feed_forward --training.dtype=bfloat16 --training.seq_len=128 --training.local_batch_size=168 --loss.num_chunks=4 --dataloader.num_workers=2 --dataloader.persistent_workers --dataloader.prefetch_factor=2 --metrics.log_freq=1 --comm.trace_buf_size=0 --dump_folder=outputs/autoresearch/may19-qwen3-14b/run402-mxfp8-feed-forward-compile-lbs168-torch-nccl-high-priority-last-layer-no-reshard-loss-chunks4-seq128-bf16-nccl-zero-cta-dataloader-worker2-prefetch2-metrics-logfreq1-no-flight-recorder > run.log 2>&1
9d30d50e+dirty	11686	0.00	163.69	discard	forward-only FSDP prefetch is slower and loss rises; bidirectional prefetch remains better	NCCL_CTA_POLICY=2 NGPU=8 LOG_RANK=0 MODULE=qwen3 CONFIG=qwen3_14b ./run_train.sh --training.steps=10 --compile.enable --compile.components=loss,feed_forward --training.dtype=bfloat16 --training.seq_len=128 --training.local_batch_size=168 --loss.num_chunks=4 --dataloader.num_workers=2 --dataloader.persistent_workers --dataloader.prefetch_factor=2 --metrics.log_freq=1 --comm.trace_buf_size=0 --dump_folder=outputs/autoresearch/may19-qwen3-14b/run403-mxfp8-feed-forward-compile-lbs168-forward-prefetch-only-last-layer-no-reshard-loss-chunks4-seq128-bf16-nccl-zero-cta-dataloader-worker2-prefetch2-metrics-logfreq1-no-flight-recorder > run.log 2>&1
9d30d50e	12074	0.00	163.69	discard	NCCL_CGA_CLUSTER_SIZE=4 is clean and high-band but remains below the measured MXFP8 FFN-compile peak	NCCL_CGA_CLUSTER_SIZE=4 NCCL_CTA_POLICY=2 NGPU=8 LOG_RANK=0 MODULE=qwen3 CONFIG=qwen3_14b ./run_train.sh --training.steps=10 --compile.enable --compile.components=loss,feed_forward --training.dtype=bfloat16 --training.seq_len=128 --training.local_batch_size=168 --loss.num_chunks=4 --dataloader.num_workers=2 --dataloader.persistent_workers --dataloader.prefetch_factor=2 --metrics.log_freq=1 --comm.trace_buf_size=0 --dump_folder=outputs/autoresearch/may19-qwen3-14b/run404-mxfp8-feed-forward-compile-lbs168-nccl-cga-cluster-size4-last-layer-no-reshard-loss-chunks4-seq128-bf16-nccl-zero-cta-dataloader-worker2-prefetch2-metrics-logfreq1-no-flight-recorder > run.log 2>&1
9d30d50e	12077	0.00	163.69	discard	NCCL_CGA_CLUSTER_SIZE=2 is clean and high-band but still below the measured MXFP8 FFN-compile peak	NCCL_CGA_CLUSTER_SIZE=2 NCCL_CTA_POLICY=2 NGPU=8 LOG_RANK=0 MODULE=qwen3 CONFIG=qwen3_14b ./run_train.sh --training.steps=10 --compile.enable --compile.components=loss,feed_forward --training.dtype=bfloat16 --training.seq_len=128 --training.local_batch_size=168 --loss.num_chunks=4 --dataloader.num_workers=2 --dataloader.persistent_workers --dataloader.prefetch_factor=2 --metrics.log_freq=1 --comm.trace_buf_size=0 --dump_folder=outputs/autoresearch/may19-qwen3-14b/run405-mxfp8-feed-forward-compile-lbs168-nccl-cga-cluster-size2-last-layer-no-reshard-loss-chunks4-seq128-bf16-nccl-zero-cta-dataloader-worker2-prefetch2-metrics-logfreq1-no-flight-recorder > run.log 2>&1
57186cc0	12038	0.00	163.69	discard	NCCL_MIN_CTAS=32 is clean on the MXFP8 FFN-compile batch168 setup but remains below the measured peak	NCCL_MIN_CTAS=32 NCCL_CTA_POLICY=2 NGPU=8 LOG_RANK=0 MODULE=qwen3 CONFIG=qwen3_14b ./run_train.sh --training.steps=10 --compile.enable --compile.components=loss,feed_forward --training.dtype=bfloat16 --training.seq_len=128 --training.local_batch_size=168 --loss.num_chunks=4 --dataloader.num_workers=2 --dataloader.persistent_workers --dataloader.prefetch_factor=2 --metrics.log_freq=1 --comm.trace_buf_size=0 --dump_folder=outputs/autoresearch/may19-qwen3-14b/run406-mxfp8-feed-forward-compile-lbs168-nccl-min-ctas32-last-layer-no-reshard-loss-chunks4-seq128-bf16-nccl-zero-cta-dataloader-worker2-prefetch2-metrics-logfreq1-no-flight-recorder > run.log 2>&1
57186cc0+dirty	12151	0.00	166.95	keep	shared MXFP8 input casting for FFN w1/w3 is a new peak and directly reduces duplicate gate/up activation casts	NCCL_CTA_POLICY=2 NGPU=8 LOG_RANK=0 MODULE=qwen3 CONFIG=qwen3_14b ./run_train.sh --training.steps=10 --compile.enable --compile.components=loss,feed_forward --training.dtype=bfloat16 --training.seq_len=128 --training.local_batch_size=168 --loss.num_chunks=4 --dataloader.num_workers=2 --dataloader.persistent_workers --dataloader.prefetch_factor=2 --metrics.log_freq=1 --comm.trace_buf_size=0 --dump_folder=outputs/autoresearch/may19-qwen3-14b/run407-mxfp8-shared-gate-up-input-cast-feed-forward-compile-lbs168-last-layer-no-reshard-loss-chunks4-seq128-bf16-nccl-zero-cta-dataloader-worker2-prefetch2-metrics-logfreq1-no-flight-recorder > run.log 2>&1
57186cc0+dirty	12072	0.00	169.82	discard	shared MXFP8 input casting with batch172 is slower than batch168 and crosses the preferred memory ceiling	NCCL_CTA_POLICY=2 NGPU=8 LOG_RANK=0 MODULE=qwen3 CONFIG=qwen3_14b ./run_train.sh --training.steps=10 --compile.enable --compile.components=loss,feed_forward --training.dtype=bfloat16 --training.seq_len=128 --training.local_batch_size=172 --loss.num_chunks=4 --dataloader.num_workers=2 --dataloader.persistent_workers --dataloader.prefetch_factor=2 --metrics.log_freq=1 --comm.trace_buf_size=0 --dump_folder=outputs/autoresearch/may19-qwen3-14b/run408-mxfp8-shared-gate-up-input-cast-feed-forward-compile-lbs172-last-layer-no-reshard-loss-chunks4-seq128-bf16-nccl-zero-cta-dataloader-worker2-prefetch2-metrics-logfreq1-no-flight-recorder > run.log 2>&1
533845d4	12182	0.00	166.95	keep	profiled shared MXFP8 gate/up input-cast best; profiled tps is diagnostic and not used alone for ranking	NCCL_CTA_POLICY=2 NGPU=8 LOG_RANK=0 MODULE=qwen3 CONFIG=qwen3_14b ./run_train.sh --training.steps=10 --compile.enable --compile.components=loss,feed_forward --training.dtype=bfloat16 --training.seq_len=128 --training.local_batch_size=168 --loss.num_chunks=4 --dataloader.num_workers=2 --dataloader.persistent_workers --dataloader.prefetch_factor=2 --metrics.log_freq=1 --comm.trace_buf_size=0 --profiler.enable_profiling --profiler.profile_freq=10 --profiler.profiler_warmup=2 --profiler.profiler_active=1 --dump_folder=outputs/autoresearch/may19-qwen3-14b/run409-profile-mxfp8-shared-gate-up-input-cast-feed-forward-compile-lbs168-last-layer-no-reshard-loss-chunks4-seq128-bf16-nccl-zero-cta-dataloader-worker2-prefetch2-metrics-logfreq1-no-flight-recorder > run.log 2>&1
533845d4+dirty	12064	0.00	168.18	discard	two-module FSDP prefetch distance is slower and uses more memory than one-module bidirectional prefetch	NCCL_CTA_POLICY=2 NGPU=8 LOG_RANK=0 MODULE=qwen3 CONFIG=qwen3_14b ./run_train.sh --training.steps=10 --compile.enable --compile.components=loss,feed_forward --training.dtype=bfloat16 --training.seq_len=128 --training.local_batch_size=168 --loss.num_chunks=4 --dataloader.num_workers=2 --dataloader.persistent_workers --dataloader.prefetch_factor=2 --metrics.log_freq=1 --comm.trace_buf_size=0 --dump_folder=outputs/autoresearch/may19-qwen3-14b/run410-mxfp8-shared-gate-up-input-cast-two-module-fsdp-prefetch-feed-forward-compile-lbs168-last-layer-no-reshard-loss-chunks4-seq128-bf16-nccl-zero-cta-dataloader-worker2-prefetch2-metrics-logfreq1-no-flight-recorder > run.log 2>&1
533845d4+dirty	11549	0.00	171.05	discard	partial high-precision wgrad for FFN gate/up removes some MXFP8 casts but is much slower and memory-risky	NCCL_CTA_POLICY=2 NGPU=8 LOG_RANK=0 MODULE=qwen3 CONFIG=qwen3_14b ./run_train.sh --training.steps=10 --compile.enable --compile.components=loss,feed_forward --training.dtype=bfloat16 --training.seq_len=128 --training.local_batch_size=168 --loss.num_chunks=4 --dataloader.num_workers=2 --dataloader.persistent_workers --dataloader.prefetch_factor=2 --metrics.log_freq=1 --comm.trace_buf_size=0 --dump_folder=outputs/autoresearch/may19-qwen3-14b/run411-mxfp8-shared-gate-up-input-cast-hp-wgrad-gate-up-feed-forward-compile-lbs168-last-layer-no-reshard-loss-chunks4-seq128-bf16-nccl-zero-cta-dataloader-worker2-prefetch2-metrics-logfreq1-no-flight-recorder > run.log 2>&1
147122f5	12221	0.00	166.95	keep	shared MXFP8 gate/up input-cast recipe with AdamW weight_decay=0.0 is a new measured peak	NCCL_CTA_POLICY=2 NGPU=8 LOG_RANK=0 MODULE=qwen3 CONFIG=qwen3_14b ./run_train.sh --training.steps=10 --compile.enable --compile.components=loss,feed_forward --training.dtype=bfloat16 --training.seq_len=128 --training.local_batch_size=168 --loss.num_chunks=4 --optimizer.weight_decay=0.0 --dataloader.num_workers=2 --dataloader.persistent_workers --dataloader.prefetch_factor=2 --metrics.log_freq=1 --comm.trace_buf_size=0 --dump_folder=outputs/autoresearch/may19-qwen3-14b/run412-mxfp8-shared-gate-up-input-cast-weight-decay0-feed-forward-compile-lbs168-last-layer-no-reshard-loss-chunks4-seq128-bf16-nccl-zero-cta-dataloader-worker2-prefetch2-metrics-logfreq1-no-flight-recorder > run.log 2>&1
147122f5	12184	0.00	166.95	discard	Adam with weight_decay=0.0 is valid but below AdamW weight_decay=0.0 on the shared-cast recipe	NCCL_CTA_POLICY=2 NGPU=8 LOG_RANK=0 MODULE=qwen3 CONFIG=qwen3_14b ./run_train.sh --training.steps=10 --compile.enable --compile.components=loss,feed_forward --training.dtype=bfloat16 --training.seq_len=128 --training.local_batch_size=168 --loss.num_chunks=4 --optimizer.name=Adam --optimizer.weight_decay=0.0 --dataloader.num_workers=2 --dataloader.persistent_workers --dataloader.prefetch_factor=2 --metrics.log_freq=1 --comm.trace_buf_size=0 --dump_folder=outputs/autoresearch/may19-qwen3-14b/run413-mxfp8-shared-gate-up-input-cast-adam-weight-decay0-feed-forward-compile-lbs168-last-layer-no-reshard-loss-chunks4-seq128-bf16-nccl-zero-cta-dataloader-worker2-prefetch2-metrics-logfreq1-no-flight-recorder > run.log 2>&1
147122f5	12058	0.00	166.95	discard	NCCL_CGA_CLUSTER_SIZE=2 does not compose with the shared-cast weight_decay=0 peak	NCCL_CGA_CLUSTER_SIZE=2 NCCL_CTA_POLICY=2 NGPU=8 LOG_RANK=0 MODULE=qwen3 CONFIG=qwen3_14b ./run_train.sh --training.steps=10 --compile.enable --compile.components=loss,feed_forward --training.dtype=bfloat16 --training.seq_len=128 --training.local_batch_size=168 --loss.num_chunks=4 --optimizer.weight_decay=0.0 --dataloader.num_workers=2 --dataloader.persistent_workers --dataloader.prefetch_factor=2 --metrics.log_freq=1 --comm.trace_buf_size=0 --dump_folder=outputs/autoresearch/may19-qwen3-14b/run414-mxfp8-shared-gate-up-input-cast-weight-decay0-nccl-cga-cluster-size2-feed-forward-compile-lbs168-last-layer-no-reshard-loss-chunks4-seq128-bf16-nccl-zero-cta-dataloader-worker2-prefetch2-metrics-logfreq1-no-flight-recorder > run.log 2>&1
147122f5	11992	0.00	167.34	discard	loss chunks8 is slower and slightly higher memory than chunks4 on the shared-cast weight_decay=0 recipe	NCCL_CTA_POLICY=2 NGPU=8 LOG_RANK=0 MODULE=qwen3 CONFIG=qwen3_14b ./run_train.sh --training.steps=10 --compile.enable --compile.components=loss,feed_forward --training.dtype=bfloat16 --training.seq_len=128 --training.local_batch_size=168 --loss.num_chunks=8 --optimizer.weight_decay=0.0 --dataloader.num_workers=2 --dataloader.persistent_workers --dataloader.prefetch_factor=2 --metrics.log_freq=1 --comm.trace_buf_size=0 --dump_folder=outputs/autoresearch/may19-qwen3-14b/run415-mxfp8-shared-gate-up-input-cast-weight-decay0-loss-chunks8-feed-forward-compile-lbs168-last-layer-no-reshard-seq128-bf16-nccl-zero-cta-dataloader-worker2-prefetch2-metrics-logfreq1-no-flight-recorder > run.log 2>&1
9be1b91c	0	0.00	0.0	crash	loss chunks3 violates the Triton dim1 128-row constraint before step 1 on the shared-cast weight_decay=0 recipe	NCCL_CTA_POLICY=2 NGPU=8 LOG_RANK=0 MODULE=qwen3 CONFIG=qwen3_14b ./run_train.sh --training.steps=10 --compile.enable --compile.components=loss,feed_forward --training.dtype=bfloat16 --training.seq_len=128 --training.local_batch_size=168 --loss.num_chunks=3 --optimizer.weight_decay=0.0 --dataloader.num_workers=2 --dataloader.persistent_workers --dataloader.prefetch_factor=2 --metrics.log_freq=1 --comm.trace_buf_size=0 --dump_folder=outputs/autoresearch/may19-qwen3-14b/run416-mxfp8-shared-gate-up-input-cast-weight-decay0-loss-chunks3-feed-forward-compile-lbs168-last-layer-no-reshard-seq128-bf16-nccl-zero-cta-dataloader-worker2-prefetch2-metrics-logfreq1-no-flight-recorder > run.log 2>&1
9be1b91c	0	0.00	0.0	crash	loss chunks6 also violates the Triton dim1 128-row constraint before step 1 on the shared-cast weight_decay=0 recipe	NCCL_CTA_POLICY=2 NGPU=8 LOG_RANK=0 MODULE=qwen3 CONFIG=qwen3_14b ./run_train.sh --training.steps=10 --compile.enable --compile.components=loss,feed_forward --training.dtype=bfloat16 --training.seq_len=128 --training.local_batch_size=168 --loss.num_chunks=6 --optimizer.weight_decay=0.0 --dataloader.num_workers=2 --dataloader.persistent_workers --dataloader.prefetch_factor=2 --metrics.log_freq=1 --comm.trace_buf_size=0 --dump_folder=outputs/autoresearch/may19-qwen3-14b/run417-mxfp8-shared-gate-up-input-cast-weight-decay0-loss-chunks6-feed-forward-compile-lbs168-last-layer-no-reshard-seq128-bf16-nccl-zero-cta-dataloader-worker2-prefetch2-metrics-logfreq1-no-flight-recorder > run.log 2>&1
b0b9002f+dirty	12093	0.00	166.95	discard	lm_head reshard_after_forward=false is valid but below the shared-cast weight_decay=0 best	NCCL_CTA_POLICY=2 NGPU=8 LOG_RANK=0 MODULE=qwen3 CONFIG=qwen3_14b ./run_train.sh --training.steps=10 --compile.enable --compile.components=loss,feed_forward --training.dtype=bfloat16 --training.seq_len=128 --training.local_batch_size=168 --loss.num_chunks=4 --optimizer.weight_decay=0.0 --dataloader.num_workers=2 --dataloader.persistent_workers --dataloader.prefetch_factor=2 --metrics.log_freq=1 --comm.trace_buf_size=0 --dump_folder=outputs/autoresearch/may19-qwen3-14b/run418-mxfp8-shared-gate-up-input-cast-weight-decay0-lm-head-no-reshard-feed-forward-compile-lbs168-last-layer-no-reshard-loss-chunks4-seq128-bf16-nccl-zero-cta-dataloader-worker2-prefetch2-metrics-logfreq1-no-flight-recorder > run.log 2>&1
6a74ad58	12067	0.00	166.95	discard	bf16 optimizer states do not improve the shared-cast weight_decay=0 recipe	NCCL_CTA_POLICY=2 NGPU=8 LOG_RANK=0 MODULE=qwen3 CONFIG=qwen3_14b ./run_train.sh --training.steps=10 --compile.enable --compile.components=loss,feed_forward --training.dtype=bfloat16 --training.seq_len=128 --training.local_batch_size=168 --loss.num_chunks=4 --optimizer.weight_decay=0.0 --optimizer.implementation=fused_opt_states_bf16 --dataloader.num_workers=2 --dataloader.persistent_workers --dataloader.prefetch_factor=2 --metrics.log_freq=1 --comm.trace_buf_size=0 --dump_folder=outputs/autoresearch/may19-qwen3-14b/run419-mxfp8-shared-gate-up-input-cast-weight-decay0-bf16-opt-states-feed-forward-compile-lbs168-last-layer-no-reshard-loss-chunks4-seq128-bf16-nccl-zero-cta-dataloader-worker2-prefetch2-metrics-logfreq1-no-flight-recorder > run.log 2>&1
d26c5d21+dirty	12138	0.00	166.95	discard	feed-forward residual compile boundary is valid but slower than whole-feed-forward compile on the shared-cast weight_decay=0 recipe	NCCL_CTA_POLICY=2 NGPU=8 LOG_RANK=0 MODULE=qwen3 CONFIG=qwen3_14b ./run_train.sh --training.steps=10 --compile.enable --compile.components=loss,feed_forward_residual --training.dtype=bfloat16 --training.seq_len=128 --training.local_batch_size=168 --loss.num_chunks=4 --optimizer.weight_decay=0.0 --dataloader.num_workers=2 --dataloader.persistent_workers --dataloader.prefetch_factor=2 --metrics.log_freq=1 --comm.trace_buf_size=0 --dump_folder=outputs/autoresearch/may19-qwen3-14b/run420-mxfp8-shared-gate-up-input-cast-weight-decay0-feed-forward-residual-compile-lbs168-last-layer-no-reshard-loss-chunks4-seq128-bf16-nccl-zero-cta-dataloader-worker2-prefetch2-metrics-logfreq1-no-flight-recorder > run.log 2>&1
f6377af4	12249	0.00	166.95	keep	explicit NCCL NVLS composes with the shared-cast weight_decay=0 recipe and is a new measured peak	NCCL_NVLS_ENABLE=1 NCCL_CTA_POLICY=2 NGPU=8 LOG_RANK=0 MODULE=qwen3 CONFIG=qwen3_14b ./run_train.sh --training.steps=10 --compile.enable --compile.components=loss,feed_forward --training.dtype=bfloat16 --training.seq_len=128 --training.local_batch_size=168 --loss.num_chunks=4 --optimizer.weight_decay=0.0 --dataloader.num_workers=2 --dataloader.persistent_workers --dataloader.prefetch_factor=2 --metrics.log_freq=1 --comm.trace_buf_size=0 --dump_folder=outputs/autoresearch/may19-qwen3-14b/run421-mxfp8-shared-gate-up-input-cast-weight-decay0-nccl-nvls-enable-feed-forward-compile-lbs168-last-layer-no-reshard-loss-chunks4-seq128-bf16-nccl-zero-cta-dataloader-worker2-prefetch2-metrics-logfreq1-no-flight-recorder > run.log 2>&1
71171108	11961	0.00	169.82	discard	batch172 remains slower and memory-risky even with explicit NVLS plus weight_decay=0	NCCL_NVLS_ENABLE=1 NCCL_CTA_POLICY=2 NGPU=8 LOG_RANK=0 MODULE=qwen3 CONFIG=qwen3_14b ./run_train.sh --training.steps=10 --compile.enable --compile.components=loss,feed_forward --training.dtype=bfloat16 --training.seq_len=128 --training.local_batch_size=172 --loss.num_chunks=4 --optimizer.weight_decay=0.0 --dataloader.num_workers=2 --dataloader.persistent_workers --dataloader.prefetch_factor=2 --metrics.log_freq=1 --comm.trace_buf_size=0 --dump_folder=outputs/autoresearch/may19-qwen3-14b/run422-mxfp8-shared-gate-up-input-cast-weight-decay0-nccl-nvls-enable-feed-forward-compile-lbs172-last-layer-no-reshard-loss-chunks4-seq128-bf16-nccl-zero-cta-dataloader-worker2-prefetch2-metrics-logfreq1-no-flight-recorder > run.log 2>&1
02dd7f0f+dirty	0	0.00	0.0	crash	reusing saved forward MX weight layout for gate/up grad_input violates TorchAO MX matmul layout requirements	NCCL_NVLS_ENABLE=1 NCCL_CTA_POLICY=2 NGPU=8 LOG_RANK=0 MODULE=qwen3 CONFIG=qwen3_14b ./run_train.sh --training.steps=10 --compile.enable --compile.components=loss,feed_forward --training.dtype=bfloat16 --training.seq_len=128 --training.local_batch_size=168 --loss.num_chunks=4 --optimizer.weight_decay=0.0 --dataloader.num_workers=2 --dataloader.persistent_workers --dataloader.prefetch_factor=2 --metrics.log_freq=1 --comm.trace_buf_size=0 --dump_folder=outputs/autoresearch/may19-qwen3-14b/run423-mxfp8-shared-gate-up-save-forward-weight-mx-for-grad-input-weight-decay0-nccl-nvls-enable-feed-forward-compile-lbs168-last-layer-no-reshard-loss-chunks4-seq128-bf16-nccl-zero-cta-dataloader-worker2-prefetch2-metrics-logfreq1-no-flight-recorder > run.log 2>&1
