commit	tokens_per_sec	mfu_percent	peak_memory_gb	status	description	command
bfc8d098+dirty	14369	0.00	171.09	discard	Inductor max-autotune is valid but increases memory above the target envelope and does not beat the lean model-compile short signal	TORCHINDUCTOR_MAX_AUTOTUNE=1 TORCH_NCCL_CUDA_EVENT_CACHE=0 NCCL_NVLS_ENABLE=1 NCCL_CTA_POLICY=2 NGPU=8 LOG_RANK=0 MODULE=qwen3 CONFIG=qwen3_14b ./run_train.sh --training.steps=10 --compile.enable --compile.components=model,loss,qk_norm_rope,qkv_grad_input_concat,pairwise_rope --training.dtype=bfloat16 --training.seq_len=128 --training.local_batch_size=176 --loss.num_chunks=4 --optimizer.weight_decay=0.0 --dataloader.num_workers=2 --dataloader.persistent_workers --dataloader.prefetch_factor=2 --metrics.log_freq=1 --comm.trace_buf_size=0 --dump_folder=outputs/autoresearch/may19-qwen3-14b/run599-inductor-max-autotune-model-compile-pairwise-rope-qkv-grad-input-concat-batch176-event-cache0 > outputs/autoresearch/may19-qwen3-14b/run599-inductor-max-autotune-model-compile-pairwise-rope-qkv-grad-input-concat-batch176-event-cache0.run.log 2>&1
bfc8d098+dirty	14418	0.00	171.09	discard	Inductor coordinate-descent tuning is valid but greatly increases compile latency and memory without beating the lean model-compile recipe	TORCHINDUCTOR_COORDINATE_DESCENT_TUNING=1 TORCH_NCCL_CUDA_EVENT_CACHE=0 NCCL_NVLS_ENABLE=1 NCCL_CTA_POLICY=2 NGPU=8 LOG_RANK=0 MODULE=qwen3 CONFIG=qwen3_14b ./run_train.sh --training.steps=10 --compile.enable --compile.components=model,loss,qk_norm_rope,qkv_grad_input_concat,pairwise_rope --training.dtype=bfloat16 --training.seq_len=128 --training.local_batch_size=176 --loss.num_chunks=4 --optimizer.weight_decay=0.0 --dataloader.num_workers=2 --dataloader.persistent_workers --dataloader.prefetch_factor=2 --metrics.log_freq=1 --comm.trace_buf_size=0 --dump_folder=outputs/autoresearch/may19-qwen3-14b/run600-inductor-coordinate-descent-model-compile-pairwise-rope-qkv-grad-input-concat-batch176-event-cache0 > outputs/autoresearch/may19-qwen3-14b/run600-inductor-coordinate-descent-model-compile-pairwise-rope-qkv-grad-input-concat-batch176-event-cache0.run.log 2>&1
bfc8d098+dirty	0	0.00	0.00	discard	batch177 boundary probe fails in torchao MXFP8 dim1 conversion with n_rows tiling assertion unsupported	TORCH_NCCL_CUDA_EVENT_CACHE=0 NCCL_NVLS_ENABLE=1 NCCL_CTA_POLICY=2 NGPU=8 LOG_RANK=0 MODULE=qwen3 CONFIG=qwen3_14b ./run_train.sh --training.steps=10 --compile.enable --compile.components=model,loss,qk_norm_rope,qkv_grad_input_concat,pairwise_rope --training.dtype=bfloat16 --training.seq_len=128 --training.local_batch_size=177 --loss.num_chunks=4 --optimizer.weight_decay=0.0 --dataloader.num_workers=2 --dataloader.persistent_workers --dataloader.prefetch_factor=2 --metrics.log_freq=1 --comm.trace_buf_size=0 --dump_folder=outputs/autoresearch/may19-qwen3-14b/run601-model-compile-pairwise-rope-qkv-grad-input-concat-batch177-event-cache0 > outputs/autoresearch/may19-qwen3-14b/run601-model-compile-pairwise-rope-qkv-grad-input-concat-batch177-event-cache0.run.log 2>&1
bfc8d098+dirty	14437	0.00	172.03	discard	resharding the last layer lets batch180 run but memory remains above the target envelope and throughput does not justify the tradeoff	TORCH_NCCL_CUDA_EVENT_CACHE=0 NCCL_NVLS_ENABLE=1 NCCL_CTA_POLICY=2 NGPU=8 LOG_RANK=0 MODULE=qwen3 CONFIG=qwen3_14b ./run_train.sh --training.steps=10 --compile.enable --compile.components=model,loss,qk_norm_rope,qkv_grad_input_concat,pairwise_rope,reshard_last_layer --training.dtype=bfloat16 --training.seq_len=128 --training.local_batch_size=180 --loss.num_chunks=4 --optimizer.weight_decay=0.0 --dataloader.num_workers=2 --dataloader.persistent_workers --dataloader.prefetch_factor=2 --metrics.log_freq=1 --comm.trace_buf_size=0 --dump_folder=outputs/autoresearch/may19-qwen3-14b/run602-reshard-last-layer-model-compile-pairwise-rope-qkv-grad-input-concat-batch180-event-cache0 > outputs/autoresearch/may19-qwen3-14b/run602-reshard-last-layer-model-compile-pairwise-rope-qkv-grad-input-concat-batch180-event-cache0.run.log 2>&1
bfc8d098+dirty	0	0.00	0.00	discard	batch180 with loss chunks8 fails in torchao MXFP8 dim1 conversion with n_rows tiling assertion unsupported	TORCH_NCCL_CUDA_EVENT_CACHE=0 NCCL_NVLS_ENABLE=1 NCCL_CTA_POLICY=2 NGPU=8 LOG_RANK=0 MODULE=qwen3 CONFIG=qwen3_14b ./run_train.sh --training.steps=10 --compile.enable --compile.components=model,loss,qk_norm_rope,qkv_grad_input_concat,pairwise_rope --training.dtype=bfloat16 --training.seq_len=128 --training.local_batch_size=180 --loss.num_chunks=8 --optimizer.weight_decay=0.0 --dataloader.num_workers=2 --dataloader.persistent_workers --dataloader.prefetch_factor=2 --metrics.log_freq=1 --comm.trace_buf_size=0 --dump_folder=outputs/autoresearch/may19-qwen3-14b/run603-model-compile-pairwise-rope-qkv-grad-input-concat-batch180-loss-chunks8-event-cache0 > outputs/autoresearch/may19-qwen3-14b/run603-model-compile-pairwise-rope-qkv-grad-input-concat-batch180-loss-chunks8-event-cache0.run.log 2>&1
bfc8d098+dirty	14565	0.00	168.89	keep	pairwise RoPE block512 on the lean model-compile recipe gives the strongest short signal so far at the same memory peak; needs sustained validation	TORCH_NCCL_CUDA_EVENT_CACHE=0 NCCL_NVLS_ENABLE=1 NCCL_CTA_POLICY=2 NGPU=8 LOG_RANK=0 MODULE=qwen3 CONFIG=qwen3_14b ./run_train.sh --training.steps=10 --compile.enable --compile.components=model,loss,qk_norm_rope,qkv_grad_input_concat,pairwise_rope --training.dtype=bfloat16 --training.seq_len=128 --training.local_batch_size=176 --loss.num_chunks=4 --optimizer.weight_decay=0.0 --dataloader.num_workers=2 --dataloader.persistent_workers --dataloader.prefetch_factor=2 --metrics.log_freq=1 --comm.trace_buf_size=0 --dump_folder=outputs/autoresearch/may19-qwen3-14b/run604-pairwise-rope-block512-model-compile-qkv-grad-input-concat-batch176-event-cache0 > outputs/autoresearch/may19-qwen3-14b/run604-pairwise-rope-block512-model-compile-qkv-grad-input-concat-batch176-event-cache0.run.log 2>&1
bfc8d098+dirty	14309	0.00	168.89	discard	pairwise RoPE block512 gives a strong short spike but sustained steps 11-20 regress below the block256 lean model-compile winner	TORCH_NCCL_CUDA_EVENT_CACHE=0 NCCL_NVLS_ENABLE=1 NCCL_CTA_POLICY=2 NGPU=8 LOG_RANK=0 MODULE=qwen3 CONFIG=qwen3_14b ./run_train.sh --training.steps=20 --compile.enable --compile.components=model,loss,qk_norm_rope,qkv_grad_input_concat,pairwise_rope --training.dtype=bfloat16 --training.seq_len=128 --training.local_batch_size=176 --loss.num_chunks=4 --optimizer.weight_decay=0.0 --dataloader.num_workers=2 --dataloader.persistent_workers --dataloader.prefetch_factor=2 --metrics.log_freq=1 --comm.trace_buf_size=0 --dump_folder=outputs/autoresearch/may19-qwen3-14b/run605-pairwise-rope-block512-model-compile-qkv-grad-input-concat-20step-batch176-event-cache0 > outputs/autoresearch/may19-qwen3-14b/run605-pairwise-rope-block512-model-compile-qkv-grad-input-concat-20step-batch176-event-cache0.run.log 2>&1
bfc8d098+dirty	0	0.00	177.67	discard	torch.compile cudagraphs backend OOMs because CUDA graph private pools push memory far above the target envelope	TORCH_NCCL_CUDA_EVENT_CACHE=0 NCCL_NVLS_ENABLE=1 NCCL_CTA_POLICY=2 NGPU=8 LOG_RANK=0 MODULE=qwen3 CONFIG=qwen3_14b ./run_train.sh --training.steps=10 --compile.enable --compile.backend=cudagraphs --compile.components=model,loss,qk_norm_rope,qkv_grad_input_concat,pairwise_rope --training.dtype=bfloat16 --training.seq_len=128 --training.local_batch_size=176 --loss.num_chunks=4 --optimizer.weight_decay=0.0 --dataloader.num_workers=2 --dataloader.persistent_workers --dataloader.prefetch_factor=2 --metrics.log_freq=1 --comm.trace_buf_size=0 --dump_folder=outputs/autoresearch/may19-qwen3-14b/run606-cudagraphs-backend-model-compile-pairwise-rope-qkv-grad-input-concat-batch176-event-cache0 > outputs/autoresearch/may19-qwen3-14b/run606-cudagraphs-backend-model-compile-pairwise-rope-qkv-grad-input-concat-batch176-event-cache0.run.log 2>&1
bfc8d098+dirty	14311	0.00	168.89	discard	metrics log_freq10 is valid but step20 interval throughput does not beat the log_freq1 sustained winner	TORCH_NCCL_CUDA_EVENT_CACHE=0 NCCL_NVLS_ENABLE=1 NCCL_CTA_POLICY=2 NGPU=8 LOG_RANK=0 MODULE=qwen3 CONFIG=qwen3_14b ./run_train.sh --training.steps=20 --compile.enable --compile.components=model,loss,qk_norm_rope,qkv_grad_input_concat,pairwise_rope --training.dtype=bfloat16 --training.seq_len=128 --training.local_batch_size=176 --loss.num_chunks=4 --optimizer.weight_decay=0.0 --dataloader.num_workers=2 --dataloader.persistent_workers --dataloader.prefetch_factor=2 --metrics.log_freq=10 --comm.trace_buf_size=0 --dump_folder=outputs/autoresearch/may19-qwen3-14b/run607-model-compile-pairwise-rope-qkv-grad-input-concat-20step-batch176-logfreq10-event-cache0 > outputs/autoresearch/may19-qwen3-14b/run607-model-compile-pairwise-rope-qkv-grad-input-concat-20step-batch176-logfreq10-event-cache0.run.log 2>&1
bfc8d098+dirty	14346	0.00	168.89	discard	NCCL_CTA_POLICY=1 is valid but slower than the current CTA policy 2 lean model-compile recipe	TORCH_NCCL_CUDA_EVENT_CACHE=0 NCCL_NVLS_ENABLE=1 NCCL_CTA_POLICY=1 NGPU=8 LOG_RANK=0 MODULE=qwen3 CONFIG=qwen3_14b ./run_train.sh --training.steps=10 --compile.enable --compile.components=model,loss,qk_norm_rope,qkv_grad_input_concat,pairwise_rope --training.dtype=bfloat16 --training.seq_len=128 --training.local_batch_size=176 --loss.num_chunks=4 --optimizer.weight_decay=0.0 --dataloader.num_workers=2 --dataloader.persistent_workers --dataloader.prefetch_factor=2 --metrics.log_freq=1 --comm.trace_buf_size=0 --dump_folder=outputs/autoresearch/may19-qwen3-14b/run608-nccl-cta-policy1-model-compile-pairwise-rope-qkv-grad-input-concat-batch176-event-cache0 > outputs/autoresearch/may19-qwen3-14b/run608-nccl-cta-policy1-model-compile-pairwise-rope-qkv-grad-input-concat-batch176-event-cache0.run.log 2>&1
bfc8d098+dirty	14373	0.00	168.89	discard	NCCL_CTA_POLICY=0 is valid but slower than the current CTA policy 2 lean model-compile recipe	TORCH_NCCL_CUDA_EVENT_CACHE=0 NCCL_NVLS_ENABLE=1 NCCL_CTA_POLICY=0 NGPU=8 LOG_RANK=0 MODULE=qwen3 CONFIG=qwen3_14b ./run_train.sh --training.steps=10 --compile.enable --compile.components=model,loss,qk_norm_rope,qkv_grad_input_concat,pairwise_rope --training.dtype=bfloat16 --training.seq_len=128 --training.local_batch_size=176 --loss.num_chunks=4 --optimizer.weight_decay=0.0 --dataloader.num_workers=2 --dataloader.persistent_workers --dataloader.prefetch_factor=2 --metrics.log_freq=1 --comm.trace_buf_size=0 --dump_folder=outputs/autoresearch/may19-qwen3-14b/run609-nccl-cta-policy0-model-compile-pairwise-rope-qkv-grad-input-concat-batch176-event-cache0 > outputs/autoresearch/may19-qwen3-14b/run609-nccl-cta-policy0-model-compile-pairwise-rope-qkv-grad-input-concat-batch176-event-cache0.run.log 2>&1
bfc8d098+dirty	14395	0.00	168.89	discard	NCCL_NVLS_ENABLE=0 is valid but slower than the NVLS-enabled lean model-compile recipe at the same memory peak	TORCH_NCCL_CUDA_EVENT_CACHE=0 NCCL_NVLS_ENABLE=0 NCCL_CTA_POLICY=2 NGPU=8 LOG_RANK=0 MODULE=qwen3 CONFIG=qwen3_14b ./run_train.sh --training.steps=10 --compile.enable --compile.components=model,loss,qk_norm_rope,qkv_grad_input_concat,pairwise_rope --training.dtype=bfloat16 --training.seq_len=128 --training.local_batch_size=176 --loss.num_chunks=4 --optimizer.weight_decay=0.0 --dataloader.num_workers=2 --dataloader.persistent_workers --dataloader.prefetch_factor=2 --metrics.log_freq=1 --comm.trace_buf_size=0 --dump_folder=outputs/autoresearch/may19-qwen3-14b/run610-nccl-nvls0-model-compile-pairwise-rope-qkv-grad-input-concat-batch176-event-cache0 > outputs/autoresearch/may19-qwen3-14b/run610-nccl-nvls0-model-compile-pairwise-rope-qkv-grad-input-concat-batch176-event-cache0.run.log 2>&1
bfc8d098+dirty	14460	0.00	168.89	keep	TORCH_NCCL_HIGH_PRIORITY=1 on the current lean model-compile recipe improves the short sample at the same memory peak; needs sustained validation	TORCH_NCCL_CUDA_EVENT_CACHE=0 TORCH_NCCL_HIGH_PRIORITY=1 NCCL_NVLS_ENABLE=1 NCCL_CTA_POLICY=2 NGPU=8 LOG_RANK=0 MODULE=qwen3 CONFIG=qwen3_14b ./run_train.sh --training.steps=10 --compile.enable --compile.components=model,loss,qk_norm_rope,qkv_grad_input_concat,pairwise_rope --training.dtype=bfloat16 --training.seq_len=128 --training.local_batch_size=176 --loss.num_chunks=4 --optimizer.weight_decay=0.0 --dataloader.num_workers=2 --dataloader.persistent_workers --dataloader.prefetch_factor=2 --metrics.log_freq=1 --comm.trace_buf_size=0 --dump_folder=outputs/autoresearch/may19-qwen3-14b/run611-nccl-high-priority-model-compile-pairwise-rope-qkv-grad-input-concat-batch176-event-cache0 > outputs/autoresearch/may19-qwen3-14b/run611-nccl-high-priority-model-compile-pairwise-rope-qkv-grad-input-concat-batch176-event-cache0.run.log 2>&1
bfc8d098+dirty	14325	0.00	168.89	discard	TORCH_NCCL_HIGH_PRIORITY=1 gives a strong short sample but sustained steps 11-20 regress below the lean model-compile winner	TORCH_NCCL_CUDA_EVENT_CACHE=0 TORCH_NCCL_HIGH_PRIORITY=1 NCCL_NVLS_ENABLE=1 NCCL_CTA_POLICY=2 NGPU=8 LOG_RANK=0 MODULE=qwen3 CONFIG=qwen3_14b ./run_train.sh --training.steps=20 --compile.enable --compile.components=model,loss,qk_norm_rope,qkv_grad_input_concat,pairwise_rope --training.dtype=bfloat16 --training.seq_len=128 --training.local_batch_size=176 --loss.num_chunks=4 --optimizer.weight_decay=0.0 --dataloader.num_workers=2 --dataloader.persistent_workers --dataloader.prefetch_factor=2 --metrics.log_freq=1 --comm.trace_buf_size=0 --dump_folder=outputs/autoresearch/may19-qwen3-14b/run612-nccl-high-priority-model-compile-pairwise-rope-qkv-grad-input-concat-20step-batch176-event-cache0 > outputs/autoresearch/may19-qwen3-14b/run612-nccl-high-priority-model-compile-pairwise-rope-qkv-grad-input-concat-20step-batch176-event-cache0.run.log 2>&1
bfc8d098+dirty	14461	0.00	170.12	discard	FSDP forward prefetch distance 2 improves the short sample but raises memory above the target envelope, making it too risky versus the 168.89 GiB winner	TORCH_NCCL_CUDA_EVENT_CACHE=0 NCCL_NVLS_ENABLE=1 NCCL_CTA_POLICY=2 NGPU=8 LOG_RANK=0 MODULE=qwen3 CONFIG=qwen3_14b ./run_train.sh --training.steps=10 --compile.enable --compile.components=model,loss,qk_norm_rope,qkv_grad_input_concat,pairwise_rope,fsdp_forward_prefetch2 --training.dtype=bfloat16 --training.seq_len=128 --training.local_batch_size=176 --loss.num_chunks=4 --optimizer.weight_decay=0.0 --dataloader.num_workers=2 --dataloader.persistent_workers --dataloader.prefetch_factor=2 --metrics.log_freq=1 --comm.trace_buf_size=0 --dump_folder=outputs/autoresearch/may19-qwen3-14b/run613-fsdp-forward-prefetch2-model-compile-pairwise-rope-qkv-grad-input-concat-batch176-event-cache0 > outputs/autoresearch/may19-qwen3-14b/run613-fsdp-forward-prefetch2-model-compile-pairwise-rope-qkv-grad-input-concat-batch176-event-cache0.run.log 2>&1
bfc8d098+dirty	14307	0.00	168.89	discard	FSDP backward prefetch distance 2 is valid but slower than the lean model-compile winner at the same memory peak	TORCH_NCCL_CUDA_EVENT_CACHE=0 NCCL_NVLS_ENABLE=1 NCCL_CTA_POLICY=2 NGPU=8 LOG_RANK=0 MODULE=qwen3 CONFIG=qwen3_14b ./run_train.sh --training.steps=10 --compile.enable --compile.components=model,loss,qk_norm_rope,qkv_grad_input_concat,pairwise_rope,fsdp_backward_prefetch2 --training.dtype=bfloat16 --training.seq_len=128 --training.local_batch_size=176 --loss.num_chunks=4 --optimizer.weight_decay=0.0 --dataloader.num_workers=2 --dataloader.persistent_workers --dataloader.prefetch_factor=2 --metrics.log_freq=1 --comm.trace_buf_size=0 --dump_folder=outputs/autoresearch/may19-qwen3-14b/run614-fsdp-backward-prefetch2-model-compile-pairwise-rope-qkv-grad-input-concat-batch176-event-cache0 > outputs/autoresearch/may19-qwen3-14b/run614-fsdp-backward-prefetch2-model-compile-pairwise-rope-qkv-grad-input-concat-batch176-event-cache0.run.log 2>&1
bfc8d098+dirty	14018	0.00	169.45	discard	gate/up MXFP8 grad-input concat is valid but slower and slightly higher-memory than the lean model-compile winner, so QKV concat does not transfer to FFN gate/up	TORCH_NCCL_CUDA_EVENT_CACHE=0 NCCL_NVLS_ENABLE=1 NCCL_CTA_POLICY=2 NGPU=8 LOG_RANK=0 MODULE=qwen3 CONFIG=qwen3_14b ./run_train.sh --training.steps=10 --compile.enable --compile.components=model,loss,qk_norm_rope,qkv_grad_input_concat,pairwise_rope,gate_up_grad_input_concat --training.dtype=bfloat16 --training.seq_len=128 --training.local_batch_size=176 --loss.num_chunks=4 --optimizer.weight_decay=0.0 --dataloader.num_workers=2 --dataloader.persistent_workers --dataloader.prefetch_factor=2 --metrics.log_freq=1 --comm.trace_buf_size=0 --dump_folder=outputs/autoresearch/may19-qwen3-14b/run615-gate-up-grad-input-concat-model-compile-pairwise-rope-qkv-grad-input-concat-batch176-event-cache0 > outputs/autoresearch/may19-qwen3-14b/run615-gate-up-grad-input-concat-model-compile-pairwise-rope-qkv-grad-input-concat-batch176-event-cache0.run.log 2>&1
bfc8d098+dirty	0	0.00	0.00	discard	loss chunks6 on the current lean model-compile stack fails in torchao MXFP8 dim1 conversion because the chunked gradient row count violates the max_row_tile_size divisibility assertion	TORCH_NCCL_CUDA_EVENT_CACHE=0 NCCL_NVLS_ENABLE=1 NCCL_CTA_POLICY=2 NGPU=8 LOG_RANK=0 MODULE=qwen3 CONFIG=qwen3_14b ./run_train.sh --training.steps=10 --compile.enable --compile.components=model,loss,qk_norm_rope,qkv_grad_input_concat,pairwise_rope --training.dtype=bfloat16 --training.seq_len=128 --training.local_batch_size=176 --loss.num_chunks=6 --optimizer.weight_decay=0.0 --dataloader.num_workers=2 --dataloader.persistent_workers --dataloader.prefetch_factor=2 --metrics.log_freq=1 --comm.trace_buf_size=0 --dump_folder=outputs/autoresearch/may19-qwen3-14b/run616-loss-chunks6-model-compile-pairwise-rope-qkv-grad-input-concat-batch176-event-cache0 > outputs/autoresearch/may19-qwen3-14b/run616-loss-chunks6-model-compile-pairwise-rope-qkv-grad-input-concat-batch176-event-cache0.run.log 2>&1
bfc8d098+dirty	14195	0.00	168.91	discard	profile current lean model-compile winner diagnostic: trace still dominated by MXFP8 scaled matmul, NCCL reduce-scatter/all-gather, and MXFP8 dim1 casts; profiler overhead lowers reported throughput	TORCH_NCCL_CUDA_EVENT_CACHE=0 NCCL_NVLS_ENABLE=1 NCCL_CTA_POLICY=2 NGPU=8 LOG_RANK=0 MODULE=qwen3 CONFIG=qwen3_14b ./run_train.sh --training.steps=10 --compile.enable --compile.components=model,loss,qk_norm_rope,qkv_grad_input_concat,pairwise_rope --training.dtype=bfloat16 --training.seq_len=128 --training.local_batch_size=176 --loss.num_chunks=4 --optimizer.weight_decay=0.0 --dataloader.num_workers=2 --dataloader.persistent_workers --dataloader.prefetch_factor=2 --metrics.log_freq=1 --comm.trace_buf_size=0 --profiler.enable_profiling --profiler.profile_freq=10 --profiler.profiler_warmup=2 --profiler.profiler_active=1 --dump_folder=outputs/autoresearch/may19-qwen3-14b/run617-profile-current-winner-model-compile-pairwise-rope-qkv-grad-input-concat-batch176-event-cache0 > outputs/autoresearch/may19-qwen3-14b/run617-profile-current-winner-model-compile-pairwise-rope-qkv-grad-input-concat-batch176-event-cache0.run.log 2>&1
bfc8d098+dirty	14470	0.00	168.91	keep	full QKV backward concat on the lean model-compile stack improves the short sample at nearly unchanged memory; needs sustained validation	TORCH_NCCL_CUDA_EVENT_CACHE=0 NCCL_NVLS_ENABLE=1 NCCL_CTA_POLICY=2 NGPU=8 LOG_RANK=0 MODULE=qwen3 CONFIG=qwen3_14b ./run_train.sh --training.steps=10 --compile.enable --compile.components=model,loss,qk_norm_rope,qkv_backward_concat,pairwise_rope --training.dtype=bfloat16 --training.seq_len=128 --training.local_batch_size=176 --loss.num_chunks=4 --optimizer.weight_decay=0.0 --dataloader.num_workers=2 --dataloader.persistent_workers --dataloader.prefetch_factor=2 --metrics.log_freq=1 --comm.trace_buf_size=0 --dump_folder=outputs/autoresearch/may19-qwen3-14b/run618-qkv-backward-concat-model-compile-pairwise-rope-batch176-event-cache0 > outputs/autoresearch/may19-qwen3-14b/run618-qkv-backward-concat-model-compile-pairwise-rope-batch176-event-cache0.run.log 2>&1
bfc8d098+dirty	14192	0.00	168.91	discard	full QKV backward concat gives a strong short sample on the lean model-compile stack but sustained steps 11-20 regress below the grad-input-only QKV concat winner	TORCH_NCCL_CUDA_EVENT_CACHE=0 NCCL_NVLS_ENABLE=1 NCCL_CTA_POLICY=2 NGPU=8 LOG_RANK=0 MODULE=qwen3 CONFIG=qwen3_14b ./run_train.sh --training.steps=20 --compile.enable --compile.components=model,loss,qk_norm_rope,qkv_backward_concat,pairwise_rope --training.dtype=bfloat16 --training.seq_len=128 --training.local_batch_size=176 --loss.num_chunks=4 --optimizer.weight_decay=0.0 --dataloader.num_workers=2 --dataloader.persistent_workers --dataloader.prefetch_factor=2 --metrics.log_freq=1 --comm.trace_buf_size=0 --dump_folder=outputs/autoresearch/may19-qwen3-14b/run619-qkv-backward-concat-model-compile-pairwise-rope-20step-batch176-event-cache0 > outputs/autoresearch/may19-qwen3-14b/run619-qkv-backward-concat-model-compile-pairwise-rope-20step-batch176-event-cache0.run.log 2>&1
bfc8d098+dirty	14259	0.00	173.11	discard	QKV grad-weight-only concat under lean model compile is slower and raises memory far above the target envelope; grad-input-only remains the best QKV concat mode	TORCH_NCCL_CUDA_EVENT_CACHE=0 NCCL_NVLS_ENABLE=1 NCCL_CTA_POLICY=2 NGPU=8 LOG_RANK=0 MODULE=qwen3 CONFIG=qwen3_14b ./run_train.sh --training.steps=10 --compile.enable --compile.components=model,loss,qk_norm_rope,qkv_grad_weight_concat,pairwise_rope --training.dtype=bfloat16 --training.seq_len=128 --training.local_batch_size=176 --loss.num_chunks=4 --optimizer.weight_decay=0.0 --dataloader.num_workers=2 --dataloader.persistent_workers --dataloader.prefetch_factor=2 --metrics.log_freq=1 --comm.trace_buf_size=0 --dump_folder=outputs/autoresearch/may19-qwen3-14b/run620-qkv-grad-weight-concat-model-compile-pairwise-rope-batch176-event-cache0 > outputs/autoresearch/may19-qwen3-14b/run620-qkv-grad-weight-concat-model-compile-pairwise-rope-batch176-event-cache0.run.log 2>&1
