commit	tokens_per_sec	mfu_percent	peak_memory_gb	status	description	command
fbfd4d9	10301	38.58	169.1	keep	exact current-best rerun stays above old durable threshold	NCCL_CTA_POLICY=2 NGPU=8 LOG_RANK=0 MODULE=qwen3 CONFIG=qwen3_14b ./run_train.sh --training.steps=10 --compile.enable --training.dtype=bfloat16 --training.seq_len=128 --training.local_batch_size=160 --loss.num_chunks=6 --dataloader.num_workers=2 --dataloader.persistent_workers --dataloader.prefetch_factor=2 --comm.trace_buf_size=0 --dump_folder=outputs/autoresearch/may19-qwen3-14b/run190-rerun-sdpa-prefetch-seq128-lbs160-compile-bf16-nccl-zero-cta-loss-chunks6-dataloader-worker2-prefetch2-no-flight-recorder > run.log 2>&1
4c85a38	9742	36.48	175.8	discard	transformer layer partial reshard_after_forward=4 is memory-risky and slower	NCCL_CTA_POLICY=2 NGPU=8 LOG_RANK=0 MODULE=qwen3 CONFIG=qwen3_14b ./run_train.sh --training.steps=10 --compile.enable --training.dtype=bfloat16 --training.seq_len=128 --training.local_batch_size=160 --loss.num_chunks=6 --dataloader.num_workers=2 --dataloader.persistent_workers --dataloader.prefetch_factor=2 --comm.trace_buf_size=0 --dump_folder=outputs/autoresearch/may19-qwen3-14b/run191-partial-reshard4-sdpa-prefetch-seq128-lbs160-compile-bf16-nccl-zero-cta-loss-chunks6-dataloader-worker2-prefetch2-no-flight-recorder > run.log 2>&1
8f860b0	3168	11.86	175.9	discard	transformer layer partial reshard_after_forward=2 causes allocator retries	NCCL_CTA_POLICY=2 NGPU=8 LOG_RANK=0 MODULE=qwen3 CONFIG=qwen3_14b ./run_train.sh --training.steps=10 --compile.enable --training.dtype=bfloat16 --training.seq_len=128 --training.local_batch_size=160 --loss.num_chunks=6 --dataloader.num_workers=2 --dataloader.persistent_workers --dataloader.prefetch_factor=2 --comm.trace_buf_size=0 --dump_folder=outputs/autoresearch/may19-qwen3-14b/run192-partial-reshard2-sdpa-prefetch-seq128-lbs160-compile-bf16-nccl-zero-cta-loss-chunks6-dataloader-worker2-prefetch2-no-flight-recorder > run.log 2>&1
b6933b8	10279	38.49	169.1	discard	TOKENIZERS_PARALLELISM does not beat current DataLoader best	TOKENIZERS_PARALLELISM=true NCCL_CTA_POLICY=2 NGPU=8 LOG_RANK=0 MODULE=qwen3 CONFIG=qwen3_14b ./run_train.sh --training.steps=10 --compile.enable --training.dtype=bfloat16 --training.seq_len=128 --training.local_batch_size=160 --loss.num_chunks=6 --dataloader.num_workers=2 --dataloader.persistent_workers --dataloader.prefetch_factor=2 --comm.trace_buf_size=0 --dump_folder=outputs/autoresearch/may19-qwen3-14b/run193-sdpa-prefetch-seq128-lbs160-compile-bf16-nccl-zero-cta-loss-chunks6-dataloader-worker2-prefetch2-tokenizers-parallelism-no-flight-recorder > run.log 2>&1
20cc910	6808	25.49	169.1	discard	effectively disabled gradient clipping severely regresses throughput	NCCL_CTA_POLICY=2 NGPU=8 LOG_RANK=0 MODULE=qwen3 CONFIG=qwen3_14b ./run_train.sh --training.steps=10 --compile.enable --training.dtype=bfloat16 --training.seq_len=128 --training.local_batch_size=160 --loss.num_chunks=6 --dataloader.num_workers=2 --dataloader.persistent_workers --dataloader.prefetch_factor=2 --training.max_norm=1000000.0 --comm.trace_buf_size=0 --dump_folder=outputs/autoresearch/may19-qwen3-14b/run194-sdpa-prefetch-seq128-lbs160-compile-bf16-nccl-zero-cta-loss-chunks6-dataloader-worker2-prefetch2-max-norm-large-no-flight-recorder > run.log 2>&1
aa9ccb8	10336	38.71	169.1	keep	OMP_NUM_THREADS=2 is a tiny tentative new measured high needing validation	OMP_NUM_THREADS=2 NCCL_CTA_POLICY=2 NGPU=8 LOG_RANK=0 MODULE=qwen3 CONFIG=qwen3_14b ./run_train.sh --training.steps=10 --compile.enable --training.dtype=bfloat16 --training.seq_len=128 --training.local_batch_size=160 --loss.num_chunks=6 --dataloader.num_workers=2 --dataloader.persistent_workers --dataloader.prefetch_factor=2 --comm.trace_buf_size=0 --dump_folder=outputs/autoresearch/may19-qwen3-14b/run195-sdpa-prefetch-seq128-lbs160-compile-bf16-nccl-zero-cta-loss-chunks6-dataloader-worker2-prefetch2-omp2-no-flight-recorder > run.log 2>&1
767a4b4	10259	38.42	169.1	discard	exact OMP_NUM_THREADS=2 rerun fails to validate tiny measured high	OMP_NUM_THREADS=2 NCCL_CTA_POLICY=2 NGPU=8 LOG_RANK=0 MODULE=qwen3 CONFIG=qwen3_14b ./run_train.sh --training.steps=10 --compile.enable --training.dtype=bfloat16 --training.seq_len=128 --training.local_batch_size=160 --loss.num_chunks=6 --dataloader.num_workers=2 --dataloader.persistent_workers --dataloader.prefetch_factor=2 --comm.trace_buf_size=0 --dump_folder=outputs/autoresearch/may19-qwen3-14b/run196-rerun-sdpa-prefetch-seq128-lbs160-compile-bf16-nccl-zero-cta-loss-chunks6-dataloader-worker2-prefetch2-omp2-no-flight-recorder > run.log 2>&1
3cdc4e9	10311	38.61	170.9	discard	local_batch_size=162 is below best and memory-risky	NCCL_CTA_POLICY=2 NGPU=8 LOG_RANK=0 MODULE=qwen3 CONFIG=qwen3_14b ./run_train.sh --training.steps=10 --compile.enable --training.dtype=bfloat16 --training.seq_len=128 --training.local_batch_size=162 --loss.num_chunks=6 --dataloader.num_workers=2 --dataloader.persistent_workers --dataloader.prefetch_factor=2 --comm.trace_buf_size=0 --dump_folder=outputs/autoresearch/may19-qwen3-14b/run197-sdpa-prefetch-seq128-lbs162-compile-bf16-nccl-zero-cta-loss-chunks6-dataloader-worker2-prefetch2-no-flight-recorder > run.log 2>&1
4614050	9940	N/A	129.9	discard	Float8LinearConverter lowers memory but slows current command	NCCL_CTA_POLICY=2 NGPU=8 LOG_RANK=0 MODULE=qwen3 CONFIG=qwen3_14b ./run_train.sh --training.steps=10 --compile.enable --training.dtype=bfloat16 --training.seq_len=128 --training.local_batch_size=160 --loss.num_chunks=6 --dataloader.num_workers=2 --dataloader.persistent_workers --dataloader.prefetch_factor=2 --comm.trace_buf_size=0 --dump_folder=outputs/autoresearch/may19-qwen3-14b/run198-float8-linear-sdpa-prefetch-seq128-lbs160-compile-bf16-nccl-zero-cta-loss-chunks6-dataloader-worker2-prefetch2-no-flight-recorder > run.log 2>&1
a8d8ed2	0	0.00	0.0	crash	flex_flash attention cannot lower without CUTE flash library	NCCL_CTA_POLICY=2 NGPU=8 LOG_RANK=0 MODULE=qwen3 CONFIG=qwen3_14b ./run_train.sh --training.steps=10 --compile.enable --training.dtype=bfloat16 --training.seq_len=128 --training.local_batch_size=160 --loss.num_chunks=6 --dataloader.num_workers=2 --dataloader.persistent_workers --dataloader.prefetch_factor=2 --comm.trace_buf_size=0 --dump_folder=outputs/autoresearch/may19-qwen3-14b/run199-flex-flash-sdpa-replacement-prefetch-seq128-lbs160-compile-bf16-nccl-zero-cta-loss-chunks6-dataloader-worker2-prefetch2-no-flight-recorder > run.log 2>&1
3adbc3f	9992	37.42	168.4	discard	plain flex attention runs but is slower than SDPA	NCCL_CTA_POLICY=2 NGPU=8 LOG_RANK=0 MODULE=qwen3 CONFIG=qwen3_14b ./run_train.sh --training.steps=10 --compile.enable --training.dtype=bfloat16 --training.seq_len=128 --training.local_batch_size=160 --loss.num_chunks=6 --dataloader.num_workers=2 --dataloader.persistent_workers --dataloader.prefetch_factor=2 --comm.trace_buf_size=0 --dump_folder=outputs/autoresearch/may19-qwen3-14b/run200-flex-attention-sdpa-replacement-prefetch-seq128-lbs160-compile-bf16-nccl-zero-cta-loss-chunks6-dataloader-worker2-prefetch2-no-flight-recorder > run.log 2>&1
2eeafe1	9690	36.29	169.1	discard	disabling structured logging regresses current best command	NCCL_CTA_POLICY=2 NGPU=8 LOG_RANK=0 MODULE=qwen3 CONFIG=qwen3_14b ./run_train.sh --training.steps=10 --compile.enable --training.dtype=bfloat16 --training.seq_len=128 --training.local_batch_size=160 --loss.num_chunks=6 --dataloader.num_workers=2 --dataloader.persistent_workers --dataloader.prefetch_factor=2 --debug.no-enable-structured-logging --comm.trace_buf_size=0 --dump_folder=outputs/autoresearch/may19-qwen3-14b/run201-sdpa-prefetch-seq128-lbs160-compile-bf16-nccl-zero-cta-loss-chunks6-dataloader-worker2-prefetch2-no-structured-logging-no-flight-recorder > run.log 2>&1
2a15e78	9756	36.54	169.1	discard	profile current best two-worker SDPA command diagnostic	NCCL_CTA_POLICY=2 NGPU=8 LOG_RANK=0 MODULE=qwen3 CONFIG=qwen3_14b ./run_train.sh --training.steps=10 --compile.enable --training.dtype=bfloat16 --training.seq_len=128 --training.local_batch_size=160 --loss.num_chunks=6 --dataloader.num_workers=2 --dataloader.persistent_workers --dataloader.prefetch_factor=2 --comm.trace_buf_size=0 --dump_folder=outputs/autoresearch/may19-qwen3-14b/run202-profile-sdpa-prefetch-seq128-lbs160-compile-bf16-nccl-zero-cta-loss-chunks6-dataloader-worker2-prefetch2-no-flight-recorder --profiler.enable_profiling --profiler.profile_freq=10 --profiler.profiler_warmup=2 --profiler.profiler_active=1 > run.log 2>&1
a3ecec9	2824	10.58	175.4	discard	HSDP 2x4 causes severe allocator pressure and throughput collapse	NCCL_CTA_POLICY=2 NGPU=8 LOG_RANK=0 MODULE=qwen3 CONFIG=qwen3_14b ./run_train.sh --training.steps=10 --compile.enable --training.dtype=bfloat16 --training.seq_len=128 --training.local_batch_size=160 --loss.num_chunks=6 --dataloader.num_workers=2 --dataloader.persistent_workers --dataloader.prefetch_factor=2 --parallelism.data_parallel_replicate_degree=2 --parallelism.data_parallel_shard_degree=4 --comm.trace_buf_size=0 --dump_folder=outputs/autoresearch/may19-qwen3-14b/run203-hsdp2x4-sdpa-prefetch-seq128-lbs160-compile-bf16-nccl-zero-cta-loss-chunks6-dataloader-worker2-prefetch2-no-flight-recorder > run.log 2>&1
68f7e79	10256	38.41	169.1	discard	NCCL_BUFFSIZE=8388608 is clean but below current best	NCCL_BUFFSIZE=8388608 NCCL_CTA_POLICY=2 NGPU=8 LOG_RANK=0 MODULE=qwen3 CONFIG=qwen3_14b ./run_train.sh --training.steps=10 --compile.enable --training.dtype=bfloat16 --training.seq_len=128 --training.local_batch_size=160 --loss.num_chunks=6 --dataloader.num_workers=2 --dataloader.persistent_workers --dataloader.prefetch_factor=2 --comm.trace_buf_size=0 --dump_folder=outputs/autoresearch/may19-qwen3-14b/run204-sdpa-prefetch-seq128-lbs160-compile-bf16-nccl-zero-cta-buffsize8m-loss-chunks6-dataloader-worker2-prefetch2-no-flight-recorder > run.log 2>&1
3eb10e9	10254	N/A	157.0	discard	Float8 batch200 uses memory headroom but remains below BF16 best	NCCL_CTA_POLICY=2 NGPU=8 LOG_RANK=0 MODULE=qwen3 CONFIG=qwen3_14b ./run_train.sh --training.steps=10 --compile.enable --training.dtype=bfloat16 --training.seq_len=128 --training.local_batch_size=200 --loss.num_chunks=6 --dataloader.num_workers=2 --dataloader.persistent_workers --dataloader.prefetch_factor=2 --comm.trace_buf_size=0 --dump_folder=outputs/autoresearch/may19-qwen3-14b/run205-float8-linear-sdpa-prefetch-seq128-lbs200-compile-bf16-nccl-zero-cta-loss-chunks6-dataloader-worker2-prefetch2-no-flight-recorder > run.log 2>&1
82f5bef	10281	38.50	169.1	keep	exact current-best rerun after Float8 restore stays in variance band	NCCL_CTA_POLICY=2 NGPU=8 LOG_RANK=0 MODULE=qwen3 CONFIG=qwen3_14b ./run_train.sh --training.steps=10 --compile.enable --training.dtype=bfloat16 --training.seq_len=128 --training.local_batch_size=160 --loss.num_chunks=6 --dataloader.num_workers=2 --dataloader.persistent_workers --dataloader.prefetch_factor=2 --comm.trace_buf_size=0 --dump_folder=outputs/autoresearch/may19-qwen3-14b/run206-rerun-sdpa-prefetch-seq128-lbs160-compile-bf16-nccl-zero-cta-loss-chunks6-dataloader-worker2-prefetch2-no-flight-recorder > run.log 2>&1
9164c0e	10259	38.42	169.1	discard	NCCL_MIN_CTAS=16 does not improve current best	NCCL_MIN_CTAS=16 NCCL_CTA_POLICY=2 NGPU=8 LOG_RANK=0 MODULE=qwen3 CONFIG=qwen3_14b ./run_train.sh --training.steps=10 --compile.enable --training.dtype=bfloat16 --training.seq_len=128 --training.local_batch_size=160 --loss.num_chunks=6 --dataloader.num_workers=2 --dataloader.persistent_workers --dataloader.prefetch_factor=2 --comm.trace_buf_size=0 --dump_folder=outputs/autoresearch/may19-qwen3-14b/run207-sdpa-prefetch-seq128-lbs160-compile-bf16-nccl-zero-cta-min-ctas16-loss-chunks6-dataloader-worker2-prefetch2-no-flight-recorder > run.log 2>&1
3dd87fe	10244	38.36	169.1	discard	NCCL_BUFFSIZE=2097152 is slower than default buffer size	NCCL_BUFFSIZE=2097152 NCCL_CTA_POLICY=2 NGPU=8 LOG_RANK=0 MODULE=qwen3 CONFIG=qwen3_14b ./run_train.sh --training.steps=10 --compile.enable --training.dtype=bfloat16 --training.seq_len=128 --training.local_batch_size=160 --loss.num_chunks=6 --dataloader.num_workers=2 --dataloader.persistent_workers --dataloader.prefetch_factor=2 --comm.trace_buf_size=0 --dump_folder=outputs/autoresearch/may19-qwen3-14b/run208-sdpa-prefetch-seq128-lbs160-compile-bf16-nccl-zero-cta-buffsize2m-loss-chunks6-dataloader-worker2-prefetch2-no-flight-recorder > run.log 2>&1
404343c	10110	37.86	169.7	discard	gradient accumulation 2 is slower and slightly memory-riskier	NCCL_CTA_POLICY=2 NGPU=8 LOG_RANK=0 MODULE=qwen3 CONFIG=qwen3_14b ./run_train.sh --training.steps=10 --compile.enable --training.dtype=bfloat16 --training.seq_len=128 --training.local_batch_size=160 --training.global_batch_size=2560 --loss.num_chunks=6 --dataloader.num_workers=2 --dataloader.persistent_workers --dataloader.prefetch_factor=2 --comm.trace_buf_size=0 --dump_folder=outputs/autoresearch/may19-qwen3-14b/run209-sdpa-prefetch-seq128-lbs160-gbs2560-gradacc2-compile-bf16-nccl-zero-cta-loss-chunks6-dataloader-worker2-prefetch2-no-flight-recorder > run.log 2>&1
87d1af1	10409	38.98	169.1	keep	metrics log_freq=5 gives tentative reported-tps high	NCCL_CTA_POLICY=2 NGPU=8 LOG_RANK=0 MODULE=qwen3 CONFIG=qwen3_14b ./run_train.sh --training.steps=10 --compile.enable --training.dtype=bfloat16 --training.seq_len=128 --training.local_batch_size=160 --loss.num_chunks=6 --dataloader.num_workers=2 --dataloader.persistent_workers --dataloader.prefetch_factor=2 --metrics.log_freq=5 --comm.trace_buf_size=0 --dump_folder=outputs/autoresearch/may19-qwen3-14b/run210-sdpa-prefetch-seq128-lbs160-compile-bf16-nccl-zero-cta-loss-chunks6-dataloader-worker2-prefetch2-metrics-logfreq5-no-flight-recorder > run.log 2>&1
63c8faa	10421	39.02	169.1	keep	exact metrics log_freq=5 rerun validates new reported-tps best	NCCL_CTA_POLICY=2 NGPU=8 LOG_RANK=0 MODULE=qwen3 CONFIG=qwen3_14b ./run_train.sh --training.steps=10 --compile.enable --training.dtype=bfloat16 --training.seq_len=128 --training.local_batch_size=160 --loss.num_chunks=6 --dataloader.num_workers=2 --dataloader.persistent_workers --dataloader.prefetch_factor=2 --metrics.log_freq=5 --comm.trace_buf_size=0 --dump_folder=outputs/autoresearch/may19-qwen3-14b/run211-rerun-sdpa-prefetch-seq128-lbs160-compile-bf16-nccl-zero-cta-loss-chunks6-dataloader-worker2-prefetch2-metrics-logfreq5-no-flight-recorder > run.log 2>&1
832d165	10490	39.28	169.1	keep	metrics log_freq=2 gives tentative reported-tps high	NCCL_CTA_POLICY=2 NGPU=8 LOG_RANK=0 MODULE=qwen3 CONFIG=qwen3_14b ./run_train.sh --training.steps=10 --compile.enable --training.dtype=bfloat16 --training.seq_len=128 --training.local_batch_size=160 --loss.num_chunks=6 --dataloader.num_workers=2 --dataloader.persistent_workers --dataloader.prefetch_factor=2 --metrics.log_freq=2 --comm.trace_buf_size=0 --dump_folder=outputs/autoresearch/may19-qwen3-14b/run212-sdpa-prefetch-seq128-lbs160-compile-bf16-nccl-zero-cta-loss-chunks6-dataloader-worker2-prefetch2-metrics-logfreq2-no-flight-recorder > run.log 2>&1
f52ea6d	10504	39.33	169.1	keep	exact metrics log_freq=2 rerun validates new reported-tps best	NCCL_CTA_POLICY=2 NGPU=8 LOG_RANK=0 MODULE=qwen3 CONFIG=qwen3_14b ./run_train.sh --training.steps=10 --compile.enable --training.dtype=bfloat16 --training.seq_len=128 --training.local_batch_size=160 --loss.num_chunks=6 --dataloader.num_workers=2 --dataloader.persistent_workers --dataloader.prefetch_factor=2 --metrics.log_freq=2 --comm.trace_buf_size=0 --dump_folder=outputs/autoresearch/may19-qwen3-14b/run213-rerun-sdpa-prefetch-seq128-lbs160-compile-bf16-nccl-zero-cta-loss-chunks6-dataloader-worker2-prefetch2-metrics-logfreq2-no-flight-recorder > run.log 2>&1
d77a2db	10530	39.43	169.1	keep	metrics log_freq=1 gives tentative reported-tps high	NCCL_CTA_POLICY=2 NGPU=8 LOG_RANK=0 MODULE=qwen3 CONFIG=qwen3_14b ./run_train.sh --training.steps=10 --compile.enable --training.dtype=bfloat16 --training.seq_len=128 --training.local_batch_size=160 --loss.num_chunks=6 --dataloader.num_workers=2 --dataloader.persistent_workers --dataloader.prefetch_factor=2 --metrics.log_freq=1 --comm.trace_buf_size=0 --dump_folder=outputs/autoresearch/may19-qwen3-14b/run214-sdpa-prefetch-seq128-lbs160-compile-bf16-nccl-zero-cta-loss-chunks6-dataloader-worker2-prefetch2-metrics-logfreq1-no-flight-recorder > run.log 2>&1
45a3de3	10625	39.79	169.1	keep	exact metrics log_freq=1 rerun validates new reported-tps best	NCCL_CTA_POLICY=2 NGPU=8 LOG_RANK=0 MODULE=qwen3 CONFIG=qwen3_14b ./run_train.sh --training.steps=10 --compile.enable --training.dtype=bfloat16 --training.seq_len=128 --training.local_batch_size=160 --loss.num_chunks=6 --dataloader.num_workers=2 --dataloader.persistent_workers --dataloader.prefetch_factor=2 --metrics.log_freq=1 --comm.trace_buf_size=0 --dump_folder=outputs/autoresearch/may19-qwen3-14b/run215-rerun-sdpa-prefetch-seq128-lbs160-compile-bf16-nccl-zero-cta-loss-chunks6-dataloader-worker2-prefetch2-metrics-logfreq1-no-flight-recorder > run.log 2>&1
3d1561d	10410	38.98	169.1	discard	no structured logging regresses under metrics log_freq=1	NCCL_CTA_POLICY=2 NGPU=8 LOG_RANK=0 MODULE=qwen3 CONFIG=qwen3_14b ./run_train.sh --training.steps=10 --compile.enable --training.dtype=bfloat16 --training.seq_len=128 --training.local_batch_size=160 --loss.num_chunks=6 --dataloader.num_workers=2 --dataloader.persistent_workers --dataloader.prefetch_factor=2 --metrics.log_freq=1 --debug.no-enable-structured-logging --comm.trace_buf_size=0 --dump_folder=outputs/autoresearch/may19-qwen3-14b/run216-sdpa-prefetch-seq128-lbs160-compile-bf16-nccl-zero-cta-loss-chunks6-dataloader-worker2-prefetch2-metrics-logfreq1-no-structured-logging-no-flight-recorder > run.log 2>&1
ffbdf7c	10550	39.51	169.1	discard	disable color printing under log_freq=1 does not beat best	NCCL_CTA_POLICY=2 NGPU=8 LOG_RANK=0 MODULE=qwen3 CONFIG=qwen3_14b ./run_train.sh --training.steps=10 --compile.enable --training.dtype=bfloat16 --training.seq_len=128 --training.local_batch_size=160 --loss.num_chunks=6 --dataloader.num_workers=2 --dataloader.persistent_workers --dataloader.prefetch_factor=2 --metrics.log_freq=1 --metrics.disable_color_printing --comm.trace_buf_size=0 --dump_folder=outputs/autoresearch/may19-qwen3-14b/run217-sdpa-prefetch-seq128-lbs160-compile-bf16-nccl-zero-cta-loss-chunks6-dataloader-worker2-prefetch2-metrics-logfreq1-no-color-no-flight-recorder > run.log 2>&1
bc777c9	10465	39.19	170.0	discard	local_batch_size=161 under log_freq=1 is slower and memory-risky	NCCL_CTA_POLICY=2 NGPU=8 LOG_RANK=0 MODULE=qwen3 CONFIG=qwen3_14b ./run_train.sh --training.steps=10 --compile.enable --training.dtype=bfloat16 --training.seq_len=128 --training.local_batch_size=161 --loss.num_chunks=6 --dataloader.num_workers=2 --dataloader.persistent_workers --dataloader.prefetch_factor=2 --metrics.log_freq=1 --comm.trace_buf_size=0 --dump_folder=outputs/autoresearch/may19-qwen3-14b/run218-sdpa-prefetch-seq128-lbs161-compile-bf16-nccl-zero-cta-loss-chunks6-dataloader-worker2-prefetch2-metrics-logfreq1-no-flight-recorder > run.log 2>&1
b943d52	10404	38.96	169.1	discard	profile current log_freq=1 best diagnostic	NCCL_CTA_POLICY=2 NGPU=8 LOG_RANK=0 MODULE=qwen3 CONFIG=qwen3_14b ./run_train.sh --training.steps=10 --compile.enable --training.dtype=bfloat16 --training.seq_len=128 --training.local_batch_size=160 --loss.num_chunks=6 --dataloader.num_workers=2 --dataloader.persistent_workers --dataloader.prefetch_factor=2 --metrics.log_freq=1 --comm.trace_buf_size=0 --dump_folder=outputs/autoresearch/may19-qwen3-14b/run219-profile-sdpa-prefetch-seq128-lbs160-compile-bf16-nccl-zero-cta-loss-chunks6-dataloader-worker2-prefetch2-metrics-logfreq1-no-flight-recorder --profiler.enable_profiling --profiler.profile_freq=10 --profiler.profiler_warmup=2 --profiler.profiler_active=1 > run.log 2>&1
9b04a30	10482	39.25	171.4	discard	coordinate descent tuning only is slower and memory-risky	TORCHINDUCTOR_COORDINATE_DESCENT_TUNING=1 NCCL_CTA_POLICY=2 NGPU=8 LOG_RANK=0 MODULE=qwen3 CONFIG=qwen3_14b ./run_train.sh --training.steps=10 --compile.enable --training.dtype=bfloat16 --training.seq_len=128 --training.local_batch_size=160 --loss.num_chunks=6 --dataloader.num_workers=2 --dataloader.persistent_workers --dataloader.prefetch_factor=2 --metrics.log_freq=1 --comm.trace_buf_size=0 --dump_folder=outputs/autoresearch/may19-qwen3-14b/run220-sdpa-prefetch-seq128-lbs160-compile-bf16-nccl-zero-cta-loss-chunks6-dataloader-worker2-prefetch2-metrics-logfreq1-inductor-coordinate-descent-no-flight-recorder > run.log 2>&1
27165c5	10594	39.67	169.1	keep	exact current-best log_freq=1 rerun stays in variance band	NCCL_CTA_POLICY=2 NGPU=8 LOG_RANK=0 MODULE=qwen3 CONFIG=qwen3_14b ./run_train.sh --training.steps=10 --compile.enable --training.dtype=bfloat16 --training.seq_len=128 --training.local_batch_size=160 --loss.num_chunks=6 --dataloader.num_workers=2 --dataloader.persistent_workers --dataloader.prefetch_factor=2 --metrics.log_freq=1 --comm.trace_buf_size=0 --dump_folder=outputs/autoresearch/may19-qwen3-14b/run221-rerun-sdpa-prefetch-seq128-lbs160-compile-bf16-nccl-zero-cta-loss-chunks6-dataloader-worker2-prefetch2-metrics-logfreq1-no-flight-recorder > run.log 2>&1
08ea81d	10509	39.35	169.1	discard	lm_head reshard_after_forward=false does not improve current best	NCCL_CTA_POLICY=2 NGPU=8 LOG_RANK=0 MODULE=qwen3 CONFIG=qwen3_14b ./run_train.sh --training.steps=10 --compile.enable --training.dtype=bfloat16 --training.seq_len=128 --training.local_batch_size=160 --loss.num_chunks=6 --dataloader.num_workers=2 --dataloader.persistent_workers --dataloader.prefetch_factor=2 --metrics.log_freq=1 --comm.trace_buf_size=0 --dump_folder=outputs/autoresearch/may19-qwen3-14b/run222-lm-head-no-reshard-sdpa-prefetch-seq128-lbs160-compile-bf16-nccl-zero-cta-loss-chunks6-dataloader-worker2-prefetch2-metrics-logfreq1-no-flight-recorder > run.log 2>&1
