commit	tokens_per_sec	mfu_percent	peak_memory_gb	status	description	command
041eef8	7506	0.00	168.7	discard	broad FP8 SDPA seq128 local batch 220 regresses	NGPU=8 LOG_RANK=0 MODULE=qwen3 CONFIG=qwen3_14b ./run_train.sh --training.steps=10 --compile.enable --training.dtype=bfloat16 --training.seq_len=128 --training.local_batch_size=220 --comm.trace_buf_size=0 --dump_folder=outputs/autoresearch/may19-qwen3-14b/run107-sdpa-fp8-rowwise-no-filter-prefetch-seq128-lbs220-compile-bf16-no-flight-recorder > run.log 2>&1
8512bac	9925	37.30	168.6	discard	SDPA seq256 local batch 80 below seq128 best	NGPU=8 LOG_RANK=0 MODULE=qwen3 CONFIG=qwen3_14b ./run_train.sh --training.steps=10 --compile.enable --training.dtype=bfloat16 --training.seq_len=256 --training.local_batch_size=80 --comm.trace_buf_size=0 --dump_folder=outputs/autoresearch/may19-qwen3-14b/run108-sdpa-prefetch-seq256-lbs80-compile-bf16-no-flight-recorder > run.log 2>&1
7e3de1d	9933	37.16	168.3	discard	SDPA seq96 local batch 213 below seq128 best	NGPU=8 LOG_RANK=0 MODULE=qwen3 CONFIG=qwen3_14b ./run_train.sh --training.steps=10 --compile.enable --training.dtype=bfloat16 --training.seq_len=96 --training.local_batch_size=213 --comm.trace_buf_size=0 --dump_folder=outputs/autoresearch/may19-qwen3-14b/run109-sdpa-prefetch-seq96-lbs213-compile-bf16-no-flight-recorder > run.log 2>&1
c0ce544	9949	37.26	167.7	discard	SDPA seq128 local batch 159 below batch160 best	NGPU=8 LOG_RANK=0 MODULE=qwen3 CONFIG=qwen3_14b ./run_train.sh --training.steps=10 --compile.enable --training.dtype=bfloat16 --training.seq_len=128 --training.local_batch_size=159 --comm.trace_buf_size=0 --dump_folder=outputs/autoresearch/may19-qwen3-14b/run110-sdpa-prefetch-seq128-lbs159-compile-bf16-no-flight-recorder > run.log 2>&1
39f6d75	0	0.00	177.7	crash	model-only compile OOMs during loss backward at SDPA batch160	NGPU=8 LOG_RANK=0 MODULE=qwen3 CONFIG=qwen3_14b ./run_train.sh --training.steps=10 --compile.enable --compile.components '["model"]' --training.dtype=bfloat16 --training.seq_len=128 --training.local_batch_size=160 --comm.trace_buf_size=0 --dump_folder=outputs/autoresearch/may19-qwen3-14b/run111-sdpa-prefetch-seq128-lbs160-compile-model-only-bf16-no-flight-recorder > run.log 2>&1
bb74797	9999	37.44	168.6	discard	TORCH_NCCL_AVOID_RECORD_STREAMS explicit setting is already default and below best	TORCH_NCCL_AVOID_RECORD_STREAMS=1 NGPU=8 LOG_RANK=0 MODULE=qwen3 CONFIG=qwen3_14b ./run_train.sh --training.steps=10 --compile.enable --training.dtype=bfloat16 --training.seq_len=128 --training.local_batch_size=160 --comm.trace_buf_size=0 --dump_folder=outputs/autoresearch/may19-qwen3-14b/run112-sdpa-prefetch-seq128-lbs160-compile-bf16-nccl-avoid-record-streams-no-flight-recorder > run.log 2>&1
3595c11	10006	37.47	169.5	keep	gradient accumulation 2 narrowly beats SDPA batch160 baseline and needs validation	NGPU=8 LOG_RANK=0 MODULE=qwen3 CONFIG=qwen3_14b ./run_train.sh --training.steps=10 --compile.enable --training.dtype=bfloat16 --training.seq_len=128 --training.local_batch_size=160 --training.global_batch_size=2560 --comm.trace_buf_size=0 --dump_folder=outputs/autoresearch/may19-qwen3-14b/run113-sdpa-prefetch-seq128-lbs160-gbs2560-gradacc2-compile-bf16-no-flight-recorder > run.log 2>&1
180dede	9991	37.41	169.5	discard	exact gradient accumulation 2 rerun fails to validate tentative improvement	NGPU=8 LOG_RANK=0 MODULE=qwen3 CONFIG=qwen3_14b ./run_train.sh --training.steps=10 --compile.enable --training.dtype=bfloat16 --training.seq_len=128 --training.local_batch_size=160 --training.global_batch_size=2560 --comm.trace_buf_size=0 --dump_folder=outputs/autoresearch/may19-qwen3-14b/run114-rerun-sdpa-prefetch-seq128-lbs160-gbs2560-gradacc2-compile-bf16-no-flight-recorder > run.log 2>&1
90a00a0	10014	37.50	169.5	keep	gradient accumulation 4 tentatively beats SDPA batch160 baseline but dataset re-looped	NGPU=8 LOG_RANK=0 MODULE=qwen3 CONFIG=qwen3_14b ./run_train.sh --training.steps=10 --compile.enable --training.dtype=bfloat16 --training.seq_len=128 --training.local_batch_size=160 --training.global_batch_size=5120 --comm.trace_buf_size=0 --dump_folder=outputs/autoresearch/may19-qwen3-14b/run115-sdpa-prefetch-seq128-lbs160-gbs5120-gradacc4-compile-bf16-no-flight-recorder > run.log 2>&1
1c9fd82	9935	37.20	169.5	discard	exact gradient accumulation 4 rerun fails to validate and dataset re-looped	NGPU=8 LOG_RANK=0 MODULE=qwen3 CONFIG=qwen3_14b ./run_train.sh --training.steps=10 --compile.enable --training.dtype=bfloat16 --training.seq_len=128 --training.local_batch_size=160 --training.global_batch_size=5120 --comm.trace_buf_size=0 --dump_folder=outputs/autoresearch/may19-qwen3-14b/run116-rerun-sdpa-prefetch-seq128-lbs160-gbs5120-gradacc4-compile-bf16-no-flight-recorder > run.log 2>&1
3d808f3	9860	36.96	168.6	discard	SDPA seq160 local batch 128 below seq128 best	NGPU=8 LOG_RANK=0 MODULE=qwen3 CONFIG=qwen3_14b ./run_train.sh --training.steps=10 --compile.enable --training.dtype=bfloat16 --training.seq_len=160 --training.local_batch_size=128 --comm.trace_buf_size=0 --dump_folder=outputs/autoresearch/may19-qwen3-14b/run117-sdpa-prefetch-seq160-lbs128-compile-bf16-no-flight-recorder > run.log 2>&1
725c528	9967	37.33	169.8	discard	two-module FSDP prefetch increases memory and remains below one-module best	NGPU=8 LOG_RANK=0 MODULE=qwen3 CONFIG=qwen3_14b ./run_train.sh --training.steps=10 --compile.enable --training.dtype=bfloat16 --training.seq_len=128 --training.local_batch_size=160 --comm.trace_buf_size=0 --dump_folder=outputs/autoresearch/may19-qwen3-14b/run118-sdpa-two-module-prefetch-seq128-lbs160-compile-bf16-no-flight-recorder > run.log 2>&1
f63303a	9989	37.41	168.6	discard	removing lm_head endpoint prefetch stays below best with no memory gain	NGPU=8 LOG_RANK=0 MODULE=qwen3 CONFIG=qwen3_14b ./run_train.sh --training.steps=10 --compile.enable --training.dtype=bfloat16 --training.seq_len=128 --training.local_batch_size=160 --comm.trace_buf_size=0 --dump_folder=outputs/autoresearch/may19-qwen3-14b/run119-sdpa-layer-only-prefetch-no-lm-head-endpoint-seq128-lbs160-compile-bf16-no-flight-recorder > run.log 2>&1
5b3e20c	9930	37.19	168.6	discard	foreach AdamW below default fused optimizer with no memory benefit	NGPU=8 LOG_RANK=0 MODULE=qwen3 CONFIG=qwen3_14b ./run_train.sh --training.steps=10 --compile.enable --training.dtype=bfloat16 --training.seq_len=128 --training.local_batch_size=160 --optimizer.implementation=foreach --comm.trace_buf_size=0 --dump_folder=outputs/autoresearch/may19-qwen3-14b/run120-sdpa-prefetch-seq128-lbs160-compile-bf16-foreach-optimizer-no-flight-recorder > run.log 2>&1
a76ddfd	0	0.00	0.0	invalid	structured logging false syntax rejected by parser	NGPU=8 LOG_RANK=0 MODULE=qwen3 CONFIG=qwen3_14b ./run_train.sh --training.steps=10 --compile.enable --training.dtype=bfloat16 --training.seq_len=128 --training.local_batch_size=160 --debug.enable_structured_logging=false --comm.trace_buf_size=0 --dump_folder=outputs/autoresearch/may19-qwen3-14b/run121-sdpa-prefetch-seq128-lbs160-compile-bf16-structured-logging-off-no-flight-recorder > run.log 2>&1
a76ddfd	9582	35.88	168.6	discard	structured logging disabled with valid negation regresses	NGPU=8 LOG_RANK=0 MODULE=qwen3 CONFIG=qwen3_14b ./run_train.sh --training.steps=10 --compile.enable --training.dtype=bfloat16 --training.seq_len=128 --training.local_batch_size=160 --debug.no-enable-structured-logging --comm.trace_buf_size=0 --dump_folder=outputs/autoresearch/may19-qwen3-14b/run122-sdpa-prefetch-seq128-lbs160-compile-bf16-structured-logging-off-no-flight-recorder > run.log 2>&1
efe8510	10021	37.53	168.6	keep	backward-only FSDP prefetch tentatively beats bidirectional SDPA best	NGPU=8 LOG_RANK=0 MODULE=qwen3 CONFIG=qwen3_14b ./run_train.sh --training.steps=10 --compile.enable --training.dtype=bfloat16 --training.seq_len=128 --training.local_batch_size=160 --comm.trace_buf_size=0 --dump_folder=outputs/autoresearch/may19-qwen3-14b/run123-sdpa-backward-only-prefetch-seq128-lbs160-compile-bf16-no-flight-recorder > run.log 2>&1
1b3518d	9728	36.43	168.6	discard	exact backward-only prefetch rerun fails to validate tentative win	NGPU=8 LOG_RANK=0 MODULE=qwen3 CONFIG=qwen3_14b ./run_train.sh --training.steps=10 --compile.enable --training.dtype=bfloat16 --training.seq_len=128 --training.local_batch_size=160 --comm.trace_buf_size=0 --dump_folder=outputs/autoresearch/may19-qwen3-14b/run124-rerun-sdpa-backward-only-prefetch-seq128-lbs160-compile-bf16-no-flight-recorder > run.log 2>&1
ccbf3e4	10007	37.47	171.5	keep	loss num_chunks 4 narrowly beats best but uses much more memory	NGPU=8 LOG_RANK=0 MODULE=qwen3 CONFIG=qwen3_14b ./run_train.sh --training.steps=10 --compile.enable --training.dtype=bfloat16 --training.seq_len=128 --training.local_batch_size=160 --loss.num_chunks=4 --comm.trace_buf_size=0 --dump_folder=outputs/autoresearch/may19-qwen3-14b/run125-sdpa-prefetch-seq128-lbs160-compile-bf16-loss-chunks4-no-flight-recorder > run.log 2>&1
795501a	9681	36.25	171.5	discard	exact loss num_chunks 4 rerun fails to validate and keeps high memory	NGPU=8 LOG_RANK=0 MODULE=qwen3 CONFIG=qwen3_14b ./run_train.sh --training.steps=10 --compile.enable --training.dtype=bfloat16 --training.seq_len=128 --training.local_batch_size=160 --loss.num_chunks=4 --comm.trace_buf_size=0 --dump_folder=outputs/autoresearch/may19-qwen3-14b/run126-rerun-sdpa-prefetch-seq128-lbs160-compile-bf16-loss-chunks4-no-flight-recorder > run.log 2>&1
a05a979	6995	26.19	174.0	discard	Inductor max autotune causes allocator retries and increasing loss	TORCHINDUCTOR_MAX_AUTOTUNE=1 TORCHINDUCTOR_COORDINATE_DESCENT_TUNING=1 NGPU=8 LOG_RANK=0 MODULE=qwen3 CONFIG=qwen3_14b ./run_train.sh --training.steps=10 --compile.enable --training.dtype=bfloat16 --training.seq_len=128 --training.local_batch_size=160 --comm.trace_buf_size=0 --dump_folder=outputs/autoresearch/may19-qwen3-14b/run127-sdpa-prefetch-seq128-lbs160-compile-bf16-inductor-max-autotune-no-flight-recorder > run.log 2>&1
47b30d0	0	0.00	0.0	crash	Inductor cudagraphs crash on overwritten graph output during backward	TORCHINDUCTOR_CUDAGRAPHS=1 NGPU=8 LOG_RANK=0 MODULE=qwen3 CONFIG=qwen3_14b ./run_train.sh --training.steps=10 --compile.enable --training.dtype=bfloat16 --training.seq_len=128 --training.local_batch_size=160 --comm.trace_buf_size=0 --dump_folder=outputs/autoresearch/may19-qwen3-14b/run128-sdpa-prefetch-seq128-lbs160-compile-bf16-inductor-cudagraphs-no-flight-recorder > run.log 2>&1
1ab3413	10010	37.49	168.6	keep	NCCL high-priority stream narrowly beats SDPA batch160 best and needs validation	TORCH_NCCL_HIGH_PRIORITY=1 NGPU=8 LOG_RANK=0 MODULE=qwen3 CONFIG=qwen3_14b ./run_train.sh --training.steps=10 --compile.enable --training.dtype=bfloat16 --training.seq_len=128 --training.local_batch_size=160 --comm.trace_buf_size=0 --dump_folder=outputs/autoresearch/may19-qwen3-14b/run129-sdpa-prefetch-seq128-lbs160-compile-bf16-nccl-high-priority-no-flight-recorder > run.log 2>&1
e487191	9705	36.34	168.6	discard	exact NCCL high-priority stream rerun fails to validate tentative win	TORCH_NCCL_HIGH_PRIORITY=1 NGPU=8 LOG_RANK=0 MODULE=qwen3 CONFIG=qwen3_14b ./run_train.sh --training.steps=10 --compile.enable --training.dtype=bfloat16 --training.seq_len=128 --training.local_batch_size=160 --comm.trace_buf_size=0 --dump_folder=outputs/autoresearch/may19-qwen3-14b/run130-rerun-sdpa-prefetch-seq128-lbs160-compile-bf16-nccl-high-priority-no-flight-recorder > run.log 2>&1
3d045b1	10060	37.67	168.6	keep	NCCL zero-CTA policy improves SDPA batch160 and needs validation	NCCL_CTA_POLICY=2 NGPU=8 LOG_RANK=0 MODULE=qwen3 CONFIG=qwen3_14b ./run_train.sh --training.steps=10 --compile.enable --training.dtype=bfloat16 --training.seq_len=128 --training.local_batch_size=160 --comm.trace_buf_size=0 --dump_folder=outputs/autoresearch/may19-qwen3-14b/run131-sdpa-prefetch-seq128-lbs160-compile-bf16-nccl-zero-cta-no-flight-recorder > run.log 2>&1
e011c93	10023	37.53	168.6	keep	exact NCCL zero-CTA rerun validates improvement over prior durable best	NCCL_CTA_POLICY=2 NGPU=8 LOG_RANK=0 MODULE=qwen3 CONFIG=qwen3_14b ./run_train.sh --training.steps=10 --compile.enable --training.dtype=bfloat16 --training.seq_len=128 --training.local_batch_size=160 --comm.trace_buf_size=0 --dump_folder=outputs/autoresearch/may19-qwen3-14b/run132-rerun-sdpa-prefetch-seq128-lbs160-compile-bf16-nccl-zero-cta-no-flight-recorder > run.log 2>&1
8f5be4c	10020	37.52	168.6	discard	high-priority stream on top of zero-CTA stays below zero-CTA alone	NCCL_CTA_POLICY=2 TORCH_NCCL_HIGH_PRIORITY=1 NGPU=8 LOG_RANK=0 MODULE=qwen3 CONFIG=qwen3_14b ./run_train.sh --training.steps=10 --compile.enable --training.dtype=bfloat16 --training.seq_len=128 --training.local_batch_size=160 --comm.trace_buf_size=0 --dump_folder=outputs/autoresearch/may19-qwen3-14b/run133-sdpa-prefetch-seq128-lbs160-compile-bf16-nccl-zero-cta-high-priority-no-flight-recorder > run.log 2>&1
4440eb3	9669	36.21	169.2	discard	zero-CTA local batch 161 repeats the batch-shape slowdown	NCCL_CTA_POLICY=2 NGPU=8 LOG_RANK=0 MODULE=qwen3 CONFIG=qwen3_14b ./run_train.sh --training.steps=10 --compile.enable --training.dtype=bfloat16 --training.seq_len=128 --training.local_batch_size=161 --comm.trace_buf_size=0 --dump_folder=outputs/autoresearch/may19-qwen3-14b/run134-sdpa-prefetch-seq128-lbs161-compile-bf16-nccl-zero-cta-no-flight-recorder > run.log 2>&1
7488049	9700	36.33	168.6	discard	zero-CTA backward-only prefetch regresses; restore bidirectional prefetch	NCCL_CTA_POLICY=2 NGPU=8 LOG_RANK=0 MODULE=qwen3 CONFIG=qwen3_14b ./run_train.sh --training.steps=10 --compile.enable --training.dtype=bfloat16 --training.seq_len=128 --training.local_batch_size=160 --comm.trace_buf_size=0 --dump_folder=outputs/autoresearch/may19-qwen3-14b/run135-sdpa-backward-only-prefetch-seq128-lbs160-compile-bf16-nccl-zero-cta-no-flight-recorder > run.log 2>&1
8336481	9953	37.27	168.6	discard	NCCL_NTHREADS=128 slows zero-CTA durable command	NCCL_CTA_POLICY=2 NCCL_NTHREADS=128 NGPU=8 LOG_RANK=0 MODULE=qwen3 CONFIG=qwen3_14b ./run_train.sh --training.steps=10 --compile.enable --training.dtype=bfloat16 --training.seq_len=128 --training.local_batch_size=160 --comm.trace_buf_size=0 --dump_folder=outputs/autoresearch/may19-qwen3-14b/run136-sdpa-prefetch-seq128-lbs160-compile-bf16-nccl-zero-cta-nthreads128-no-flight-recorder > run.log 2>&1
df55200	9967	37.32	168.6	discard	NCCL_MAX_NCHANNELS=16 slows zero-CTA durable command	NCCL_CTA_POLICY=2 NCCL_MAX_NCHANNELS=16 NGPU=8 LOG_RANK=0 MODULE=qwen3 CONFIG=qwen3_14b ./run_train.sh --training.steps=10 --compile.enable --training.dtype=bfloat16 --training.seq_len=128 --training.local_batch_size=160 --comm.trace_buf_size=0 --dump_folder=outputs/autoresearch/may19-qwen3-14b/run137-sdpa-prefetch-seq128-lbs160-compile-bf16-nccl-zero-cta-max-nchannels16-no-flight-recorder > run.log 2>&1
e36e329	10029	37.56	168.6	keep	explicit NCCL NVLS narrowly beats validated zero-CTA and needs validation	NCCL_CTA_POLICY=2 NCCL_NVLS_ENABLE=1 NGPU=8 LOG_RANK=0 MODULE=qwen3 CONFIG=qwen3_14b ./run_train.sh --training.steps=10 --compile.enable --training.dtype=bfloat16 --training.seq_len=128 --training.local_batch_size=160 --comm.trace_buf_size=0 --dump_folder=outputs/autoresearch/may19-qwen3-14b/run138-sdpa-prefetch-seq128-lbs160-compile-bf16-nccl-zero-cta-nvls-enable-no-flight-recorder > run.log 2>&1
21a42ea	10013	37.49	168.6	discard	exact explicit NCCL NVLS rerun fails to validate over zero-CTA alone	NCCL_CTA_POLICY=2 NCCL_NVLS_ENABLE=1 NGPU=8 LOG_RANK=0 MODULE=qwen3 CONFIG=qwen3_14b ./run_train.sh --training.steps=10 --compile.enable --training.dtype=bfloat16 --training.seq_len=128 --training.local_batch_size=160 --comm.trace_buf_size=0 --dump_folder=outputs/autoresearch/may19-qwen3-14b/run139-rerun-sdpa-prefetch-seq128-lbs160-compile-bf16-nccl-zero-cta-nvls-enable-no-flight-recorder > run.log 2>&1
512398a	10008	37.48	168.6	discard	NCCL_NVLS_ENABLE=0 stays below zero-CTA durable command	NCCL_CTA_POLICY=2 NCCL_NVLS_ENABLE=0 NGPU=8 LOG_RANK=0 MODULE=qwen3 CONFIG=qwen3_14b ./run_train.sh --training.steps=10 --compile.enable --training.dtype=bfloat16 --training.seq_len=128 --training.local_batch_size=160 --comm.trace_buf_size=0 --dump_folder=outputs/autoresearch/may19-qwen3-14b/run140-sdpa-prefetch-seq128-lbs160-compile-bf16-nccl-zero-cta-nvls-disable-no-flight-recorder > run.log 2>&1
5995609	8462	31.69	37.0	discard	full AC same-batch run is slower but creates large memory headroom	NCCL_CTA_POLICY=2 NGPU=8 LOG_RANK=0 MODULE=qwen3 CONFIG=qwen3_14b ./run_train.sh --training.steps=10 --compile.enable --training.dtype=bfloat16 --training.seq_len=128 --training.local_batch_size=160 --comm.trace_buf_size=0 --dump_folder=outputs/autoresearch/may19-qwen3-14b/run141-sdpa-prefetch-seq128-lbs160-compile-bf16-nccl-zero-cta-full-ac-no-flight-recorder > run.log 2>&1
6432543	8754	32.78	75.2	discard	full AC batch640 remains slower and re-loops tiny dataset	NCCL_CTA_POLICY=2 NGPU=8 LOG_RANK=0 MODULE=qwen3 CONFIG=qwen3_14b ./run_train.sh --training.steps=10 --compile.enable --training.dtype=bfloat16 --training.seq_len=128 --training.local_batch_size=640 --comm.trace_buf_size=0 --dump_folder=outputs/autoresearch/may19-qwen3-14b/run142-sdpa-prefetch-seq128-lbs640-compile-bf16-nccl-zero-cta-full-ac-no-flight-recorder > run.log 2>&1
3a1ed15	10288	38.53	169.1	keep	loss num_chunks 6 with zero-CTA is a new measured best and needs validation	NCCL_CTA_POLICY=2 NGPU=8 LOG_RANK=0 MODULE=qwen3 CONFIG=qwen3_14b ./run_train.sh --training.steps=10 --compile.enable --training.dtype=bfloat16 --training.seq_len=128 --training.local_batch_size=160 --loss.num_chunks=6 --comm.trace_buf_size=0 --dump_folder=outputs/autoresearch/may19-qwen3-14b/run143-sdpa-prefetch-seq128-lbs160-compile-bf16-nccl-zero-cta-loss-chunks6-no-flight-recorder > run.log 2>&1
699746f	10258	38.42	169.1	keep	exact loss num_chunks 6 rerun validates new durable command	NCCL_CTA_POLICY=2 NGPU=8 LOG_RANK=0 MODULE=qwen3 CONFIG=qwen3_14b ./run_train.sh --training.steps=10 --compile.enable --training.dtype=bfloat16 --training.seq_len=128 --training.local_batch_size=160 --loss.num_chunks=6 --comm.trace_buf_size=0 --dump_folder=outputs/autoresearch/may19-qwen3-14b/run144-rerun-sdpa-prefetch-seq128-lbs160-compile-bf16-nccl-zero-cta-loss-chunks6-no-flight-recorder > run.log 2>&1
0b7f7ce	10146	38.00	170.7	discard	loss num_chunks 5 is slower than chunks 6 and above memory-risk line	NCCL_CTA_POLICY=2 NGPU=8 LOG_RANK=0 MODULE=qwen3 CONFIG=qwen3_14b ./run_train.sh --training.steps=10 --compile.enable --training.dtype=bfloat16 --training.seq_len=128 --training.local_batch_size=160 --loss.num_chunks=5 --comm.trace_buf_size=0 --dump_folder=outputs/autoresearch/may19-qwen3-14b/run145-sdpa-prefetch-seq128-lbs160-compile-bf16-nccl-zero-cta-loss-chunks5-no-flight-recorder > run.log 2>&1
d9701ae	10179	38.12	168.8	discard	loss num_chunks 7 is lower-memory but slower than chunks 6	NCCL_CTA_POLICY=2 NGPU=8 LOG_RANK=0 MODULE=qwen3 CONFIG=qwen3_14b ./run_train.sh --training.steps=10 --compile.enable --training.dtype=bfloat16 --training.seq_len=128 --training.local_batch_size=160 --loss.num_chunks=7 --comm.trace_buf_size=0 --dump_folder=outputs/autoresearch/may19-qwen3-14b/run146-sdpa-prefetch-seq128-lbs160-compile-bf16-nccl-zero-cta-loss-chunks7-no-flight-recorder > run.log 2>&1
e12f3b3	9185	34.40	169.1	discard	profile current durable chunks6 command diagnostic	NCCL_CTA_POLICY=2 NGPU=8 LOG_RANK=0 MODULE=qwen3 CONFIG=qwen3_14b ./run_train.sh --training.steps=10 --compile.enable --training.dtype=bfloat16 --training.seq_len=128 --training.local_batch_size=160 --loss.num_chunks=6 --comm.trace_buf_size=0 --dump_folder=outputs/autoresearch/may19-qwen3-14b/run147-profile-sdpa-prefetch-seq128-lbs160-compile-bf16-nccl-zero-cta-loss-chunks6-no-flight-recorder --profiler.enable_profiling --profiler.profile_freq=10 --profiler.profiler_warmup=2 --profiler.profiler_active=1 > run.log 2>&1
f45b25d	10122	37.90	169.1	discard	FP8 rowwise auto-filter remains slower than BF16 chunks6 durable command	NCCL_CTA_POLICY=2 NGPU=8 LOG_RANK=0 MODULE=qwen3 CONFIG=qwen3_14b ./run_train.sh --training.steps=10 --compile.enable --training.dtype=bfloat16 --training.seq_len=128 --training.local_batch_size=160 --loss.num_chunks=6 --comm.trace_buf_size=0 --dump_folder=outputs/autoresearch/may19-qwen3-14b/run148-sdpa-fp8-rowwise-prefetch-seq128-lbs160-compile-bf16-nccl-zero-cta-loss-chunks6-no-flight-recorder > run.log 2>&1
62bd955	9389	35.16	169.1	discard	NCCL_PROTO=Simple regresses versus default LL protocol	NCCL_CTA_POLICY=2 NCCL_PROTO=Simple NGPU=8 LOG_RANK=0 MODULE=qwen3 CONFIG=qwen3_14b ./run_train.sh --training.steps=10 --compile.enable --training.dtype=bfloat16 --training.seq_len=128 --training.local_batch_size=160 --loss.num_chunks=6 --comm.trace_buf_size=0 --dump_folder=outputs/autoresearch/may19-qwen3-14b/run149-sdpa-prefetch-seq128-lbs160-compile-bf16-nccl-zero-cta-loss-chunks6-nccl-proto-simple-no-flight-recorder > run.log 2>&1
b62ab62	10131	37.94	169.1	discard	NCCL_PROTO=LL128 slower than default LL protocol	NCCL_CTA_POLICY=2 NCCL_PROTO=LL128 NGPU=8 LOG_RANK=0 MODULE=qwen3 CONFIG=qwen3_14b ./run_train.sh --training.steps=10 --compile.enable --training.dtype=bfloat16 --training.seq_len=128 --training.local_batch_size=160 --loss.num_chunks=6 --comm.trace_buf_size=0 --dump_folder=outputs/autoresearch/may19-qwen3-14b/run150-sdpa-prefetch-seq128-lbs160-compile-bf16-nccl-zero-cta-loss-chunks6-nccl-proto-ll128-no-flight-recorder > run.log 2>&1
d44fd22	10360	38.79	170.5	discard	FSDP symmetric-memory all modules is fast but unsafe due NCCL corrupted-comm warnings	NCCL_CTA_POLICY=2 NGPU=8 LOG_RANK=0 MODULE=qwen3 CONFIG=qwen3_14b ./run_train.sh --training.steps=10 --compile.enable --training.dtype=bfloat16 --training.seq_len=128 --training.local_batch_size=160 --loss.num_chunks=6 --comm.trace_buf_size=0 --dump_folder=outputs/autoresearch/may19-qwen3-14b/run151-sdpa-prefetch-seq128-lbs160-compile-bf16-nccl-zero-cta-loss-chunks6-fsdp-symm-mem-no-flight-recorder > run.log 2>&1
