commit	tokens_per_sec	mfu_percent	peak_memory_gb	status	description	command
bfc8d098+dirty	0	0.00	0.00	crash	SDPA cuDNN-only backend is unsupported for the current Qwen3 GQA shape and fails during Dynamo fake tensor propagation with no available kernel	TORCH_NCCL_CUDA_EVENT_CACHE=0 NCCL_NVLS_ENABLE=1 NCCL_CTA_POLICY=2 NGPU=8 LOG_RANK=0 MODULE=qwen3 CONFIG=qwen3_14b ./run_train.sh --training.steps=10 --compile.enable --compile.components=model,loss,qk_norm_rope,qkv_grad_input_concat,pairwise_rope,sdpa_cudnn_only --training.dtype=bfloat16 --training.seq_len=128 --training.local_batch_size=176 --loss.num_chunks=4 --optimizer.weight_decay=0.0 --dataloader.num_workers=2 --dataloader.persistent_workers --dataloader.prefetch_factor=2 --metrics.log_freq=1 --comm.trace_buf_size=0 --dump_folder=outputs/autoresearch/may19-qwen3-14b/run642-sdpa-cudnn-only-model-compile-pairwise-rope-qkv-grad-input-concat-batch176-event-cache0 > outputs/autoresearch/may19-qwen3-14b/run642-sdpa-cudnn-only-model-compile-pairwise-rope-qkv-grad-input-concat-batch176-event-cache0.run.log 2>&1
bfc8d098+dirty	14286	0.00	168.91	discard	torch.compile(fullgraph=False) for each TransformerBlock is valid but slower than the fullgraph block-compile winner at the same memory peak	TORCH_NCCL_CUDA_EVENT_CACHE=0 NCCL_NVLS_ENABLE=1 NCCL_CTA_POLICY=2 NGPU=8 LOG_RANK=0 MODULE=qwen3 CONFIG=qwen3_14b ./run_train.sh --training.steps=10 --compile.enable --compile.components=model,model_non_fullgraph,loss,qk_norm_rope,qkv_grad_input_concat,pairwise_rope --training.dtype=bfloat16 --training.seq_len=128 --training.local_batch_size=176 --loss.num_chunks=4 --optimizer.weight_decay=0.0 --dataloader.num_workers=2 --dataloader.persistent_workers --dataloader.prefetch_factor=2 --metrics.log_freq=1 --comm.trace_buf_size=0 --dump_folder=outputs/autoresearch/may19-qwen3-14b/run643-model-non-fullgraph-pairwise-rope-qkv-grad-input-concat-batch176-event-cache0 > outputs/autoresearch/may19-qwen3-14b/run643-model-non-fullgraph-pairwise-rope-qkv-grad-input-concat-batch176-event-cache0.run.log 2>&1
bfc8d098+dirty	14423	0.00	168.91	discard	NCCL_MAX_CTAS=32 is valid but does not improve GEMM/collective overlap versus automatic CTA usage on the lean model-compile stack	NCCL_MAX_CTAS=32 TORCH_NCCL_CUDA_EVENT_CACHE=0 NCCL_NVLS_ENABLE=1 NCCL_CTA_POLICY=2 NGPU=8 LOG_RANK=0 MODULE=qwen3 CONFIG=qwen3_14b ./run_train.sh --training.steps=10 --compile.enable --compile.components=model,loss,qk_norm_rope,qkv_grad_input_concat,pairwise_rope --training.dtype=bfloat16 --training.seq_len=128 --loss.num_chunks=4 --training.local_batch_size=176 --optimizer.weight_decay=0.0 --dataloader.num_workers=2 --dataloader.persistent_workers --dataloader.prefetch_factor=2 --metrics.log_freq=1 --comm.trace_buf_size=0 --dump_folder=outputs/autoresearch/may19-qwen3-14b/run644-nccl-max-ctas32-model-compile-pairwise-rope-qkv-grad-input-concat-batch176-event-cache0 > outputs/autoresearch/may19-qwen3-14b/run644-nccl-max-ctas32-model-compile-pairwise-rope-qkv-grad-input-concat-batch176-event-cache0.run.log 2>&1
bfc8d098+dirty	14329	0.00	168.91	discard	torch._dynamo compiled autograd is valid but slower than the default autograd capture path on the lean model-compile stack	TORCH_NCCL_CUDA_EVENT_CACHE=0 NCCL_NVLS_ENABLE=1 NCCL_CTA_POLICY=2 NGPU=8 LOG_RANK=0 MODULE=qwen3 CONFIG=qwen3_14b ./run_train.sh --training.steps=10 --compile.enable --compile.components=model,compiled_autograd,loss,qk_norm_rope,qkv_grad_input_concat,pairwise_rope --training.dtype=bfloat16 --training.seq_len=128 --training.local_batch_size=176 --loss.num_chunks=4 --optimizer.weight_decay=0.0 --dataloader.num_workers=2 --dataloader.persistent_workers --dataloader.prefetch_factor=2 --metrics.log_freq=1 --comm.trace_buf_size=0 --dump_folder=outputs/autoresearch/may19-qwen3-14b/run645-compiled-autograd-model-compile-pairwise-rope-qkv-grad-input-concat-batch176-event-cache0 > outputs/autoresearch/may19-qwen3-14b/run645-compiled-autograd-model-compile-pairwise-rope-qkv-grad-input-concat-batch176-event-cache0.run.log 2>&1
bfc8d098+dirty	0	0.00	0.00	crash	nested attention/feed-forward FSDP under fullgraph block compile crashes because FSDP hooks call torch._dynamo.disable inside the compiled block graph	TORCH_NCCL_CUDA_EVENT_CACHE=0 NCCL_NVLS_ENABLE=1 NCCL_CTA_POLICY=2 NGPU=8 LOG_RANK=0 MODULE=qwen3 CONFIG=qwen3_14b ./run_train.sh --training.steps=10 --compile.enable --compile.components=model,loss,qk_norm_rope,qkv_grad_input_concat,pairwise_rope,fsdp_attention_ffn --training.dtype=bfloat16 --training.seq_len=128 --training.local_batch_size=176 --loss.num_chunks=4 --optimizer.weight_decay=0.0 --dataloader.num_workers=2 --dataloader.persistent_workers --dataloader.prefetch_factor=2 --metrics.log_freq=1 --comm.trace_buf_size=0 --dump_folder=outputs/autoresearch/may19-qwen3-14b/run646-fsdp-attention-ffn-model-compile-pairwise-rope-qkv-grad-input-concat-batch176-event-cache0 > outputs/autoresearch/may19-qwen3-14b/run646-fsdp-attention-ffn-model-compile-pairwise-rope-qkv-grad-input-concat-batch176-event-cache0.run.log 2>&1
bfc8d098+dirty	14073	0.00	168.66	discard	nested attention/feed-forward FSDP with non-fullgraph block compile runs and lowers memory slightly, but throughput regresses too much at batch176	TORCH_NCCL_CUDA_EVENT_CACHE=0 NCCL_NVLS_ENABLE=1 NCCL_CTA_POLICY=2 NGPU=8 LOG_RANK=0 MODULE=qwen3 CONFIG=qwen3_14b ./run_train.sh --training.steps=10 --compile.enable --compile.components=model,model_non_fullgraph,loss,qk_norm_rope,qkv_grad_input_concat,pairwise_rope,fsdp_attention_ffn --training.dtype=bfloat16 --training.seq_len=128 --training.local_batch_size=176 --loss.num_chunks=4 --optimizer.weight_decay=0.0 --dataloader.num_workers=2 --dataloader.persistent_workers --dataloader.prefetch_factor=2 --metrics.log_freq=1 --comm.trace_buf_size=0 --dump_folder=outputs/autoresearch/may19-qwen3-14b/run647-fsdp-attention-ffn-model-non-fullgraph-pairwise-rope-qkv-grad-input-concat-batch176-event-cache0 > outputs/autoresearch/may19-qwen3-14b/run647-fsdp-attention-ffn-model-non-fullgraph-pairwise-rope-qkv-grad-input-concat-batch176-event-cache0.run.log 2>&1
bfc8d098+dirty	14107	0.00	171.82	discard	batch180 with nested attention/feed-forward FSDP and non-fullgraph block compile remains slower and crosses the memory envelope, so the lower batch176 memory does not unlock a useful larger batch	TORCH_NCCL_CUDA_EVENT_CACHE=0 NCCL_NVLS_ENABLE=1 NCCL_CTA_POLICY=2 NGPU=8 LOG_RANK=0 MODULE=qwen3 CONFIG=qwen3_14b ./run_train.sh --training.steps=10 --compile.enable --compile.components=model,model_non_fullgraph,loss,qk_norm_rope,qkv_grad_input_concat,pairwise_rope,fsdp_attention_ffn --training.dtype=bfloat16 --training.seq_len=128 --training.local_batch_size=180 --loss.num_chunks=4 --optimizer.weight_decay=0.0 --dataloader.num_workers=2 --dataloader.persistent_workers --dataloader.prefetch_factor=2 --metrics.log_freq=1 --comm.trace_buf_size=0 --dump_folder=outputs/autoresearch/may19-qwen3-14b/run648-batch180-fsdp-attention-ffn-model-non-fullgraph-pairwise-rope-qkv-grad-input-concat-event-cache0 > outputs/autoresearch/may19-qwen3-14b/run648-batch180-fsdp-attention-ffn-model-non-fullgraph-pairwise-rope-qkv-grad-input-concat-event-cache0.run.log 2>&1
bfc8d098+dirty	10416	0.00	168.91	discard	QKV forward plus full backward concat is valid but catastrophically slower; grad-weight concat and forward fusion create a much worse schedule than grad-input-only concat	TORCH_NCCL_CUDA_EVENT_CACHE=0 NCCL_NVLS_ENABLE=1 NCCL_CTA_POLICY=2 NGPU=8 LOG_RANK=0 MODULE=qwen3 CONFIG=qwen3_14b ./run_train.sh --training.steps=10 --compile.enable --compile.components=model,loss,qk_norm_rope,qkv_backward_concat,pairwise_rope --training.dtype=bfloat16 --training.seq_len=128 --training.local_batch_size=176 --loss.num_chunks=4 --optimizer.weight_decay=0.0 --dataloader.num_workers=2 --dataloader.persistent_workers --dataloader.prefetch_factor=2 --metrics.log_freq=1 --comm.trace_buf_size=0 --dump_folder=outputs/autoresearch/may19-qwen3-14b/run649-qkv-forward-full-backward-concat-model-compile-pairwise-rope-batch176-event-cache0 > outputs/autoresearch/may19-qwen3-14b/run649-qkv-forward-full-backward-concat-model-compile-pairwise-rope-batch176-event-cache0.run.log 2>&1
bfc8d098+dirty	10554	0.00	169.34	discard	custom Triton SwiGLU forward/backward is numerically valid but much slower and higher-memory; the custom autograd boundary/materialization overwhelms the saved elementwise work	TORCH_NCCL_CUDA_EVENT_CACHE=0 NCCL_NVLS_ENABLE=1 NCCL_CTA_POLICY=2 NGPU=8 LOG_RANK=0 MODULE=qwen3 CONFIG=qwen3_14b ./run_train.sh --training.steps=10 --compile.enable --compile.components=model,loss,qk_norm_rope,qkv_grad_input_concat,pairwise_rope,triton_swiglu --training.dtype=bfloat16 --training.seq_len=128 --training.local_batch_size=176 --loss.num_chunks=4 --optimizer.weight_decay=0.0 --dataloader.num_workers=2 --dataloader.persistent_workers --dataloader.prefetch_factor=2 --metrics.log_freq=1 --comm.trace_buf_size=0 --dump_folder=outputs/autoresearch/may19-qwen3-14b/run650-triton-swiglu-model-compile-pairwise-rope-qkv-grad-input-concat-batch176-event-cache0 > outputs/autoresearch/may19-qwen3-14b/run650-triton-swiglu-model-compile-pairwise-rope-qkv-grad-input-concat-batch176-event-cache0.run.log 2>&1
bfc8d098+dirty	10282	0.00	169.45	discard	FFN gate/up grad-input concat on the lean model-compile stack is much slower and crosses the 95 percent memory line; QKV grad-input concat remains the only useful concat variant	TORCH_NCCL_CUDA_EVENT_CACHE=0 NCCL_NVLS_ENABLE=1 NCCL_CTA_POLICY=2 NGPU=8 LOG_RANK=0 MODULE=qwen3 CONFIG=qwen3_14b ./run_train.sh --training.steps=10 --compile.enable --compile.components=model,loss,qk_norm_rope,qkv_grad_input_concat,pairwise_rope,gate_up_grad_input_concat --training.dtype=bfloat16 --training.seq_len=128 --training.local_batch_size=176 --loss.num_chunks=4 --optimizer.weight_decay=0.0 --dataloader.num_workers=2 --dataloader.persistent_workers --dataloader.prefetch_factor=2 --metrics.log_freq=1 --comm.trace_buf_size=0 --dump_folder=outputs/autoresearch/may19-qwen3-14b/run651-gate-up-grad-input-concat-model-compile-pairwise-rope-qkv-grad-input-concat-batch176-event-cache0 > outputs/autoresearch/may19-qwen3-14b/run651-gate-up-grad-input-concat-model-compile-pairwise-rope-qkv-grad-input-concat-batch176-event-cache0.run.log 2>&1
bfc8d098+dirty	10469	0.00	168.91	discard	NCCL_MIN_CTAS=32 on the lean model-compile stack sharply reduces throughput; forcing a high CTA floor appears to starve GEMM/collective overlap rather than improve progress	NCCL_MIN_CTAS=32 TORCH_NCCL_CUDA_EVENT_CACHE=0 NCCL_NVLS_ENABLE=1 NCCL_CTA_POLICY=2 NGPU=8 LOG_RANK=0 MODULE=qwen3 CONFIG=qwen3_14b ./run_train.sh --training.steps=10 --compile.enable --compile.components=model,loss,qk_norm_rope,qkv_grad_input_concat,pairwise_rope --training.dtype=bfloat16 --training.seq_len=128 --training.local_batch_size=176 --loss.num_chunks=4 --optimizer.weight_decay=0.0 --dataloader.num_workers=2 --dataloader.persistent_workers --dataloader.prefetch_factor=2 --metrics.log_freq=1 --comm.trace_buf_size=0 --dump_folder=outputs/autoresearch/may19-qwen3-14b/run652-nccl-min-ctas32-model-compile-pairwise-rope-qkv-grad-input-concat-batch176-event-cache0 > outputs/autoresearch/may19-qwen3-14b/run652-nccl-min-ctas32-model-compile-pairwise-rope-qkv-grad-input-concat-batch176-event-cache0.run.log 2>&1
bfc8d098+dirty	10358	0.00	168.91	discard	NCCL_MIN_CTAS=16 also sharply reduces throughput, so CTA floors are the wrong direction for collective/GEMM overlap on this workload	NCCL_MIN_CTAS=16 TORCH_NCCL_CUDA_EVENT_CACHE=0 NCCL_NVLS_ENABLE=1 NCCL_CTA_POLICY=2 NGPU=8 LOG_RANK=0 MODULE=qwen3 CONFIG=qwen3_14b ./run_train.sh --training.steps=10 --compile.enable --compile.components=model,loss,qk_norm_rope,qkv_grad_input_concat,pairwise_rope --training.dtype=bfloat16 --training.seq_len=128 --training.local_batch_size=176 --loss.num_chunks=4 --optimizer.weight_decay=0.0 --dataloader.num_workers=2 --dataloader.persistent_workers --dataloader.prefetch_factor=2 --metrics.log_freq=1 --comm.trace_buf_size=0 --dump_folder=outputs/autoresearch/may19-qwen3-14b/run653-nccl-min-ctas16-model-compile-pairwise-rope-qkv-grad-input-concat-batch176-event-cache0 > outputs/autoresearch/may19-qwen3-14b/run653-nccl-min-ctas16-model-compile-pairwise-rope-qkv-grad-input-concat-batch176-event-cache0.run.log 2>&1
bfc8d098+dirty	10312	0.00	168.91	discard	NCCL_CTA_POLICY=1 collapses throughput on the lean model-compile stack; policy 2 remains required for this recipe	TORCH_NCCL_CUDA_EVENT_CACHE=0 NCCL_NVLS_ENABLE=1 NCCL_CTA_POLICY=1 NGPU=8 LOG_RANK=0 MODULE=qwen3 CONFIG=qwen3_14b ./run_train.sh --training.steps=10 --compile.enable --compile.components=model,loss,qk_norm_rope,qkv_grad_input_concat,pairwise_rope --training.dtype=bfloat16 --training.seq_len=128 --training.local_batch_size=176 --loss.num_chunks=4 --optimizer.weight_decay=0.0 --dataloader.num_workers=2 --dataloader.persistent_workers --dataloader.prefetch_factor=2 --metrics.log_freq=1 --comm.trace_buf_size=0 --dump_folder=outputs/autoresearch/may19-qwen3-14b/run654-nccl-cta-policy1-model-compile-pairwise-rope-qkv-grad-input-concat-batch176-event-cache0 > outputs/autoresearch/may19-qwen3-14b/run654-nccl-cta-policy1-model-compile-pairwise-rope-qkv-grad-input-concat-batch176-event-cache0.run.log 2>&1
bfc8d098+dirty	10516	0.00	168.91	discard	NCCL_CGA_CLUSTER_SIZE=4 sharply reduces throughput; CGA size 2 was only mildly slower, but larger CGA clustering is harmful here	TORCH_NCCL_CUDA_EVENT_CACHE=0 NCCL_CGA_CLUSTER_SIZE=4 NCCL_NVLS_ENABLE=1 NCCL_CTA_POLICY=2 NGPU=8 LOG_RANK=0 MODULE=qwen3 CONFIG=qwen3_14b ./run_train.sh --training.steps=10 --compile.enable --compile.components=model,loss,qk_norm_rope,qkv_grad_input_concat,pairwise_rope --training.dtype=bfloat16 --training.seq_len=128 --training.local_batch_size=176 --loss.num_chunks=4 --optimizer.weight_decay=0.0 --dataloader.num_workers=2 --dataloader.persistent_workers --dataloader.prefetch_factor=2 --metrics.log_freq=1 --comm.trace_buf_size=0 --dump_folder=outputs/autoresearch/may19-qwen3-14b/run655-nccl-cga4-model-compile-pairwise-rope-qkv-grad-input-concat-batch176-event-cache0 > outputs/autoresearch/may19-qwen3-14b/run655-nccl-cga4-model-compile-pairwise-rope-qkv-grad-input-concat-batch176-event-cache0.run.log 2>&1
bfc8d098+dirty	1702	0.00	172.38	discard	removing loss compile triggers allocator retries and severe slowdown; compiled chunked loss is required for memory and throughput on the lean model-compile stack	TORCH_NCCL_CUDA_EVENT_CACHE=0 NCCL_NVLS_ENABLE=1 NCCL_CTA_POLICY=2 NGPU=8 LOG_RANK=0 MODULE=qwen3 CONFIG=qwen3_14b ./run_train.sh --training.steps=10 --compile.enable --compile.components=model,qk_norm_rope,qkv_grad_input_concat,pairwise_rope --training.dtype=bfloat16 --training.seq_len=128 --training.local_batch_size=176 --loss.num_chunks=4 --optimizer.weight_decay=0.0 --dataloader.num_workers=2 --dataloader.persistent_workers --dataloader.prefetch_factor=2 --metrics.log_freq=1 --comm.trace_buf_size=0 --dump_folder=outputs/autoresearch/may19-qwen3-14b/run656-no-loss-compile-model-pairwise-rope-qkv-grad-input-concat-batch176-event-cache0 > outputs/autoresearch/may19-qwen3-14b/run656-no-loss-compile-model-pairwise-rope-qkv-grad-input-concat-batch176-event-cache0.run.log 2>&1
