commit	tokens_per_sec	mfu_percent	peak_memory_gb	status	description	command
4a6812d	10392	38.92	169.7	discard	layer-only FSDP symmetric-memory is fast but still unsafe due NCCL corrupted-comm warnings	NCCL_CTA_POLICY=2 NGPU=8 LOG_RANK=0 MODULE=qwen3 CONFIG=qwen3_14b ./run_train.sh --training.steps=10 --compile.enable --training.dtype=bfloat16 --training.seq_len=128 --training.local_batch_size=160 --loss.num_chunks=6 --comm.trace_buf_size=0 --dump_folder=outputs/autoresearch/may19-qwen3-14b/run152-sdpa-layer-symm-mem-prefetch-seq128-lbs160-compile-bf16-nccl-zero-cta-loss-chunks6-no-flight-recorder > run.log 2>&1
7ffb0b9	10303	38.58	175.6	discard	ProcessGroup-allocated FSDP comm buffers raise memory and emit NCCL IPC deregistration warnings	NCCL_CTA_POLICY=2 NGPU=8 LOG_RANK=0 MODULE=qwen3 CONFIG=qwen3_14b ./run_train.sh --training.steps=10 --compile.enable --training.dtype=bfloat16 --training.seq_len=128 --training.local_batch_size=160 --loss.num_chunks=6 --comm.trace_buf_size=0 --dump_folder=outputs/autoresearch/may19-qwen3-14b/run153-sdpa-pg-alloc-prefetch-seq128-lbs160-compile-bf16-nccl-zero-cta-loss-chunks6-no-flight-recorder > run.log 2>&1
ae8dfe2	10207	38.22	167.8	discard	FSDP async unshard is safe and lower-memory but slower at batch160	NCCL_CTA_POLICY=2 NGPU=8 LOG_RANK=0 MODULE=qwen3 CONFIG=qwen3_14b ./run_train.sh --training.steps=10 --compile.enable --training.dtype=bfloat16 --training.seq_len=128 --training.local_batch_size=160 --loss.num_chunks=6 --comm.trace_buf_size=0 --dump_folder=outputs/autoresearch/may19-qwen3-14b/run154-sdpa-async-unshard-prefetch-seq128-lbs160-compile-bf16-nccl-zero-cta-loss-chunks6-no-flight-recorder > run.log 2>&1
f0d3965	9955	37.28	169.6	discard	async unshard plus batch162 fails to convert memory headroom into throughput	NCCL_CTA_POLICY=2 NGPU=8 LOG_RANK=0 MODULE=qwen3 CONFIG=qwen3_14b ./run_train.sh --training.steps=10 --compile.enable --training.dtype=bfloat16 --training.seq_len=128 --training.local_batch_size=162 --loss.num_chunks=6 --comm.trace_buf_size=0 --dump_folder=outputs/autoresearch/may19-qwen3-14b/run155-sdpa-async-unshard-prefetch-seq128-lbs162-compile-bf16-nccl-zero-cta-loss-chunks6-no-flight-recorder > run.log 2>&1
f07b803	0	0.00	0.0	crash	NCCL_ALGO=Tree unsupported for initialization Broadcast int8	NCCL_CTA_POLICY=2 NCCL_ALGO=Tree NGPU=8 LOG_RANK=0 MODULE=qwen3 CONFIG=qwen3_14b ./run_train.sh --training.steps=10 --compile.enable --training.dtype=bfloat16 --training.seq_len=128 --training.local_batch_size=160 --loss.num_chunks=6 --comm.trace_buf_size=0 --dump_folder=outputs/autoresearch/may19-qwen3-14b/run156-sdpa-prefetch-seq128-lbs160-compile-bf16-nccl-zero-cta-loss-chunks6-nccl-algo-tree-no-flight-recorder > run.log 2>&1
e3a1f3d	9801	36.70	169.1	discard	CUDA_DEVICE_MAX_CONNECTIONS=1 worsens scheduling for durable chunks6 command	CUDA_DEVICE_MAX_CONNECTIONS=1 NCCL_CTA_POLICY=2 NGPU=8 LOG_RANK=0 MODULE=qwen3 CONFIG=qwen3_14b ./run_train.sh --training.steps=10 --compile.enable --training.dtype=bfloat16 --training.seq_len=128 --training.local_batch_size=160 --loss.num_chunks=6 --comm.trace_buf_size=0 --dump_folder=outputs/autoresearch/may19-qwen3-14b/run157-sdpa-prefetch-seq128-lbs160-compile-bf16-nccl-zero-cta-loss-chunks6-cuda-max-connections1-no-flight-recorder > run.log 2>&1
df2d811	10237	38.33	169.1	discard	disabling FSDP forward input casts is safe but below durable chunks6 rerun	NCCL_CTA_POLICY=2 NGPU=8 LOG_RANK=0 MODULE=qwen3 CONFIG=qwen3_14b ./run_train.sh --training.steps=10 --compile.enable --training.dtype=bfloat16 --training.seq_len=128 --training.local_batch_size=160 --loss.num_chunks=6 --comm.trace_buf_size=0 --dump_folder=outputs/autoresearch/may19-qwen3-14b/run158-sdpa-no-fsdp-input-casts-prefetch-seq128-lbs160-compile-bf16-nccl-zero-cta-loss-chunks6-no-flight-recorder > run.log 2>&1
2f333af	9921	37.15	169.1	discard	metrics color printing disabled does not improve reported throughput	NCCL_CTA_POLICY=2 NGPU=8 LOG_RANK=0 MODULE=qwen3 CONFIG=qwen3_14b ./run_train.sh --training.steps=10 --compile.enable --training.dtype=bfloat16 --training.seq_len=128 --training.local_batch_size=160 --loss.num_chunks=6 --metrics.disable_color_printing --comm.trace_buf_size=0 --dump_folder=outputs/autoresearch/may19-qwen3-14b/run159-sdpa-prefetch-seq128-lbs160-compile-bf16-nccl-zero-cta-loss-chunks6-no-color-no-flight-recorder > run.log 2>&1
019abea	0	0.00	0.0	crash	compiling lm_head with fullgraph fails because nn.Linear is skipped by Dynamo	NCCL_CTA_POLICY=2 NGPU=8 LOG_RANK=0 MODULE=qwen3 CONFIG=qwen3_14b ./run_train.sh --training.steps=10 --compile.enable --training.dtype=bfloat16 --training.seq_len=128 --training.local_batch_size=160 --loss.num_chunks=6 --comm.trace_buf_size=0 --dump_folder=outputs/autoresearch/may19-qwen3-14b/run160-sdpa-compiled-lm-head-prefetch-seq128-lbs160-compile-bf16-nccl-zero-cta-loss-chunks6-no-flight-recorder > run.log 2>&1
53ac215	9931	37.19	169.1	discard	root FSDP endpoint prefetch is valid but slower than durable schedule	NCCL_CTA_POLICY=2 NGPU=8 LOG_RANK=0 MODULE=qwen3 CONFIG=qwen3_14b ./run_train.sh --training.steps=10 --compile.enable --training.dtype=bfloat16 --training.seq_len=128 --training.local_batch_size=160 --loss.num_chunks=6 --comm.trace_buf_size=0 --dump_folder=outputs/autoresearch/may19-qwen3-14b/run161-sdpa-root-endpoint-prefetch-seq128-lbs160-compile-bf16-nccl-zero-cta-loss-chunks6-no-flight-recorder > run.log 2>&1
a3d1dce	10296	38.56	169.1	keep	root forward-only FSDP prefetch is a tentative small win needing exact rerun	NCCL_CTA_POLICY=2 NGPU=8 LOG_RANK=0 MODULE=qwen3 CONFIG=qwen3_14b ./run_train.sh --training.steps=10 --compile.enable --training.dtype=bfloat16 --training.seq_len=128 --training.local_batch_size=160 --loss.num_chunks=6 --comm.trace_buf_size=0 --dump_folder=outputs/autoresearch/may19-qwen3-14b/run162-sdpa-root-forward-prefetch-seq128-lbs160-compile-bf16-nccl-zero-cta-loss-chunks6-no-flight-recorder > run.log 2>&1
26a5589	9406	35.22	169.1	discard	exact root forward prefetch rerun fails to validate tentative win	NCCL_CTA_POLICY=2 NGPU=8 LOG_RANK=0 MODULE=qwen3 CONFIG=qwen3_14b ./run_train.sh --training.steps=10 --compile.enable --training.dtype=bfloat16 --training.seq_len=128 --training.local_batch_size=160 --loss.num_chunks=6 --comm.trace_buf_size=0 --dump_folder=outputs/autoresearch/may19-qwen3-14b/run163-rerun-sdpa-root-forward-prefetch-seq128-lbs160-compile-bf16-nccl-zero-cta-loss-chunks6-no-flight-recorder > run.log 2>&1
f7a4454	10268	38.45	169.1	keep	AdamW weight_decay=0 is a tiny tentative win needing exact rerun	NCCL_CTA_POLICY=2 NGPU=8 LOG_RANK=0 MODULE=qwen3 CONFIG=qwen3_14b ./run_train.sh --training.steps=10 --compile.enable --training.dtype=bfloat16 --training.seq_len=128 --training.local_batch_size=160 --loss.num_chunks=6 --optimizer.weight_decay=0.0 --comm.trace_buf_size=0 --dump_folder=outputs/autoresearch/may19-qwen3-14b/run164-sdpa-prefetch-seq128-lbs160-compile-bf16-nccl-zero-cta-loss-chunks6-weight-decay0-no-flight-recorder > run.log 2>&1
5607f0d	9966	37.32	169.1	discard	exact AdamW weight_decay=0 rerun fails to validate tentative win	NCCL_CTA_POLICY=2 NGPU=8 LOG_RANK=0 MODULE=qwen3 CONFIG=qwen3_14b ./run_train.sh --training.steps=10 --compile.enable --training.dtype=bfloat16 --training.seq_len=128 --training.local_batch_size=160 --loss.num_chunks=6 --optimizer.weight_decay=0.0 --comm.trace_buf_size=0 --dump_folder=outputs/autoresearch/may19-qwen3-14b/run165-rerun-sdpa-prefetch-seq128-lbs160-compile-bf16-nccl-zero-cta-loss-chunks6-weight-decay0-no-flight-recorder > run.log 2>&1
897e995	10288	38.53	169.1	keep	fused Adam weight_decay=0 matches measured best and needs validation	NCCL_CTA_POLICY=2 NGPU=8 LOG_RANK=0 MODULE=qwen3 CONFIG=qwen3_14b ./run_train.sh --training.steps=10 --compile.enable --training.dtype=bfloat16 --training.seq_len=128 --training.local_batch_size=160 --loss.num_chunks=6 --optimizer.name=Adam --optimizer.weight_decay=0.0 --comm.trace_buf_size=0 --dump_folder=outputs/autoresearch/may19-qwen3-14b/run166-sdpa-prefetch-seq128-lbs160-compile-bf16-nccl-zero-cta-loss-chunks6-adam-weight-decay0-no-flight-recorder > run.log 2>&1
2201f17	9999	37.44	169.1	discard	exact fused Adam weight_decay=0 rerun fails to validate tentative win	NCCL_CTA_POLICY=2 NGPU=8 LOG_RANK=0 MODULE=qwen3 CONFIG=qwen3_14b ./run_train.sh --training.steps=10 --compile.enable --training.dtype=bfloat16 --training.seq_len=128 --training.local_batch_size=160 --loss.num_chunks=6 --optimizer.name=Adam --optimizer.weight_decay=0.0 --comm.trace_buf_size=0 --dump_folder=outputs/autoresearch/may19-qwen3-14b/run167-rerun-sdpa-prefetch-seq128-lbs160-compile-bf16-nccl-zero-cta-loss-chunks6-adam-weight-decay0-no-flight-recorder > run.log 2>&1
02ada7b	9843	36.86	169.1	discard	NCCL_MIN_NCHANNELS=16 slows durable chunks6 command	NCCL_CTA_POLICY=2 NCCL_MIN_NCHANNELS=16 NGPU=8 LOG_RANK=0 MODULE=qwen3 CONFIG=qwen3_14b ./run_train.sh --training.steps=10 --compile.enable --training.dtype=bfloat16 --training.seq_len=128 --training.local_batch_size=160 --loss.num_chunks=6 --comm.trace_buf_size=0 --dump_folder=outputs/autoresearch/may19-qwen3-14b/run168-sdpa-prefetch-seq128-lbs160-compile-bf16-nccl-zero-cta-loss-chunks6-nccl-min-nchannels16-no-flight-recorder > run.log 2>&1
0c8bf2f	10110	37.86	169.1	discard	TORCH_NCCL_AVOID_RECORD_STREAMS=0 below durable chunks6 command	TORCH_NCCL_AVOID_RECORD_STREAMS=0 NCCL_CTA_POLICY=2 NGPU=8 LOG_RANK=0 MODULE=qwen3 CONFIG=qwen3_14b ./run_train.sh --training.steps=10 --compile.enable --training.dtype=bfloat16 --training.seq_len=128 --training.local_batch_size=160 --loss.num_chunks=6 --comm.trace_buf_size=0 --dump_folder=outputs/autoresearch/may19-qwen3-14b/run169-sdpa-prefetch-seq128-lbs160-compile-bf16-nccl-zero-cta-loss-chunks6-nccl-record-streams-no-flight-recorder > run.log 2>&1
ebf8af0	9456	35.38	168.3	discard	seq96 local batch213 remains slower under zero-CTA chunks6	NCCL_CTA_POLICY=2 NGPU=8 LOG_RANK=0 MODULE=qwen3 CONFIG=qwen3_14b ./run_train.sh --training.steps=10 --compile.enable --training.dtype=bfloat16 --training.seq_len=96 --training.local_batch_size=213 --loss.num_chunks=6 --comm.trace_buf_size=0 --dump_folder=outputs/autoresearch/may19-qwen3-14b/run170-sdpa-prefetch-seq96-lbs213-compile-bf16-nccl-zero-cta-loss-chunks6-no-flight-recorder > run.log 2>&1
342907f	9968	37.32	168.0	discard	seq120 local batch170 below durable seq128 chunks6 command	NCCL_CTA_POLICY=2 NGPU=8 LOG_RANK=0 MODULE=qwen3 CONFIG=qwen3_14b ./run_train.sh --training.steps=10 --compile.enable --training.dtype=bfloat16 --training.seq_len=120 --training.local_batch_size=170 --loss.num_chunks=6 --comm.trace_buf_size=0 --dump_folder=outputs/autoresearch/may19-qwen3-14b/run171-sdpa-prefetch-seq120-lbs170-compile-bf16-nccl-zero-cta-loss-chunks6-no-flight-recorder > run.log 2>&1
afd8280	9907	37.11	168.5	discard	seq136 local batch150 below durable seq128 chunks6 command	NCCL_CTA_POLICY=2 NGPU=8 LOG_RANK=0 MODULE=qwen3 CONFIG=qwen3_14b ./run_train.sh --training.steps=10 --compile.enable --training.dtype=bfloat16 --training.seq_len=136 --training.local_batch_size=150 --loss.num_chunks=6 --comm.trace_buf_size=0 --dump_folder=outputs/autoresearch/may19-qwen3-14b/run172-sdpa-prefetch-seq136-lbs150-compile-bf16-nccl-zero-cta-loss-chunks6-no-flight-recorder > run.log 2>&1
4e34691	10274	38.47	169.1	keep	BF16 fused optimizer states are a tentative small win needing exact rerun	NCCL_CTA_POLICY=2 NGPU=8 LOG_RANK=0 MODULE=qwen3 CONFIG=qwen3_14b ./run_train.sh --training.steps=10 --compile.enable --training.dtype=bfloat16 --training.seq_len=128 --training.local_batch_size=160 --loss.num_chunks=6 --optimizer.implementation=fused_opt_states_bf16 --comm.trace_buf_size=0 --dump_folder=outputs/autoresearch/may19-qwen3-14b/run173-sdpa-prefetch-seq128-lbs160-compile-bf16-nccl-zero-cta-loss-chunks6-bf16-optimizer-states-no-flight-recorder > run.log 2>&1
f7e3b40	9833	36.82	169.1	discard	exact BF16 fused optimizer states rerun fails to validate tentative win	NCCL_CTA_POLICY=2 NGPU=8 LOG_RANK=0 MODULE=qwen3 CONFIG=qwen3_14b ./run_train.sh --training.steps=10 --compile.enable --training.dtype=bfloat16 --training.seq_len=128 --training.local_batch_size=160 --loss.num_chunks=6 --optimizer.implementation=fused_opt_states_bf16 --comm.trace_buf_size=0 --dump_folder=outputs/autoresearch/may19-qwen3-14b/run174-rerun-sdpa-prefetch-seq128-lbs160-compile-bf16-nccl-zero-cta-loss-chunks6-bf16-optimizer-states-no-flight-recorder > run.log 2>&1
b2ac3e8	10243	38.36	169.1	discard	NCCL_MAX_CTAS=16 stays below durable chunks6 command	NCCL_CTA_POLICY=2 NCCL_MAX_CTAS=16 NGPU=8 LOG_RANK=0 MODULE=qwen3 CONFIG=qwen3_14b ./run_train.sh --training.steps=10 --compile.enable --training.dtype=bfloat16 --training.seq_len=128 --training.local_batch_size=160 --loss.num_chunks=6 --comm.trace_buf_size=0 --dump_folder=outputs/autoresearch/may19-qwen3-14b/run175-sdpa-prefetch-seq128-lbs160-compile-bf16-nccl-zero-cta-max-ctas16-loss-chunks6-no-flight-recorder > run.log 2>&1
40032d1	10307	38.60	169.1	keep	one DataLoader worker prefetch is a tentative new measured best needing exact rerun	NCCL_CTA_POLICY=2 NGPU=8 LOG_RANK=0 MODULE=qwen3 CONFIG=qwen3_14b ./run_train.sh --training.steps=10 --compile.enable --training.dtype=bfloat16 --training.seq_len=128 --training.local_batch_size=160 --loss.num_chunks=6 --dataloader.num_workers=1 --dataloader.persistent_workers --dataloader.prefetch_factor=2 --comm.trace_buf_size=0 --dump_folder=outputs/autoresearch/may19-qwen3-14b/run176-sdpa-prefetch-seq128-lbs160-compile-bf16-nccl-zero-cta-loss-chunks6-dataloader-worker1-prefetch2-no-flight-recorder > run.log 2>&1
bf29ae1	10270	38.46	169.1	keep	exact one DataLoader worker prefetch rerun validates over durable chunks6 command	NCCL_CTA_POLICY=2 NGPU=8 LOG_RANK=0 MODULE=qwen3 CONFIG=qwen3_14b ./run_train.sh --training.steps=10 --compile.enable --training.dtype=bfloat16 --training.seq_len=128 --training.local_batch_size=160 --loss.num_chunks=6 --dataloader.num_workers=1 --dataloader.persistent_workers --dataloader.prefetch_factor=2 --comm.trace_buf_size=0 --dump_folder=outputs/autoresearch/may19-qwen3-14b/run177-rerun-sdpa-prefetch-seq128-lbs160-compile-bf16-nccl-zero-cta-loss-chunks6-dataloader-worker1-prefetch2-no-flight-recorder > run.log 2>&1
f285605	10290	38.53	169.1	keep	two DataLoader workers are a tentative input-pipeline win needing exact rerun	NCCL_CTA_POLICY=2 NGPU=8 LOG_RANK=0 MODULE=qwen3 CONFIG=qwen3_14b ./run_train.sh --training.steps=10 --compile.enable --training.dtype=bfloat16 --training.seq_len=128 --training.local_batch_size=160 --loss.num_chunks=6 --dataloader.num_workers=2 --dataloader.persistent_workers --dataloader.prefetch_factor=2 --comm.trace_buf_size=0 --dump_folder=outputs/autoresearch/may19-qwen3-14b/run178-sdpa-prefetch-seq128-lbs160-compile-bf16-nccl-zero-cta-loss-chunks6-dataloader-worker2-prefetch2-no-flight-recorder > run.log 2>&1
e82d946	10328	38.67	169.1	keep	exact two DataLoader workers rerun validates new best command	NCCL_CTA_POLICY=2 NGPU=8 LOG_RANK=0 MODULE=qwen3 CONFIG=qwen3_14b ./run_train.sh --training.steps=10 --compile.enable --training.dtype=bfloat16 --training.seq_len=128 --training.local_batch_size=160 --loss.num_chunks=6 --dataloader.num_workers=2 --dataloader.persistent_workers --dataloader.prefetch_factor=2 --comm.trace_buf_size=0 --dump_folder=outputs/autoresearch/may19-qwen3-14b/run179-rerun-sdpa-prefetch-seq128-lbs160-compile-bf16-nccl-zero-cta-loss-chunks6-dataloader-worker2-prefetch2-no-flight-recorder > run.log 2>&1
1ba4956	10283	38.51	169.1	discard	four DataLoader workers add overhead versus the two-worker command	NCCL_CTA_POLICY=2 NGPU=8 LOG_RANK=0 MODULE=qwen3 CONFIG=qwen3_14b ./run_train.sh --training.steps=10 --compile.enable --training.dtype=bfloat16 --training.seq_len=128 --training.local_batch_size=160 --loss.num_chunks=6 --dataloader.num_workers=4 --dataloader.persistent_workers --dataloader.prefetch_factor=2 --comm.trace_buf_size=0 --dump_folder=outputs/autoresearch/may19-qwen3-14b/run180-sdpa-prefetch-seq128-lbs160-compile-bf16-nccl-zero-cta-loss-chunks6-dataloader-worker4-prefetch2-no-flight-recorder > run.log 2>&1
8601022	10268	38.45	169.1	discard	two DataLoader workers with prefetch_factor=4 regresses versus prefetch_factor=2	NCCL_CTA_POLICY=2 NGPU=8 LOG_RANK=0 MODULE=qwen3 CONFIG=qwen3_14b ./run_train.sh --training.steps=10 --compile.enable --training.dtype=bfloat16 --training.seq_len=128 --training.local_batch_size=160 --loss.num_chunks=6 --dataloader.num_workers=2 --dataloader.persistent_workers --dataloader.prefetch_factor=4 --comm.trace_buf_size=0 --dump_folder=outputs/autoresearch/may19-qwen3-14b/run181-sdpa-prefetch-seq128-lbs160-compile-bf16-nccl-zero-cta-loss-chunks6-dataloader-worker2-prefetch4-no-flight-recorder > run.log 2>&1
a4cd80f	10301	38.58	169.1	discard	pinned memory does not beat the validated two-worker DataLoader command	NCCL_CTA_POLICY=2 NGPU=8 LOG_RANK=0 MODULE=qwen3 CONFIG=qwen3_14b ./run_train.sh --training.steps=10 --compile.enable --training.dtype=bfloat16 --training.seq_len=128 --training.local_batch_size=160 --loss.num_chunks=6 --dataloader.num_workers=2 --dataloader.persistent_workers --dataloader.prefetch_factor=2 --dataloader.pin_memory --comm.trace_buf_size=0 --dump_folder=outputs/autoresearch/may19-qwen3-14b/run182-sdpa-prefetch-seq128-lbs160-compile-bf16-nccl-zero-cta-loss-chunks6-dataloader-worker2-prefetch2-pin-memory-no-flight-recorder > run.log 2>&1
f0480d5	10254	38.40	169.1	discard	three DataLoader workers are slower than validated two-worker setting	NCCL_CTA_POLICY=2 NGPU=8 LOG_RANK=0 MODULE=qwen3 CONFIG=qwen3_14b ./run_train.sh --training.steps=10 --compile.enable --training.dtype=bfloat16 --training.seq_len=128 --training.local_batch_size=160 --loss.num_chunks=6 --dataloader.num_workers=3 --dataloader.persistent_workers --dataloader.prefetch_factor=2 --comm.trace_buf_size=0 --dump_folder=outputs/autoresearch/may19-qwen3-14b/run183-sdpa-prefetch-seq128-lbs160-compile-bf16-nccl-zero-cta-loss-chunks6-dataloader-worker3-prefetch2-no-flight-recorder > run.log 2>&1
b130c48	9566	35.82	169.1	discard	profile current best two-worker DataLoader command diagnostic	NCCL_CTA_POLICY=2 NGPU=8 LOG_RANK=0 MODULE=qwen3 CONFIG=qwen3_14b ./run_train.sh --training.steps=10 --compile.enable --training.dtype=bfloat16 --training.seq_len=128 --training.local_batch_size=160 --loss.num_chunks=6 --dataloader.num_workers=2 --dataloader.persistent_workers --dataloader.prefetch_factor=2 --comm.trace_buf_size=0 --dump_folder=outputs/autoresearch/may19-qwen3-14b/run184-profile-sdpa-prefetch-seq128-lbs160-compile-bf16-nccl-zero-cta-loss-chunks6-dataloader-worker2-prefetch2-no-flight-recorder --profiler.enable_profiling --profiler.profile_freq=10 --profiler.profiler_warmup=2 --profiler.profiler_active=1 > run.log 2>&1
5bc61e7	0	0.00	0.0	crash	model-only compile OOMs in eager chunked cross entropy	NCCL_CTA_POLICY=2 NGPU=8 LOG_RANK=0 MODULE=qwen3 CONFIG=qwen3_14b ./run_train.sh --training.steps=10 --compile.enable --compile.components '["model"]' --training.dtype=bfloat16 --training.seq_len=128 --training.local_batch_size=160 --loss.num_chunks=6 --dataloader.num_workers=2 --dataloader.persistent_workers --dataloader.prefetch_factor=2 --comm.trace_buf_size=0 --dump_folder=outputs/autoresearch/may19-qwen3-14b/run185-sdpa-prefetch-seq128-lbs160-compile-model-only-bf16-nccl-zero-cta-loss-chunks6-dataloader-worker2-prefetch2-no-flight-recorder > run.log 2>&1
49bd1b0	10263	38.43	169.1	discard	two-worker DataLoader with BF16 optimizer states remains below best	NCCL_CTA_POLICY=2 NGPU=8 LOG_RANK=0 MODULE=qwen3 CONFIG=qwen3_14b ./run_train.sh --training.steps=10 --compile.enable --training.dtype=bfloat16 --training.seq_len=128 --training.local_batch_size=160 --loss.num_chunks=6 --dataloader.num_workers=2 --dataloader.persistent_workers --dataloader.prefetch_factor=2 --optimizer.implementation=fused_opt_states_bf16 --comm.trace_buf_size=0 --dump_folder=outputs/autoresearch/may19-qwen3-14b/run186-sdpa-prefetch-seq128-lbs160-compile-bf16-nccl-zero-cta-loss-chunks6-dataloader-worker2-prefetch2-bf16-optimizer-states-no-flight-recorder > run.log 2>&1
72c8249	10047	37.62	169.1	discard	NCCL_MAX_CTAS=8 underfeeds current best command	NCCL_CTA_POLICY=2 NCCL_MAX_CTAS=8 NGPU=8 LOG_RANK=0 MODULE=qwen3 CONFIG=qwen3_14b ./run_train.sh --training.steps=10 --compile.enable --training.dtype=bfloat16 --training.seq_len=128 --training.local_batch_size=160 --loss.num_chunks=6 --dataloader.num_workers=2 --dataloader.persistent_workers --dataloader.prefetch_factor=2 --comm.trace_buf_size=0 --dump_folder=outputs/autoresearch/may19-qwen3-14b/run187-sdpa-prefetch-seq128-lbs160-compile-bf16-nccl-zero-cta-max-ctas8-loss-chunks6-dataloader-worker2-prefetch2-no-flight-recorder > run.log 2>&1
bbc67c4	9969	37.33	169.1	discard	two-worker DataLoader prefetch_factor=1 underfeeds input pipeline	NCCL_CTA_POLICY=2 NGPU=8 LOG_RANK=0 MODULE=qwen3 CONFIG=qwen3_14b ./run_train.sh --training.steps=10 --compile.enable --training.dtype=bfloat16 --training.seq_len=128 --training.local_batch_size=160 --loss.num_chunks=6 --dataloader.num_workers=2 --dataloader.persistent_workers --dataloader.prefetch_factor=1 --comm.trace_buf_size=0 --dump_folder=outputs/autoresearch/may19-qwen3-14b/run188-sdpa-prefetch-seq128-lbs160-compile-bf16-nccl-zero-cta-loss-chunks6-dataloader-worker2-prefetch1-no-flight-recorder > run.log 2>&1
252ff08	10255	38.40	169.1	discard	two DataLoader workers without persistence below validated setting	NCCL_CTA_POLICY=2 NGPU=8 LOG_RANK=0 MODULE=qwen3 CONFIG=qwen3_14b ./run_train.sh --training.steps=10 --compile.enable --training.dtype=bfloat16 --training.seq_len=128 --training.local_batch_size=160 --loss.num_chunks=6 --dataloader.num_workers=2 --dataloader.prefetch_factor=2 --comm.trace_buf_size=0 --dump_folder=outputs/autoresearch/may19-qwen3-14b/run189-sdpa-prefetch-seq128-lbs160-compile-bf16-nccl-zero-cta-loss-chunks6-dataloader-worker2-prefetch2-no-persistent-workers-no-flight-recorder > run.log 2>&1
