commit	tokens_per_sec	mfu_percent	peak_memory_gb	status	description	command
b57e3c1	10529	39.43	169.1	discard	NCCL_ALGO=NVLSTree,Ring is below measured peak; automatic NCCL algorithm selection remains best	NCCL_ALGO=NVLSTree,Ring NCCL_CTA_POLICY=2 NGPU=8 LOG_RANK=0 MODULE=qwen3 CONFIG=qwen3_14b ./run_train.sh --training.steps=10 --compile.enable --training.dtype=bfloat16 --training.seq_len=128 --training.local_batch_size=160 --loss.num_chunks=6 --dataloader.num_workers=2 --dataloader.persistent_workers --dataloader.prefetch_factor=2 --metrics.log_freq=1 --comm.trace_buf_size=0 --dump_folder=outputs/autoresearch/may19-qwen3-14b/run313-nccl-algo-nvlstree-ring-sdpa-prefetch-seq128-lbs160-compile-bf16-nccl-zero-cta-loss-chunks6-dataloader-worker2-prefetch2-metrics-logfreq1-no-flight-recorder > run.log 2>&1
8acea97	10266	38.44	169.1	discard	NCCL_ALGO=PAT,Ring is below measured peak; automatic NCCL algorithm selection remains best	NCCL_ALGO=PAT,Ring NCCL_CTA_POLICY=2 NGPU=8 LOG_RANK=0 MODULE=qwen3 CONFIG=qwen3_14b ./run_train.sh --training.steps=10 --compile.enable --training.dtype=bfloat16 --training.seq_len=128 --training.local_batch_size=160 --loss.num_chunks=6 --dataloader.num_workers=2 --dataloader.persistent_workers --dataloader.prefetch_factor=2 --metrics.log_freq=1 --comm.trace_buf_size=0 --dump_folder=outputs/autoresearch/may19-qwen3-14b/run314-nccl-algo-pat-ring-sdpa-prefetch-seq128-lbs160-compile-bf16-nccl-zero-cta-loss-chunks6-dataloader-worker2-prefetch2-metrics-logfreq1-no-flight-recorder > run.log 2>&1
7d0c769	10445	39.11	169.1	keep	exact current-best rerun after NCCL algorithm probes samples low but remains healthy	NCCL_CTA_POLICY=2 NGPU=8 LOG_RANK=0 MODULE=qwen3 CONFIG=qwen3_14b ./run_train.sh --training.steps=10 --compile.enable --training.dtype=bfloat16 --training.seq_len=128 --training.local_batch_size=160 --loss.num_chunks=6 --dataloader.num_workers=2 --dataloader.persistent_workers --dataloader.prefetch_factor=2 --metrics.log_freq=1 --comm.trace_buf_size=0 --dump_folder=outputs/autoresearch/may19-qwen3-14b/run315-rerun-after-nccl-algorithm-probes-sdpa-prefetch-seq128-lbs160-compile-bf16-nccl-zero-cta-loss-chunks6-dataloader-worker2-prefetch2-metrics-logfreq1-no-flight-recorder > run.log 2>&1
3dc1138	10527	39.42	169.1	profile	profiler refresh after NCCL algorithm probes still shows GPU-busy GEMM plus overlapped FSDP ring-LL reduce-scatter/all-gather; no host or DataLoader bottleneck	NCCL_CTA_POLICY=2 NGPU=8 LOG_RANK=0 MODULE=qwen3 CONFIG=qwen3_14b ./run_train.sh --training.steps=10 --compile.enable --training.dtype=bfloat16 --training.seq_len=128 --training.local_batch_size=160 --loss.num_chunks=6 --dataloader.num_workers=2 --dataloader.persistent_workers --dataloader.prefetch_factor=2 --metrics.log_freq=1 --comm.trace_buf_size=0 --profiler.enable_profiling --profiler.profile_freq=10 --profiler.profiler_warmup=2 --profiler.profiler_active=1 --dump_folder=outputs/autoresearch/may19-qwen3-14b/run316-profile-after-nccl-algorithm-probes-sdpa-prefetch-seq128-lbs160-compile-bf16-nccl-zero-cta-loss-chunks6-dataloader-worker2-prefetch2-metrics-logfreq1-no-flight-recorder > run.log 2>&1
4680f65	10515	39.38	169.1	discard	final norm FSDP prefetch chain is below measured peak; durable direct lm_head prefetch remains better	NCCL_CTA_POLICY=2 NGPU=8 LOG_RANK=0 MODULE=qwen3 CONFIG=qwen3_14b ./run_train.sh --training.steps=10 --compile.enable --training.dtype=bfloat16 --training.seq_len=128 --training.local_batch_size=160 --loss.num_chunks=6 --dataloader.num_workers=2 --dataloader.persistent_workers --dataloader.prefetch_factor=2 --metrics.log_freq=1 --comm.trace_buf_size=0 --dump_folder=outputs/autoresearch/may19-qwen3-14b/run317-final-norm-fsdp-prefetch-chain-sdpa-prefetch-seq128-lbs160-compile-bf16-nccl-zero-cta-loss-chunks6-dataloader-worker2-prefetch2-metrics-logfreq1-no-flight-recorder > run.log 2>&1
f87c8ce	10658	39.91	169.1	keep	exact current-best rerun after final norm source restore is the new measured peak	NCCL_CTA_POLICY=2 NGPU=8 LOG_RANK=0 MODULE=qwen3 CONFIG=qwen3_14b ./run_train.sh --training.steps=10 --compile.enable --training.dtype=bfloat16 --training.seq_len=128 --training.local_batch_size=160 --loss.num_chunks=6 --dataloader.num_workers=2 --dataloader.persistent_workers --dataloader.prefetch_factor=2 --metrics.log_freq=1 --comm.trace_buf_size=0 --dump_folder=outputs/autoresearch/may19-qwen3-14b/run318-rerun-after-final-norm-source-restore-sdpa-prefetch-seq128-lbs160-compile-bf16-nccl-zero-cta-loss-chunks6-dataloader-worker2-prefetch2-metrics-logfreq1-no-flight-recorder > run.log 2>&1
c90a5c8	10584	39.63	169.1	discard	TORCH_NCCL_USE_TENSOR_REGISTER_ALLOCATOR_HOOK=1 is below measured peak; default ProcessGroupNCCL registration remains better	TORCH_NCCL_USE_TENSOR_REGISTER_ALLOCATOR_HOOK=1 NCCL_CTA_POLICY=2 NGPU=8 LOG_RANK=0 MODULE=qwen3 CONFIG=qwen3_14b ./run_train.sh --training.steps=10 --compile.enable --training.dtype=bfloat16 --training.seq_len=128 --training.local_batch_size=160 --loss.num_chunks=6 --dataloader.num_workers=2 --dataloader.persistent_workers --dataloader.prefetch_factor=2 --metrics.log_freq=1 --comm.trace_buf_size=0 --dump_folder=outputs/autoresearch/may19-qwen3-14b/run319-torch-nccl-tensor-register-allocator-hook-sdpa-prefetch-seq128-lbs160-compile-bf16-nccl-zero-cta-loss-chunks6-dataloader-worker2-prefetch2-metrics-logfreq1-no-flight-recorder > run.log 2>&1
214a3df	10287	38.52	169.1	discard	loss.num_chunks=3 fits but is much slower; keep loss.num_chunks=6	NCCL_CTA_POLICY=2 NGPU=8 LOG_RANK=0 MODULE=qwen3 CONFIG=qwen3_14b ./run_train.sh --training.steps=10 --compile.enable --training.dtype=bfloat16 --training.seq_len=128 --training.local_batch_size=160 --loss.num_chunks=3 --dataloader.num_workers=2 --dataloader.persistent_workers --dataloader.prefetch_factor=2 --metrics.log_freq=1 --comm.trace_buf_size=0 --dump_folder=outputs/autoresearch/may19-qwen3-14b/run320-loss-chunks3-sdpa-prefetch-seq128-lbs160-compile-bf16-nccl-zero-cta-dataloader-worker2-prefetch2-metrics-logfreq1-no-flight-recorder > run.log 2>&1
becb1a1	10618	39.76	169.1	discard	NCCL_P2P_DIRECT_DISABLE=1 is valid but below measured peak; default direct P2P remains better	NCCL_P2P_DIRECT_DISABLE=1 NCCL_CTA_POLICY=2 NGPU=8 LOG_RANK=0 MODULE=qwen3 CONFIG=qwen3_14b ./run_train.sh --training.steps=10 --compile.enable --training.dtype=bfloat16 --training.seq_len=128 --training.local_batch_size=160 --loss.num_chunks=6 --dataloader.num_workers=2 --dataloader.persistent_workers --dataloader.prefetch_factor=2 --metrics.log_freq=1 --comm.trace_buf_size=0 --dump_folder=outputs/autoresearch/may19-qwen3-14b/run321-nccl-p2p-direct-disable-sdpa-prefetch-seq128-lbs160-compile-bf16-nccl-zero-cta-loss-chunks6-dataloader-worker2-prefetch2-metrics-logfreq1-no-flight-recorder > run.log 2>&1
ed6bce9	10477	39.23	169.1	keep	exact current-best rerun after P2P and loss closure samples low but remains healthy	NCCL_CTA_POLICY=2 NGPU=8 LOG_RANK=0 MODULE=qwen3 CONFIG=qwen3_14b ./run_train.sh --training.steps=10 --compile.enable --training.dtype=bfloat16 --training.seq_len=128 --training.local_batch_size=160 --loss.num_chunks=6 --dataloader.num_workers=2 --dataloader.persistent_workers --dataloader.prefetch_factor=2 --metrics.log_freq=1 --comm.trace_buf_size=0 --dump_folder=outputs/autoresearch/may19-qwen3-14b/run322-rerun-after-p2p-and-loss-closure-sdpa-prefetch-seq128-lbs160-compile-bf16-nccl-zero-cta-loss-chunks6-dataloader-worker2-prefetch2-metrics-logfreq1-no-flight-recorder > run.log 2>&1
9f2db1d	10513	39.37	167.07	discard	root FSDP no-reshard reduces memory but is below measured peak; restore durable root reshard policy	NCCL_CTA_POLICY=2 NGPU=8 LOG_RANK=0 MODULE=qwen3 CONFIG=qwen3_14b ./run_train.sh --training.steps=10 --compile.enable --training.dtype=bfloat16 --training.seq_len=128 --training.local_batch_size=160 --loss.num_chunks=6 --dataloader.num_workers=2 --dataloader.persistent_workers --dataloader.prefetch_factor=2 --metrics.log_freq=1 --comm.trace_buf_size=0 --dump_folder=outputs/autoresearch/may19-qwen3-14b/run323-root-fsdp-no-reshard-sdpa-prefetch-seq128-lbs160-compile-bf16-nccl-zero-cta-loss-chunks6-dataloader-worker2-prefetch2-metrics-logfreq1-no-flight-recorder > run.log 2>&1
b69040e	10553	39.52	168.94	discard	root FSDP no-reshard with local_batch_size=162 stays below measured peak despite safe memory	NCCL_CTA_POLICY=2 NGPU=8 LOG_RANK=0 MODULE=qwen3 CONFIG=qwen3_14b ./run_train.sh --training.steps=10 --compile.enable --training.dtype=bfloat16 --training.seq_len=128 --training.local_batch_size=162 --loss.num_chunks=6 --dataloader.num_workers=2 --dataloader.persistent_workers --dataloader.prefetch_factor=2 --metrics.log_freq=1 --comm.trace_buf_size=0 --dump_folder=outputs/autoresearch/may19-qwen3-14b/run324-root-fsdp-no-reshard-lbs162-sdpa-prefetch-seq128-compile-bf16-nccl-zero-cta-loss-chunks6-dataloader-worker2-prefetch2-metrics-logfreq1-no-flight-recorder > run.log 2>&1
62c37e3	0	0.00	0.0	invalid	exact rerun after root source restore was interrupted by SIGTERM before step 1 completed	NCCL_CTA_POLICY=2 NGPU=8 LOG_RANK=0 MODULE=qwen3 CONFIG=qwen3_14b ./run_train.sh --training.steps=10 --compile.enable --training.dtype=bfloat16 --training.seq_len=128 --training.local_batch_size=160 --loss.num_chunks=6 --dataloader.num_workers=2 --dataloader.persistent_workers --dataloader.prefetch_factor=2 --metrics.log_freq=1 --comm.trace_buf_size=0 --dump_folder=outputs/autoresearch/may19-qwen3-14b/run325-rerun-after-root-source-restore-sdpa-prefetch-seq128-lbs160-compile-bf16-nccl-zero-cta-loss-chunks6-dataloader-worker2-prefetch2-metrics-logfreq1-no-flight-recorder > run.log 2>&1
4bb42b6	10479	39.24	167.98	discard	attention/FFN compile granularity lowers memory but is slower than block-level compile; restore durable compile granularity	NCCL_CTA_POLICY=2 NGPU=8 LOG_RANK=0 MODULE=qwen3 CONFIG=qwen3_14b ./run_train.sh --training.steps=10 --compile.enable --training.dtype=bfloat16 --training.seq_len=128 --training.local_batch_size=160 --loss.num_chunks=6 --dataloader.num_workers=2 --dataloader.persistent_workers --dataloader.prefetch_factor=2 --metrics.log_freq=1 --comm.trace_buf_size=0 --dump_folder=outputs/autoresearch/may19-qwen3-14b/run326-attention-ffn-compile-granularity-sdpa-prefetch-seq128-lbs160-compile-bf16-nccl-zero-cta-loss-chunks6-dataloader-worker2-prefetch2-metrics-logfreq1-no-flight-recorder > run.log 2>&1
635bce9	10286	38.52	174.10	discard	TORCHINDUCTOR_MAX_AUTOTUNE_GEMM=1 is slower and memory-heavy on final SDPA stack; keep default GEMM selection	TORCHINDUCTOR_MAX_AUTOTUNE_GEMM=1 NCCL_CTA_POLICY=2 NGPU=8 LOG_RANK=0 MODULE=qwen3 CONFIG=qwen3_14b ./run_train.sh --training.steps=10 --compile.enable --training.dtype=bfloat16 --training.seq_len=128 --training.local_batch_size=160 --loss.num_chunks=6 --dataloader.num_workers=2 --dataloader.persistent_workers --dataloader.prefetch_factor=2 --metrics.log_freq=1 --comm.trace_buf_size=0 --dump_folder=outputs/autoresearch/may19-qwen3-14b/run327-inductor-max-autotune-gemm-only-sdpa-prefetch-seq128-lbs160-compile-bf16-nccl-zero-cta-loss-chunks6-dataloader-worker2-prefetch2-metrics-logfreq1-no-flight-recorder > run.log 2>&1
ad640dd	10535	39.45	169.10	discard	block compile with fullgraph=False is valid but below measured peak; restore fullgraph=True apply_compile path	NCCL_CTA_POLICY=2 NGPU=8 LOG_RANK=0 MODULE=qwen3 CONFIG=qwen3_14b ./run_train.sh --training.steps=10 --compile.enable --training.dtype=bfloat16 --training.seq_len=128 --training.local_batch_size=160 --loss.num_chunks=6 --dataloader.num_workers=2 --dataloader.persistent_workers --dataloader.prefetch_factor=2 --metrics.log_freq=1 --comm.trace_buf_size=0 --dump_folder=outputs/autoresearch/may19-qwen3-14b/run328-block-compile-fullgraph-false-sdpa-prefetch-seq128-lbs160-compile-bf16-nccl-zero-cta-loss-chunks6-dataloader-worker2-prefetch2-metrics-logfreq1-no-flight-recorder > run.log 2>&1
13c3a98	10522	39.40	169.10	discard	forced SDPA Flash attention is valid but below measured peak; keep default SDPA backend priority	NCCL_CTA_POLICY=2 NGPU=8 LOG_RANK=0 MODULE=qwen3 CONFIG=qwen3_14b ./run_train.sh --training.steps=10 --compile.enable --training.dtype=bfloat16 --training.seq_len=128 --training.local_batch_size=160 --loss.num_chunks=6 --dataloader.num_workers=2 --dataloader.persistent_workers --dataloader.prefetch_factor=2 --metrics.log_freq=1 --comm.trace_buf_size=0 --dump_folder=outputs/autoresearch/may19-qwen3-14b/run329-force-sdpa-flash-backend-sdpa-prefetch-seq128-lbs160-compile-bf16-nccl-zero-cta-loss-chunks6-dataloader-worker2-prefetch2-metrics-logfreq1-no-flight-recorder > run.log 2>&1
e0b48db	10561	39.55	169.86	discard	two-layer FSDP parameter groups fit but are below measured peak; keep one group per transformer layer	NCCL_CTA_POLICY=2 NGPU=8 LOG_RANK=0 MODULE=qwen3 CONFIG=qwen3_14b ./run_train.sh --training.steps=10 --compile.enable --training.dtype=bfloat16 --training.seq_len=128 --training.local_batch_size=160 --loss.num_chunks=6 --dataloader.num_workers=2 --dataloader.persistent_workers --dataloader.prefetch_factor=2 --metrics.log_freq=1 --comm.trace_buf_size=0 --dump_folder=outputs/autoresearch/may19-qwen3-14b/run330-two-layer-fsdp-groups-sdpa-prefetch-seq128-lbs160-compile-bf16-nccl-zero-cta-loss-chunks6-dataloader-worker2-prefetch2-metrics-logfreq1-no-flight-recorder > run.log 2>&1
5939c33	0	0.00	0.0	crash	flex_flash after CUTE install reaches generated CUTE code but fails on missing flash_attn.cute.block_sparsity	NCCL_CTA_POLICY=2 NGPU=8 LOG_RANK=0 MODULE=qwen3 CONFIG=qwen3_14b ./run_train.sh --training.steps=10 --compile.enable --training.dtype=bfloat16 --training.seq_len=128 --training.local_batch_size=160 --loss.num_chunks=6 --dataloader.num_workers=2 --dataloader.persistent_workers --dataloader.prefetch_factor=2 --metrics.log_freq=1 --comm.trace_buf_size=0 --dump_folder=outputs/autoresearch/may19-qwen3-14b/run331-flex-flash-after-cute-install-sdpa-prefetch-seq128-lbs160-compile-bf16-nccl-zero-cta-loss-chunks6-dataloader-worker2-prefetch2-metrics-logfreq1-no-flight-recorder > run.log 2>&1
41b60a8	0	0.00	0.0	crash	flex_flash with vendored FlashAttention resolves block_sparsity but fails in SM100 block-sparse correction with None gO	PYTHONPATH=/home/avenkataraman/github/pytorch/third_party/flash-attention:$PYTHONPATH NCCL_CTA_POLICY=2 NGPU=8 LOG_RANK=0 MODULE=qwen3 CONFIG=qwen3_14b ./run_train.sh --training.steps=10 --compile.enable --training.dtype=bfloat16 --training.seq_len=128 --training.local_batch_size=160 --loss.num_chunks=6 --dataloader.num_workers=2 --dataloader.persistent_workers --dataloader.prefetch_factor=2 --metrics.log_freq=1 --comm.trace_buf_size=0 --dump_folder=outputs/autoresearch/may19-qwen3-14b/run332-flex-flash-vendored-flash-attn-seq128-lbs160-compile-bf16-nccl-zero-cta-loss-chunks6-dataloader-worker2-prefetch2-metrics-logfreq1-no-flight-recorder > run.log 2>&1
d30819f	10481	39.25	169.10	discard	CUTE DSL GEMM autotune is valid but below measured peak; default GEMM selection remains better	CUTEDSL_ENABLE_AUTOTUNING=1 TORCHINDUCTOR_MAX_AUTOTUNE_GEMM=1 TORCHINDUCTOR_MAX_AUTOTUNE_GEMM_BACKENDS=ATEN,CUTEDSL NCCL_CTA_POLICY=2 NGPU=8 LOG_RANK=0 MODULE=qwen3 CONFIG=qwen3_14b ./run_train.sh --training.steps=10 --compile.enable --training.dtype=bfloat16 --training.seq_len=128 --training.local_batch_size=160 --loss.num_chunks=6 --dataloader.num_workers=2 --dataloader.persistent_workers --dataloader.prefetch_factor=2 --metrics.log_freq=1 --comm.trace_buf_size=0 --dump_folder=outputs/autoresearch/may19-qwen3-14b/run333-cutedsl-gemm-autotune-sdpa-prefetch-seq128-lbs160-compile-bf16-nccl-zero-cta-loss-chunks6-dataloader-worker2-prefetch2-metrics-logfreq1-no-flight-recorder > run.log 2>&1
70c04bd	5227	0.00	129.86	discard	Float8Linear converter is much slower and emits FSDP view-tensor warning; restore BF16 Linear configs	NCCL_CTA_POLICY=2 NGPU=8 LOG_RANK=0 MODULE=qwen3 CONFIG=qwen3_14b ./run_train.sh --training.steps=10 --compile.enable --training.dtype=bfloat16 --training.seq_len=128 --training.local_batch_size=160 --loss.num_chunks=6 --dataloader.num_workers=2 --dataloader.persistent_workers --dataloader.prefetch_factor=2 --metrics.log_freq=1 --comm.trace_buf_size=0 --dump_folder=outputs/autoresearch/may19-qwen3-14b/run334-float8-linear-converter-sdpa-prefetch-seq128-lbs160-compile-bf16-nccl-zero-cta-loss-chunks6-dataloader-worker2-prefetch2-metrics-logfreq1-no-flight-recorder > run.log 2>&1
b9347ac	0	0.00	0.0	crash	MXFP8Linear converter crashes before step 1 in torchao mxfp8_quantize invalid argument	NCCL_CTA_POLICY=2 NGPU=8 LOG_RANK=0 MODULE=qwen3 CONFIG=qwen3_14b ./run_train.sh --training.steps=10 --compile.enable --training.dtype=bfloat16 --training.seq_len=128 --training.local_batch_size=160 --loss.num_chunks=6 --dataloader.num_workers=2 --dataloader.persistent_workers --dataloader.prefetch_factor=2 --metrics.log_freq=1 --comm.trace_buf_size=0 --dump_folder=outputs/autoresearch/may19-qwen3-14b/run335-mxfp8-linear-converter-sdpa-prefetch-seq128-lbs160-compile-bf16-nccl-zero-cta-loss-chunks6-dataloader-worker2-prefetch2-metrics-logfreq1-no-flight-recorder > run.log 2>&1
4e5f0e2	10528	39.42	172.50	discard	three-layer FSDP groups fit but are slower and memory-risky; keep per-layer groups	NCCL_CTA_POLICY=2 NGPU=8 LOG_RANK=0 MODULE=qwen3 CONFIG=qwen3_14b ./run_train.sh --training.steps=10 --compile.enable --training.dtype=bfloat16 --training.seq_len=128 --training.local_batch_size=160 --loss.num_chunks=6 --dataloader.num_workers=2 --dataloader.persistent_workers --dataloader.prefetch_factor=2 --metrics.log_freq=1 --comm.trace_buf_size=0 --dump_folder=outputs/autoresearch/may19-qwen3-14b/run336-three-layer-fsdp-groups-sdpa-prefetch-seq128-lbs160-compile-bf16-nccl-zero-cta-loss-chunks6-dataloader-worker2-prefetch2-metrics-logfreq1-no-flight-recorder > run.log 2>&1
8a9c2bd	10657	39.91	167.17	keep	optimizer-in-backward matches peak band and saves memory, but grad_norm metric becomes zero; test batch conversion next	NCCL_CTA_POLICY=2 NGPU=8 LOG_RANK=0 MODULE=qwen3 CONFIG=qwen3_14b ./run_train.sh --training.steps=10 --compile.enable --training.dtype=bfloat16 --training.seq_len=128 --training.local_batch_size=160 --loss.num_chunks=6 --dataloader.num_workers=2 --dataloader.persistent_workers --dataloader.prefetch_factor=2 --metrics.log_freq=1 --comm.trace_buf_size=0 --dump_folder=outputs/autoresearch/may19-qwen3-14b/run337-optimizer-in-backward-sdpa-prefetch-seq128-lbs160-compile-bf16-nccl-zero-cta-loss-chunks6-dataloader-worker2-prefetch2-metrics-logfreq1-no-flight-recorder > run.log 2>&1
8a9c2bd	10548	39.50	168.92	discard	optimizer-in-backward batch162 does not beat peak; restore normal optimizer due grad_norm caveat	NCCL_CTA_POLICY=2 NGPU=8 LOG_RANK=0 MODULE=qwen3 CONFIG=qwen3_14b ./run_train.sh --training.steps=10 --compile.enable --training.dtype=bfloat16 --training.seq_len=128 --training.local_batch_size=162 --loss.num_chunks=6 --dataloader.num_workers=2 --dataloader.persistent_workers --dataloader.prefetch_factor=2 --metrics.log_freq=1 --comm.trace_buf_size=0 --dump_folder=outputs/autoresearch/may19-qwen3-14b/run338-optimizer-in-backward-lbs162-sdpa-prefetch-seq128-compile-bf16-nccl-zero-cta-loss-chunks6-dataloader-worker2-prefetch2-metrics-logfreq1-no-flight-recorder > run.log 2>&1
8ed2db5	0	0.00	0.0	crash	model-only compile OOMs in uncompiled chunked cross entropy before step 1	NCCL_CTA_POLICY=2 NGPU=8 LOG_RANK=0 MODULE=qwen3 CONFIG=qwen3_14b ./run_train.sh --training.steps=10 --compile.enable --compile.components='["model"]' --training.dtype=bfloat16 --training.seq_len=128 --training.local_batch_size=160 --loss.num_chunks=6 --dataloader.num_workers=2 --dataloader.persistent_workers --dataloader.prefetch_factor=2 --metrics.log_freq=1 --comm.trace_buf_size=0 --dump_folder=outputs/autoresearch/may19-qwen3-14b/run339-model-only-compile-sdpa-prefetch-seq128-lbs160-bf16-nccl-zero-cta-loss-chunks6-dataloader-worker2-prefetch2-metrics-logfreq1-no-flight-recorder > run.log 2>&1
b7914812	0	0.00	0.0	crash	MXFP8Linear with Triton dim1 avoids CUDA invalid-argument crash but loss chunk6 backward violates Triton dim1 128-row tile constraint	NCCL_CTA_POLICY=2 NGPU=8 LOG_RANK=0 MODULE=qwen3 CONFIG=qwen3_14b ./run_train.sh --training.steps=10 --compile.enable --training.dtype=bfloat16 --training.seq_len=128 --training.local_batch_size=160 --loss.num_chunks=6 --dataloader.num_workers=2 --dataloader.persistent_workers --dataloader.prefetch_factor=2 --metrics.log_freq=1 --comm.trace_buf_size=0 --dump_folder=outputs/autoresearch/may19-qwen3-14b/run340-mxfp8-linear-triton-dim1-sdpa-prefetch-seq128-lbs160-compile-bf16-nccl-zero-cta-loss-chunks6-dataloader-worker2-prefetch2-metrics-logfreq1-no-flight-recorder > run.log 2>&1
03fc0ca2	0	0.00	0.0	crash	MXFP8Linear Triton dim1 with loss chunk5 still violates 128-row tile because chunking follows sequence slices, not equal flat token rows	NCCL_CTA_POLICY=2 NGPU=8 LOG_RANK=0 MODULE=qwen3 CONFIG=qwen3_14b ./run_train.sh --training.steps=10 --compile.enable --training.dtype=bfloat16 --training.seq_len=128 --training.local_batch_size=160 --loss.num_chunks=5 --dataloader.num_workers=2 --dataloader.persistent_workers --dataloader.prefetch_factor=2 --metrics.log_freq=1 --comm.trace_buf_size=0 --dump_folder=outputs/autoresearch/may19-qwen3-14b/run341-mxfp8-linear-triton-dim1-loss-chunks5-sdpa-prefetch-seq128-lbs160-compile-bf16-nccl-zero-cta-dataloader-worker2-prefetch2-metrics-logfreq1-no-flight-recorder > run.log 2>&1
