commit	tokens_per_sec	mfu_percent	peak_memory_gb	status	description	command
116d305d+dirty	14059	0.00	172.88	discard	compiled residual-plus-RMSNorm block helper sustains above the old peak but is slightly slower and no lower-memory than compiling only the outer RMSNorm calls	TORCH_NCCL_CUDA_EVENT_CACHE=0 NCCL_NVLS_ENABLE=1 NCCL_CTA_POLICY=2 NGPU=8 LOG_RANK=0 MODULE=qwen3 CONFIG=qwen3_14b ./run_train.sh --training.steps=20 --compile.enable --compile.components=loss,feed_forward,qkv_linear,qk_norm_rope,block_norms --training.dtype=bfloat16 --training.seq_len=128 --training.local_batch_size=176 --loss.num_chunks=4 --optimizer.weight_decay=0.0 --dataloader.num_workers=2 --dataloader.persistent_workers --dataloader.prefetch_factor=2 --metrics.log_freq=1 --comm.trace_buf_size=0 --dump_folder=outputs/autoresearch/may19-qwen3-14b/run532-compile-block-norms-20step-batch176-event-cache0 > outputs/autoresearch/may19-qwen3-14b/run532-compile-block-norms-20step-batch176-event-cache0.run.log 2>&1
116d305d+dirty	14249	0.00	172.88	keep	compiled outer block RMSNorm helpers give the highest short sample but remain memory-risky and require sustained validation	TORCH_NCCL_CUDA_EVENT_CACHE=0 NCCL_NVLS_ENABLE=1 NCCL_CTA_POLICY=2 NGPU=8 LOG_RANK=0 MODULE=qwen3 CONFIG=qwen3_14b ./run_train.sh --training.steps=10 --compile.enable --compile.components=loss,feed_forward,qkv_linear,qk_norm_rope,block_norms --training.dtype=bfloat16 --training.seq_len=128 --training.local_batch_size=176 --loss.num_chunks=4 --optimizer.weight_decay=0.0 --dataloader.num_workers=2 --dataloader.persistent_workers --dataloader.prefetch_factor=2 --metrics.log_freq=1 --comm.trace_buf_size=0 --dump_folder=outputs/autoresearch/may19-qwen3-14b/run533-compile-outer-rmsnorms-batch176-event-cache0 > outputs/autoresearch/may19-qwen3-14b/run533-compile-outer-rmsnorms-batch176-event-cache0.run.log 2>&1
116d305d+dirty	14070	0.00	172.88	keep	compiled outer block RMSNorm helpers sustain a new throughput peak over steps 11-20 but use 96.93 percent HBM	TORCH_NCCL_CUDA_EVENT_CACHE=0 NCCL_NVLS_ENABLE=1 NCCL_CTA_POLICY=2 NGPU=8 LOG_RANK=0 MODULE=qwen3 CONFIG=qwen3_14b ./run_train.sh --training.steps=20 --compile.enable --compile.components=loss,feed_forward,qkv_linear,qk_norm_rope,block_norms --training.dtype=bfloat16 --training.seq_len=128 --training.local_batch_size=176 --loss.num_chunks=4 --optimizer.weight_decay=0.0 --dataloader.num_workers=2 --dataloader.persistent_workers --dataloader.prefetch_factor=2 --metrics.log_freq=1 --comm.trace_buf_size=0 --dump_folder=outputs/autoresearch/may19-qwen3-14b/run534-compile-outer-rmsnorms-20step-batch176-event-cache0 > outputs/autoresearch/may19-qwen3-14b/run534-compile-outer-rmsnorms-20step-batch176-event-cache0.run.log 2>&1
bf4f67bc	13999	0.00	172.88	keep	profiled the compiled outer block RMSNorm throughput branch; profiled tps is diagnostic and trace shows NCCL/cast/GEMM still dominate	TORCH_NCCL_CUDA_EVENT_CACHE=0 NCCL_NVLS_ENABLE=1 NCCL_CTA_POLICY=2 NGPU=8 LOG_RANK=0 MODULE=qwen3 CONFIG=qwen3_14b ./run_train.sh --training.steps=10 --compile.enable --compile.components=loss,feed_forward,qkv_linear,qk_norm_rope,block_norms --training.dtype=bfloat16 --training.seq_len=128 --training.local_batch_size=176 --loss.num_chunks=4 --optimizer.weight_decay=0.0 --dataloader.num_workers=2 --dataloader.persistent_workers --dataloader.prefetch_factor=2 --metrics.log_freq=1 --comm.trace_buf_size=0 --profiler.enable_profiling --profiler.profile_freq=10 --profiler.profiler_warmup=2 --profiler.profiler_active=1 --dump_folder=outputs/autoresearch/may19-qwen3-14b/run535-profile-outer-rmsnorms-batch176-event-cache0 > outputs/autoresearch/may19-qwen3-14b/run535-profile-outer-rmsnorms-batch176-event-cache0.run.log 2>&1
bf4f67bc+dirty	13955	0.00	172.88	discard	calling aten._fused_rms_norm directly for outer block norms has the same high memory and is slower than the compiled helper path	TORCH_NCCL_CUDA_EVENT_CACHE=0 NCCL_NVLS_ENABLE=1 NCCL_CTA_POLICY=2 NGPU=8 LOG_RANK=0 MODULE=qwen3 CONFIG=qwen3_14b ./run_train.sh --training.steps=10 --compile.enable --compile.components=loss,feed_forward,qkv_linear,qk_norm_rope,block_norms --training.dtype=bfloat16 --training.seq_len=128 --training.local_batch_size=176 --loss.num_chunks=4 --optimizer.weight_decay=0.0 --dataloader.num_workers=2 --dataloader.persistent_workers --dataloader.prefetch_factor=2 --metrics.log_freq=1 --comm.trace_buf_size=0 --dump_folder=outputs/autoresearch/may19-qwen3-14b/run536-fused-aten-outer-rmsnorms-batch176-event-cache0 > outputs/autoresearch/may19-qwen3-14b/run536-fused-aten-outer-rmsnorms-batch176-event-cache0.run.log 2>&1
bf4f67bc	13791	0.00	169.71	discard	batch172 on the compiled outer block RMSNorm source lowers memory versus batch176 but remains above 95 percent and falls below both active throughput points	TORCH_NCCL_CUDA_EVENT_CACHE=0 NCCL_NVLS_ENABLE=1 NCCL_CTA_POLICY=2 NGPU=8 LOG_RANK=0 MODULE=qwen3 CONFIG=qwen3_14b ./run_train.sh --training.steps=10 --compile.enable --compile.components=loss,feed_forward,qkv_linear,qk_norm_rope,block_norms --training.dtype=bfloat16 --training.seq_len=128 --training.local_batch_size=172 --loss.num_chunks=4 --optimizer.weight_decay=0.0 --dataloader.num_workers=2 --dataloader.persistent_workers --dataloader.prefetch_factor=2 --metrics.log_freq=1 --comm.trace_buf_size=0 --dump_folder=outputs/autoresearch/may19-qwen3-14b/run537-block-norms-batch172-event-cache0 > outputs/autoresearch/may19-qwen3-14b/run537-block-norms-batch172-event-cache0.run.log 2>&1
eb2b4938+dirty	14146	0.00	170.14	discard	fused Q/K RMSNorm plus RoPE forward gave a strong short sample and lower memory than block_norms but required sustained validation because the step-10 loss spiked in the first run	TORCH_NCCL_CUDA_EVENT_CACHE=0 NCCL_NVLS_ENABLE=1 NCCL_CTA_POLICY=2 NGPU=8 LOG_RANK=0 MODULE=qwen3 CONFIG=qwen3_14b ./run_train.sh --training.steps=10 --compile.enable --compile.components=loss,feed_forward,qkv_linear,qk_norm_rope,block_norms --training.dtype=bfloat16 --training.seq_len=128 --training.local_batch_size=176 --loss.num_chunks=4 --optimizer.weight_decay=0.0 --dataloader.num_workers=2 --dataloader.persistent_workers --dataloader.prefetch_factor=2 --metrics.log_freq=1 --comm.trace_buf_size=0 --dump_folder=outputs/autoresearch/may19-qwen3-14b/run538-fused-qk-rmsnorm-rope-blocknorms-batch176-event-cache0 > outputs/autoresearch/may19-qwen3-14b/run538-fused-qk-rmsnorm-rope-blocknorms-batch176-event-cache0.run.log 2>&1
eb2b4938+dirty	13959	0.00	170.14	discard	fused Q/K RMSNorm plus RoPE forward lowered memory versus block_norms but sustained throughput fell below both the safe qk_norm_rope point and the block_norms throughput point	TORCH_NCCL_CUDA_EVENT_CACHE=0 NCCL_NVLS_ENABLE=1 NCCL_CTA_POLICY=2 NGPU=8 LOG_RANK=0 MODULE=qwen3 CONFIG=qwen3_14b ./run_train.sh --training.steps=20 --compile.enable --compile.components=loss,feed_forward,qkv_linear,qk_norm_rope,block_norms --training.dtype=bfloat16 --training.seq_len=128 --training.local_batch_size=176 --loss.num_chunks=4 --optimizer.weight_decay=0.0 --dataloader.num_workers=2 --dataloader.persistent_workers --dataloader.prefetch_factor=2 --metrics.log_freq=1 --comm.trace_buf_size=0 --dump_folder=outputs/autoresearch/may19-qwen3-14b/run539-fused-qk-rmsnorm-rope-20step-blocknorms-batch176-event-cache0 > outputs/autoresearch/may19-qwen3-14b/run539-fused-qk-rmsnorm-rope-20step-blocknorms-batch176-event-cache0.run.log 2>&1
dc962bb9+dirty	14083	0.00	172.88	discard	compiling only the attention-side outer RMSNorm matches the combined block_norms memory cliff and does not beat the combined short-run peak	TORCH_NCCL_CUDA_EVENT_CACHE=0 NCCL_NVLS_ENABLE=1 NCCL_CTA_POLICY=2 NGPU=8 LOG_RANK=0 MODULE=qwen3 CONFIG=qwen3_14b ./run_train.sh --training.steps=10 --compile.enable --compile.components=loss,feed_forward,qkv_linear,qk_norm_rope,attention_norm --training.dtype=bfloat16 --training.seq_len=128 --training.local_batch_size=176 --loss.num_chunks=4 --optimizer.weight_decay=0.0 --dataloader.num_workers=2 --dataloader.persistent_workers --dataloader.prefetch_factor=2 --metrics.log_freq=1 --comm.trace_buf_size=0 --dump_folder=outputs/autoresearch/may19-qwen3-14b/run540-attention-norm-only-batch176-event-cache0 > outputs/autoresearch/may19-qwen3-14b/run540-attention-norm-only-batch176-event-cache0.run.log 2>&1
dc962bb9+dirty	14075	0.00	172.88	discard	compiling only the FFN-side outer RMSNorm also hits the block_norms memory cliff and does not beat the combined short-run peak	TORCH_NCCL_CUDA_EVENT_CACHE=0 NCCL_NVLS_ENABLE=1 NCCL_CTA_POLICY=2 NGPU=8 LOG_RANK=0 MODULE=qwen3 CONFIG=qwen3_14b ./run_train.sh --training.steps=10 --compile.enable --compile.components=loss,feed_forward,qkv_linear,qk_norm_rope,ffn_norm --training.dtype=bfloat16 --training.seq_len=128 --training.local_batch_size=176 --loss.num_chunks=4 --optimizer.weight_decay=0.0 --dataloader.num_workers=2 --dataloader.persistent_workers --dataloader.prefetch_factor=2 --metrics.log_freq=1 --comm.trace_buf_size=0 --dump_folder=outputs/autoresearch/may19-qwen3-14b/run541-ffn-norm-only-batch176-event-cache0 > outputs/autoresearch/may19-qwen3-14b/run541-ffn-norm-only-batch176-event-cache0.run.log 2>&1
40f511e0+dirty	14013	0.00	172.88	discard	custom residual-plus-RMSNorm forward for the FFN norm is valid but slower than the kept block_norms branch and does not reduce memory	TORCH_NCCL_CUDA_EVENT_CACHE=0 NCCL_NVLS_ENABLE=1 NCCL_CTA_POLICY=2 NGPU=8 LOG_RANK=0 MODULE=qwen3 CONFIG=qwen3_14b ./run_train.sh --training.steps=10 --compile.enable --compile.components=loss,feed_forward,qkv_linear,qk_norm_rope,residual_rms_norm --training.dtype=bfloat16 --training.seq_len=128 --training.local_batch_size=176 --loss.num_chunks=4 --optimizer.weight_decay=0.0 --dataloader.num_workers=2 --dataloader.persistent_workers --dataloader.prefetch_factor=2 --metrics.log_freq=1 --comm.trace_buf_size=0 --dump_folder=outputs/autoresearch/may19-qwen3-14b/run542-residual-rms-norm-batch176-event-cache0 > outputs/autoresearch/may19-qwen3-14b/run542-residual-rms-norm-batch176-event-cache0.run.log 2>&1
5e4202e5+dirty	14240	0.00	168.91	keep	patching the RMSNorm modules directly with a compiled helper gives a high safe-memory short sample without the block_norms memory cliff	TORCH_NCCL_CUDA_EVENT_CACHE=0 NCCL_NVLS_ENABLE=1 NCCL_CTA_POLICY=2 NGPU=8 LOG_RANK=0 MODULE=qwen3 CONFIG=qwen3_14b ./run_train.sh --training.steps=10 --compile.enable --compile.components=loss,feed_forward,qkv_linear,qk_norm_rope,norm_modules --training.dtype=bfloat16 --training.seq_len=128 --training.local_batch_size=176 --loss.num_chunks=4 --optimizer.weight_decay=0.0 --dataloader.num_workers=2 --dataloader.persistent_workers --dataloader.prefetch_factor=2 --metrics.log_freq=1 --comm.trace_buf_size=0 --dump_folder=outputs/autoresearch/may19-qwen3-14b/run543-compiled-norm-modules-batch176-event-cache0 > outputs/autoresearch/may19-qwen3-14b/run543-compiled-norm-modules-batch176-event-cache0.run.log 2>&1
5e4202e5+dirty	14023	0.00	168.91	keep	compiled RMSNorm modules sustain a new safe-memory peak over steps 11-20, though the memory-risky block_norms branch remains the absolute sustained throughput leader	TORCH_NCCL_CUDA_EVENT_CACHE=0 NCCL_NVLS_ENABLE=1 NCCL_CTA_POLICY=2 NGPU=8 LOG_RANK=0 MODULE=qwen3 CONFIG=qwen3_14b ./run_train.sh --training.steps=20 --compile.enable --compile.components=loss,feed_forward,qkv_linear,qk_norm_rope,norm_modules --training.dtype=bfloat16 --training.seq_len=128 --training.local_batch_size=176 --loss.num_chunks=4 --optimizer.weight_decay=0.0 --dataloader.num_workers=2 --dataloader.persistent_workers --dataloader.prefetch_factor=2 --metrics.log_freq=1 --comm.trace_buf_size=0 --dump_folder=outputs/autoresearch/may19-qwen3-14b/run544-compiled-norm-modules-20step-batch176-event-cache0 > outputs/autoresearch/may19-qwen3-14b/run544-compiled-norm-modules-20step-batch176-event-cache0.run.log 2>&1
70df98a9	14367	0.00	172.47	keep	batch180 on norm_modules gives the highest short sample so far but requires sustained validation because prior batch180 sources decayed over longer windows	TORCH_NCCL_CUDA_EVENT_CACHE=0 NCCL_NVLS_ENABLE=1 NCCL_CTA_POLICY=2 NGPU=8 LOG_RANK=0 MODULE=qwen3 CONFIG=qwen3_14b ./run_train.sh --training.steps=10 --compile.enable --compile.components=loss,feed_forward,qkv_linear,qk_norm_rope,norm_modules --training.dtype=bfloat16 --training.seq_len=128 --training.local_batch_size=180 --loss.num_chunks=4 --optimizer.weight_decay=0.0 --dataloader.num_workers=2 --dataloader.persistent_workers --dataloader.prefetch_factor=2 --metrics.log_freq=1 --comm.trace_buf_size=0 --dump_folder=outputs/autoresearch/may19-qwen3-14b/run545-norm-modules-batch180-event-cache0 > outputs/autoresearch/may19-qwen3-14b/run545-norm-modules-batch180-event-cache0.run.log 2>&1
70df98a9	14046	0.00	172.47	keep	batch180 on norm_modules sustains below the block_norms throughput branch but above the safe norm_modules batch176 branch, with slightly lower memory than block_norms	TORCH_NCCL_CUDA_EVENT_CACHE=0 NCCL_NVLS_ENABLE=1 NCCL_CTA_POLICY=2 NGPU=8 LOG_RANK=0 MODULE=qwen3 CONFIG=qwen3_14b ./run_train.sh --training.steps=20 --compile.enable --compile.components=loss,feed_forward,qkv_linear,qk_norm_rope,norm_modules --training.dtype=bfloat16 --training.seq_len=128 --training.local_batch_size=180 --loss.num_chunks=4 --optimizer.weight_decay=0.0 --dataloader.num_workers=2 --dataloader.persistent_workers --dataloader.prefetch_factor=2 --metrics.log_freq=1 --comm.trace_buf_size=0 --dump_folder=outputs/autoresearch/may19-qwen3-14b/run546-norm-modules-batch180-20step-event-cache0 > outputs/autoresearch/may19-qwen3-14b/run546-norm-modules-batch180-20step-event-cache0.run.log 2>&1
25e21fd2	14183	0.00	168.91	keep	profiled the norm_modules safe branch; profiled tps is diagnostic and trace confirms MXFP8 GEMM/casts plus NCCL remain dominant	TORCH_NCCL_CUDA_EVENT_CACHE=0 NCCL_NVLS_ENABLE=1 NCCL_CTA_POLICY=2 NGPU=8 LOG_RANK=0 MODULE=qwen3 CONFIG=qwen3_14b ./run_train.sh --training.steps=10 --compile.enable --compile.components=loss,feed_forward,qkv_linear,qk_norm_rope,norm_modules --training.dtype=bfloat16 --training.seq_len=128 --training.local_batch_size=176 --loss.num_chunks=4 --optimizer.weight_decay=0.0 --dataloader.num_workers=2 --dataloader.persistent_workers --dataloader.prefetch_factor=2 --metrics.log_freq=1 --comm.trace_buf_size=0 --profiler.enable_profiling --profiler.profile_freq=10 --profiler.profiler_warmup=2 --profiler.profiler_active=1 --dump_folder=outputs/autoresearch/may19-qwen3-14b/run547-profile-norm-modules-batch176-event-cache0 > outputs/autoresearch/may19-qwen3-14b/run547-profile-norm-modules-batch176-event-cache0.run.log 2>&1
322ae189+dirty	14014	0.00	168.91	discard	dynamic=False on the compiled norm_modules helper does not improve throughput or memory versus the kept dynamic compile helper	TORCH_NCCL_CUDA_EVENT_CACHE=0 NCCL_NVLS_ENABLE=1 NCCL_CTA_POLICY=2 NGPU=8 LOG_RANK=0 MODULE=qwen3 CONFIG=qwen3_14b ./run_train.sh --training.steps=10 --compile.enable --compile.components=loss,feed_forward,qkv_linear,qk_norm_rope,norm_modules --training.dtype=bfloat16 --training.seq_len=128 --training.local_batch_size=176 --loss.num_chunks=4 --optimizer.weight_decay=0.0 --dataloader.num_workers=2 --dataloader.persistent_workers --dataloader.prefetch_factor=2 --metrics.log_freq=1 --comm.trace_buf_size=0 --dump_folder=outputs/autoresearch/may19-qwen3-14b/run548-norm-modules-dynamic-false-batch176-event-cache0 > outputs/autoresearch/may19-qwen3-14b/run548-norm-modules-dynamic-false-batch176-event-cache0.run.log 2>&1
4e6834c6+dirty	13942	0.00	168.91	discard	compiling only the SDPA inner_attention modules is valid but slower than the kept norm_modules branch	TORCH_NCCL_CUDA_EVENT_CACHE=0 NCCL_NVLS_ENABLE=1 NCCL_CTA_POLICY=2 NGPU=8 LOG_RANK=0 MODULE=qwen3 CONFIG=qwen3_14b ./run_train.sh --training.steps=10 --compile.enable --compile.components=loss,feed_forward,qkv_linear,qk_norm_rope,norm_modules,inner_attention --training.dtype=bfloat16 --training.seq_len=128 --training.local_batch_size=176 --loss.num_chunks=4 --optimizer.weight_decay=0.0 --dataloader.num_workers=2 --dataloader.persistent_workers --dataloader.prefetch_factor=2 --metrics.log_freq=1 --comm.trace_buf_size=0 --dump_folder=outputs/autoresearch/may19-qwen3-14b/run549-compile-inner-attention-norm-modules-batch176-event-cache0 > outputs/autoresearch/may19-qwen3-14b/run549-compile-inner-attention-norm-modules-batch176-event-cache0.run.log 2>&1
3bcc3fd0	14088	0.00	173.27	discard	CUTE DSL GEMM autotune is valid on the current norm_modules stack but slower and memory-riskier than the kept branches	CUTEDSL_ENABLE_AUTOTUNING=1 TORCHINDUCTOR_MAX_AUTOTUNE=1 TORCHINDUCTOR_MAX_AUTOTUNE_GEMM=1 TORCHINDUCTOR_MAX_AUTOTUNE_GEMM_BACKENDS=CUTEDSL,TRITON,ATEN TORCH_NCCL_CUDA_EVENT_CACHE=0 NCCL_NVLS_ENABLE=1 NCCL_CTA_POLICY=2 NGPU=8 LOG_RANK=0 MODULE=qwen3 CONFIG=qwen3_14b ./run_train.sh --training.steps=10 --compile.enable --compile.components=loss,feed_forward,qkv_linear,qk_norm_rope,norm_modules --training.dtype=bfloat16 --training.seq_len=128 --training.local_batch_size=176 --loss.num_chunks=4 --optimizer.weight_decay=0.0 --dataloader.num_workers=2 --dataloader.persistent_workers --dataloader.prefetch_factor=2 --metrics.log_freq=1 --comm.trace_buf_size=0 --dump_folder=outputs/autoresearch/may19-qwen3-14b/run550-cutedsl-gemm-autotune-norm-modules-batch176-event-cache0 > outputs/autoresearch/may19-qwen3-14b/run550-cutedsl-gemm-autotune-norm-modules-batch176-event-cache0.run.log 2>&1
368dbe2a	14121	0.00	168.91	discard	disabling activation checkpoint RNG preservation is valid and memory-neutral but below the kept norm_modules short-run peak	TORCH_NCCL_CUDA_EVENT_CACHE=0 NCCL_NVLS_ENABLE=1 NCCL_CTA_POLICY=2 NGPU=8 LOG_RANK=0 MODULE=qwen3 CONFIG=qwen3_14b ./run_train.sh --training.steps=10 --compile.enable --compile.components=loss,feed_forward,qkv_linear,qk_norm_rope,norm_modules --training.dtype=bfloat16 --training.seq_len=128 --training.local_batch_size=176 --loss.num_chunks=4 --optimizer.weight_decay=0.0 --activation-checkpoint.no-preserve-rng-state --dataloader.num_workers=2 --dataloader.persistent_workers --dataloader.prefetch_factor=2 --metrics.log_freq=1 --comm.trace_buf_size=0 --dump_folder=outputs/autoresearch/may19-qwen3-14b/run552-ac-no-preserve-rng-norm-modules-batch176-event-cache0 > outputs/autoresearch/may19-qwen3-14b/run552-ac-no-preserve-rng-norm-modules-batch176-event-cache0.run.log 2>&1
d16adaaa	14209	0.00	168.91	discard	activation checkpoint early-stop is valid and memory-neutral but does not beat the kept norm_modules short-run peak	TORCH_NCCL_CUDA_EVENT_CACHE=0 NCCL_NVLS_ENABLE=1 NCCL_CTA_POLICY=2 NGPU=8 LOG_RANK=0 MODULE=qwen3 CONFIG=qwen3_14b ./run_train.sh --training.steps=10 --compile.enable --compile.components=loss,feed_forward,qkv_linear,qk_norm_rope,norm_modules --training.dtype=bfloat16 --training.seq_len=128 --training.local_batch_size=176 --loss.num_chunks=4 --optimizer.weight_decay=0.0 --activation-checkpoint.early-stop --dataloader.num_workers=2 --dataloader.persistent_workers --dataloader.prefetch_factor=2 --metrics.log_freq=1 --comm.trace_buf_size=0 --dump_folder=outputs/autoresearch/may19-qwen3-14b/run553-ac-early-stop-norm-modules-batch176-event-cache0 > outputs/autoresearch/may19-qwen3-14b/run553-ac-early-stop-norm-modules-batch176-event-cache0.run.log 2>&1
844c3750	14077	0.00	168.91	discard	combining activation checkpoint early-stop with no RNG preservation regresses versus either single checkpoint knob	TORCH_NCCL_CUDA_EVENT_CACHE=0 NCCL_NVLS_ENABLE=1 NCCL_CTA_POLICY=2 NGPU=8 LOG_RANK=0 MODULE=qwen3 CONFIG=qwen3_14b ./run_train.sh --training.steps=10 --compile.enable --compile.components=loss,feed_forward,qkv_linear,qk_norm_rope,norm_modules --training.dtype=bfloat16 --training.seq_len=128 --training.local_batch_size=176 --loss.num_chunks=4 --optimizer.weight_decay=0.0 --activation-checkpoint.early-stop --activation-checkpoint.no-preserve-rng-state --dataloader.num_workers=2 --dataloader.persistent_workers --dataloader.prefetch_factor=2 --metrics.log_freq=1 --comm.trace_buf_size=0 --dump_folder=outputs/autoresearch/may19-qwen3-14b/run554-ac-early-stop-no-preserve-rng-norm-modules-batch176-event-cache0 > outputs/autoresearch/may19-qwen3-14b/run554-ac-early-stop-no-preserve-rng-norm-modules-batch176-event-cache0.run.log 2>&1
0deafe33+dirty	14145	0.00	168.91	discard	direct aten._fused_rms_norm at the norm-module boundary is valid but slower than the compiled norm_modules helper	TORCH_NCCL_CUDA_EVENT_CACHE=0 NCCL_NVLS_ENABLE=1 NCCL_CTA_POLICY=2 NGPU=8 LOG_RANK=0 MODULE=qwen3 CONFIG=qwen3_14b ./run_train.sh --training.steps=10 --compile.enable --compile.components=loss,feed_forward,qkv_linear,qk_norm_rope,aten_norm_modules --training.dtype=bfloat16 --training.seq_len=128 --training.local_batch_size=176 --loss.num_chunks=4 --optimizer.weight_decay=0.0 --dataloader.num_workers=2 --dataloader.persistent_workers --dataloader.prefetch_factor=2 --metrics.log_freq=1 --comm.trace_buf_size=0 --dump_folder=outputs/autoresearch/may19-qwen3-14b/run555-aten-norm-modules-batch176-event-cache0 > outputs/autoresearch/may19-qwen3-14b/run555-aten-norm-modules-batch176-event-cache0.run.log 2>&1
