commit	tokens_per_sec	mfu_percent	peak_memory_gb	status	description	command
4da4a3f0+dirty	11196	0.00	166.26	discard	JSON-style compile component override parsed as literal strings so inner_attention compile did not execute; use comma-separated components	NCCL_CTA_POLICY=2 NGPU=8 LOG_RANK=0 MODULE=qwen3 CONFIG=qwen3_14b ./run_train.sh --training.steps=10 --compile.enable --compile.components='["loss","inner_attention"]' --training.dtype=bfloat16 --training.seq_len=128 --training.local_batch_size=128 --loss.num_chunks=4 --dataloader.num_workers=2 --dataloader.persistent_workers --dataloader.prefetch_factor=2 --metrics.log_freq=1 --comm.trace_buf_size=0 --dump_folder=outputs/autoresearch/may19-qwen3-14b/run370-mxfp8-compile-inner-attention-no-fsdp-forward-input-casts-loss-chunks4-sdpa-prefetch-seq128-lbs128-bf16-nccl-zero-cta-dataloader-worker2-prefetch2-metrics-logfreq1-no-flight-recorder > run.log 2>&1
2378a302	11524	0.00	164.17	keep	correct comma-syntax loss compile is a new MXFP8 peak and saves memory versus the JSON-style no-compile baseline	NCCL_CTA_POLICY=2 NGPU=8 LOG_RANK=0 MODULE=qwen3 CONFIG=qwen3_14b ./run_train.sh --training.steps=10 --compile.enable --compile.components=loss --training.dtype=bfloat16 --training.seq_len=128 --training.local_batch_size=128 --loss.num_chunks=4 --dataloader.num_workers=2 --dataloader.persistent_workers --dataloader.prefetch_factor=2 --metrics.log_freq=1 --comm.trace_buf_size=0 --dump_folder=outputs/autoresearch/may19-qwen3-14b/run371-mxfp8-correct-loss-compile-no-fsdp-forward-input-casts-loss-chunks4-sdpa-prefetch-seq128-lbs128-bf16-nccl-zero-cta-dataloader-worker2-prefetch2-metrics-logfreq1-no-flight-recorder > run.log 2>&1
eb44cd2e	11504	0.00	164.17	discard	compiling inner_attention in addition to correct loss compile is valid but slightly below the loss-only peak	NCCL_CTA_POLICY=2 NGPU=8 LOG_RANK=0 MODULE=qwen3 CONFIG=qwen3_14b ./run_train.sh --training.steps=10 --compile.enable --compile.components=loss,inner_attention --training.dtype=bfloat16 --training.seq_len=128 --training.local_batch_size=128 --loss.num_chunks=4 --dataloader.num_workers=2 --dataloader.persistent_workers --dataloader.prefetch_factor=2 --metrics.log_freq=1 --comm.trace_buf_size=0 --dump_folder=outputs/autoresearch/may19-qwen3-14b/run372-mxfp8-correct-loss-plus-inner-attention-compile-no-fsdp-forward-input-casts-loss-chunks4-sdpa-prefetch-seq128-lbs128-bf16-nccl-zero-cta-dataloader-worker2-prefetch2-metrics-logfreq1-no-flight-recorder > run.log 2>&1
1ebeea9a	11427	0.00	168.51	discard	correct loss compile batch132 is valid and under 95% memory but slower than batch128	NCCL_CTA_POLICY=2 NGPU=8 LOG_RANK=0 MODULE=qwen3 CONFIG=qwen3_14b ./run_train.sh --training.steps=10 --compile.enable --compile.components=loss --training.dtype=bfloat16 --training.seq_len=128 --training.local_batch_size=132 --loss.num_chunks=4 --dataloader.num_workers=2 --dataloader.persistent_workers --dataloader.prefetch_factor=2 --metrics.log_freq=1 --comm.trace_buf_size=0 --dump_folder=outputs/autoresearch/may19-qwen3-14b/run373-mxfp8-correct-loss-compile-lbs132-no-fsdp-forward-input-casts-loss-chunks4-sdpa-prefetch-seq128-bf16-nccl-zero-cta-dataloader-worker2-prefetch2-metrics-logfreq1-no-flight-recorder > run.log 2>&1
ed7edca0	0	0.00	0.0	crash	correct loss compile batch130 violates MXFP8 Triton dim1 128-row tile constraint because each loss chunk has 4160 rows	NCCL_CTA_POLICY=2 NGPU=8 LOG_RANK=0 MODULE=qwen3 CONFIG=qwen3_14b ./run_train.sh --training.steps=10 --compile.enable --compile.components=loss --training.dtype=bfloat16 --training.seq_len=128 --training.local_batch_size=130 --loss.num_chunks=4 --dataloader.num_workers=2 --dataloader.persistent_workers --dataloader.prefetch_factor=2 --metrics.log_freq=1 --comm.trace_buf_size=0 --dump_folder=outputs/autoresearch/may19-qwen3-14b/run374-mxfp8-correct-loss-compile-lbs130-no-fsdp-forward-input-casts-loss-chunks4-sdpa-prefetch-seq128-bf16-nccl-zero-cta-dataloader-worker2-prefetch2-metrics-logfreq1-no-flight-recorder > run.log 2>&1
78355ca4	11527	0.00	164.52	keep	correct loss compile chunks2 is clean and narrowly beats chunks4, but only by tie-band variance	NCCL_CTA_POLICY=2 NGPU=8 LOG_RANK=0 MODULE=qwen3 CONFIG=qwen3_14b ./run_train.sh --training.steps=10 --compile.enable --compile.components=loss --training.dtype=bfloat16 --training.seq_len=128 --training.local_batch_size=128 --loss.num_chunks=2 --dataloader.num_workers=2 --dataloader.persistent_workers --dataloader.prefetch_factor=2 --metrics.log_freq=1 --comm.trace_buf_size=0 --dump_folder=outputs/autoresearch/may19-qwen3-14b/run375-mxfp8-correct-loss-compile-loss-chunks2-no-fsdp-forward-input-casts-seq128-lbs128-bf16-nccl-zero-cta-dataloader-worker2-prefetch2-metrics-logfreq1-no-flight-recorder > run.log 2>&1
dda9686c	11499	0.00	164.52	keep	chunks2 corrected-loss rerun stays clean but falls below chunks4 peak, so chunks4 remains the working baseline	NCCL_CTA_POLICY=2 NGPU=8 LOG_RANK=0 MODULE=qwen3 CONFIG=qwen3_14b ./run_train.sh --training.steps=10 --compile.enable --compile.components=loss --training.dtype=bfloat16 --training.seq_len=128 --training.local_batch_size=128 --loss.num_chunks=2 --dataloader.num_workers=2 --dataloader.persistent_workers --dataloader.prefetch_factor=2 --metrics.log_freq=1 --comm.trace_buf_size=0 --dump_folder=outputs/autoresearch/may19-qwen3-14b/run376-rerun-mxfp8-correct-loss-compile-loss-chunks2-no-fsdp-forward-input-casts-seq128-lbs128-bf16-nccl-zero-cta-dataloader-worker2-prefetch2-metrics-logfreq1-no-flight-recorder > run.log 2>&1
3d6c538a	11428	0.00	164.17	keep	profiled corrected-loss chunks4 working baseline; profiled tps is not used for ranking	NCCL_CTA_POLICY=2 NGPU=8 LOG_RANK=0 MODULE=qwen3 CONFIG=qwen3_14b ./run_train.sh --training.steps=10 --compile.enable --compile.components=loss --training.dtype=bfloat16 --training.seq_len=128 --training.local_batch_size=128 --loss.num_chunks=4 --dataloader.num_workers=2 --dataloader.persistent_workers --dataloader.prefetch_factor=2 --metrics.log_freq=1 --comm.trace_buf_size=0 --profiler.enable_profiling --profiler.profile_freq=10 --profiler.profiler_warmup=2 --profiler.profiler_active=1 --dump_folder=outputs/autoresearch/may19-qwen3-14b/run377-profile-mxfp8-correct-loss-compile-loss-chunks4-no-fsdp-forward-input-casts-seq128-lbs128-bf16-nccl-zero-cta-dataloader-worker2-prefetch2-metrics-logfreq1-no-flight-recorder > run.log 2>&1
8ad2b90a+dirty	11490	0.00	165.40	discard	two-module FSDP prefetch is valid but slower and uses more memory than one-module prefetch	NCCL_CTA_POLICY=2 NGPU=8 LOG_RANK=0 MODULE=qwen3 CONFIG=qwen3_14b ./run_train.sh --training.steps=10 --compile.enable --compile.components=loss --training.dtype=bfloat16 --training.seq_len=128 --training.local_batch_size=128 --loss.num_chunks=4 --dataloader.num_workers=2 --dataloader.persistent_workers --dataloader.prefetch_factor=2 --metrics.log_freq=1 --comm.trace_buf_size=0 --dump_folder=outputs/autoresearch/may19-qwen3-14b/run378-mxfp8-correct-loss-compile-two-module-fsdp-prefetch-loss-chunks4-seq128-lbs128-bf16-nccl-zero-cta-dataloader-worker2-prefetch2-metrics-logfreq1-no-flight-recorder > run.log 2>&1
8ec8dbc6	11248	0.00	164.17	discard	default NCCL CTA policy remains slower than NCCL_CTA_POLICY=2 after correcting loss compile syntax	NGPU=8 LOG_RANK=0 MODULE=qwen3 CONFIG=qwen3_14b ./run_train.sh --training.steps=10 --compile.enable --compile.components=loss --training.dtype=bfloat16 --training.seq_len=128 --training.local_batch_size=128 --loss.num_chunks=4 --dataloader.num_workers=2 --dataloader.persistent_workers --dataloader.prefetch_factor=2 --metrics.log_freq=1 --comm.trace_buf_size=0 --dump_folder=outputs/autoresearch/may19-qwen3-14b/run379-mxfp8-correct-loss-compile-default-nccl-cta-loss-chunks4-seq128-lbs128-bf16-dataloader-worker2-prefetch2-metrics-logfreq1-no-flight-recorder > run.log 2>&1
1eed10e5+dirty	11535	0.00	163.64	keep	last transformer layer with reshard_after_forward disabled is a new peak and lowers memory	NCCL_CTA_POLICY=2 NGPU=8 LOG_RANK=0 MODULE=qwen3 CONFIG=qwen3_14b ./run_train.sh --training.steps=10 --compile.enable --compile.components=loss --training.dtype=bfloat16 --training.seq_len=128 --training.local_batch_size=128 --loss.num_chunks=4 --dataloader.num_workers=2 --dataloader.persistent_workers --dataloader.prefetch_factor=2 --metrics.log_freq=1 --comm.trace_buf_size=0 --dump_folder=outputs/autoresearch/may19-qwen3-14b/run380-mxfp8-correct-loss-compile-last-layer-no-reshard-loss-chunks4-seq128-lbs128-bf16-nccl-zero-cta-dataloader-worker2-prefetch2-metrics-logfreq1-no-flight-recorder > run.log 2>&1
66cdb981	11495	0.00	163.64	keep	last-layer no-reshard rerun validates the lower memory envelope but lands below the measured speed peak	NCCL_CTA_POLICY=2 NGPU=8 LOG_RANK=0 MODULE=qwen3 CONFIG=qwen3_14b ./run_train.sh --training.steps=10 --compile.enable --compile.components=loss --training.dtype=bfloat16 --training.seq_len=128 --training.local_batch_size=128 --loss.num_chunks=4 --dataloader.num_workers=2 --dataloader.persistent_workers --dataloader.prefetch_factor=2 --metrics.log_freq=1 --comm.trace_buf_size=0 --dump_folder=outputs/autoresearch/may19-qwen3-14b/run381-rerun-mxfp8-correct-loss-compile-last-layer-no-reshard-loss-chunks4-seq128-lbs128-bf16-nccl-zero-cta-dataloader-worker2-prefetch2-metrics-logfreq1-no-flight-recorder > run.log 2>&1
495d6d3b	0	0.00	0.0	crash	built-in per-TransformerBlock model compile still crashes with Inductor fake-tensor recursion on the current MXFP8 Triton stack	NCCL_CTA_POLICY=2 NGPU=8 LOG_RANK=0 MODULE=qwen3 CONFIG=qwen3_14b ./run_train.sh --training.steps=10 --compile.enable --compile.components=loss,model --training.dtype=bfloat16 --training.seq_len=128 --training.local_batch_size=128 --loss.num_chunks=4 --dataloader.num_workers=2 --dataloader.persistent_workers --dataloader.prefetch_factor=2 --metrics.log_freq=1 --comm.trace_buf_size=0 --dump_folder=outputs/autoresearch/may19-qwen3-14b/run382-mxfp8-correct-loss-plus-model-compile-last-layer-no-reshard-loss-chunks4-seq128-lbs128-bf16-nccl-zero-cta-dataloader-worker2-prefetch2-metrics-logfreq1-no-flight-recorder > run.log 2>&1
8ebdfc21+dirty	11662	0.00	133.23	keep	feed-forward-only compile is valid and produces a new peak while sharply lowering peak memory	NCCL_CTA_POLICY=2 NGPU=8 LOG_RANK=0 MODULE=qwen3 CONFIG=qwen3_14b ./run_train.sh --training.steps=10 --compile.enable --compile.components=loss,feed_forward --training.dtype=bfloat16 --training.seq_len=128 --training.local_batch_size=128 --loss.num_chunks=4 --dataloader.num_workers=2 --dataloader.persistent_workers --dataloader.prefetch_factor=2 --metrics.log_freq=1 --comm.trace_buf_size=0 --dump_folder=outputs/autoresearch/may19-qwen3-14b/run383-mxfp8-correct-loss-plus-feed-forward-compile-last-layer-no-reshard-loss-chunks4-seq128-lbs128-bf16-nccl-zero-cta-dataloader-worker2-prefetch2-metrics-logfreq1-no-flight-recorder > run.log 2>&1
064dcc49	11963	0.00	156.85	keep	feed-forward compile converts memory headroom into a larger batch160 throughput win	NCCL_CTA_POLICY=2 NGPU=8 LOG_RANK=0 MODULE=qwen3 CONFIG=qwen3_14b ./run_train.sh --training.steps=10 --compile.enable --compile.components=loss,feed_forward --training.dtype=bfloat16 --training.seq_len=128 --training.local_batch_size=160 --loss.num_chunks=4 --dataloader.num_workers=2 --dataloader.persistent_workers --dataloader.prefetch_factor=2 --metrics.log_freq=1 --comm.trace_buf_size=0 --dump_folder=outputs/autoresearch/may19-qwen3-14b/run384-mxfp8-correct-loss-plus-feed-forward-compile-lbs160-last-layer-no-reshard-loss-chunks4-seq128-bf16-nccl-zero-cta-dataloader-worker2-prefetch2-metrics-logfreq1-no-flight-recorder > run.log 2>&1
545bc756	12078	0.00	170.39	keep	batch176 is fastest so far but exceeds the preferred 95 percent memory line, so treat as a risky peak	NCCL_CTA_POLICY=2 NGPU=8 LOG_RANK=0 MODULE=qwen3 CONFIG=qwen3_14b ./run_train.sh --training.steps=10 --compile.enable --compile.components=loss,feed_forward --training.dtype=bfloat16 --training.seq_len=128 --training.local_batch_size=176 --loss.num_chunks=4 --dataloader.num_workers=2 --dataloader.persistent_workers --dataloader.prefetch_factor=2 --metrics.log_freq=1 --comm.trace_buf_size=0 --dump_folder=outputs/autoresearch/may19-qwen3-14b/run385-mxfp8-correct-loss-plus-feed-forward-compile-lbs176-last-layer-no-reshard-loss-chunks4-seq128-bf16-nccl-zero-cta-dataloader-worker2-prefetch2-metrics-logfreq1-no-flight-recorder > run.log 2>&1
86982fb2	12115	0.00	163.69	keep	batch168 beats batch176 while staying below the preferred memory ceiling	NCCL_CTA_POLICY=2 NGPU=8 LOG_RANK=0 MODULE=qwen3 CONFIG=qwen3_14b ./run_train.sh --training.steps=10 --compile.enable --compile.components=loss,feed_forward --training.dtype=bfloat16 --training.seq_len=128 --training.local_batch_size=168 --loss.num_chunks=4 --dataloader.num_workers=2 --dataloader.persistent_workers --dataloader.prefetch_factor=2 --metrics.log_freq=1 --comm.trace_buf_size=0 --dump_folder=outputs/autoresearch/may19-qwen3-14b/run386-mxfp8-correct-loss-plus-feed-forward-compile-lbs168-last-layer-no-reshard-loss-chunks4-seq128-bf16-nccl-zero-cta-dataloader-worker2-prefetch2-metrics-logfreq1-no-flight-recorder > run.log 2>&1
f8c3de6f	11880	0.00	166.62	discard	batch172 is slower than both batch168 and batch176 despite higher memory than batch168	NCCL_CTA_POLICY=2 NGPU=8 LOG_RANK=0 MODULE=qwen3 CONFIG=qwen3_14b ./run_train.sh --training.steps=10 --compile.enable --compile.components=loss,feed_forward --training.dtype=bfloat16 --training.seq_len=128 --training.local_batch_size=172 --loss.num_chunks=4 --dataloader.num_workers=2 --dataloader.persistent_workers --dataloader.prefetch_factor=2 --metrics.log_freq=1 --comm.trace_buf_size=0 --dump_folder=outputs/autoresearch/may19-qwen3-14b/run387-mxfp8-correct-loss-plus-feed-forward-compile-lbs172-last-layer-no-reshard-loss-chunks4-seq128-bf16-nccl-zero-cta-dataloader-worker2-prefetch2-metrics-logfreq1-no-flight-recorder > run.log 2>&1
08a0521a	12078	0.00	168.28	discard	loss chunks2 at batch168 is slower and higher memory than chunks4	NCCL_CTA_POLICY=2 NGPU=8 LOG_RANK=0 MODULE=qwen3 CONFIG=qwen3_14b ./run_train.sh --training.steps=10 --compile.enable --compile.components=loss,feed_forward --training.dtype=bfloat16 --training.seq_len=128 --training.local_batch_size=168 --loss.num_chunks=2 --dataloader.num_workers=2 --dataloader.persistent_workers --dataloader.prefetch_factor=2 --metrics.log_freq=1 --comm.trace_buf_size=0 --dump_folder=outputs/autoresearch/may19-qwen3-14b/run388-mxfp8-correct-loss-plus-feed-forward-compile-lbs168-loss-chunks2-last-layer-no-reshard-seq128-bf16-nccl-zero-cta-dataloader-worker2-prefetch2-metrics-logfreq1-no-flight-recorder > run.log 2>&1
3ea71eed	11959	0.00	163.69	keep	profiled active FFN-compile batch168 safe best; profiled tps is not used for ranking	NCCL_CTA_POLICY=2 NGPU=8 LOG_RANK=0 MODULE=qwen3 CONFIG=qwen3_14b ./run_train.sh --training.steps=10 --compile.enable --compile.components=loss,feed_forward --training.dtype=bfloat16 --training.seq_len=128 --training.local_batch_size=168 --loss.num_chunks=4 --dataloader.num_workers=2 --dataloader.persistent_workers --dataloader.prefetch_factor=2 --metrics.log_freq=1 --comm.trace_buf_size=0 --profiler.enable_profiling --profiler.profile_freq=10 --profiler.profiler_warmup=2 --profiler.profiler_active=1 --dump_folder=outputs/autoresearch/may19-qwen3-14b/run389-profile-mxfp8-correct-loss-plus-feed-forward-compile-lbs168-last-layer-no-reshard-loss-chunks4-seq128-bf16-nccl-zero-cta-dataloader-worker2-prefetch2-metrics-logfreq1-no-flight-recorder > run.log 2>&1
2ee35177+dirty	12042	0.00	163.77	discard	final two transformer layers no-reshard is valid but slower than final-layer-only no-reshard	NCCL_CTA_POLICY=2 NGPU=8 LOG_RANK=0 MODULE=qwen3 CONFIG=qwen3_14b ./run_train.sh --training.steps=10 --compile.enable --compile.components=loss,feed_forward --training.dtype=bfloat16 --training.seq_len=128 --training.local_batch_size=168 --loss.num_chunks=4 --dataloader.num_workers=2 --dataloader.persistent_workers --dataloader.prefetch_factor=2 --metrics.log_freq=1 --comm.trace_buf_size=0 --dump_folder=outputs/autoresearch/may19-qwen3-14b/run390-mxfp8-correct-loss-plus-feed-forward-compile-lbs168-last-two-layers-no-reshard-loss-chunks4-seq128-bf16-nccl-zero-cta-dataloader-worker2-prefetch2-metrics-logfreq1-no-flight-recorder > run.log 2>&1
8d99840e+dirty	0	0.00	0.0	crash	attention-module compile with FFN compile crashes with Inductor fake-tensor recursion before step 1	NCCL_CTA_POLICY=2 NGPU=8 LOG_RANK=0 MODULE=qwen3 CONFIG=qwen3_14b ./run_train.sh --training.steps=10 --compile.enable --compile.components=loss,feed_forward,attention --training.dtype=bfloat16 --training.seq_len=128 --training.local_batch_size=168 --loss.num_chunks=4 --dataloader.num_workers=2 --dataloader.persistent_workers --dataloader.prefetch_factor=2 --metrics.log_freq=1 --comm.trace_buf_size=0 --dump_folder=outputs/autoresearch/may19-qwen3-14b/run391-mxfp8-correct-loss-plus-feed-forward-plus-attention-compile-lbs168-last-layer-no-reshard-loss-chunks4-seq128-bf16-nccl-zero-cta-dataloader-worker2-prefetch2-metrics-logfreq1-no-flight-recorder > run.log 2>&1
4518061b+dirty	0	0.00	0.0	crash	flex_flash attention reaches CUTE path but missing cutlass.utils.ampere_helpers blocks before step 1	NCCL_CTA_POLICY=2 NGPU=8 LOG_RANK=0 MODULE=qwen3 CONFIG=qwen3_14b ./run_train.sh --training.steps=10 --compile.enable --compile.components=loss,feed_forward --training.dtype=bfloat16 --training.seq_len=128 --training.local_batch_size=168 --loss.num_chunks=4 --dataloader.num_workers=2 --dataloader.persistent_workers --dataloader.prefetch_factor=2 --metrics.log_freq=1 --comm.trace_buf_size=0 --dump_folder=outputs/autoresearch/may19-qwen3-14b/run392-mxfp8-flex-flash-attention-correct-loss-plus-feed-forward-compile-lbs168-last-layer-no-reshard-loss-chunks4-seq128-bf16-nccl-zero-cta-dataloader-worker2-prefetch2-metrics-logfreq1-no-flight-recorder > run.log 2>&1
3846faf1+dirty	12036	0.00	165.10	discard	plain FlexAttention is valid but slower and higher memory than SDPA on the FFN-compile batch168 setup	NCCL_CTA_POLICY=2 NGPU=8 LOG_RANK=0 MODULE=qwen3 CONFIG=qwen3_14b ./run_train.sh --training.steps=10 --compile.enable --compile.components=loss,feed_forward --training.dtype=bfloat16 --training.seq_len=128 --training.local_batch_size=168 --loss.num_chunks=4 --dataloader.num_workers=2 --dataloader.persistent_workers --dataloader.prefetch_factor=2 --metrics.log_freq=1 --comm.trace_buf_size=0 --dump_folder=outputs/autoresearch/may19-qwen3-14b/run393-mxfp8-flex-attention-correct-loss-plus-feed-forward-compile-lbs168-last-layer-no-reshard-loss-chunks4-seq128-bf16-nccl-zero-cta-dataloader-worker2-prefetch2-metrics-logfreq1-no-flight-recorder > run.log 2>&1
73674095	11956	0.00	160.02	discard	batch164 is valid but slower than batch168 despite lower memory	NCCL_CTA_POLICY=2 NGPU=8 LOG_RANK=0 MODULE=qwen3 CONFIG=qwen3_14b ./run_train.sh --training.steps=10 --compile.enable --compile.components=loss,feed_forward --training.dtype=bfloat16 --training.seq_len=128 --training.local_batch_size=164 --loss.num_chunks=4 --dataloader.num_workers=2 --dataloader.persistent_workers --dataloader.prefetch_factor=2 --metrics.log_freq=1 --comm.trace_buf_size=0 --dump_folder=outputs/autoresearch/may19-qwen3-14b/run394-mxfp8-correct-loss-plus-feed-forward-compile-lbs164-last-layer-no-reshard-loss-chunks4-seq128-bf16-nccl-zero-cta-dataloader-worker2-prefetch2-metrics-logfreq1-no-flight-recorder > run.log 2>&1
1dbd73c6	12071	0.00	163.69	discard	NCCL_CTA_POLICY=1 is valid but slower than policy2 on the FFN-compile batch168 setup	NCCL_CTA_POLICY=1 NGPU=8 LOG_RANK=0 MODULE=qwen3 CONFIG=qwen3_14b ./run_train.sh --training.steps=10 --compile.enable --compile.components=loss,feed_forward --training.dtype=bfloat16 --training.seq_len=128 --training.local_batch_size=168 --loss.num_chunks=4 --dataloader.num_workers=2 --dataloader.persistent_workers --dataloader.prefetch_factor=2 --metrics.log_freq=1 --comm.trace_buf_size=0 --dump_folder=outputs/autoresearch/may19-qwen3-14b/run395-mxfp8-correct-loss-plus-feed-forward-compile-lbs168-nccl-cta-policy1-last-layer-no-reshard-loss-chunks4-seq128-bf16-dataloader-worker2-prefetch2-metrics-logfreq1-no-flight-recorder > run.log 2>&1
04676fd1+dirty	11911	0.00	163.22	discard	all transformer layers resharded is slower than final-layer-only no-reshard on the FFN-compile batch168 setup	NCCL_CTA_POLICY=2 NGPU=8 LOG_RANK=0 MODULE=qwen3 CONFIG=qwen3_14b ./run_train.sh --training.steps=10 --compile.enable --compile.components=loss,feed_forward --training.dtype=bfloat16 --training.seq_len=128 --training.local_batch_size=168 --loss.num_chunks=4 --dataloader.num_workers=2 --dataloader.persistent_workers --dataloader.prefetch_factor=2 --metrics.log_freq=1 --comm.trace_buf_size=0 --dump_folder=outputs/autoresearch/may19-qwen3-14b/run396-mxfp8-correct-loss-plus-feed-forward-compile-lbs168-all-layers-reshard-loss-chunks4-seq128-bf16-nccl-zero-cta-dataloader-worker2-prefetch2-metrics-logfreq1-no-flight-recorder > run.log 2>&1
a43de327+dirty	0	0.00	0.0	crash	layer norm module compile fails before step 1 because RMSNorm frames are Dynamo skipfiles with fullgraph=True	NCCL_CTA_POLICY=2 NGPU=8 LOG_RANK=0 MODULE=qwen3 CONFIG=qwen3_14b ./run_train.sh --training.steps=10 --compile.enable --compile.components=loss,feed_forward,norms --training.dtype=bfloat16 --training.seq_len=128 --training.local_batch_size=168 --loss.num_chunks=4 --dataloader.num_workers=2 --dataloader.persistent_workers --dataloader.prefetch_factor=2 --metrics.log_freq=1 --comm.trace_buf_size=0 --dump_folder=outputs/autoresearch/may19-qwen3-14b/run397-mxfp8-correct-loss-plus-feed-forward-plus-norms-compile-lbs168-last-layer-no-reshard-loss-chunks4-seq128-bf16-nccl-zero-cta-dataloader-worker2-prefetch2-metrics-logfreq1-no-flight-recorder > run.log 2>&1
