commit	tokens_per_sec	mfu_percent	peak_memory_gb	status	description	command
a8e92ef4	13426	0.00	162.66	keep	profiled the Triton RoPE active recipe; profiled tps is diagnostic, trace confirms RoPE slice/mul work collapsed and NCCL/GEMM dominate	TORCH_NCCL_CUDA_EVENT_CACHE=0 NCCL_NVLS_ENABLE=1 NCCL_CTA_POLICY=2 NGPU=8 LOG_RANK=0 MODULE=qwen3 CONFIG=qwen3_14b ./run_train.sh --training.steps=10 --compile.enable --compile.components=loss,feed_forward,qkv_linear --training.dtype=bfloat16 --training.seq_len=128 --training.local_batch_size=168 --loss.num_chunks=4 --optimizer.weight_decay=0.0 --dataloader.num_workers=2 --dataloader.persistent_workers --dataloader.prefetch_factor=2 --metrics.log_freq=1 --comm.trace_buf_size=0 --profiler.enable_profiling --profiler.profile_freq=10 --profiler.profiler_warmup=2 --profiler.profiler_active=1 --dump_folder=outputs/autoresearch/may19-qwen3-14b/run507-profile-triton-rope-event-cache0 > outputs/autoresearch/may19-qwen3-14b/run507-profile-triton-rope-event-cache0.run.log 2>&1
1f152213+dirty	13351	0.00	163.15	discard	combining Q and K RoPE into one Triton launch is valid but slower and higher-memory than separate custom RoPE calls	TORCH_NCCL_CUDA_EVENT_CACHE=0 NCCL_NVLS_ENABLE=1 NCCL_CTA_POLICY=2 NGPU=8 LOG_RANK=0 MODULE=qwen3 CONFIG=qwen3_14b ./run_train.sh --training.steps=10 --compile.enable --compile.components=loss,feed_forward,qkv_linear --training.dtype=bfloat16 --training.seq_len=128 --training.local_batch_size=168 --loss.num_chunks=4 --optimizer.weight_decay=0.0 --dataloader.num_workers=2 --dataloader.persistent_workers --dataloader.prefetch_factor=2 --metrics.log_freq=1 --comm.trace_buf_size=0 --dump_folder=outputs/autoresearch/may19-qwen3-14b/run508-combined-qk-triton-rope-event-cache0 > outputs/autoresearch/may19-qwen3-14b/run508-combined-qk-triton-rope-event-cache0.run.log 2>&1
85d91bab	13659	0.00	168.91	keep	batch176 converts Triton RoPE memory headroom into a small new throughput peak below the 95 percent memory guideline	TORCH_NCCL_CUDA_EVENT_CACHE=0 NCCL_NVLS_ENABLE=1 NCCL_CTA_POLICY=2 NGPU=8 LOG_RANK=0 MODULE=qwen3 CONFIG=qwen3_14b ./run_train.sh --training.steps=10 --compile.enable --compile.components=loss,feed_forward,qkv_linear --training.dtype=bfloat16 --training.seq_len=128 --training.local_batch_size=176 --loss.num_chunks=4 --optimizer.weight_decay=0.0 --dataloader.num_workers=2 --dataloader.persistent_workers --dataloader.prefetch_factor=2 --metrics.log_freq=1 --comm.trace_buf_size=0 --dump_folder=outputs/autoresearch/may19-qwen3-14b/run509-triton-rope-batch176-event-cache0 > outputs/autoresearch/may19-qwen3-14b/run509-triton-rope-batch176-event-cache0.run.log 2>&1
5d140d03	13733	0.00	168.91	keep	profiled the Triton RoPE batch176 active recipe; profiled tps is diagnostic and trace shows batch176 improved NCCL amortization versus batch168	TORCH_NCCL_CUDA_EVENT_CACHE=0 NCCL_NVLS_ENABLE=1 NCCL_CTA_POLICY=2 NGPU=8 LOG_RANK=0 MODULE=qwen3 CONFIG=qwen3_14b ./run_train.sh --training.steps=10 --compile.enable --compile.components=loss,feed_forward,qkv_linear --training.dtype=bfloat16 --training.seq_len=128 --training.local_batch_size=176 --loss.num_chunks=4 --optimizer.weight_decay=0.0 --dataloader.num_workers=2 --dataloader.persistent_workers --dataloader.prefetch_factor=2 --metrics.log_freq=1 --comm.trace_buf_size=0 --profiler.enable_profiling --profiler.profile_freq=10 --profiler.profiler_warmup=2 --profiler.profiler_active=1 --dump_folder=outputs/autoresearch/may19-qwen3-14b/run510-profile-triton-rope-batch176-event-cache0 > outputs/autoresearch/may19-qwen3-14b/run510-profile-triton-rope-batch176-event-cache0.run.log 2>&1
5d140d03+dirty	13594	0.00	168.91	discard	Triton RoPE block512 is valid but slower at step 10 than the active block256 source	TORCH_NCCL_CUDA_EVENT_CACHE=0 NCCL_NVLS_ENABLE=1 NCCL_CTA_POLICY=2 NGPU=8 LOG_RANK=0 MODULE=qwen3 CONFIG=qwen3_14b ./run_train.sh --training.steps=10 --compile.enable --compile.components=loss,feed_forward,qkv_linear --training.dtype=bfloat16 --training.seq_len=128 --training.local_batch_size=176 --loss.num_chunks=4 --optimizer.weight_decay=0.0 --dataloader.num_workers=2 --dataloader.persistent_workers --dataloader.prefetch_factor=2 --metrics.log_freq=1 --comm.trace_buf_size=0 --dump_folder=outputs/autoresearch/may19-qwen3-14b/run511-triton-rope-block512-batch176-event-cache0 > outputs/autoresearch/may19-qwen3-14b/run511-triton-rope-block512-batch176-event-cache0.run.log 2>&1
e4c2251b	13647	0.00	168.91	discard	NCCL_MIN_NCHANNELS=16 is valid and close but does not beat the active default channel selection on batch176	NCCL_MIN_NCHANNELS=16 TORCH_NCCL_CUDA_EVENT_CACHE=0 NCCL_NVLS_ENABLE=1 NCCL_CTA_POLICY=2 NGPU=8 LOG_RANK=0 MODULE=qwen3 CONFIG=qwen3_14b ./run_train.sh --training.steps=10 --compile.enable --compile.components=loss,feed_forward,qkv_linear --training.dtype=bfloat16 --training.seq_len=128 --training.local_batch_size=176 --loss.num_chunks=4 --optimizer.weight_decay=0.0 --dataloader.num_workers=2 --dataloader.persistent_workers --dataloader.prefetch_factor=2 --metrics.log_freq=1 --comm.trace_buf_size=0 --dump_folder=outputs/autoresearch/may19-qwen3-14b/run512-nccl-min-nchannels16-batch176-event-cache0 > outputs/autoresearch/may19-qwen3-14b/run512-nccl-min-nchannels16-batch176-event-cache0.run.log 2>&1
a92cebb4	13399	0.00	166.24	discard	batch172 is valid on the Triton RoPE active source but slower than batch176 despite lower memory	TORCH_NCCL_CUDA_EVENT_CACHE=0 NCCL_NVLS_ENABLE=1 NCCL_CTA_POLICY=2 NGPU=8 LOG_RANK=0 MODULE=qwen3 CONFIG=qwen3_14b ./run_train.sh --training.steps=10 --compile.enable --compile.components=loss,feed_forward,qkv_linear --training.dtype=bfloat16 --training.seq_len=128 --training.local_batch_size=172 --loss.num_chunks=4 --optimizer.weight_decay=0.0 --dataloader.num_workers=2 --dataloader.persistent_workers --dataloader.prefetch_factor=2 --metrics.log_freq=1 --comm.trace_buf_size=0 --dump_folder=outputs/autoresearch/may19-qwen3-14b/run513-triton-rope-batch172-event-cache0 > outputs/autoresearch/may19-qwen3-14b/run513-triton-rope-batch172-event-cache0.run.log 2>&1
3665b43b+dirty	13734	0.00	168.91	keep	using reshape for attention output flattening avoids the explicit contiguous/view path and sets a new measured non-profile peak	TORCH_NCCL_CUDA_EVENT_CACHE=0 NCCL_NVLS_ENABLE=1 NCCL_CTA_POLICY=2 NGPU=8 LOG_RANK=0 MODULE=qwen3 CONFIG=qwen3_14b ./run_train.sh --training.steps=10 --compile.enable --compile.components=loss,feed_forward,qkv_linear --training.dtype=bfloat16 --training.seq_len=128 --training.local_batch_size=176 --loss.num_chunks=4 --optimizer.weight_decay=0.0 --dataloader.num_workers=2 --dataloader.persistent_workers --dataloader.prefetch_factor=2 --metrics.log_freq=1 --comm.trace_buf_size=0 --dump_folder=outputs/autoresearch/may19-qwen3-14b/run514-attn-output-reshape-batch176-event-cache0 > outputs/autoresearch/may19-qwen3-14b/run514-attn-output-reshape-batch176-event-cache0.run.log 2>&1
9e7a7b43	13513	0.00	168.91	keep	profiled the attention-output reshape active source; profiled tps is diagnostic and trace remains dominated by NCCL plus GEMM/MXFP8	TORCH_NCCL_CUDA_EVENT_CACHE=0 NCCL_NVLS_ENABLE=1 NCCL_CTA_POLICY=2 NGPU=8 LOG_RANK=0 MODULE=qwen3 CONFIG=qwen3_14b ./run_train.sh --training.steps=10 --compile.enable --compile.components=loss,feed_forward,qkv_linear --training.dtype=bfloat16 --training.seq_len=128 --training.local_batch_size=176 --loss.num_chunks=4 --optimizer.weight_decay=0.0 --dataloader.num_workers=2 --dataloader.persistent_workers --dataloader.prefetch_factor=2 --metrics.log_freq=1 --comm.trace_buf_size=0 --profiler.enable_profiling --profiler.profile_freq=10 --profiler.profiler_warmup=2 --profiler.profiler_active=1 --dump_folder=outputs/autoresearch/may19-qwen3-14b/run515-profile-attn-output-reshape-batch176-event-cache0 > outputs/autoresearch/may19-qwen3-14b/run515-profile-attn-output-reshape-batch176-event-cache0.run.log 2>&1
632d6f34	13555	0.00	168.91	discard	NCCL_MIN_NCHANNELS=8 is valid but slower than default channel selection on the reshape active source	NCCL_MIN_NCHANNELS=8 TORCH_NCCL_CUDA_EVENT_CACHE=0 NCCL_NVLS_ENABLE=1 NCCL_CTA_POLICY=2 NGPU=8 LOG_RANK=0 MODULE=qwen3 CONFIG=qwen3_14b ./run_train.sh --training.steps=10 --compile.enable --compile.components=loss,feed_forward,qkv_linear --training.dtype=bfloat16 --training.seq_len=128 --training.local_batch_size=176 --loss.num_chunks=4 --optimizer.weight_decay=0.0 --dataloader.num_workers=2 --dataloader.persistent_workers --dataloader.prefetch_factor=2 --metrics.log_freq=1 --comm.trace_buf_size=0 --dump_folder=outputs/autoresearch/may19-qwen3-14b/run516-nccl-min-nchannels8-reshape-batch176-event-cache0 > outputs/autoresearch/may19-qwen3-14b/run516-nccl-min-nchannels8-reshape-batch176-event-cache0.run.log 2>&1
b77c6ea0	13626	0.00	168.91	discard	disabling color printing in metrics logs is valid but slower than the active colored log path	TORCH_NCCL_CUDA_EVENT_CACHE=0 NCCL_NVLS_ENABLE=1 NCCL_CTA_POLICY=2 NGPU=8 LOG_RANK=0 MODULE=qwen3 CONFIG=qwen3_14b ./run_train.sh --training.steps=10 --compile.enable --compile.components=loss,feed_forward,qkv_linear --training.dtype=bfloat16 --training.seq_len=128 --training.local_batch_size=176 --loss.num_chunks=4 --optimizer.weight_decay=0.0 --dataloader.num_workers=2 --dataloader.persistent_workers --dataloader.prefetch_factor=2 --metrics.log_freq=1 --metrics.disable_color_printing --comm.trace_buf_size=0 --dump_folder=outputs/autoresearch/may19-qwen3-14b/run517-disable-color-reshape-batch176-event-cache0 > outputs/autoresearch/may19-qwen3-14b/run517-disable-color-reshape-batch176-event-cache0.run.log 2>&1
fb18bcd3	13767	0.00	172.47	discard	batch180 samples higher step10 tps but is above the memory risk line and has severe mid-run throughput collapses	TORCH_NCCL_CUDA_EVENT_CACHE=0 NCCL_NVLS_ENABLE=1 NCCL_CTA_POLICY=2 NGPU=8 LOG_RANK=0 MODULE=qwen3 CONFIG=qwen3_14b ./run_train.sh --training.steps=10 --compile.enable --compile.components=loss,feed_forward,qkv_linear --training.dtype=bfloat16 --training.seq_len=128 --training.local_batch_size=180 --loss.num_chunks=4 --optimizer.weight_decay=0.0 --dataloader.num_workers=2 --dataloader.persistent_workers --dataloader.prefetch_factor=2 --metrics.log_freq=1 --comm.trace_buf_size=0 --dump_folder=outputs/autoresearch/may19-qwen3-14b/run518-batch180-reshape-event-cache0 > outputs/autoresearch/may19-qwen3-14b/run518-batch180-reshape-event-cache0.run.log 2>&1
dc3d482e	13586	0.00	172.47	discard	batch180 is stable over 20 steps but sustained steps 11-20 average below the batch176 peak while remaining above the memory risk line	TORCH_NCCL_CUDA_EVENT_CACHE=0 NCCL_NVLS_ENABLE=1 NCCL_CTA_POLICY=2 NGPU=8 LOG_RANK=0 MODULE=qwen3 CONFIG=qwen3_14b ./run_train.sh --training.steps=20 --compile.enable --compile.components=loss,feed_forward,qkv_linear --training.dtype=bfloat16 --training.seq_len=128 --training.local_batch_size=180 --loss.num_chunks=4 --optimizer.weight_decay=0.0 --dataloader.num_workers=2 --dataloader.persistent_workers --dataloader.prefetch_factor=2 --metrics.log_freq=1 --comm.trace_buf_size=0 --dump_folder=outputs/autoresearch/may19-qwen3-14b/run519-batch180-20step-stability-reshape-event-cache0 > outputs/autoresearch/may19-qwen3-14b/run519-batch180-20step-stability-reshape-event-cache0.run.log 2>&1
4211d5ee	0	0.00	0.0	crash	batch180 loss chunks5 violates MXFP8 dim1 row tiling because seq128 splits into uneven 26/25-token chunks	TORCH_NCCL_CUDA_EVENT_CACHE=0 NCCL_NVLS_ENABLE=1 NCCL_CTA_POLICY=2 NGPU=8 LOG_RANK=0 MODULE=qwen3 CONFIG=qwen3_14b ./run_train.sh --training.steps=10 --compile.enable --compile.components=loss,feed_forward,qkv_linear --training.dtype=bfloat16 --training.seq_len=128 --training.local_batch_size=180 --loss.num_chunks=5 --optimizer.weight_decay=0.0 --dataloader.num_workers=2 --dataloader.persistent_workers --dataloader.prefetch_factor=2 --metrics.log_freq=1 --comm.trace_buf_size=0 --dump_folder=outputs/autoresearch/may19-qwen3-14b/run520-batch180-loss-chunks5-reshape-event-cache0 > outputs/autoresearch/may19-qwen3-14b/run520-batch180-loss-chunks5-reshape-event-cache0.run.log 2>&1
4211d5ee	13521	0.00	173.86	discard	batch184 loss chunks8 is valid but allocator-retry memory-risky and slower than batch176	TORCH_NCCL_CUDA_EVENT_CACHE=0 NCCL_NVLS_ENABLE=1 NCCL_CTA_POLICY=2 NGPU=8 LOG_RANK=0 MODULE=qwen3 CONFIG=qwen3_14b ./run_train.sh --training.steps=10 --compile.enable --compile.components=loss,feed_forward,qkv_linear --training.dtype=bfloat16 --training.seq_len=128 --training.local_batch_size=184 --loss.num_chunks=8 --optimizer.weight_decay=0.0 --dataloader.num_workers=2 --dataloader.persistent_workers --dataloader.prefetch_factor=2 --metrics.log_freq=1 --comm.trace_buf_size=0 --dump_folder=outputs/autoresearch/may19-qwen3-14b/run521-batch184-loss-chunks8-reshape-event-cache0 > outputs/autoresearch/may19-qwen3-14b/run521-batch184-loss-chunks8-reshape-event-cache0.run.log 2>&1
3705d821+dirty	13563	0.00	169.52	discard	keeping the last two transformer layers unresharded raises memory and does not beat the accepted last-layer-only FSDP granularity	TORCH_NCCL_CUDA_EVENT_CACHE=0 NCCL_NVLS_ENABLE=1 NCCL_CTA_POLICY=2 NGPU=8 LOG_RANK=0 MODULE=qwen3 CONFIG=qwen3_14b ./run_train.sh --training.steps=10 --compile.enable --compile.components=loss,feed_forward,qkv_linear --training.dtype=bfloat16 --training.seq_len=128 --training.local_batch_size=176 --loss.num_chunks=4 --optimizer.weight_decay=0.0 --dataloader.num_workers=2 --dataloader.persistent_workers --dataloader.prefetch_factor=2 --metrics.log_freq=1 --comm.trace_buf_size=0 --dump_folder=outputs/autoresearch/may19-qwen3-14b/run522-last-two-layers-no-reshard-batch176-event-cache0 > outputs/autoresearch/may19-qwen3-14b/run522-last-two-layers-no-reshard-batch176-event-cache0.run.log 2>&1
ea5891f2+dirty	13593	0.00	168.91	discard	in-place Triton RoPE is valid but does not lower peak memory or beat the accepted out-of-place Triton RoPE source	TORCH_NCCL_CUDA_EVENT_CACHE=0 NCCL_NVLS_ENABLE=1 NCCL_CTA_POLICY=2 NGPU=8 LOG_RANK=0 MODULE=qwen3 CONFIG=qwen3_14b ./run_train.sh --training.steps=10 --compile.enable --compile.components=loss,feed_forward,qkv_linear --training.dtype=bfloat16 --training.seq_len=128 --training.local_batch_size=176 --loss.num_chunks=4 --optimizer.weight_decay=0.0 --dataloader.num_workers=2 --dataloader.persistent_workers --dataloader.prefetch_factor=2 --metrics.log_freq=1 --comm.trace_buf_size=0 --dump_folder=outputs/autoresearch/may19-qwen3-14b/run523-inplace-triton-rope-batch176-event-cache0 > outputs/autoresearch/may19-qwen3-14b/run523-inplace-triton-rope-batch176-event-cache0.run.log 2>&1
6e386f7d+dirty	13471	0.00	169.43	discard	separately wrapping tok_embeddings with endpoint prefetch raises memory, worsens loss, and does not improve throughput on the final stack	TORCH_NCCL_CUDA_EVENT_CACHE=0 NCCL_NVLS_ENABLE=1 NCCL_CTA_POLICY=2 NGPU=8 LOG_RANK=0 MODULE=qwen3 CONFIG=qwen3_14b ./run_train.sh --training.steps=10 --compile.enable --compile.components=loss,feed_forward,qkv_linear --training.dtype=bfloat16 --training.seq_len=128 --training.local_batch_size=176 --loss.num_chunks=4 --optimizer.weight_decay=0.0 --dataloader.num_workers=2 --dataloader.persistent_workers --dataloader.prefetch_factor=2 --metrics.log_freq=1 --comm.trace_buf_size=0 --dump_folder=outputs/autoresearch/may19-qwen3-14b/run524-separate-tok-embeddings-fsdp-prefetch-batch176-event-cache0 > outputs/autoresearch/may19-qwen3-14b/run524-separate-tok-embeddings-fsdp-prefetch-batch176-event-cache0.run.log 2>&1
5bc112d1	13560	0.00	173.62	discard	loss chunks2 at batch176 is memory-risky and slower than the accepted chunks4 setting	TORCH_NCCL_CUDA_EVENT_CACHE=0 NCCL_NVLS_ENABLE=1 NCCL_CTA_POLICY=2 NGPU=8 LOG_RANK=0 MODULE=qwen3 CONFIG=qwen3_14b ./run_train.sh --training.steps=10 --compile.enable --compile.components=loss,feed_forward,qkv_linear --training.dtype=bfloat16 --training.seq_len=128 --training.local_batch_size=176 --loss.num_chunks=2 --optimizer.weight_decay=0.0 --dataloader.num_workers=2 --dataloader.persistent_workers --dataloader.prefetch_factor=2 --metrics.log_freq=1 --comm.trace_buf_size=0 --dump_folder=outputs/autoresearch/may19-qwen3-14b/run525-loss-chunks2-batch176-event-cache0 > outputs/autoresearch/may19-qwen3-14b/run525-loss-chunks2-batch176-event-cache0.run.log 2>&1
4def0007+dirty	13949	0.00	168.91	keep	compiling a narrow functional Q/K RMSNorm plus Triton RoPE helper sets a new measured peak without increasing memory	TORCH_NCCL_CUDA_EVENT_CACHE=0 NCCL_NVLS_ENABLE=1 NCCL_CTA_POLICY=2 NGPU=8 LOG_RANK=0 MODULE=qwen3 CONFIG=qwen3_14b ./run_train.sh --training.steps=10 --compile.enable --compile.components=loss,feed_forward,qkv_linear,qk_norm_rope --training.dtype=bfloat16 --training.seq_len=128 --training.local_batch_size=176 --loss.num_chunks=4 --optimizer.weight_decay=0.0 --dataloader.num_workers=2 --dataloader.persistent_workers --dataloader.prefetch_factor=2 --metrics.log_freq=1 --comm.trace_buf_size=0 --dump_folder=outputs/autoresearch/may19-qwen3-14b/run526-compile-qk-norm-rope-batch176-event-cache0 > outputs/autoresearch/may19-qwen3-14b/run526-compile-qk-norm-rope-batch176-event-cache0.run.log 2>&1
ef128236	14083	0.00	168.91	keep	profiled the Q/K norm plus RoPE helper active recipe; profiled tps is diagnostic and trace confirms RMSNorm time dropped sharply	TORCH_NCCL_CUDA_EVENT_CACHE=0 NCCL_NVLS_ENABLE=1 NCCL_CTA_POLICY=2 NGPU=8 LOG_RANK=0 MODULE=qwen3 CONFIG=qwen3_14b ./run_train.sh --training.steps=10 --compile.enable --compile.components=loss,feed_forward,qkv_linear,qk_norm_rope --training.dtype=bfloat16 --training.seq_len=128 --training.local_batch_size=176 --loss.num_chunks=4 --optimizer.weight_decay=0.0 --dataloader.num_workers=2 --dataloader.persistent_workers --dataloader.prefetch_factor=2 --metrics.log_freq=1 --comm.trace_buf_size=0 --profiler.enable_profiling --profiler.profile_freq=10 --profiler.profiler_warmup=2 --profiler.profiler_active=1 --dump_folder=outputs/autoresearch/may19-qwen3-14b/run527-profile-qk-norm-rope-batch176-event-cache0 > outputs/autoresearch/may19-qwen3-14b/run527-profile-qk-norm-rope-batch176-event-cache0.run.log 2>&1
ce3db3af+dirty	14003	0.00	168.91	keep	fullgraph compile for the Q/K norm plus RoPE helper is valid and sets a new non-profile peak	TORCH_NCCL_CUDA_EVENT_CACHE=0 NCCL_NVLS_ENABLE=1 NCCL_CTA_POLICY=2 NGPU=8 LOG_RANK=0 MODULE=qwen3 CONFIG=qwen3_14b ./run_train.sh --training.steps=10 --compile.enable --compile.components=loss,feed_forward,qkv_linear,qk_norm_rope --training.dtype=bfloat16 --training.seq_len=128 --training.local_batch_size=176 --loss.num_chunks=4 --optimizer.weight_decay=0.0 --dataloader.num_workers=2 --dataloader.persistent_workers --dataloader.prefetch_factor=2 --metrics.log_freq=1 --comm.trace_buf_size=0 --dump_folder=outputs/autoresearch/may19-qwen3-14b/run528-qk-norm-rope-fullgraph-batch176-event-cache0 > outputs/autoresearch/may19-qwen3-14b/run528-qk-norm-rope-fullgraph-batch176-event-cache0.run.log 2>&1
19f61c75	14069	0.00	172.47	discard	batch180 gives a higher short-run step10 sample on the fullgraph Q/K norm plus RoPE source but sits above the memory risk line and needs sustained validation	TORCH_NCCL_CUDA_EVENT_CACHE=0 NCCL_NVLS_ENABLE=1 NCCL_CTA_POLICY=2 NGPU=8 LOG_RANK=0 MODULE=qwen3 CONFIG=qwen3_14b ./run_train.sh --training.steps=10 --compile.enable --compile.components=loss,feed_forward,qkv_linear,qk_norm_rope --training.dtype=bfloat16 --training.seq_len=128 --training.local_batch_size=180 --loss.num_chunks=4 --optimizer.weight_decay=0.0 --dataloader.num_workers=2 --dataloader.persistent_workers --dataloader.prefetch_factor=2 --metrics.log_freq=1 --comm.trace_buf_size=0 --dump_folder=outputs/autoresearch/may19-qwen3-14b/run529-qk-norm-rope-batch180-event-cache0 > outputs/autoresearch/may19-qwen3-14b/run529-qk-norm-rope-batch180-event-cache0.run.log 2>&1
19f61c75	13963	0.00	172.47	discard	batch180 validates numerically but sustained steps 11-20 average below the batch176 active peak while remaining memory-risky	TORCH_NCCL_CUDA_EVENT_CACHE=0 NCCL_NVLS_ENABLE=1 NCCL_CTA_POLICY=2 NGPU=8 LOG_RANK=0 MODULE=qwen3 CONFIG=qwen3_14b ./run_train.sh --training.steps=20 --compile.enable --compile.components=loss,feed_forward,qkv_linear,qk_norm_rope --training.dtype=bfloat16 --training.seq_len=128 --training.local_batch_size=180 --loss.num_chunks=4 --optimizer.weight_decay=0.0 --dataloader.num_workers=2 --dataloader.persistent_workers --dataloader.prefetch_factor=2 --metrics.log_freq=1 --comm.trace_buf_size=0 --dump_folder=outputs/autoresearch/may19-qwen3-14b/run530-qk-norm-rope-batch180-20step-event-cache0 > outputs/autoresearch/may19-qwen3-14b/run530-qk-norm-rope-batch180-20step-event-cache0.run.log 2>&1
116d305d+dirty	14182	0.00	172.88	discard	compiled residual-plus-RMSNorm block helper gives a high short sample but raises memory and is dominated by the outer-RMSNorm-only variant	TORCH_NCCL_CUDA_EVENT_CACHE=0 NCCL_NVLS_ENABLE=1 NCCL_CTA_POLICY=2 NGPU=8 LOG_RANK=0 MODULE=qwen3 CONFIG=qwen3_14b ./run_train.sh --training.steps=10 --compile.enable --compile.components=loss,feed_forward,qkv_linear,qk_norm_rope,block_norms --training.dtype=bfloat16 --training.seq_len=128 --training.local_batch_size=176 --loss.num_chunks=4 --optimizer.weight_decay=0.0 --dataloader.num_workers=2 --dataloader.persistent_workers --dataloader.prefetch_factor=2 --metrics.log_freq=1 --comm.trace_buf_size=0 --dump_folder=outputs/autoresearch/may19-qwen3-14b/run531-compile-block-norms-batch176-event-cache0 > outputs/autoresearch/may19-qwen3-14b/run531-compile-block-norms-batch176-event-cache0.run.log 2>&1
