timestamp	commit	tps	memory_gib	status	mfu_pct	wall_time_s	description
2026-05-21T14:09:00	baseline	4161	49.0	keep	24.36	75	Run 1 baseline: Llama3 8B FSDP=4 TP=2 bs=1 8xH100; c4_test; construct_default_graph_passes returns empty list
2026-05-22T14:44:00	xxxxxxx	0	0.0	discard	0.00	0	Graph reconnaissance: counted FX node targets; 421 ag + 421 rs + 68 ar collectives; 196 detach; 842 _to_copy (recon-only, no perf attempt)
2026-05-22T14:52:00	ae6e425	4188	47.0	keep	24.52	75	remove_detach_nodes pass: rewire and erase 196 aten.detach.default nodes (autograd-no-op under runtime no_grad); avg of 2 runs (4202, 4174); -2GiB memory
2026-05-22T14:58:00	xxxxxxx	0	0.0	discard	0.00	0	remove_redundant_to_copy: tested same-dtype/device elimination — 0 of 841 candidates qualified; all are real fp32->bf16 mixed-precision casts
2026-05-22T15:25:00	xxxxxxx	4169	47.0	discard	24.41	75	bucket_all_gathers: shape-grouped, hoisted pure-op input chains; 421 AGs -> 64 buckets covering 160 AGs; 261 unbucketed singletons (shape heterogeneity); tps unchanged within noise
2026-05-22T15:50:00	xxxxxxx	4177	47.0	discard	24.46	75	prefetch_all_gathers FX-level: only 65/421 movable, avg move 7 positions; make_fx already places AGs right after their input deps; tps unchanged
2026-05-22T16:00:00	76d3f9e	4572	47.0	keep	26.77	77	apply_inductor_pattern_passes: joint_graph_passes + post_grad_passes (is_inference=False); 11538 -> 9101 nodes (-21%); tps 4576/4569 avg 4572 (+9.9% vs baseline)
2026-05-22T16:25:00	xxxxxxx	4577	47.0	discard	26.80	91	compile_fx_inductor (whole-graph codegen): compile_fx fails on in-place _c10d_functional.all_reduce_; compile_fx_inner fails with "_to_copy.default registered twice"; pass fell through to no-op
2026-05-22T17:00:00	b9c27f1	4783	49.1	keep	28.00	140	expanded apply_inductor_pattern_passes: added bucket_all_gather + bucket_reduce_scatter + stable_topological_sort + schedule_overlap_bucketing; tps 4781/4777/4793/4800 avg 4783 (+4.6% on iter 5, +14.9% on baseline)
2026-05-22T18:20:00	63c54ff	5566	49.1	keep	32.59	141	install_cuda_graph: capture+replay gm.forward; uses traced_result.num_static_inputs to skip copy of stable FSDP param inputs (3 persistent buffers, not 295); destroy_process_group hook for clean shutdown; tps 5566/5565 (+16.4% on iter 7, +33.8% on baseline)
2026-05-22T19:05:00	xxxxxxx	5480	49.1	discard	32.08	140	functionalize_collectives_and_compile_fx: swapped 133 in-place collectives (68 all_reduce_ + 65 all_gather_into_tensor_out) to functional + wait_tensor; compile_fx_inner blocked by device_mesh._get_submesh non-ATen op (DTensor); compile_fx re-introduces in-place via reinplace; swap alone costs -1.5% from extra waits
2026-05-22T19:30:00	xxxxxxx	0	0.0	discard	0.00	0	profile-driven analysis (iter 10, info only): GEMM 52.8%, FlashAttn 23.1%, NCCL 22.6%, FillFunctor 5.9%, _to_copy 4.6%; suggests bf16 RS (blocked-by-numerics), FillFunctor coalesce, regional compile, async loss/.item()
2026-05-22T19:50:00	xxxxxxx	5567	49.1	discard	32.60	140	collapse_dtype_roundtrips: identified 358 _to_copy(bf16->fp32) upcasts; 290 feed cat.default (different-dtype operands), 64 feed view_as_complex (RoPE precompute); 0 collapsible (no shape-op-only roundtrips after iter 5 patterns)
2026-05-22T19:42:00	d99dce8	5876	49.1	keep	34.41	141	disable_uninitialized_memory_fill: --debug.deterministic enables torch.utils.deterministic.fill_uninitialized_memory which makes 65 aten.empty.* zero-init before being fully overwritten by all_gather_into_tensor_out; audited safe and disabled; eliminates 4,061 FillFunctor kernels/step; tps 5875/5877 (+5.5% on iter 8, +41.2% on baseline)
2026-05-22T20:15:00	xxxxxxx	5883	49.1	discard	34.48	142	expanded apply_inductor_pattern_passes attempt #2: tried fsdp.dedup_fsdp_reduce_scatter, reduced_atomic_contention, ddp_fusion.schedule_comm_wait + 8 others; all node-count no-ops; remaining inductor modules don't apply to FSDP+TP joint fwd+bwd graphs
2026-05-22T21:00:00	xxxxxxx	5890	49.1	discard	34.49	161	regional_inductor_compile: 97/97 regions (size 20-39, 2996 nodes total) compiled cleanly via compile_fx_inner after draining decompositions + invalidating fast_random_decomps cache; numerics PASS; +0.24% (within noise) — regions too small (bounded by collectives every ~30 nodes), CUDA graphs already amortized launch overhead
2026-05-22T21:30:00	xxxxxxx	5877	49.1	discard	34.42	140	collapse_cat_of_upcasts: post-iter-5 graph has 0 of 290 expected _to_copy->cat patterns (joint_graph_passes already collapsed them); pass found 0 collapses; reverted
2026-05-22T22:00:00	xxxxxxx	5879	49.1	discard	34.43	142	cleanup_redundant_ops: 450 double_transpose removed (numerics pass) but +0.05% TPS (downstream codegen already collapses); 354 redundant_clone + 257 view_of_view both broke runtime via non-contiguous strides (Inductor preserves these for layout); only double_transpose retained, net no win
2026-05-22T22:35:00	xxxxxxx	5876	49.1	discard	34.41	143	iter17 batch (joint_graph 2x, post_grad is_inference=True, more inductor config flags, dedupe_symints, post-bucket joint_graph): all attempts no-op or noise; FX-pass surface for further wins is exhausted
2026-05-22T23:00:00	xxxxxxx	5876	49.1	discard	34.41	129	coalesce_independent_adds (recon-only): 225 add.Tensor nodes; all sequentially data-dependent (forward residual chain + backward grad accumulators with multi-user LHS); 0 groups of size >= 2 found; no coalescing pattern
2026-05-22T23:50:00	xxxxxxx	6042	46.2	discard	35.38	182	unblock_inductor_codegen: removed sole _get_submesh node + drained 10 decomps + cleared fast_random_decomps cache; compile_fx_inner SUCCEEDED on whole graph, tps=6042 (+2.8%); BUT step-20 loss drifted 9.21808->9.11513 and grad_norm 4.5867->22.9803 — Inductor's whole-graph lowering not bitwise-equivalent on 8B model (debugmodel bitwise test passed but masked the precision drift)
2026-05-23T00:30:00	xxxxxxx	5878	49.1	discard	34.42	139	residual FillFunctor recon (88 kernels, 22ms): 64 from FlashAttention internal scratch (opaque), 2 from CE backward zeros_like->index_put_ (semantically required), rest negligible — structural, not eliminable from passes.py
2026-05-23T01:15:00	xxxxxxx	5878	49.1	discard	34.42	179	compile_fx_inner with conservative configs (17 inductor flags off: split_reductions, epilogue_fusion, coordinate_descent_tuning, shape_padding, pattern_matcher, aggressive_fusion, allow_buffer_reuse, max_autotune*, etc.): codegen succeeds but step-20 loss drifts 9.21808->8.78991 and grad_norm 4.5867->8.1171; bitwise constraint structurally incompatible with Inductor codegen on 8B graph (confirmed across 2 attempts)
2026-05-23T01:45:00	e47a29c	6048	49.2	keep	35.42	143	remove bucket_all_gather + bucket_reduce_scatter from apply_inductor_pattern_passes: ablation revealed they become counterproductive after iter 8 CUDA graphs (the +810/+615 cat/slice/reshape nodes cost more than the launch-count reduction saves once launches are already amortized); schedule_overlap_bucketing alone suffices; tps 6052/6041/6051 (+2.9% on iter 12, +45.4% on baseline)
2026-05-23T02:30:00	xxxxxxx	6048	49.2	discard	35.42	143	re-ablation after iter 22: drop remove_detach_nodes (-16 within noise, kept), drop schedule_overlap_bucketing (-543, KEEP), 2nd joint_graph_passes (no-op), move disable_uninitialized_memory_fill before inductor (-305 — empty.* nodes don't exist yet, audit no-ops); iter 22 is tight local optimum
2026-05-23T03:00:00	xxxxxxx	0	0.0	discard	0.00	0	iter24 re-profile (post-iter-22): GEMM 32.5%, FlashAttn 25.0%, RS 17.3% (f32 195ms+bf16 64ms), AG 6.1%, elementwise 4.5%, optimizer 2.7%, CatArrayBatched 1.4% (down from 2.9%), FillFunctor 1.27% raw + 74 hidden in elementwise template
2026-05-23T03:30:00	xxxxxxx	6057	49.2	discard	35.47	143	replace_overwritten_zeros_with_empty: 0 of 11 candidates (9 aten.full scalars + 1 zeros_like + 1 ones_like) substitutable — all feed index_put_ partial overwrite or where.self read; remaining FillFunctor invocations are semantically required
2026-05-23T11:55:00	xxxxxxx	6039	49.2	discard	35.36	143	tune aten_distributed_optimizations for schedule_overlap_bucketing: set max_memory_increase_gb=20, max_in_flight_gb=10, max_compute_pre_fetch=200, compute_estimator=benchmark; all 4 knobs set OK but tps=6038/6040 (-0.15% vs 6048) — scheduler not memory-constrained (peak mem unchanged at 49.24); compute_estimator already defaults to benchmark; overlap surface saturated
2026-05-23T12:08:00	xxxxxxx	6043	49.2	discard	35.38	147	replace_random_passes + fuse_seed_creation + fuse_offset_creation: all 3 ran cleanly but 0 node delta (no rand/dropout/bernoulli in Llama3 training graph). Recon dump of post-iter-22 graph: 9,893 call_function nodes; 649 _to_copy (420 bf16->fp32, 228 fp32->bf16); 226 cat (130 bf16, 96 fp32); 229 AG (down from 421 baseline) + 293 RS (down from 421) + 68 AR — joint_graph/overlap passes consolidated collectives more than expected
2026-05-23T12:18:00	xxxxxxx	6041	49.2	discard	35.38	140	dedupe_to_copy: grouped 649 _to_copy nodes by (input_node, target_dtype/layout/device/memory_format); 0 dedup groups with >1 member. joint_graph_passes CSE already catches every duplicate. All 649 remaining _to_copy have distinct inputs (genuine dtype conversions); ~74ms / 4.6% step time is from genuine conversions, not redundancy
2026-05-23T12:30:00	xxxxxxx	6049	49.3	discard	35.42	140	sink_waits (custom FX pass): moved 325/622 waits to immediately before their earliest user, max move 4430 positions. tps=6,049 ≡ 6,048 baseline (+0.02%, noise). Strong evidence that FX-level node order doesn't affect runtime after schedule_overlap_bucketing's actual stream/event sequence is fixed by CUDA graph capture
2026-05-23T13:10:00	xxxxxxx	0	0.0	discard	0.00	0	literature research: 2 candidate ideas — (1) SymmetricMemory async-TP via micro_pipeline_tp_pass blocked because our TP uses all_reduce not AG+RS (iter-7 already confirmed no-op); (2) NCCL env vars (NCCL_MIN_NCHANNELS etc) out of passes.py scope and likely no-op past NCCL init; dead ends: custom Triton (bitwise-blocked, external library prohibition), zero-bubble PP (no PP), bf16 collectives (bitwise-blocked), CUDA graph extensions (already capturing joint graph)
2026-05-23T12:45:00	xxxxxxx	6040	49.2	discard	35.37	1140	baseline variance characterization over 8 runs: 6047/6039/6035/6040/6035/6044/6041/6041 → mean 6040.25, σ=4.1, range 12. True noise band ±2σ ≈ ±8 tps, much tighter than the prior ±1.5% (±90) threshold. Reclassifies +14 tps deltas (iter-14, iter-15) as potentially real (3.5σ above new mean)
2026-05-23T14:00:00	xxxxxxx	5742	49.3	discard	33.61	1150	regional_inductor_compile re-attempt on iter-22 graph: 472/708 regions compiled (avg size 7.8 nodes, 3687 total nodes Triton-fused); numerics PASS; 8-run mean tps=5742 σ=5.3 → REGRESSION -298 (-4.9%) vs 6040. Inductor per-region codegen worse than unfused under CUDA graphs (re-introduces materializations that cuda graph had eliminated). iter-14's +14 on iter-12 graph was 3-run noise, not real signal
2026-05-23T15:25:00	xxxxxxx	0	0.0	discard	0.00	0	graph motif analysis (recon-only): top-10 3-tuples and top-5 4-tuples in iter-22 graph. Top motifs dominated by zero-cost metadata ops (view/t/slice — 258+194+192). Genuine compute: RoPE bf16↔fp32 round-trips at 128/step (Inductor would fuse but bitwise-blocked); clone→view→slice at 192 (real memcpy but hand-fusion hard). FX-layer fusion surface confirmed exhausted
2026-05-23T16:25:00	xxxxxxx	5846	47.1	discard	34.24	1140	coalesced bucket_reduce_scatter (bucket_mode=coalesced): pass succeeded, added 645 nodes (vs 1425 default mode). 8-run mean 5846 σ=7.6 → REGRESSION -194 tps (-3.2%) vs 6040. Coalesced mode still adds wrapper nodes for output routing; structural conclusion (post-CUDA-graphs, bucketing in any form is counterproductive) extends to coalesced mode
2026-05-23T14:30:00	xxxxxxx	6040	49.2	discard	35.37	1140	remaining aten_distributed_optimizations knobs (compute_overlap_multipler=2, max_coll_distance=400, bucket_exposed_first=True, prioritize_bucketing_during_scheduling=True, insert_overlap_deps=True): 8-run mean 6040.0 σ=3.6 → ZERO effect vs baseline. All 5 knobs either already at effective values or don't apply to this graph. Overlap scheduling surface fully explored via config
2026-05-23T14:50:00	xxxxxxx	6035	49.2	discard	35.33	1140	install_cuda_graph with priority=-1 capture stream (speculative): 8-run mean 6035.1 σ=6.2 → -5 tps within noise. Captured kernels do not appear to inherit elevated stream priority at replay, or the priority doesn't influence kernel scheduling in this regime
2026-05-23T15:10:00	xxxxxxx	6022	51.2	discard	35.27	1140	ablation: drop remove_detach_nodes from pass list. 8-run mean 6021.9 σ=4.6 → -18 tps (8.8σ regression) AND memory +2 GiB (49.24->51.21). Confirms remove_detach_nodes is load-bearing on iter-22 graph (per-pass contribution: +18 tps, -2 GiB memory). Keep in pass list
2026-05-23T15:30:00	xxxxxxx	5737	49.2	discard	33.59	1140	ablation: drop disable_uninitialized_memory_fill. 8-run mean 5737.1 σ=3.7 → -303 tps (5%, massively load-bearing). Confirms iter-23's -305 tps result. Per-pass contribution: +303 tps. The fill_uninitialized_memory disable is the single largest source of TPS in the current configuration (after install_cuda_graph)
2026-05-23T15:55:00	xxxxxxx	6038	49.2	discard	35.35	1140	ado.enable_fusion_regions=False (toggle off the fusion-region cost-estimation grouping in schedule_overlap_bucketing): 8-run mean 6037.75 σ=4.8 → -2.5 tps within noise. The fusion-regions-based cost grouping doesn't change scheduler decisions on this graph
2026-05-23T16:05:00	xxxxxxx	0	0.0	crash	0.00	0	post_grad_fusion_options enabled (batch_linear_post_grad, group_linear, batch_aten_{tanh,sigmoid,relu,add,sub,div,mul}): CRASH on numerics — model hash mismatch (eager vs aot_fx_trace). At least one of these fusions changes reduction order or precision. Not bitwise-safe under our constraint
